year,grant,sub,num,id,subject,title,author,school,money,duration
2015,国际(地区)合作与交流项目,A01,276,11591240142,A050106,首届国际理论物理中心宇宙学高等研讨班,孙成一,西北大学,1.5,2015-05至2015-11
2015,国际(地区)合作与交流项目,A01,277,61520106009,F030103,多智能体事件驱动分布式优化控制,孙长银,东南大学,245.0,2016-01至2020-12
2015,国际(地区)合作与交流项目,A01,278,61511130046,F050901,Bi离子掺杂氟化物晶体和锗酸盐玻璃中发光中心的形成机理及其发光、结构特性,苏良碧,中国科学院上海硅酸盐研究所,9.0,2015-01至2016-12
2015,国际(地区)合作与交流项目,A01,279,71520107005,G0306,决策模式差异化情景下的中美低碳创新政策工具比较研究,苏竣,清华大学,184.0,2016-01至2020-12
2015,国际(地区)合作与交流项目,A01,280,81581220391,H1906,中巴(NSFC-CNPq)双边学术研讨会,苏川,南京医科大学,3.5,2015-06至2015-12
2015,国际(地区)合作与交流项目,A01,281,41571130042,D01,喀斯特关键带土壤演化及其岩性与生物控制机制,宋照亮,天津大学,292.8,2016-01至2019-12
2015,国际(地区)合作与交流项目,A01,282,31561143005,C1303,优异抗旱小麦种质的筛选、相关基因挖掘及育种利用,宋卫宁,西北农林科技大学,232.0,2016-01至2020-12
2015,国际(地区)合作与交流项目,A01,283,41581260330,D0607,2015年度水下科学、技术与教育国际会议,宋士吉,清华大学,4.8,2015-08至2015-12
2015,国际(地区)合作与交流项目,A01,284,61511130085,F010202,利用物理层动态性提高无线信息安全,宋令阳,北京大学,10.0,2015-04至2018-03
2015,国际(地区)合作与交流项目,A01,285,41561144008,D01,浅水和深水湖泊蓝藻微囊藻水华形成机制：应用新方法学研究产毒种群的时空结构,宋立荣,中国科学院水生生物研究所,168.0,2015-10至2018-09
2015,国际(地区)合作与交流项目,A01,286,11511140092,A0205,力-化学耦合诱导3D培养骨髓间充质干细胞向肌腱细胞定向分化研究,宋关斌,重庆大学,13.6,2015-04至2017-12
2015,国际(地区)合作与交流项目,A01,287,51511130036,E0307,高生成焓多氮有机含能化合物结构与其化学及相变安定性关系,舒远杰,西安近代化学研究所,9.0,2015-01至2016-12
2015,国际(地区)合作与交流项目,A01,288,41511140124,D010105,国际应用系统分析研究学会暑期青年科学家项目,史培军,北京师范大学,4.3,2015-06至2015-08
2015,国际(地区)合作与交流项目,A01,289,41581230268,D041002,中俄20周年合作双边研讨会,史建魁,中国科学院国家空间科学中心,0.6,2015-06至2015-12
2015,国际(地区)合作与交流项目,A01,290,81511140117,H2610,广西少数民族农村老年人身心健康与社区环境因素关系研究,石武祥,桂林医学院,3.2,2015-03至2015-12
2015,国际(地区)合作与交流项目,A01,291,41581330146,D0702,“地球关键带中水和土壤的生态服务功能维持机理研究”中英双边研讨会,石朋,河海大学,27.8,2015-04至2015-10
2015,国际(地区)合作与交流项目,A01,292,71581230410,G0313,中英（NSFC-ESRC）城市转型合作研究项目双边评审会,石敏俊,中国科学院大学,1.5,2015-08至2015-12
2015,国际(地区)合作与交流项目,A01,293,11591240354,A040103,"纳米科学前沿会议（smr,2710）",施奇武,四川大学,1.5,2015-08至2015-12
2015,国际(地区)合作与交流项目,A01,294,51561145001,E030901,具有利于电荷收集的透明电极结构和特殊设计活性层的大面积有机光伏器件及其创新实现手段,施敏敏,浙江大学,166.0,2015-10至2018-09
2015,国际(地区)合作与交流项目,A01,295,41581220462,D03,中加合作研究项目联合评审会,沈延安,中国科学技术大学,2.0,2015-10至2015-12
2015,国际(地区)合作与交流项目,A01,296,41520104007,D03,晚奥陶-早志留世海洋中氮、硫的生物地球化学循环：来自美国内华达中部的证据,沈延安,中国科学技术大学,250.0,2016-01至2020-12
2015,国际(地区)合作与交流项目,A01,297,81561148011,H3002,基于泰国植物及真菌资源的抗2型糖尿病及阿尔茨海默病高活性药物先导物的发现及药理作用机制研究,沈旭,南京中医药大学,250.0,2015-10至2018-09
2015,国际(地区)合作与交流项目,A01,298,51561125001,E0604,基于载氧体解耦的煤化学链燃烧多尺度基础研究,沈来宏,东南大学,256.6,2015-01至2018-12
2015,国际(地区)合作与交流项目,A01,299,81581240110,H2610,参加7th HOPE Meeting会议,沈洪兵,南京医科大学,0.5,2015-02至2015-09
2015,国际(地区)合作与交流项目,A01,300,31581220359,C030801,2015年中美生物多样性双边会,申卫军,中国科学院华南植物园,2.0,2015-10至2015-12
2015,国际(地区)合作与交流项目,A01,301,51561125002,E0510,面向环境可持续性的数字化制造装备设计、制造与运行的基础理论研究,邵新宇,华中科技大学,257.5,2015-01至2018-12
2015,国际(地区)合作与交流项目,A01,302,51561130156,E0709,纳秒脉冲放电等离子体协同催化甲烷转化制取高品位能源的关键技术研究,邵涛,中国科学院电工研究所,42.0,2015-03至2018-02
2015,国际(地区)合作与交流项目,A01,303,41571130081,D0702,黄土高原关键带水循环过程与空间异质性,邵明安,中国科学院地理科学与资源研究所,426.1,2016-01至2019-12
2015,国际(地区)合作与交流项目,A01,304,11511130011,A050106,地面与空间高精度引力实验新方法研究,邵成刚,华中科技大学,9.0,2015-01至2016-12
2015,国际(地区)合作与交流项目,A01,305,81511140101,H0912,肌萎缩侧索硬化分子发病机制在东亚人群的研究,商慧芳,四川大学,9.4,2015-04至2017-12
2015,国际(地区)合作与交流项目,A01,306,51581230272,E080102,中英低碳城市双边（NSFC-RCUK_EPSRC）研讨会,任云英,西安建筑科技大学,1.35,2015-06至2015-12
2015,国际(地区)合作与交流项目,A01,307,81520108019,H1904,烈性病毒感染和复制的分子机制,饶子和,南开大学,235.0,2016-01至2020-12
2015,国际(地区)合作与交流项目,A01,308,41511130027,D020101,东亚古近纪中纬度气候重建—植物化石证据,全成,吉林大学,9.0,2015-01至2016-12
2015,国际(地区)合作与交流项目,A01,309,61511140293,F030101,微网储能系统的能量成型协调控制策略研究,曲延滨,哈尔滨工业大学,12.5,2015-07至2017-06
2015,国际(地区)合作与交流项目,A01,310,51520105010,E0707,游标永磁直线伺服电机系统研究,曲荣海,华中科技大学,245.0,2016-01至2020-12
2015,国际(地区)合作与交流项目,A01,311,21581240106,B03,参加7th HOPE Meeting会议,裘晓辉,国家纳米科学中心,0.6,2015-03至2015-09
2015,国际(地区)合作与交流项目,A01,312,31561143015,C031201,中国-日本暖温带森林关键植物类群谱系分化与遗传多样性形成的时空格局与机制,邱英雄,浙江大学,166.0,2015-11至2018-10
2015,国际(地区)合作与交流项目,A01,313,31511140095,C020203,中国-日本森林植物区系关键类群谱系分化与物种形成的时空格局与机制,邱英雄,浙江大学,19.7,2015-04至2017-12
2015,国际(地区)合作与交流项目,A01,314,41561144007,D0510,中国超大城市地区大气细颗粒物健康效应的成因与机制研究,邱兴华,北京大学,168.0,2015-10至2018-09
2015,国际(地区)合作与交流项目,A01,315,71561147001,G0305,作物营养强化对改善人口营养健康影响及评估研究,青平,华中农业大学,200.0,2016-01至2020-12
2015,国际(地区)合作与交流项目,A01,316,51511130042,E090102,基于冰盖层边界物理参数变化的冰层生消过程厚度预测方法的分析与试验研究,秦建敏,太原理工大学,6.84,2015-01至2016-12
2015,国际(地区)合作与交流项目,A01,317,31561163002,C040203,东喜马拉雅与台湾昆虫区系隔离分化式样与形成机制,乔格侠,中国科学院动物研究所,168.0,2015-01至2017-12
2015,国际(地区)合作与交流项目,A01,318,81581260453,H19,2015海峡两岸热带医学研究学术交流研讨会,钱平,华中农业大学,2.55,2015-10至2015-12
2015,国际(地区)合作与交流项目,A01,319,51581230404,E020501,有机、无机和/或高分子材料与复合材料和/或其应用,钱觉时,重庆大学,1.5,2015-08至2015-12
2015,国际(地区)合作与交流项目,A01,320,81520108025,H1606,MEF2D在肿瘤微环境调控肝癌侵袭转移中的作用及分子机制研究,钱程,中国人民解放军第三军医大学,235.0,2016-01至2020-12
2015,国际(地区)合作与交流项目,A01,321,71511140295,G0112,新兴社会化在线限时优惠折扣模式的跨国实证研究,齐佳音,上海对外经贸大学,10.5,2015-07至2017-06
2015,国际(地区)合作与交流项目,A01,322,51581220386,E060401,中巴(NSFC-CNPq)双边学术研讨会,齐飞,上海交通大学,2.9,2015-06至2015-12
2015,国际(地区)合作与交流项目,A01,323,81520108013,H0420,双胎妊娠队列研究：探究生命早期基因-环境复杂的交互作用，及其在婴幼儿相关疾病早期预测中的作用,漆洪波,重庆医科大学,235.0,2016-01至2020-12
2015,国际(地区)合作与交流项目,A01,324,81561138001,H08,在糯虫与小鼠中基因转录后水平调节干细胞多能性的保守性机制研究,戚华宇,中国科学院广州生物医药与健康研究院,160.0,2015-01至2017-12
2015,国际(地区)合作与交流项目,A01,325,21581240397,B070102,天然产物化学,普建新,中国科学院昆明植物研究所,0.8,2015-11至2015-12
2015,国际(地区)合作与交流项目,A01,326,81511140297,H2818,基于生物转化的融合与集成技术的高生物活性天然产物开发,朴香兰,中央民族大学,10.6,2015-07至2017-06
2015,国际(地区)合作与交流项目,A01,327,41561134016,D02,气候变化和人为活动对长江和黄河流域径流的影响,朴世龙,北京大学,252.1,2016-01至2018-12
2015,国际(地区)合作与交流项目,A01,328,41571130053,D070102,红壤关键带多尺度水文过程及其驱动下的物质迁移与模型模拟,彭新华,中国科学院南京土壤研究所,425.0,2016-01至2019-12
2015,国际(地区)合作与交流项目,A01,329,61520106013,F0503,纳米结构等离子生物传感器的理论与实验研究,彭伟,大连理工大学,245.0,2016-01至2020-12
2015,国际(地区)合作与交流项目,A01,330,31561143012,C1401,木薯低温敏感分子基础及耐低温育种,彭明,中国热带农业科学院热带生物技术研究所,218.0,2016-01至2020-12
2015,国际(地区)合作与交流项目,A01,331,81511130049,H0220,阿片受体的作用及其对低氧的适应机制,裴建明,中国人民解放军第四军医大学,9.0,2015-01至2016-12
2015,国际(地区)合作与交流项目,A01,332,71581240326,G0201,2015年第六届亚太性别峰会,欧阳桃花,北京航空航天大学,1.5,2015-08至2015-12
2015,国际(地区)合作与交流项目,A01,333,31561130153,C0702,秀丽隐杆线虫和果蝇中纤毛形成的分子及细胞生物学机制研究,欧光朔,清华大学,41.67,2015-03至2018-02
2015,国际(地区)合作与交流项目,A01,334,41581260339,D0608,2015年度水下科学、技术与教育国际会议,聂红涛,天津大学,1.5,2015-08至2015-12
2015,国际(地区)合作与交流项目,A01,335,51581330355,E090402,中荷“水道、港口、河口、海岸工程”研讨会,倪晋仁,北京大学,16.8,2015-09至2016-03
2015,国际(地区)合作与交流项目,A01,336,21511130020,B01,均相与非均相水溶液中As(III)的光催化氧化过程,那平,天津大学,9.0,2015-01至2016-12
2015,国际(地区)合作与交流项目,A01,337,31581220357,C030502,2015年中美生物多样性双边会,米湘成,中国科学院植物研究所,2.0,2015-10至2015-12
2015,国际(地区)合作与交流项目,A01,338,51561135010,E031002,为成功而塑形：应用于纳米药物的生物可降解聚合物囊泡的最佳形态设计,孟凤华,苏州大学,252.5,2015-08至2019-07
2015,国际(地区)合作与交流项目,A01,339,41561144009,D0304,中国--以色列石盐沉积中的地质微生物,孟凡巍,中国科学院南京地质古生物研究所,200.0,2015-10至2018-09
2015,国际(地区)合作与交流项目,A01,340,51581340303,E0314,第11届中韩双边高分子材料研讨会：高分子加工基础与应用,门永锋,中国科学院长春应用化学研究所,12.0,2015-08至2015-12
2015,国际(地区)合作与交流项目,A01,341,71581330009,G0301,中英“城市转型”双边研讨会,毛中根,西南财经大学,25.0,2015-01至2015-07
2015,国际(地区)合作与交流项目,A01,342,51511130075,E060203,叶片壁面压力脉动的高精度数值仿真与建模,毛义军,西安交通大学,8.85,2015-04至2017-03
2015,国际(地区)合作与交流项目,A01,343,71581240322,G021501,第六届亚太性别峰会,买忆媛,华中科技大学,1.5,2015-08至2015-12
2015,国际(地区)合作与交流项目,A01,344,61511130081,F020508,基于非高斯概率模型的跨域视觉分析,马占宇,北京邮电大学,10.0,2015-04至2017-03
2015,国际(地区)合作与交流项目,A01,345,31511140286,C08,IL-23和Th17细胞在系统性红斑狼疮疾病中的作用,马小京,上海交通大学,12.0,2015-07至2017-06
2015,国际(地区)合作与交流项目,A01,346,81561128006,H19,通过多价双特异性抗体介导的ADCC清除HIV潜伏感染细胞的研究,马丽英,中国疾病预防控制中心性病艾滋病预防控制中心,200.0,2016-01至2018-12
2015,国际(地区)合作与交流项目,A01,347,31581220382,C030602,中巴(NSFC-CNPq)双边学术研讨会,马克平,中国科学院植物研究所,3.5,2015-06至2015-12
2015,国际(地区)合作与交流项目,A01,348,31581220360,C030602,2015年中美生物多样性双边会,马克平,中国科学院植物研究所,2.0,2015-10至2015-12
2015,国际(地区)合作与交流项目,A01,349,61581230489,F0402,2015年中英未来科技创新合作新模式高层论坛,马建国,天津大学,3.0,2015-12至2016-03
2015,国际(地区)合作与交流项目,A01,350,11581260328,A040413,2015年度水下科学、技术与教育国际会议,马辉,清华大学,2.0,2015-08至2015-12
2015,国际(地区)合作与交流项目,A01,351,11581240311,A040215,强关联电子系统新奇材料与新理论暑期讨论班,吕智国,上海交通大学,1.5,2015-08至2015-12
2015,国际(地区)合作与交流项目,A01,352,41571130083,D01,黄土高原关键带区域水土过程与生态系统服务功能优化,吕一河,中国科学院生态环境研究中心,420.5,2016-01至2019-12
2015,国际(地区)合作与交流项目,A01,353,31581260329,C190303,2015年度水下科学、技术与教育国际会议,吕颂辉,暨南大学,1.2,2015-08至2015-12
2015,国际(地区)合作与交流项目,A01,354,41511140096,D0709,燃煤排放PM2.5中磁性组分的氧化还原特征及生物活性的研究,吕森林,上海大学,15.5,2015-04至2017-12
2015,国际(地区)合作与交流项目,A01,355,11581240166,A050106,大尺度结构形成和暗能量宇宙学,吕剑波,辽宁师范大学,1.25,2015-05至2015-12
2015,国际(地区)合作与交流项目,A01,356,11520101001,A020316,大型结构损伤检测的非接触快捷精确成像理论与方法,骆英,江苏大学,270.0,2016-01至2020-12
2015,国际(地区)合作与交流项目,A01,357,81520108008,H0726,KLF3/5信号通路-ncRNA网络调控成骨血管生成及其在增龄性骨丢失中的作用机制研究,罗湘杭,中南大学,235.0,2016-01至2020-12
2015,国际(地区)合作与交流项目,A01,358,21511130063,B060305,水稻根际有效态砷的时空分布特征研究,罗军,南京大学,10.0,2015-04至2017-03
2015,国际(地区)合作与交流项目,A01,359,31581230400,C2101,中德（NSFC-DFG）跨学科重大国际合作研究项目双边评审会,罗劲,首都师范大学,2.1,2015-08至2015-12
2015,国际(地区)合作与交流项目,A01,360,81561168023,H1805,一种用于心血管疾病诊断血管力学评估的超声综合功能成像框架,罗建文,清华大学,84.0,2016-01至2019-12
2015,国际(地区)合作与交流项目,A01,361,81561168022,H09,对Neuroligin和Itch相互作用的功能及在体研究,罗建红,浙江大学,84.0,2016-01至2019-12
2015,国际(地区)合作与交流项目,A01,362,51511130034,E060105,热储能中高效复合吸附剂的研究,陆紫生,上海交通大学,9.0,2015-01至2016-12
2015,国际(地区)合作与交流项目,A01,363,51520105014,E0909,粉沙淤泥质海岸滩槽动力地貌过程及其对滩涂连片开发的响应研究,陆永军,水利部交通运输部国家能源局南京水利科学研究院,245.0,2016-01至2020-12
2015,国际(地区)合作与交流项目,A01,364,41581230479,D070104,中英(NSFC-NERC)地球关键带项目评审会,陆雅海,北京大学,1.5,2015-09至2016-03
2015,国际(地区)合作与交流项目,A01,365,81581260444,H09,2015年“青少年精神健康及疾病学术研讨会”,陆林,北京大学,3.65,2015-10至2015-12
2015,国际(地区)合作与交流项目,A01,366,41581320005,D0203,中美矿物-微生物胞外电子转移及能量来源论坛,鲁安怀,北京大学,12.0,2015-01至2015-12
2015,国际(地区)合作与交流项目,A01,367,31561143014,C130403,玉米耐旱基因资源发掘与分子育种利用,卢艳丽,四川农业大学,244.0,2016-01至2020-12
2015,国际(地区)合作与交流项目,A01,368,81520108001,H0108,MUC1对慢性阻塞性肺疾病气道炎症和重构的调节作用与机制研究,卢文菊,广州医科大学,250.0,2016-01至2020-12
2015,国际(地区)合作与交流项目,A01,369,61520106003,F0123,基于半导体氧化物纳米结构的气体传感器感知机理和关键技术研究,卢革宇,吉林大学,250.0,2016-01至2020-12
2015,国际(地区)合作与交流项目,A01,370,31520103912,C140206,褐飞虱相关的化学信号物及其介导的水稻防御反应,娄永根,浙江大学,275.0,2016-01至2020-12
2015,国际(地区)合作与交流项目,A01,371,31581220361,C030401,2015年中美生物多样性双边会,娄安如,北京师范大学,2.0,2015-10至2015-12
2015,国际(地区)合作与交流项目,A01,372,11591240120,A05,生物系统中的囚禁性颗粒输运动力学行为研究,龙飞,昆明理工大学,1.5,2015-05至2015-12
2015,国际(地区)合作与交流项目,A01,373,21581240105,B010307,参加7th HOPE Meeting会议,刘子桐,中国科学院化学研究所,0.6,2015-03至2015-09
2015,国际(地区)合作与交流项目,A01,374,51520105003,E0207,单原子层2D材料的杂化界面控制与新功能化,刘忠范,北京大学,245.0,2016-01至2020-12
2015,国际(地区)合作与交流项目,A01,375,61520106005,F02,高效能数据中心--数据中心资源的优化组织与调度,刘志勇,中国科学院计算技术研究所,250.0,2016-01至2020-12
2015,国际(地区)合作与交流项目,A01,376,21520102008,B0807,面向绿色合成的纳米酶催化剂的分子与过程工程基础研究,刘铮,清华大学,210.0,2016-01至2020-12
2015,国际(地区)合作与交流项目,A01,377,81561168021,H0919,基因与环境相互作用对早发性精神分裂症患者神经发育影像的研究,刘哲宁,中南大学,84.2,2016-01至2019-12
2015,国际(地区)合作与交流项目,A01,378,71581240323,G0307,参加2015年在韩国首尔举办的亚太性别峰会,刘云,北京理工大学,1.5,2015-08至2015-12
2015,国际(地区)合作与交流项目,A01,379,71581240317,G020902,第十四届中韩双边质量研讨会,刘玉敏,郑州大学,8.0,2015-07至2015-12
2015,国际(地区)合作与交流项目,A01,380,11511130057,A020301,高温蠕变疲劳评估的新型直接法研究,刘应华,清华大学,10.0,2015-04至2017-03
2015,国际(地区)合作与交流项目,A01,381,31520103918,C180701,质粒协助沙门菌的适应性及其机制研究,刘雅红,华南农业大学,255.0,2016-01至2020-12
2015,国际(地区)合作与交流项目,A01,382,31581260429,C2117,2015年“青少年精神健康及疾病学术研讨会”,刘勋,中国科学院心理研究所,2.35,2015-10至2015-12
2015,国际(地区)合作与交流项目,A01,383,41581240313,D0712,通过生态模型途径和生态友好环境管理应用促进环境保护,刘雪华,清华大学,5.5,2015-12至2015-12
2015,国际(地区)合作与交流项目,A01,384,11581230392,A040102,荷兰-中国功能软物质双边研讨会,刘向阳,厦门大学,15.0,2015-10至2015-12
2015,国际(地区)合作与交流项目,A01,385,21520102004,B0704,以多样性为导向的天然产物生物合成研究,刘文,中国科学院上海有机化学研究所,200.0,2016-01至2020-12
2015,国际(地区)合作与交流项目,A01,386,41571130052,D0701,红壤关键带铁循环耦合碳氮转化过程及其生态功能,刘同旭,广东省生态环境技术研究所,424.0,2016-01至2019-12
2015,国际(地区)合作与交流项目,A01,387,41581260338,D0604,2015年度水下科学、技术与教育国际会议,刘素美,中国海洋大学,4.5,2015-08至2015-12
2015,国际(地区)合作与交流项目,A01,388,61581240316,F01,适应未来智慧生活的先进信息处理技术中韩双边研讨会,刘荣科,北京航空航天大学,4.5,2015-07至2015-12
2015,国际(地区)合作与交流项目,A01,389,31561143008,C130401,稻米淀粉品质改良优异种质资源挖掘及其遗传与结构基础研究,刘巧泉,扬州大学,245.0,2016-01至2020-12
2015,国际(地区)合作与交流项目,A01,390,21561162003,B05,单分子共轭聚合物的电致发光探测,刘培念,华东理工大学,85.0,2016-01至2019-12
2015,国际(地区)合作与交流项目,A01,391,51561135003,E080701,低碳化进程中城市多模式交通系统运营关键问题研究,刘攀,东南大学,255.0,2015-09至2018-08
2015,国际(地区)合作与交流项目,A01,392,71511140296,G010301,中韩“腹地—港口—港口—腹地”集装箱调度与风险管理研究,刘南,浙江大学,5.0,2015-07至2017-06
2015,国际(地区)合作与交流项目,A01,393,31520103916,C1804,旋毛虫免疫抑制关键蛋白分子的分离、鉴定及其作用机制探究,刘明远,吉林大学,249.0,2016-01至2020-12
2015,国际(地区)合作与交流项目,A01,394,31511130137,C19,细胞因子在调控虹鳟抗原呈递中的作用,刘敏,东北农业大学,10.0,2015-05至2017-04
2015,国际(地区)合作与交流项目,A01,395,41511130032,D041002,地磁场变化和地壳形变过程耦合研究,刘静,中国地震局地震预测研究所,9.0,2015-01至2016-12
2015,国际(地区)合作与交流项目,A01,396,61581230406,F0306,中德（NSFC-DFG）跨学科重大国际合作研究项目双边评审会,刘景泰,南开大学,2.1,2015-08至2015-12
2015,国际(地区)合作与交流项目,A01,397,41581320465,D0702,基于可持续城市发展的粮食-能源-水资源关系双边会,刘杰,北京大学,8.0,2015-10至2015-12
2015,国际(地区)合作与交流项目,A01,398,31561130152,C1201,海胆亲缘DNA甲基化图谱的遗传和在早期发育中的重编程和功能,刘江,中国科学院北京基因组研究所,42.17,2015-03至2018-02
2015,国际(地区)合作与交流项目,A01,399,31511130131,C1101,中枢神经系统重要神经递质Y-氨基丁酸的B型受体的神经信号转导机制研究,刘剑峰,华中科技大学,15.0,2015-01至2017-12
2015,国际(地区)合作与交流项目,A01,400,31561123001,C03,Dimensions合作研究项目：植物性染色体和雌雄异株化多层次驱动生物多样性的整合研究,刘建全,四川大学,250.0,2016-01至2020-12
2015,国际(地区)合作与交流项目,A01,401,41561144010,D0214,过去8万年以来沙尘向地中海-黎凡特东部和中国东部运输的天气-气候条件研究,刘嘉麒,中国科学院地质与地球物理研究所,200.0,2015-10至2018-09
2015,国际(地区)合作与交流项目,A01,402,51561135004,E08,基于能源绩效的历史城市低碳转换机理与规划方法研究,刘加平,西安建筑科技大学,252.0,2015-09至2018-08
2015,国际(地区)合作与交流项目,A01,403,81561148013,H3002,云南和泰国真菌中药物先导的发现和结构修饰,刘吉开,中南民族大学,251.0,2015-10至2018-09
2015,国际(地区)合作与交流项目,A01,404,41581230269,D010103,中俄20周年合作双边研讨会,刘鸿雁,北京大学,0.6,2015-06至2015-12
2015,国际(地区)合作与交流项目,A01,405,41571130044,D01,喀斯特关键带区域生态系统服务的形成机制及土地利用优化,刘鸿雁,北京大学,318.4,2016-01至2019-12
2015,国际(地区)合作与交流项目,A01,406,51581260349,E091003,2015年度水下科学、技术与教育国际会议,刘海笑,天津大学,1.5,2015-08至2015-12
2015,国际(地区)合作与交流项目,A01,407,31511140284,C020409,西瓜属植物中葫芦素生物合成途径的构建,刘海峰,延边大学,8.0,2015-07至2017-06
2015,国际(地区)合作与交流项目,A01,408,31520103909,C110501,Seipin基因缺陷导致脂肪萎缩的分子机理研究,刘国庆,北京大学,267.0,2016-01至2020-12
2015,国际(地区)合作与交流项目,A01,409,41511140123,D010502,国际应用系统分析研究学会暑期青年科学家项目,刘耕源,北京师范大学,4.3,2015-06至2015-08
2015,国际(地区)合作与交流项目,A01,410,51561130157,E02,面向太阳能燃料层状结构光催化材料的设计与构建,刘岗,中国科学院金属研究所,42.42,2015-03至2018-02
2015,国际(地区)合作与交流项目,A01,411,41561124015,D05,气候变化对中国华北平原和加拿大魁北克地区水资源和粮食安全的影响研究,刘昌明,中国科学院遗传与发育生物学研究所农业资源研究中心,126.0,2016-01至2017-12
2015,国际(地区)合作与交流项目,A01,412,71591340301,G030501,国家自然科学基金委员会与国际林业研究中心学术研讨会,刘璨,国家林业局经济发展研究中心,11.0,2015-09至2015-12
