year,grant,sub,num,id,subject,title,author,school,money,duration
2009,国际(地区)合作与交流项目,A01,577,20910302015,B010704,2009组合科学国际会议,刘刚,中国医学科学院,6.0,2009-01至2010-01
2009,国际(地区)合作与交流项目,A01,578,10911130171,A050304,高能重离子碰撞中强子和直接光子的产生,刘复明,华中师范大学,2.4,2009-03至2009-12
2009,国际(地区)合作与交流项目,A01,579,40911140282,D0609,用于保护功能纳米生物材料研究与技术,刘成圣,中国海洋大学,8.0,2009-06至2011-05
2009,国际(地区)合作与交流项目,A01,580,20910302019,B0808,等离子体强化催化反应过程时空多尺度结构及其效应研究,刘昌俊,天津大学,4.0,2009-05至2009-08
2009,国际(地区)合作与交流项目,A01,581,30911130360,C120114,HoxB4和微环境因子调控多能干细胞造血分化的实验研究,刘兵,中国人民解放军军事科学院军事医学研究院,45.0,2010-01至2012-12
2009,国际(地区)合作与交流项目,A01,582,10911130356,A040212,半导体二维纳米结构中自旋输运和自旋操纵的实验研究,刘宝利,中国科学院物理研究所,45.0,2010-01至2012-12
2009,国际(地区)合作与交流项目,A01,583,40911130158,D020104,新元古代-寒武纪生物地球化学循环,凌洪飞,南京大学,3.6,2009-04至2009-12
2009,国际(地区)合作与交流项目,A01,584,60910306057,F0404,第8届国际专用集成电路会议,林殷茵,复旦大学,4.0,2009-10至2009-12
2009,国际(地区)合作与交流项目,A01,585,40910104003,D0609,南中国海贝类养殖水体中纤毛虫原生动物的生物多样性和生态学研究,林晓凤,华南师范大学,1.0,2009-01至2009-06
2009,国际(地区)合作与交流项目,A01,586,50981220203,E020703,世界妇女研究者大会,林红,清华大学,1.1,2009-05至2009-12
2009,国际(地区)合作与交流项目,A01,587,20981240182,B010307,第十三届中韩基础科学研究联合委员会,林国强,中国科学院上海有机化学研究所,1.5,2009-05至2009-08
2009,国际(地区)合作与交流项目,A01,588,60910306046,F020808,第十五届移动计算与网络国际会议,林闯,清华大学,3.0,2009-09至2009-12
2009,国际(地区)合作与交流项目,A01,589,20910302016,B040105,第九届亚太国际微分离分析学术会议,林炳承,中国科学院大连化学物理研究所,4.0,2009-10至2009-10
2009,国际(地区)合作与交流项目,A01,590,60910306054,F020206,第七届并行分布式处理与应用国际学术会议,廖小飞,华中科技大学,2.0,2009-10至2009-12
2009,国际(地区)合作与交流项目,A01,591,40981220401,D0512,2009中美气候变化双边研讨会,廖宏,中国科学院大气物理研究所,1.3,2009-10至2009-12
2009,国际(地区)合作与交流项目,A01,592,60910306059,F0205,信息技术国际研讨会,梁艳春,吉林大学,2.0,2009-09至2009-12
2009,国际(地区)合作与交流项目,A01,593,20981260377,B04,中国西北部中药资源开发国际研讨会,梁鑫淼,中国科学院大连化学物理研究所,0.94,2009-12至2009-12
2009,国际(地区)合作与交流项目,A01,594,30911130188,H0215,Api6在巨噬细胞脂质转运中的作用及其机制研究,练雪梅,重庆医科大学,6.2,2009-04至2010-12
2009,国际(地区)合作与交流项目,A01,595,30910103024,H31,奖赏环路在异丙酚依赖中的作用及其机制研究,连庆泉,温州医科大学,1.0,2009-05至2009-12
2009,国际(地区)合作与交流项目,A01,596,10910301009,A011503,数学机械化国际会议,李子明,中国科学院数学与系统科学研究院,3.0,2009-05至2009-12
2009,国际(地区)合作与交流项目,A01,597,50981240186,E0808,参加NSFC-JST研讨会,李忠献,天津大学,9.0,2009-06至2009-09
2009,国际(地区)合作与交流项目,A01,598,40910104017,D0611,极区和亚极区水域冰的热力学模拟,李志军,大连理工大学,2.5,2009-07至2009-12
2009,国际(地区)合作与交流项目,A01,599,40991340469,D010203,中日韩地理学家学术研讨会,李志刚,中山大学,5.0,2009-12至2009-12
2009,国际(地区)合作与交流项目,A01,600,50910305015,E06,第20届国际流化床燃烧会议,李振山,清华大学,3.0,2009-05至2009-12
2009,国际(地区)合作与交流项目,A01,601,30910103911,H1608,胰腺癌上皮内瘤变PanIN 3期分子标志物在胰腺癌早期诊断中的价值,李兆申,中国人民解放军第二军医大学,100.0,2010-01至2013-12
2009,国际(地区)合作与交流项目,A01,602,30911120030,C130404,变化气候下食物与生物能源生产的改良—在澳大利亚与中国培育新的芸苔属异源多倍体,李再云,华中农业大学,9.0,2009-01至2010-12
2009,国际(地区)合作与交流项目,A01,603,30911120028,C010201,粘细菌来源的抗革兰氏阴性耐药致病菌活性代谢产物的研发,李越中,山东大学,9.0,2009-01至2010-12
2009,国际(地区)合作与交流项目,A01,604,30910103904,C010801,水稻矮缩病毒（RDV）与传毒介体叶蝉相互作用研究,李毅,北京大学,110.0,2010-01至2013-12
2009,国际(地区)合作与交流项目,A01,605,30910303083,H3110,第18届国际微粒体和药物氧化学术会议,李燕,中国医学科学院,6.0,2010-03至2010-08
2009,国际(地区)合作与交流项目,A01,606,40910304024,D02,2009年第一届世界青年地球科学家(YES)大会,李亚林,中国地质大学（北京）,8.0,2009-07至2009-12
2009,国际(地区)合作与交流项目,A01,607,40991240416,D040901,非线性动力学与地震预报高级研修班,李亚峻,吉林大学,1.2,2009-09至2009-12
2009,国际(地区)合作与交流项目,A01,608,10911120387,A011403,年龄结构的多菌株传染病模型的持续性与灭绝,李学志,信阳师范学院,8.0,2010-01至2011-12
2009,国际(地区)合作与交流项目,A01,609,40911120077,D0609,东南亚海洋甲壳动物关键类群生物多样性和种群生态学研究,李新正,中国科学院海洋研究所,9.0,2009-01至2010-12
2009,国际(地区)合作与交流项目,A01,610,50981240306,E0508,中韩先进制造技术研讨会,李新亚,机械科学研究总院,3.2,2009-05至2009-12
2009,国际(地区)合作与交流项目,A01,611,30911120487,H0713,MENIN在人胰腺发育和糖尿病中的作用,李小英,上海交通大学,45.0,2010-01至2012-12
2009,国际(地区)合作与交流项目,A01,612,20981360213,B0301,第三届海峡两岸理论化学研讨会,李象远,四川大学,3.0,2009-04至2009-11
2009,国际(地区)合作与交流项目,A01,613,30911130223,C110208,促性腺激素和环境内分泌干扰物对转基因小鼠前列腺发育的影响,李向东,中国农业大学,3.0,2009-03至2009-12
2009,国际(地区)合作与交流项目,A01,614,20910302043,B080403,晶体工程与药物传送系统国际会议,李韡,天津大学,3.0,2009-09至2009-10
2009,国际(地区)合作与交流项目,A01,615,50910305007,E050202,第七届杭州流体传动及控制国际会议,李伟,浙江大学,5.0,2009-05至2009-12
2009,国际(地区)合作与交流项目,A01,616,30910303026,C0701,第十次全国暨国际膜生物学研讨会,李巍,中国科学院遗传与发育生物学研究所,7.0,2009-07至2009-12
2009,国际(地区)合作与交流项目,A01,617,50910105065,E080702,城市环境交通容量时间特性性研究,李铁柱,东南大学,3.0,2010-01至2010-11
2009,国际(地区)合作与交流项目,A01,618,10981240150,A0102,线性代数进展与趋势暑期班及高级研讨班,李书超,华中师范大学,1.2,2009-06至2009-10
2009,国际(地区)合作与交流项目,A01,619,10991240291,A050204,LHC物理研讨会,李世渊,山东大学,1.0,2009-06至2009-12
2009,国际(地区)合作与交流项目,A01,620,70910307029,G0206,并购的价值创造、产业重组与经济安全国际会议,李善民,中山大学,1.5,2009-11至2009-12
2009,国际(地区)合作与交流项目,A01,621,40911120091,D0201,全球环境变化背景下的中国北方和贝加尔湖上新世鼠兔和鼠平类的演化、多样性和扩散事件,李强,中国科学院古脊椎动物与古人类研究所,9.0,2009-01至2010-12
2009,国际(地区)合作与交流项目,A01,622,30981260458,H2801,中国西北部中药资源开发国际研讨会,李萍,中国药科大学,1.0,2009-12至2009-12
2009,国际(地区)合作与交流项目,A01,623,30910303025,C130105,亚洲精细农业会议,李民赞,中国农业大学,8.0,2009-07至2009-12
2009,国际(地区)合作与交流项目,A01,624,30910403032,H0730,组织特异性Visfatin基因表达抑制的体内代谢组学研究,李伶,重庆医科大学,1.2,2009-07至2009-12
2009,国际(地区)合作与交流项目,A01,625,60910306024,F020305,计算化学E-SCIENCE高性能计算与协同计算学术会议,李廉,兰州大学,4.0,2009-08至2009-12
2009,国际(地区)合作与交流项目,A01,626,60911130512,F0103,协同多用户MIMO通信网络中关键技术研究,李立华,北京邮电大学,40.0,2010-01至2012-12
2009,国际(地区)合作与交流项目,A01,627,50981260126,E090303,流域梯级开发的环境生态效应及生态水利调控理论研究,李兰,武汉大学,1.0,2009-06至2009-09
2009,国际(地区)合作与交流项目,A01,628,10910301040,A0117,2009年国际应用数学与计算数学研讨会,李开泰,西安交通大学,2.0,2009-08至2009-12
2009,国际(地区)合作与交流项目,A01,629,30911120494,H0902,年老化、文化和记忆绑定：中国和加拿大跨文化比较研究,李娟,中国科学院心理研究所,45.0,2010-01至2012-12
2009,国际(地区)合作与交流项目,A01,630,20910302039,B08,第五届中美化工会议,李静海,中国科学院过程工程研究所,7.0,2009-10至2009-12
2009,国际(地区)合作与交流项目,A01,631,10910301057,A011602,图染色与匹配国际学术交流会,李敬文,兰州交通大学,2.5,2009-08至2009-12
2009,国际(地区)合作与交流项目,A01,632,50950110346,E030906,Fabrication of huge single grain microphase separation for highly functional nano-devices,李晶泽,电子科技大学,20.0,2009-11至2010-10
2009,国际(地区)合作与交流项目,A01,633,30910103074,C0901,神经黑色素对α-Synuclein过表达多巴胺能神经元相关基因表达的影响,李洁,天津医科大学,1.7,2009-10至2010-03
2009,国际(地区)合作与交流项目,A01,634,10911130357,A040205,在纳米尺度上操控电子序,李洁,中国科学院物理研究所,45.0,2010-01至2012-12
2009,国际(地区)合作与交流项目,A01,635,50911130135,E050503,功能表面与流体相互作用仿生研究,李建桥,吉林大学,8.8,2009-04至2010-12
2009,国际(地区)合作与交流项目,A01,636,10910301054,A050608,第二十一届国际磁体技术大会,李建刚,中国科学院合肥物质科学研究院,4.0,2009-10至2009-10
2009,国际(地区)合作与交流项目,A01,637,70911130017,G0307,国家创新体系与创新支撑平台比较研究：以两个国家和两个行业为例,李纪珍,清华大学,6.0,2009-01至2010-12
2009,国际(地区)合作与交流项目,A01,638,30981340241,H1906,第十三届中韩区域生物工程研讨会,李晖,哈尔滨医科大学,10.0,2009-12至2009-12
2009,国际(地区)合作与交流项目,A01,639,30911120065,C04,中国东北与俄罗斯远东地区小蛾类生物多样性和动物地理学研究,李后魂,南开大学,9.0,2009-01至2010-12
2009,国际(地区)合作与交流项目,A01,640,10910401059,A010801,Navier-Stokes-Poisson方程的数学研究,李海梁,首都师范大学,0.8,2009-07至2009-12
2009,国际(地区)合作与交流项目,A01,641,50981340470,E0607,第二届中泰可再生能源技术研讨会,李海滨,中国科学院广州能源研究所,18.0,2009-12至2009-12
2009,国际(地区)合作与交流项目,A01,642,40911130227,D0201,滇东地区早寒武世特异埋葬化石库生物学及埋藏学研究,李国祥,中国科学院南京地质古生物研究所,1.6,2009-06至2010-06
2009,国际(地区)合作与交流项目,A01,643,40911130004,D020101,滇东地区早寒武世特异埋葬化石库生物学及埋藏学研究,李国祥,中国科学院南京地质古生物研究所,4.7,2009-04至2009-10
2009,国际(地区)合作与交流项目,A01,644,40910104053,D020101,新元古代—寒武纪和二叠纪—三叠纪过渡期地质事件对比研究,李国祥,中国科学院南京地质古生物研究所,1.0,2009-07至2009-12
2009,国际(地区)合作与交流项目,A01,645,50910305022,E0804,城市污泥可持续管理与技术国际会议—2009,李圭白,哈尔滨工业大学,4.0,2009-08至2010-06
2009,国际(地区)合作与交流项目,A01,646,60911130129,F030304,基于电子/生物混合气味传感器系统的爆炸物痕量检测,李光,浙江大学,7.4,2009-04至2010-12
2009,国际(地区)合作与交流项目,A01,647,70911130016,G03,现代电能质量管理及相关电能定价策略研究,李庚银,华北电力大学,8.8,2009-03至2011-08
2009,国际(地区)合作与交流项目,A01,648,30911140276,H3002,长白山药用植物抗败血症活性物质的筛选及作用机理研究,李镐,延边大学,5.0,2009-06至2011-05
2009,国际(地区)合作与交流项目,A01,649,40910104040,D0202,四川盆地下侏罗统地层学研究,李罡,中国科学院南京地质古生物研究所,2.0,2009-07至2009-12
2009,国际(地区)合作与交流项目,A01,650,40910104001,D0201,西藏第三纪底栖有孔虫生物地层学研究,李罡,中国科学院南京地质古生物研究所,1.0,2009-01至2009-06
2009,国际(地区)合作与交流项目,A01,651,70981240259,G0312,参加ASIAHORCs Joint Symposium,李锋,中国科学院生态环境研究中心,0.7,2009-07至2009-12
2009,国际(地区)合作与交流项目,A01,652,10910301073,A0405,西太平洋声学会议资助,李风华,中国科学院声学研究所,5.0,2009-09至2009-12
2009,国际(地区)合作与交流项目,A01,653,10910301014,A01,上同调和表示论国际会议,李方,浙江大学,2.0,2009-07至2009-12
2009,国际(地区)合作与交流项目,A01,654,10911120393,A010801,偏微分方程的正则性,李东升,西安交通大学,8.0,2010-01至2011-12
2009,国际(地区)合作与交流项目,A01,655,30910103909,C080104,TSLP在免疫耐受形成中的调节作用,李大金,复旦大学,80.0,2010-01至2012-12
2009,国际(地区)合作与交流项目,A01,656,10910301062,A0204,流动的稳定性,李存标,北京大学,2.0,2009-06至2009-12
2009,国际(地区)合作与交流项目,A01,657,30911130164,C160502,岷江上游生态恢复与物种选择,李春阳,中国科学院成都生物研究所,1.0,2009-09至2009-12
2009,国际(地区)合作与交流项目,A01,658,60911130419,F020201,用于软件缺陷预测的程序复杂性度量技术研究,李春平,清华大学,6.4,2009-01至2010-12
2009,国际(地区)合作与交流项目,A01,659,30911120047,C020302,中国东北和俄罗斯远东早第三纪植物群的对比研究及其对环境变化的响应,李承森,中国科学院植物研究所,9.0,2009-01至2010-12
2009,国际(地区)合作与交流项目,A01,660,20910302014,B010302,第四届太平洋自由基化学会议,李超忠,中国科学院上海有机化学研究所,6.0,2009-11至2009-11
2009,国际(地区)合作与交流项目,A01,661,50910305021,E080301,建筑热环境动态调节与控制的理论与方法,李百战,重庆大学,5.0,2009-06至2010-03
2009,国际(地区)合作与交流项目,A01,662,10910301046,A0103,弦理论中的几何不变量,李安民,四川大学,3.0,2009-06至2009-10
2009,国际(地区)合作与交流项目,A01,663,10910301067,A020306,第二届智能材料与纳米技术国际会议,冷劲松,哈尔滨工业大学,3.0,2009-07至2009-12
2009,国际(地区)合作与交流项目,A01,664,10911120384,A010801,弹性复杂流体的数学理论,雷震,复旦大学,8.0,2010-01至2011-12
2009,国际(地区)合作与交流项目,A01,665,40921160381,D0506,海峡地区热带气旋结构和强度异常变化多尺度动力机制研究,雷小途,中国气象局上海台风研究所,195.0,2010-01至2012-12
2009,国际(地区)合作与交流项目,A01,666,20981240248,B010504,参加2nd HOPE Meeting会议,雷爱文,武汉大学,0.6,2009-09至2009-12
2009,国际(地区)合作与交流项目,A01,667,50911120201,E050802,板材热环境成形中基于破裂准则的成形极限研究,郎利辉,北京航空航天大学,9.0,2008-01至2009-12
2009,国际(地区)合作与交流项目,A01,668,40910104016,D070103,Cr(III)-有机酸配合物的光催化氧化作用研究,兰叶青,南京农业大学,1.0,2009-06至2009-11
2009,国际(地区)合作与交流项目,A01,669,50910305010,E020603,第15届插层化合物国际会议,康飞宇,清华大学,4.0,2009-05至2009-12
2009,国际(地区)合作与交流项目,A01,670,30910303063,C0203,纪念达尔文“物种起源”发表150周年国际学术会议,瞿礼嘉,北京大学,6.0,2009-07至2009-12
2009,国际(地区)合作与交流项目,A01,671,40991240301,D0508,高分辨率气候模式模拟,鞠丽霞,中国科学院大气物理研究所,1.0,2009-08至2009-12
2009,国际(地区)合作与交流项目,A01,672,10910301079,A03,第一届伽利略-徐光启国际会议,景益鹏,中国科学院上海天文台,4.0,2009-10至2009-12
2009,国际(地区)合作与交流项目,A01,673,30910303044,C07,干细胞与重编程,景乃禾,中国科学院上海生命科学研究院,4.0,2009-07至2009-12
2009,国际(地区)合作与交流项目,A01,674,70910307011,G02,中国管理研究方法研讨会,井润田,电子科技大学,3.0,2009-07至2009-07
2009,国际(地区)合作与交流项目,A01,675,50981340243,E0113,第五届中韩双边先进钢铁工业技术发展研讨会,金自力,内蒙古科技大学,10.0,2009-08至2009-12
2009,国际(地区)合作与交流项目,A01,676,60911130131,F020202,多视点需求工程中优先化需求的合并与修正,金芝,中国科学院数学与系统科学研究院,8.6,2009-04至2010-12
2009,国际(地区)合作与交流项目,A01,677,70911130176,G011203,我国统计数据质量的评估系统研究,金勇进,中国人民大学,2.8,2009-03至2009-12
2009,国际(地区)合作与交流项目,A01,678,30911130361,C120114,胚胎干细胞的转录调控与蛋白稳定性机制研究,金颖,上海交通大学,45.0,2010-01至2012-12
2009,国际(地区)合作与交流项目,A01,679,40910304037,D0202,国际地学计划516项目(IGCP-516)第五次国际研讨会,金小赤,中国地质科学院地质研究所,4.0,2009-07至2009-12
2009,国际(地区)合作与交流项目,A01,680,50920105806,E080501,基于全寿命的混凝土结构耐久性基础研究,金伟良,浙江大学,100.0,2010-01至2012-12
2009,国际(地区)合作与交流项目,A01,681,10911130173,A050203,ATLAS实验物理合作研究,金山,中国科学院高能物理研究所,4.3,2009-04至2009-12
2009,国际(地区)合作与交流项目,A01,682,50981260122,E080401,中国水资源及水质保护论坛,金鹏康,西安建筑科技大学,1.0,2009-06至2009-09
2009,国际(地区)合作与交流项目,A01,683,50981330499,E0608,中英能源动力系统中CO2捕集和埋存技术研讨会,金红光,中国科学院工程热物理研究所,13.0,2009-11至2009-12
2009,国际(地区)合作与交流项目,A01,684,50981330374,E0608,中芬可再生能源利用技术研讨会,金红光,中国科学院工程热物理研究所,6.8,2009-09至2009-12
2009,国际(地区)合作与交流项目,A01,685,40911140146,D0102,国际应用系统分析研究学会暑期青年科学家项目,金凤君,中国科学院地理科学与资源研究所,4.6,2009-06至2009-11
2009,国际(地区)合作与交流项目,A01,686,20910302055,B06,第二届水科学与水资源、低碳能源国际论坛,金放鸣,同济大学,3.0,2009-12至2009-12
2009,国际(地区)合作与交流项目,A01,687,20911140270,B040103,电喷雾-活性受体的开发及其在N-连接糖链分析中的应用,金东日,延边大学,5.0,2009-06至2011-05
2009,国际(地区)合作与交流项目,A01,688,10910301082,A040407,光子定域化和光子带隙国际会议,金崇君,中山大学,5.0,2010-01至2010-02
2009,国际(地区)合作与交流项目,A01,689,30981260455,H2801,中国西北部中药资源开发国际研讨会,金城,中国人民解放军第三０二医院,1.0,2009-12至2009-12
2009,国际(地区)合作与交流项目,A01,690,20910102050,B030704,结晶-结晶嵌段共聚物多尺度结构研究,蒋世春,天津大学,1.5,2009-10至2009-12
2009,国际(地区)合作与交流项目,A01,691,40911130159,D0305,华南早寒武纪Ni-Mo多金属矿化层的年代学研究,蒋少涌,南京大学,3.1,2009-05至2009-10
2009,国际(地区)合作与交流项目,A01,692,50920105101,E010301,金属玻璃原子结构和相变的研究,蒋建中,浙江大学,100.0,2010-01至2012-12
2009,国际(地区)合作与交流项目,A01,693,20981340465,B070501,药物设计理论与实验方法研讨会(2010),蒋华良,中国科学院上海药物研究所,8.0,2010-03至2010-09
2009,国际(地区)合作与交流项目,A01,694,60991240303,F040506,从经典到量子一维系统的非平衡物理暑期学校,姜岩峰,北方工业大学,1.0,2009-07至2009-12
2009,国际(地区)合作与交流项目,A01,695,60981240194,F040103,图案化金属纳米粒子制备及其表面增强拉曼散射效应研究,姜卫粉,华北水利水电大学,1.2,2009-05至2009-09
2009,国际(地区)合作与交流项目,A01,696,40981260002,D0702,中国水资源及水质保护论坛,姜彤,中国科学院南京地理与湖泊研究所,1.0,2009-06至2009-12
2009,国际(地区)合作与交流项目,A01,697,40911130506,D0702,海河和鄱阳湖流域气候极端值变化趋势评价和比较,姜彤,国家气候中心,45.0,2010-01至2012-12
2009,国际(地区)合作与交流项目,A01,698,50981220205,E050904,第二届中美（NSFC-NSF）“纳米制造”双边研讨会,姜澜,北京理工大学,1.2,2009-04至2009-12
2009,国际(地区)合作与交流项目,A01,699,60910306020,F050304,2009年中美光纤传感技术研究、发展与应用研讨会,姜德生,武汉理工大学,6.0,2009-07至2009-12
2009,国际(地区)合作与交流项目,A01,700,10910301032,A0504,国际电气与电子工程师学会第16届实时技术大会,江晓山,中国科学院高能物理研究所,3.0,2009-05至2009-12
2009,国际(地区)合作与交流项目,A01,701,20920102036,B0202,仿生智能孔道体系的设计与制备,江雷,中国科学院化学研究所,110.0,2010-01至2012-12
2009,国际(地区)合作与交流项目,A01,702,20931160427,B060305,环境污染物复合效应高通量研究平台,江桂斌,中国科学院生态环境研究中心,32.5,2010-01至2012-12
2009,国际(地区)合作与交流项目,A01,703,20910302047,B06,第29届国际二恶英大会,江桂斌,中国科学院生态环境研究中心,7.0,2009-08至2009-12
2009,国际(地区)合作与交流项目,A01,704,40920124002,D020101,二叠纪末大绝灭后的早-中三叠世海洋生态系复苏辐射过程中海生爬行动物群辐射演化事件序列及全球迁移-演变模型,江大勇,北京大学,140.0,2010-01至2013-12
2009,国际(地区)合作与交流项目,A01,705,40911130226,D020101,中国西南中三叠世海生脊椎动物群与德国Muschelkalk动物群的比较研究及其古地理联系,江大勇,北京大学,7.2,2009-07至2009-12
2009,国际(地区)合作与交流项目,A01,706,10981260461,A040205,2009凝聚态及光物理学术研讨会,冀子武,山东大学,1.0,2009-12至2009-12
2009,国际(地区)合作与交流项目,A01,707,10911120093,A050202,分波分析方法的开发和轻强子谱物理的研究,季晓斌,中国科学院高能物理研究所,9.0,2009-01至2010-12
2009,国际(地区)合作与交流项目,A01,708,10910101047,A020412,颗粒介质耗能减振的机理研究,季顺迎,大连理工大学,1.8,2009-06至2009-12
2009,国际(地区)合作与交流项目,A01,709,30911120046,C030402,中亚地区干旱半干旱区域直翅类昆虫多样性与暴发规律的探讨,季荣,新疆师范大学,9.0,2009-01至2010-12
2009,国际(地区)合作与交流项目,A01,710,10911130220,A030305,类地行星形成和动力学研究,季江徽,中国科学院紫金山天文台,1.0,2009-08至2009-12
2009,国际(地区)合作与交流项目,A01,711,20910102041,B010301,多组分反应构建杂环化合物中的催化剂导向性研究,纪顺俊,苏州大学,5.0,2009-10至2010-09
2009,国际(地区)合作与交流项目,A01,712,10911130232,A0402,铁磁半导体自旋矩转移和纳米自旋电子学的混合器件,姬扬,中国科学院半导体研究所,48.0,2009-09至2012-08
2009,国际(地区)合作与交流项目,A01,713,70910307017,G0214,第15届海峡两岸信息管理与信息系统发展与策略学术研讨会,霍佳震,同济大学,1.5,2009-08至2009-12
2009,国际(地区)合作与交流项目,A01,714,50910305020,E0213,第二届国际自密实混凝土设计、性能及应用会议,黄政宇,湖南大学,5.0,2009-06至2010-02
2009,国际(地区)合作与交流项目,A01,715,10910301042,A0117,第十九届区域分解法国际学术会议,黄云清,湘潭大学,3.5,2009-01至2009-12
2009,国际(地区)合作与交流项目,A01,716,30910303022,C120110,模式生物与疾病,黄勋,中国科学院遗传与发育生物学研究所,4.0,2009-05至2009-12
2009,国际(地区)合作与交流项目,A01,717,30910103089,C200301,选择离子流动管质谱法研究食品中呋喃的形成、变化与其测定,黄雪松,暨南大学,1.4,2010-01至2010-06
2009,国际(地区)合作与交流项目,A01,718,30911130167,H1809,采用动态因果模型分析精神分裂症患者的眼跟踪启动运动,黄晓琦,四川大学,4.1,2009-04至2010-12
2009,国际(地区)合作与交流项目,A01,719,50910305042,E0804,第五届国际水协会膜技术大会暨展览会,黄霞,清华大学,4.0,2009-09至2010-06
2009,国际(地区)合作与交流项目,A01,720,10911120388,A010705,动力系统中的独立性,黄文,中国科学技术大学,8.0,2010-01至2011-12
2009,国际(地区)合作与交流项目,A01,721,40921160379,D0506,全球变暖对西北太平洋台风活动和登陆我国台风的影响及其机理研究,黄荣辉,中国科学院大气物理研究所,200.0,2010-01至2012-12
