year,grant,sub,num,id,subject,title,author,school,money,duration
2014,联合基金项目,A01,445,U1407205,B0811,类离子液体相变储能理论及在盐湖镁、氯资源规模化利用中的应用基础研究,贾永忠,中国科学院青海盐湖研究所,260.0,2015-01至2018-12
2014,联合基金项目,A01,446,U1431118,A03,空间碎片捕获运动特征状态综合辨识及其关联动力学研究,贾杰,南昌航空大学,50.0,2015-01至2017-12
2014,联合基金项目,A01,447,U1404615,F010303,中继增强型的毫米波MIMO关键技术及通信理论研究,冀保峰,河南科技大学,28.0,2015-01至2017-12
2014,联合基金项目,A01,448,U1433121,F01,基于复杂网络理论的国家航路网络宏观结构评估与优化,霍志勤,中国民航科学技术研究院,38.0,2015-01至2017-12
2014,联合基金项目,A01,449,U1430124,A06,基于压缩采样的三维辐射驱动不对称性高效分析方法研究,黄运保,广东工业大学,80.0,2015-01至2017-12
2014,联合基金项目,A01,450,U1405254,L05,云数据安全审计的理论模型与新方法研究,黄永峰,清华大学,245.0,2015-01至2018-12
2014,联合基金项目,A01,451,U1404830,H2803,基于“部位敲除法”研究中药菝葜抗炎有效部位群及其作用机制,黄显章,南阳理工学院,31.8,2015-01至2017-12
2014,联合基金项目,A01,452,U1402267,L06,兰科同属物种的生殖隔离与共存机制的研究,黄双全,华中师范大学,220.0,2015-01至2018-12
2014,联合基金项目,A01,453,U1462102,B08,新型非茂金属催化剂与功能化共聚烯烃的分子结构设计及合成研究,黄启谷,北京化工大学,65.0,2015-01至2017-12
2014,联合基金项目,A01,454,U1433118,F01,基于多体动力学仿真和HMM的直升机传动系统早期故障诊断与预测维护,黄良沛,湖南科技大学,42.0,2015-01至2017-12
2014,联合基金项目,A01,455,U1404323,C170106,TGF-β在肉鸡肠黏膜屏障损伤中的作用及其机制研究,黄进,河南工业大学,30.0,2015-01至2017-12
2014,联合基金项目,A01,456,U1401226,L02,南药鸡骨草防治病毒性乙型肝炎的物质基础及作用机制,黄宝康,中国人民解放军第二军医大学,243.0,2015-01至2018-12
2014,联合基金项目,A01,457,U1404328,C180502,中国鸡杆菌禽类宿主多样性及遗传多态性研究,皇甫和平,河南牧业经济学院,30.0,2015-01至2017-12
2014,联合基金项目,A01,458,U1401235,L03,东江饮用水源区水污染风险与控制原理,胡勇有,华南理工大学,235.0,2015-01至2018-12
2014,联合基金项目,A01,459,U1435220,F020512,面向复杂情报的大数据分析方法与决策支持,胡晓惠,中国科学院软件研究所,500.0,2015-01至2018-12
2014,联合基金项目,A01,460,U1405228,L02,黄连素通过视黄醇X受体抑制肠癌生长机制的结构生物学分析和相应药物改造,胡天惠,厦门大学,255.0,2015-01至2018-12
2014,联合基金项目,A01,461,U1432126,A0803,重离子辐射诱变耐盐南荻的筛选及其分子机理,胡瑞波,中国科学院青岛生物能源与过程研究所,60.0,2015-01至2017-12
2014,联合基金项目,A01,462,U1405233,L03,台湾海峡与吕宋海峡水体交换及相互作用研究,胡建宇,厦门大学,250.0,2015-01至2018-12
2014,联合基金项目,A01,463,U1432121,A0803,赖氨酸甲基转移酶SET8调控对肿瘤细胞重离子辐射敏感性的影响及其机制研究,胡步荣,中国科学院近代物理研究所,66.0,2015-01至2017-12
2014,联合基金项目,A01,464,U1404829,H2801,基于转录组测序对调控山茱萸环烯醚萜苷合成的bHLH类转录因子的筛选及鉴定研究,侯典云,河南科技大学,30.0,2015-01至2017-12
2014,联合基金项目,A01,465,U1407109,B08,柴达木盆地盐湖锂同位素地球化学特征及其物质来源和富集规律研究,贺茂勇,中国科学院地球环境研究所,48.0,2015-01至2017-12
2014,联合基金项目,A01,466,U1433130,F01,航空自组织网中保护隐私的认证协议研究,何明星,西华大学,42.0,2015-01至2017-12
2014,联合基金项目,A01,467,U1402223,L02,中国汉族人群重型痤疮易感基因深度筛选及功能分析,何黎,昆明医科大学,223.0,2015-01至2018-12
2014,联合基金项目,A01,468,U1403123,L02,人巨细胞病毒感染与环境危险因素互作在新疆哈萨克族原发性高血压发病中作用及甲基化机制研究,何芳,石河子大学,56.0,2015-01至2017-12
2014,联合基金项目,A01,469,U1404216,B081105,TiO2光催化氧化NO的第一性原理研究,何朝政,南阳师范学院,32.0,2015-01至2017-12
2014,联合基金项目,A01,470,U1404215,B0404,血浆中β淀粉样多肽的存在形态及其在线检测方法的研究,郝远强,商丘师范学院,30.0,2015-01至2017-12
2014,联合基金项目,A01,471,U1462130,B080901,原位揭示负载型银催化剂生成过程及其结构调控,韩永生,中国科学院过程工程研究所,60.0,2015-01至2017-12
2014,联合基金项目,A01,472,U1430122,A06,KDP晶体超精密切削中的跨尺度材料去除机理研究,韩雪松,天津大学,80.0,2015-01至2017-12
2014,联合基金项目,A01,473,U1431121,A03,基于天文高速成像的空间碎片精密测量研究,韩兴伟,中国科学院国家天文台长春人造卫星观测站,50.0,2015-01至2017-12
2014,联合基金项目,A01,474,U1431120,A03,大质量比致密双星系统的高效率高精度引力波探测器波形模板数值模型,韩文标,中国科学院上海天文台,48.0,2015-01至2017-12
2014,联合基金项目,A01,475,U1404113,A050204,新物理模型中的Higgs粒子在高能对撞机上的唯象学研究,韩金钟,周口师范学院,30.0,2015-01至2017-12
2014,联合基金项目,A01,476,U1404703,G0203,基于联盟对手吸收能力的创新收益保护策略研究,海本禄,河南师范大学,28.0,2015-01至2017-12
2014,联合基金项目,A01,477,U1404803,H0516,Wnt/beta-catenin信号通路在腹膜透析腹膜间皮细胞转分化中的作用及机制研究,郭园园,郑州大学,30.5,2015-01至2017-12
2014,联合基金项目,A01,478,U1404516,E050503,微纳织构化黏附性超疏水表面的水润滑摩擦学性能及相关关系规律研究,郭永刚,河南工业大学,30.0,2015-01至2017-12
2014,联合基金项目,A01,479,U1460201,E04,利用XRD-XRF进行铁矿石矿物定量与表征方法的基础研究,郭兴敏,北京科技大学,200.0,2015-01至2018-12
2014,联合基金项目,A01,480,U1433103,F01,数据驱动与解析模型结合的民机飞控系统细粒度故障诊断,郭润夏,中国民航大学,40.0,2015-01至2017-12
2014,联合基金项目,A01,481,U1431117,A03,对毫秒脉冲星计时中的红噪声的解析研究,郭丽,中国科学院上海天文台,48.0,2015-01至2017-12
2014,联合基金项目,A01,482,U1463201,B08,微流场技术的尺度效应优化及其在氧化体系中的应用研究,郭凯,南京工业大学,300.0,2015-01至2018-12
2014,联合基金项目,A01,483,U1404314,C1302,硫氧还蛋白h及其靶蛋白在小麦种子萌发中的功能研究,郭红祥,河南农业大学,30.0,2015-01至2017-12
2014,联合基金项目,A01,484,U1401240,L04,面向电子制造的多机器人高速协调的关键理论与方法研究,管贻生,广东工业大学,241.0,2015-01至2018-12
2014,联合基金项目,A01,485,U1406402,D06,海洋药物与生物制品,管华诗,中国海洋大学,2000.0,2014-06至2016-12
2014,联合基金项目,A01,486,U1463205,B08,光解水制氢纳米光催化材料的表界面基础研究,巩金龙,天津大学,300.0,2015-01至2018-12
2014,联合基金项目,A01,487,U1431101,A03,致密天体中射电喷流与吸积的耦合,龚小龙,长江大学,48.0,2015-01至2017-12
2014,联合基金项目,A01,488,U1404523,E080402,垃圾填埋场渗滤液催化超临界水气化制氢研究,龚为进,中原工学院,30.0,2015-01至2017-12
2014,联合基金项目,A01,489,U1435209,E020701,极化特性调控超材料与雷达波陷阱设计,龚荣洲,华中科技大学,460.0,2015-01至2018-12
2014,联合基金项目,A01,490,U1435207,E010101,Ni3Al基单晶合金高温强化机理与合金化设计研究,宫声凯,北京航空航天大学,500.0,2015-01至2018-12
2014,联合基金项目,A01,491,U1404329,C180802,MAP2在氟致小鼠大脑损伤机制中的作用研究,葛亚明,河南科技学院,30.0,2015-01至2017-12
2014,联合基金项目,A01,492,U1432117,A0803,lncRNA-29314916-CCNB2通路在重离子放疗中的辐射增敏机理研究,葛盛芳,上海交通大学,68.0,2015-01至2017-12
2014,联合基金项目,A01,493,U1435214,F02,面向大数据的知识表示、推理、在线学习理论及应用研究,高阳,南京大学,150.0,2015-01至2018-12
2014,联合基金项目,A01,494,U1401248,L04,超级电容材料与器件的基础研究,高立军,苏州大学,241.0,2015-01至2018-12
2014,联合基金项目,A01,495,U1435210,E0209,可用于微光夜视领域的新型硅基近红外成像传感器芯片材料,高劲松,中国科学院长春光学精密机械与物理研究所,500.0,2015-01至2018-12
2014,联合基金项目,A01,496,U1404201,B0202,核壳结构Co@PtM/石墨烯纳米复合材料的构筑及其电催化性能,高海丽,郑州轻工业学院,30.0,2015-01至2017-12
2014,联合基金项目,A01,497,U1407131,B081101,察尔汗盐湖铷钾伴生资源综合利用过程中的相平衡问题研究,高丹丹,中国科学院青海盐湖研究所,60.0,2015-01至2017-12
2014,联合基金项目,A01,498,U1404707,G030702,国际研发资本技术溢出对中国区域碳生产率的影响研究,高大伟,郑州轻工业学院,29.3,2015-01至2017-12
2014,联合基金项目,A01,499,U1430115,A06,电磁热集成多层金属粘接结构无损检测及缺陷量化方法研究,高斌,电子科技大学,80.0,2015-01至2017-12
2014,联合基金项目,A01,500,U1430104,A06,全固态薄膜锂离子电池快锂离子固态电解质的研究,傅正文,复旦大学,80.0,2015-01至2017-12
2014,联合基金项目,A01,501,U1432101,A0801,基于同步辐射分层层析成像的碳纤维增强复合材料层压板原位失效分析研究,傅健,北京航空航天大学,72.0,2015-01至2017-12
2014,联合基金项目,A01,502,U1431103,A03,太阳II型射电暴的成像观测研究,冯士伟,山东大学,48.0,2015-01至2017-12
2014,联合基金项目,A01,503,U1430116,A06,陶瓷材料磨削强时变特性机理研究,冯平法,清华大学,98.0,2015-01至2017-12
2014,联合基金项目,A01,504,U1403285,L08,新疆棉花高效利用土壤磷的根际和菌丝际过程与调控,冯固,中国农业大学,210.0,2015-01至2018-12
2014,联合基金项目,A01,505,U1434202,E070303,高速列车永磁牵引系统设计理论与方法研究,方攸同,浙江大学,270.0,2015-01至2018-12
2014,联合基金项目,A01,506,U1407132,B081101,无机水合盐/膨胀石墨复合相变储热材料的制备及其热特性调控,方晓明,华南理工大学,60.0,2015-01至2017-12
2014,联合基金项目,A01,507,U1401254,L05,原发性肝癌多模态图像辅助诊疗自动化分析的关键技术研究,方驰华,南方医科大学,242.0,2015-01至2018-12
2014,联合基金项目,A01,508,U1462114,B08,载体受限结晶调控负载型Z-N催化剂的活性中心分布及聚烯烃链结构,范志强,浙江大学,60.0,2015-01至2017-12
2014,联合基金项目,A01,509,U1404512,E042205,矿井提升机频繁启制动功率协调控制可逆变频调速系统研究,范波,河南科技大学,30.0,2015-01至2017-12
2014,联合基金项目,A01,510,U1432123,A0803,采用大面积GEM读出的TPC探测器研制,段利敏,中国科学院近代物理研究所,76.0,2015-01至2017-12
2014,联合基金项目,A01,511,U1404203,B050101,三元钴镍硫属化物纳米晶及其衍生材料的合成与超电容性能研究,杜卫民,安阳师范学院,30.0,2015-01至2017-12
2014,联合基金项目,A01,512,U1404601,F020701,旋转对称弹性函数的构造及其安全性能研究,杜蛟,河南师范大学,30.0,2015-01至2017-12
2014,联合基金项目,A01,513,U1435219,F020304,面向多源遥感图像的深度学习技术与系统研究,窦勇,中国人民解放军国防科技大学,500.0,2015-01至2018-12
2014,联合基金项目,A01,514,U1404804,H0517,生物电阻抗法定量腹膜透析干体重的模型研究,窦艳娜,郑州大学,30.0,2015-01至2017-12
2014,联合基金项目,A01,515,U1432245,A0802,应用同步辐射技术研究PM2.5在呼吸道细胞内的迁移转化及其诱导细胞氧化损伤的分子作用机制,丁文军,中国科学院大学,320.0,2015-01至2018-12
2014,联合基金项目,A01,516,U1404701,G0102,复杂环境下不确定瓶颈指派问题研究,丁四波,河南工业大学,29.5,2015-01至2017-12
2014,联合基金项目,A01,517,U1401231,L03,粤北铀尾矿库及周边地区放射性污染产生机制及控制原理,丁德馨,南华大学,250.0,2015-01至2018-12
2014,联合基金项目,A01,518,U1405215,L01,马蓝药效物质形成分子机制的阐释及优异种质创新研究,刁勇,华侨大学,238.0,2015-01至2018-12
2014,联合基金项目,A01,519,U1407124,B081005,锂离子电容器负极用高性能多孔超细钛酸镁/碳复合材料的设计、合成及电极构筑,邓远富,华南理工大学,60.0,2015-01至2017-12
2014,联合基金项目,A01,520,U1405223,L02,基于海洋微生物的靶向抗肿瘤药物研究,邓贤明,厦门大学,256.0,2015-01至2018-12
2014,联合基金项目,A01,521,U1433124,F01,面向枢纽机场停机位动态分配优化模型及智能调度算法研究,邓武,大连交通大学,38.0,2015-01至2017-12
2014,联合基金项目,A01,522,U1407113,B080101,柴达木盆地盐湖卤水体系多温热力学性质及其相平衡动态预测研究,邓天龙,天津科技大学,60.0,2015-01至2017-12
2014,联合基金项目,A01,523,U1404831,H2818,土家药四楞麻抗肝纤维化活性成分及作用机制研究,邓瑞雪,河南科技大学,30.0,2015-01至2017-12
2014,联合基金项目,A01,524,U1433127,F01,基于脉冲光束质量因子激光雷达探测低空大气湍流及风切变的基础及方法研究,但有全,中国民用航空飞行学院,40.0,2015-01至2017-12
2014,联合基金项目,A01,525,U1432118,A0803,低能离子与三原子分子碰撞的俘获解离实验研究,单旭,中国科学技术大学,72.0,2015-01至2017-12
2014,联合基金项目,A01,526,U1433117,F01,面向航空发动机缺损叶片自动焊接修复的三维测量与重构系统关键技术和方法研究,戴士杰,河北工业大学,38.0,2015-01至2017-12
2014,联合基金项目,A01,527,U1403294,L09,金属氮化物催化乙炔氢氯化的基础研究,代斌,石河子大学,215.0,2015-01至2018-12
2014,联合基金项目,A01,528,U1404614,F030602,复杂动态环境下参数不确定轮式移动机器人运动控制方法研究,崔明月,南阳师范学院,30.0,2015-01至2017-12
2014,联合基金项目,A01,529,U1404318,C140105,大豆疫霉菌无毒效应因子Avr3a逃避抗病蛋白识别的分子机制研究,崔林开,河南科技大学,32.0,2015-01至2017-12
2014,联合基金项目,A01,530,U1462127,B080205,超重力反应器强化调控稠环芳烃加氢裂化耦合反应及机理研究,初广文,北京化工大学,60.0,2015-01至2017-12
2014,联合基金项目,A01,531,U1434206,E080506,高速铁路隧道服役行为及安全风险控制研究,仇文革,西南交通大学,275.0,2015-01至2018-12
2014,联合基金项目,A01,532,U1432109,A0802,纤维素生物质预处理机制的多尺度原位研究,程刚,北京化工大学,70.0,2015-01至2017-12
2014,联合基金项目,A01,533,U1404306,C040204,凹耳臭蛙和大绿臭蛙高频听觉敏感基因的分子进化模式研究,陈卓,河南师范大学,30.0,2015-01至2017-12
2014,联合基金项目,A01,534,U1405252,L05,金属有机磷光材料在电致发光器件中的应用探索,陈忠宁,中国科学院福建物质结构研究所,260.0,2015-01至2018-12
2014,联合基金项目,A01,535,U1432104,A0801,X射线衍射异常精细结构（DAFS）方法研究,陈中军,中国科学院高能物理研究所,72.0,2015-01至2017-12
2014,联合基金项目,A01,536,U1403292,L09,天山造山带中-新生代再造过程与砂岩型铀矿成矿作用,陈正乐,中国地质科学院地质力学研究所,210.0,2015-01至2018-12
2014,联合基金项目,A01,537,U1430114,A06,240Pu自发裂变气体产物产额理论研究,陈永静,中国原子能科学研究院,80.0,2015-01至2017-12
2014,联合基金项目,A01,538,U1402263,L06,角倍蚜虫瘿形成的分子机理及虫瘿的生态学意义,陈晓鸣,中国林业科学研究院资源昆虫研究所,220.0,2015-01至2018-12
2014,联合基金项目,A01,539,U1430117,A06,500GPa压力范围内多晶钽的压缩特性的高精确度作用势研究,陈向荣,四川大学,80.0,2015-01至2017-12
2014,联合基金项目,A01,540,U1405212,L01,闽台水稻种质稻瘟病基础抗性基因资源挖掘及抗性机制研究,陈松彪,福建省农业科学院,259.0,2015-01至2018-12
2014,联合基金项目,A01,541,U1462113,B08,面向石化过程节能的多级分离技术与系统协同优化策略研究,陈清林,中山大学,70.0,2015-01至2017-12
2014,联合基金项目,A01,542,U1402221,L02,基于云天麻的新型联苄类化合物抗帕金森病作用机制及成药性研究,陈乃宏,中国医学科学院药物研究所,223.0,2015-01至2018-12
2014,联合基金项目,A01,543,U1431230,A03,7毫米波段宽带制冷接收机技术研究,陈卯蒸,中国科学院新疆天文台,250.0,2015-01至2018-12
2014,联合基金项目,A01,544,U1402222,L02,云南崖豆藤属植物中新型抗微管天然活性物质的发现、结构优化、成药性及作用机制研究,陈俐娟,四川大学,223.0,2015-01至2018-12
2014,联合基金项目,A01,545,U1405225,L02,Hippo通路在内质网稳态维持中的调节作用及其在肝癌治疗应用中的研究,陈兰芬,厦门大学,255.0,2015-01至2018-12
2014,联合基金项目,A01,546,U1433101,F01,新型环境友好飞机燃油系统防冰剂的研究,陈凯,中国民用航空总局第二研究所,42.0,2015-01至2017-12
2014,联合基金项目,A01,547,U1460106,E04,碳钢表面石墨烯基水性纳米复合涂层的制备及其腐蚀防护机理,陈均,安徽工业大学,46.0,2015-01至2017-12
2014,联合基金项目,A01,548,U1403224,L02,新疆药用肉苁蓉及其寄主种质资源评价研究,陈君,中国医学科学院药用植物研究所,215.0,2015-01至2018-12
2014,联合基金项目,A01,549,U1401244,L04,印刷型高效率厚膜聚合物太阳电池的高迁移率活性层材料设计与机制研究,陈军武,华南理工大学,241.0,2015-01至2018-12
2014,联合基金项目,A01,550,U1430234,A06,高选择性分离锂同位素新型冠醚类复合吸附材料的制备及构效研究,陈靖,清华大学,400.0,2015-01至2018-12
2014,联合基金项目,A01,551,U1405235,L03,海峡西岸城市群灰霾的生成、消散与防控机制,陈进生,中国科学院城市环境研究所,240.0,2015-01至2018-12
2014,联合基金项目,A01,552,U1402264,L06,榕树与榕小蜂协同进化的地理马赛克效应及其进化含义,陈进,中国科学院西双版纳热带植物园,220.0,2015-01至2018-12
2014,联合基金项目,A01,553,U1405216,L01,猪瘟病毒感染诱导的内质网应激-自噬对其免疫逃逸的调控作用及机制研究,陈金顶,华南农业大学,272.0,2015-01至2018-12
2014,联合基金项目,A01,554,U1401253,L05,网络化控制系统安全理论与关键技术,陈积明,浙江大学,240.0,2015-01至2018-12
2014,联合基金项目,A01,555,U1404702,G0110,动态EWMA控制图和预防维修策略联合经济设计,陈洪根,郑州航空工业管理学院,27.4,2015-01至2017-12
2014,联合基金项目,A01,556,U1404616,F040306,基于透明的双面TiO2纳米管/ITO电极的CdS/CuInS2量子点敏化太阳能电池研究,陈冲,河南大学,30.0,2015-01至2017-12
2014,联合基金项目,A01,557,U1405251,L05,安全和高效的异构车联网融合理论与海量数据分析方法研究,陈彩莲,上海交通大学,255.0,2015-01至2018-12
2014,联合基金项目,A01,558,U1430133,A06,微惯性器件的稳定性控制方法研究,车录锋,浙江大学,80.0,2015-01至2017-12
2014,联合基金项目,A01,559,U1404406,D0201,基于地球生物学的豫西寒武纪叠层石繁盛机理研究,常玉光,河南理工大学,30.0,2015-01至2017-12
2014,联合基金项目,A01,560,U1403391,L09,新疆东天山黄土坡铜锌多金属矿火山作用对成矿机制的制约,柴凤梅,新疆大学,100.0,2015-01至2018-12
2014,联合基金项目,A01,561,U1404620,F0205,基于行为特征的恶意程序动态分析与检测研究,曹莹,周口师范学院,30.0,2015-01至2017-12
2014,联合基金项目,A01,562,U1433119,F01,基于微观力学的复合材料低速冲击损伤演化及剩余疲劳寿命预测,蔡洪能,西安交通大学,38.0,2015-01至2017-12
2014,联合基金项目,A01,563,U1435222,F020504,面向生物威胁快速反应的大数据分析关键技术,伯晓晨,中国人民解放军军事科学院军事医学研究院,480.0,2015-01至2018-12
2014,联合基金项目,A01,564,U1432115,A0802,高压电场下聚合物液体射流微观结构演变规律的同步辐射SAXS原位研究,边风刚,中国科学院上海应用物理研究所,66.0,2015-01至2017-12
2014,联合基金项目,A01,565,U1401224,L02,结核分枝杆菌致病相关蛋白质-RNA二元网络构建及功能研究,毕利军,中国科学院生物物理研究所,243.0,2015-01至2018-12
2014,联合基金项目,A01,566,U1407134,B080901,水杨酸功能化杂化材料的制备及其在盐湖老卤吸附法提硼中的应用研究,鲍宗必,浙江大学,64.0,2015-01至2017-12
2014,联合基金项目,A01,567,U1462203,B08,耐硫型轻质烃类异构化催化剂设计和制备的基础研究,鲍晓军,福州大学,320.0,2015-01至2018-12
2014,联合基金项目,A01,568,U1404505,E020801,AlxGa1-xN和AlN@GaN纳米纤维的设计合成与光学性质研究,鲍克燕,南阳师范学院,30.0,2015-01至2017-12
2014,联合基金项目,A01,569,U1430102,A06,可动RFMEMS器件失效机理研究,鲍景富,电子科技大学,80.0,2015-01至2017-12
2014,联合基金项目,A01,570,U1430123,A06,基于微动分析的空间目标高分辨三维成像技术,白雪茹,西安电子科技大学,86.0,2015-01至2017-12
2014,联合基金项目,A01,571,U1404519,E060503,液相连续撞击流耦合鼓泡作用下天然气水合物生成过程机理,白净,郑州大学,30.0,2015-01至2017-12
2014,联合基金项目,A01,572,U1403283,L08,新疆马梨形虫病流行规律及其优势媒介蜱生物学特性鉴定和检测技术的研究,巴音查汗,新疆农业大学,210.0,2015-01至2018-12
2014,联合基金项目,A01,573,U1403201,L10,五种新疆特有贝母的药效物质基础研究与资源评价,阿布力米提·伊力,中国科学院新疆理化技术研究所,210.0,2015-01至2018-12
