year,grant,sub,num,id,subject,title,author,school,money,duration
2013,联合基金项目,A01,449,U1304816,H1617,血清miR-191在食管癌复发中的作用及机制研究,崔瑞雪,郑州大学,30.0,2014-01至2017-12
2013,联合基金项目,A01,450,U1330115,A06,铈的高压相变与物性研究,崔啟良,吉林大学,86.0,2014-01至2016-12
2013,联合基金项目,A01,451,U1361123,E0422,以高铝粉煤灰为原料熔盐电解法制备铝镓合金及其制氢机理研究,储向峰,安徽工业大学,60.0,2014-01至2016-12
2013,联合基金项目,A01,452,U1302265,L06,云南药用野生稻耿马居群广谱高抗白叶枯病基因及对应的无毒基因的鉴定和分离研究,程在全,云南省农业科学院,220.0,2014-01至2017-12
2013,联合基金项目,A01,453,U1304822,H2709,附子-白术“药对”干预乳腺癌骨转移骨质流失的作用机制,程旭锋,河南中医药大学,30.0,2014-01至2016-12
2013,联合基金项目,A01,454,U1331109,A03,天体测量仪器角编码器误差改正的一种方法,程向明,中国科学院云南天文台,60.0,2014-01至2016-12
2013,联合基金项目,A01,455,U1361130,E0422,侏罗纪煤层井工开采自燃机理及火区探测技术基础研究,程根银,华北科技学院,60.0,2014-01至2016-12
2013,联合基金项目,A01,456,U1333106,F01,单频网外辐射源低空监视雷达阵列校正新方法研究,程丰,武汉大学,37.0,2014-01至2016-12
2013,联合基金项目,A01,457,U1361112,E0422,新型液相加氢反应器的开发与流体力学放大研究,成有为,浙江大学,60.0,2014-01至2016-12
2013,联合基金项目,A01,458,U1333132,F01,基于代谢组学方法的飞行疲劳生物标志物探索研究,陈振玲,民航总医院,37.0,2014-01至2016-12
2013,联合基金项目,A01,459,U1332114,A0802,结核分枝杆菌第二信使c-di-GMP合成和降解途径中重要酶的结构与功能研究,陈宇星,中国科学技术大学,80.0,2014-01至2016-12
2013,联合基金项目,A01,460,U1305244,L04,稀土上转换荧光标记材料及其生物医学应用,陈学元,中国科学院福建物质结构研究所,300.0,2014-01至2017-12
2013,联合基金项目,A01,461,U1330105,A06,铈单晶的制备与基础物性研究,陈仙辉,中国科学技术大学,92.0,2014-01至2016-12
2013,联合基金项目,A01,462,U1330114,A06,压控半导体高功率开关器件瞬态输运机理与关键技术研究,陈万军,电子科技大学,90.0,2014-01至2016-12
2013,联合基金项目,A01,463,U1304516,E030701,基于热可逆溶胶-凝胶转变“一锅煮”法制备可恢复双网络水凝胶及其性能研究,陈强,河南理工大学,30.0,2014-01至2016-12
2013,联合基金项目,A01,464,U1332119,A0802,量子点的生物学效应及其机理的同步辐射研究,陈楠,中国科学院上海应用物理研究所,70.0,2014-01至2016-12
2013,联合基金项目,A01,465,U1304332,C200703,芽孢杆菌代谢活性物质(Surfactin)对禾谷镰刀菌的作用机制,陈亮,河南工业大学,30.0,2014-01至2016-12
2013,联合基金项目,A01,466,U1304208,B0304,杂多钼氧酸盐3d-4f异金属衍生材料的设计合成及其对偶氮类染料光降解性能研究,陈利娟,河南大学,30.0,2014-01至2016-12
2013,联合基金项目,A01,467,U1332133,A0804,稀土激活碱土硅酸盐LED橘色荧光材料的能带结构、相变与格位选择发光调控机制研究,陈雷,合肥工业大学,70.0,2014-01至2016-12
2013,联合基金项目,A01,468,U1301231,L03,珠江流域水体重金属污染的多同位素体系示踪,陈玖斌,中国科学院地球化学研究所,270.0,2014-01至2017-12
2013,联合基金项目,A01,469,U1302231,L03,高原湖泊有机碳来源及迁移转化过程的⊿14C-δ13C示踪,陈敬安,中国科学院地球化学研究所,225.0,2014-01至2017-12
2013,联合基金项目,A01,470,U1330139,A06,低附带杀伤效应对生物目标杀伤机理研究,陈菁,中国人民解放军第三军医大学,80.0,2014-01至2016-12
2013,联合基金项目,A01,471,U1305212,L01,闽台特色水禽重要病毒的致病机理研究,陈吉龙,福建农林大学,280.0,2014-01至2017-12
2013,联合基金项目,A01,472,U1304819,H1818,用于乳腺癌联合化疗的双层纳米药物输送体系的研究,陈红丽,新乡医学院,30.0,2014-01至2016-12
2013,联合基金项目,A01,473,U1304525,E070602,电动汽车驱动中随机空间矢量PWM的谐波特性与控制方法研究,陈国强,河南理工大学,30.0,2014-01至2016-12
2013,联合基金项目,A01,474,U1301252,L05,面向大数据的高性能云计算关键技术研究,陈国良,深圳大学,270.0,2014-01至2017-12
2013,联合基金项目,A01,475,U1332121,A0803,快重离子辐照激光晶体光波导的制备和波导激光产生,陈峰,山东大学,76.0,2014-01至2016-12
2013,联合基金项目,A01,476,U1303283,L08,牛病毒性腹泻病毒持续性感染的分子机制研究,陈创夫,石河子大学,215.0,2014-01至2017-12
2013,联合基金项目,A01,477,U1305245,L04,超高性能混凝土制备与工程应用基础研究,陈宝春,福州大学,290.0,2014-01至2017-12
2013,联合基金项目,A01,478,U1330118,A06,热诱导KDP晶体应力缺陷演化规律的超微观研究,车仁超,复旦大学,86.0,2014-01至2016-12
2013,联合基金项目,A01,479,U1304604,F020701,具有良好线性复杂度和错误线性复杂度性质的密码周期序列的设计与分析,常祖领,郑州大学,30.0,2014-01至2016-12
2013,联合基金项目,A01,480,U1330131,A06,新型室温固化剂体系设计与机理研究,柴涛,中北大学,78.0,2014-01至2016-12
2013,联合基金项目,A01,481,U1304603,F020305,众核编程环境中多模型协同共存的系统化方法研究,曹仰杰,郑州大学,29.0,2014-01至2016-12
2013,联合基金项目,A01,482,U1304101,A010301,子流形几何中积分形式的移动平面法,曹林芬,河南师范大学,30.0,2014-01至2016-12
2013,联合基金项目,A01,483,U1331105,A03,空间氢脉泽电子学系统关键技术研究,蔡勇,中国科学院上海天文台,58.0,2014-01至2016-12
2013,联合基金项目,A01,484,U1332206,A0803,基于HIRFL-CSR的高离化态离子X射线谱学：强场中的双电子过程研究,蔡晓红,中国科学院近代物理研究所,300.0,2014-01至2017-12
2013,联合基金项目,A01,485,U1334211,F030209,基于自主感知的列车运行安全控制和保障理论与方法,蔡伯根,北京交通大学,270.0,2014-01至2017-12
2013,联合基金项目,A01,486,U1330133,A06,高动态惯性/卫星超紧组合导航技术研究,薄煜明,南京理工大学,80.0,2014-01至2016-12
2013,联合基金项目,A01,487,U1361214,E0422,风积沙区超大工作面开采后土地损伤与生态演变规律及其修复对策研究,卞正富,中国矿业大学,220.0,2014-01至2017-12
2013,联合基金项目,A01,488,U1332127,A0803,基于模式生物线虫的重离子细胞损伤效应和径迹过程的关联研究,卞坡,中国科学院合肥物质科学研究院,68.0,2014-01至2016-12
2013,联合基金项目,A01,489,U1301222,L02,mTORC1/mTORC2信号通路在增龄性骨丢失中的作用及其调节机制,白晓春,南方医科大学,260.0,2014-01至2017-12
2013,联合基金项目,A01,490,U1330101,A06,外载荷作用下高聚物粘结炸药的损伤分析与建模研究,白树林,北京大学,88.0,2014-01至2016-12
2013,联合基金项目,A01,491,U1333120,F01,新型航电设备重离子辐射效应仿真测试及安全性评估方法研究,白杰,中国民航大学,40.0,2014-01至2016-12
2013,联合基金项目,A01,492,U1304109,A040203,基于MS2(M=Mo W)纳米结构的纳米电子器件的模拟与设计,安义鹏,河南师范大学,30.0,2014-01至2017-12
2013,联合基金项目,A01,493,U1303322,L02,基于蛋白质组学分析的维医阳痿同病异证及方药干预的临床基础研究,阿地力江·伊明,新疆医科大学,100.0,2014-01至2018-12
