year,grant,sub,num,id,subject,title,author,school,money,dueration
2011,联合基金项目,A01,156,U1134206,E080704,基于可靠度的高速铁路无砟轨道结构全寿命设计理论与方法研究,孙璐,东南大学,260,2012-01至2015-12
2011,联合基金项目,A01,157,U1128301,L08,GhAGPF1基因在棉纤维细胞发育中的功能及调控分子机制研究,孙杰,石河子大学,100,2012-01至2015-12
2011,联合基金项目,A01,158,51134024,E0422,煤矿安全生产监控与通信基础研究,孙继平,中国矿业大学（北京）,220,2012-01至2015-12
2011,联合基金项目,A01,159,61179074,F01,基于航线运力配置优化的民用飞机市场需求分析方法研究,孙宏,中国民用航空飞行学院,38,2012-01至2014-12
2011,联合基金项目,A01,160,U1179301,L09,东天山图拉尔根与白石泉铜镍硫化物矿床成矿机制的对比：来自岩浆中硫的溶解度与橄榄石成分的约束,孙赫,中国冶金地质总局矿产资源研究院,50,2012-01至2014-12
2011,联合基金项目,A01,161,U1136601,L06,横断山温带森林植物区系起源进化及分布格局形成的研究,孙航,中国科学院昆明植物研究所,220,2012-01至2015-12
2011,联合基金项目,A01,162,11176004,A06,全氮化合物的分子设计与探索合成,孙成辉,北京理工大学,50,2012-01至2014-12
2011,联合基金项目,A01,163,11179015,A0804,基于微细加工技术制备的三维微电极阵列研究创伤后应激障碍脑杏仁体的神经网络机制,随力,上海理工大学,52,2012-01至2014-12
2011,联合基金项目,A01,164,51174286,E0422,基于颗粒流的采掘溃砂机制及预测防治研究,隋旺华,中国矿业大学,45,2012-01至2014-12
2011,联合基金项目,A01,165,11176034,A06,导热颗粒填充聚砜复合材料的制备与性能研究,隋国鑫,中国科学院金属研究所,44,2012-01至2014-12
2011,联合基金项目,A01,166,61179050,F01,航空用阻燃聚碳酸酯材料的开发,苏正良,中国民用航空总局第二研究所,30,2012-01至2014-12
2011,联合基金项目,A01,167,U1132004,L02,广东潮汕食管癌发病风险预测的分子基础研究,苏敏,汕头大学,258,2012-01至2015-12
2011,联合基金项目,A01,168,U1162126,B080303,超强酸度氟功能化磺酸离子液体的制备及烷基化催化性能研究,苏宝根,浙江大学,45,2012-01至2014-12
2011,联合基金项目,A01,169,61179048,F01,协同诊断行为的可视化建模方法研究,宋云雪,中国民航大学,39,2012-01至2014-12
2011,联合基金项目,A01,170,11176013,A06,低合金超高强度钢淬火回火过程本构行为与数值模拟研究,石伟,清华大学,44,2012-01至2014-12
2011,联合基金项目,A01,171,11178013,A0303,人马座矮星系恒星的低分辨率光谱分析,石维彬,山东大学,30,2012-01至2014-12
2011,联合基金项目,A01,172,11179025,A0801,基于同步辐射技术研究土壤-水稻系统铜硫协同转化和迁移机制,施积炎,浙江大学,46,2012-01至2014-12
2011,联合基金项目,A01,173,11179002,A0803,空间单粒子辐射危害效应及其分子机理研究,邵春林,复旦大学,280,2012-01至2015-12
2011,联合基金项目,A01,174,11178017,A03,最新sCMOS成像技术及其在太阳观测中的适用性研究,尚媛园,首都师范大学,34,2012-01至2014-12
2011,联合基金项目,A01,175,11176032,A06,超宽谱太赫兹源空间功率合成技术及辐射特性研究,尚丽平,西南科技大学,45,2012-01至2014-12
2011,联合基金项目,A01,176,11178004,A03,云南天文台一米红外太阳塔自适应光学高分辨力成像技术研究,饶长辉,中国科学院光电技术研究所,170,2012-01至2015-12
2011,联合基金项目,A01,177,U1134007,L04,组织工程三维支架的精细结构与生物分子信息对干细胞定向分化的作用研究,全大萍,中山大学,260,2012-01至2015-12
2011,联合基金项目,A01,178,11179041,A0803,高离化态离子与多电子原子碰撞电荷转移过程的理论研究,屈一至,中国科学院大学,40,2012-01至2014-12
2011,联合基金项目,A01,179,U1132604,L02,抗肿瘤升麻三萜的构效优化、作用机制和成药性的研究,邱明华,中国科学院昆明植物研究所,200,2012-01至2015-12
2011,联合基金项目,A01,180,U1162202,B08,复杂化工过程资源高效利用的系统优化方法与关键技术,钱锋,华东理工大学,250,2012-01至2015-12
2011,联合基金项目,A01,181,U1120302,L10,应用极端环境微生物修复干旱区重金属和As污染环境,潘响亮,中国科学院新疆生态与地理研究所,100,2012-01至2015-12
2011,联合基金项目,A01,182,U1129301,L09,大尺寸紫外激光倍频晶体氯硼酸钾的生长及性能研究,潘世烈,中国科学院新疆理化技术研究所,100,2012-01至2015-12
2011,联合基金项目,A01,183,U1131003,L01,稻种资源的稻瘟病抗性鉴评及新抗病基因的发掘及其功能研究,潘庆华,华南农业大学,260,2012-01至2015-12
2011,联合基金项目,A01,184,51174272,E0422,浅埋深薄基岩煤层采动覆岩破断特性与机理研究,欧阳振华,煤炭科学技术研究院有限公司,45,2012-01至2014-12
2011,联合基金项目,A01,185,U1137603,L07,矿热冶炼废气中典型还原性杂质催化氧化净化关键问题研究,宁平,昆明理工大学,200,2012-01至2015-12
2011,联合基金项目,A01,186,U1134108,E0703,车网电气耦合基础理论与关键技术研究,年晓红,中南大学,60,2012-01至2014-12
2011,联合基金项目,A01,187,U1178306,L08,新疆小麦品种资源遗传多样性分析及品质性状的关联定位,穆培源,新疆农垦科学院,50,2012-01至2014-12
2011,联合基金项目,A01,188,11176015,A06,非规则网格的front tracking方法研究与程序实现,茅德康,上海大学,40,2012-01至2014-12
2011,联合基金项目,A01,189,U1138302,L08,新疆博斯腾湖环境演变及对气候变化的响应,麦麦提吐尔逊·艾则孜,新疆师范大学,171,2012-01至2015-12
2011,联合基金项目,A01,190,51174281,E0422,煤直接液化残渣中有效组分定向热转化与调控机理研究,马晓迅,西北大学,45,2012-01至2014-12
2011,联合基金项目,A01,191,U1137601,L07,冶金法制备太阳能级多晶硅中的真空精炼研究,马文会,昆明理工大学,210,2012-01至2015-12
2011,联合基金项目,A01,192,U1162123,B08,聚取代苯乙炔类二氧化碳分离膜的制备及其分离过程工艺技术研究,马立群,齐齐哈尔大学,50,2012-01至2014-12
2011,联合基金项目,A01,193,11179027,A0802,超高分子量聚乙烯纤维成型过程中结构形态演变的同步辐射原位在线研究,马敬红,东华大学,46,2012-01至2014-12
2011,联合基金项目,A01,194,U1135002,L05,数字社区无线网络信息融合安全理论及关键技术研究,马建峰,西安电子科技大学,260,2012-01至2015-12
2011,联合基金项目,A01,195,U1162101,B08,基于原子经济性合成丙炔酸及其衍生物的CO2资源化利用基础研究,吕小兵,大连理工大学,50,2012-01至2014-12
2011,联合基金项目,A01,196,11178015,A03,结合SDSS及LAMOST观测资料研究相互作用“星系对”的性质,罗智坚,上海师范大学,28,2012-01至2014-12
2011,联合基金项目,A01,197,U1134005,L04,高性能轮胎用橡胶基纳米复合材料的制备、结构与性能,罗远芳,华南理工大学,267,2012-01至2015-12
2011,联合基金项目,A01,198,51174271,E0422,生态脆弱矿区生态恢复机理与效应研究,罗旭,煤炭科学技术研究院有限公司,45,2012-01至2014-12
2011,联合基金项目,A01,199,U1132001,L02,广东人群常见偏颇体质对健康向亚健康转化的影响及其机制研究,罗仁,南方医科大学,258,2012-01至2015-12
2011,联合基金项目,A01,200,U1133004,L03,电子垃圾重金属-POPs复合污染土壤的生物修复机制,罗春玲,中国科学院广州地球化学研究所,250,2012-01至2015-12
2011,联合基金项目,A01,201,11176003,A06,超导加速腔频率在线调节技术研究,鲁向阳,北京大学,50,2012-01至2014-12
2011,联合基金项目,A01,202,U1178307,L08,哈密瓜抗蔓枯病聚合育种研究,娄群峰,南京农业大学,50,2012-01至2014-12
2011,联合基金项目,A01,203,11179016,A0803,N～20丰中子Al、Si、P和S同位素的中能库仑激发,柳敏良,中国科学院近代物理研究所,44,2012-01至2014-12
2011,联合基金项目,A01,204,U1170303,L10,新疆极端生境微生物灭生性除草剂抗性基因资源的挖掘,刘子铎,华中农业大学,50,2012-01至2014-12
2011,联合基金项目,A01,205,U1134204,E0706,高速铁路电力牵引系统的安全性预测与控制,刘志刚,北京交通大学,270,2012-01至2015-12
2011,联合基金项目,A01,206,51174266,E0422,神华集团内蒙古矿区煤中砷对周边生态环境的影响规律研究,刘志斌,辽宁工程技术大学,45,2012-01至2014-12
2011,联合基金项目,A01,207,11176031,A06,主动诱发铀部件裂变时间关联信号求解铀部件质量丰度方法研究,刘知贵,西南科技大学,47,2012-01至2014-12
2011,联合基金项目,A01,208,11176010,A06,动压箔片轴承气体－弹性动力学研究,刘占生,哈尔滨工业大学,40,2012-01至2014-12
2011,联合基金项目,A01,209,11176035,A06,离心场中结构运动与变形耦合理论及应用研究,刘占芳,重庆大学,40,2012-01至2014-12
2011,联合基金项目,A01,210,61179071,F01,双曲时差定位的线性化及相关优化估计理论研究及实现,刘怡光,四川大学,36,2012-01至2014-12
2011,联合基金项目,A01,211,61179070,F01,航站楼人群应急疏散微观仿真模型研究,刘一,中国民航管理干部学院,39,2012-01至2014-12
2011,联合基金项目,A01,212,U1162130,B08,丙烯聚合生产多尺度智能最优熔融指数混合建模研究,刘兴高,浙江大学,45,2012-01至2014-12
2011,联合基金项目,A01,213,U1133605,L03,山地云雾林生态系统附生植物对气候变化的响应机制,刘文耀,中国科学院西双版纳热带植物园,195,2012-01至2015-12
2011,联合基金项目,A01,214,11178023,A03,基于单频调制技术的被动型小氢钟长期频率稳定度研究,刘铁新,中国科学院上海天文台,30,2012-01至2015-12
2011,联合基金项目,A01,215,U1130302,L10,新疆高寒地区阿勒泰羊耐寒抗性的分子机制研究,刘守仁,新疆农垦科学院,183,2012-01至2015-12
2011,联合基金项目,A01,216,11178002,A0302,自生磁场、湍动加速及其在天体物理中的应用,刘三秋,南昌大学,140,2012-01至2015-12
2011,联合基金项目,A01,217,11179022,A0801,核糖核酸内切酶Nob1及其复合物的结构与功能,刘全胜,中国科学院高能物理研究所,52,2012-01至2014-12
2011,联合基金项目,A01,218,U1178304,L08,西昆仑山冻土积雪变化对河流水资源影响监测研究,刘景时,中国科学院青藏高原研究所,50,2012-01至2014-12
2011,联合基金项目,A01,219,11179003,A0803,地面模拟空间辐射环境下的技术方法及单粒子效应研究,刘杰,中国科学院近代物理研究所,240,2012-01至2015-12
2011,联合基金项目,A01,220,51174265,E0422,基于自适应原理的集约化矿井智能仿真关键基础研究,刘剑,辽宁工程技术大学,45,2012-01至2014-12
2011,联合基金项目,A01,221,11178016,A03,太阳磁场非势性动态演化与爆发事件的关系研究,刘继宏,石家庄学院,30,2012-01至2014-12
2011,联合基金项目,A01,222,U1132607,L02,真菌色素的化学结构与生物学功能,刘吉开,中国科学院昆明植物研究所,200,2012-01至2015-12
2011,联合基金项目,A01,223,U1134207,E080601,高速铁路软土地基沉降变形规律与控制方法研究,刘汉龙,河海大学,270,2012-01至2015-12
2011,联合基金项目,A01,224,11178014,A0307,小行星和彗星轨道的数值积分、稳定性与混沌研究,刘福窑,上海立信会计金融学院,28,2012-01至2014-12
2011,联合基金项目,A01,225,U1162203,B080303,过渡金属硫化物加氢催化剂制备科学及劣质柴油改质催化体系建构,刘晨光,中国石油大学（华东）,240,2012-01至2015-12
2011,联合基金项目,A01,226,51174276,E0422,冷等离子体强化煤直接液化基础研究,刘昌俊,天津大学,45,2012-01至2014-12
2011,联合基金项目,A01,227,11176002,A06,100GPa内材料准等熵压缩特性研究,刘仓理,中国工程物理研究院流体物理研究所,208,2012-01至2015-12
2011,联合基金项目,A01,228,11179019,A0804,超快闪烁体伽玛碘化亚铜的同步辐射真空紫外与红外光谱研究,刘波,同济大学,52,2012-01至2014-12
2011,联合基金项目,A01,229,51174261,E0422,重载铁路路基结构损伤机理及强化技术,凌贤长,哈尔滨工业大学,45,2012-01至2014-12
2011,联合基金项目,A01,230,51174262,E0422,准格尔煤田主要煤层泥炭沼泽环境与伴生金属元素富集的关系,林明月,河北工程大学,45,2012-01至2014-12
2011,联合基金项目,A01,231,51174260,E0422,矿井突水风险、过程与应急的动态可视化仿真技术及系统原型,李仲学,北京科技大学,45,2012-01至2014-12
2011,联合基金项目,A01,232,11179010,A0801,基于毛细管光学元件的硬X射线微探针及其在北京同步辐射装置的应用,李玉德,北京师范大学,48,2012-01至2014-12
2011,联合基金项目,A01,233,11179011,A0804,金-氧化物-碳纳米管/石墨烯纳米复合结构的合成和基于XAFS的结构、电催化性能研究,李彦,北京大学,52,2012-01至2014-12
2011,联合基金项目,A01,234,U1162103,B08,物理溅射法制备的新型双功能催化剂：用于异构烷烃的一步合成,李新刚,天津大学,50,2012-01至2014-12
2011,联合基金项目,A01,235,U1132003,L02,鼻咽癌miRNA分子标志物的筛选及分子机制研究,李湘平,南方医科大学,258,2012-01至2015-12
2011,联合基金项目,A01,236,U1162125,B08,大型浆态床反应器流体力学与数学模拟放大技术研究,李希,浙江大学,45,2012-01至2014-12
2011,联合基金项目,A01,237,U1134002,L04,动力锂离子电池凝胶聚合物电解质材料制备及电池系统关键理化性质研究,李伟善,华南师范大学,250,2012-01至2015-12
2011,联合基金项目,A01,238,51134013,E0422,超（超）临界机组锅炉受热面安全及寿命管理,李廷举,大连理工大学,220,2012-01至2015-12
2011,联合基金项目,A01,239,61179065,F01,基于脑电和事件相关电位的飞行疲劳生理心理研究,李松林,民航总医院,36,2012-01至2014-12
2011,联合基金项目,A01,240,51174284,E0422,富氢气氛煤热解与铁矿石还原耦合过程基础,李松庚,中国科学院过程工程研究所,45,2012-01至2014-12
2011,联合基金项目,A01,241,11178007,A03,大质量恒星的星周盘研究,李庆康,北京师范大学,30,2012-01至2014-12
2011,联合基金项目,A01,242,51134010,E04,汽车排气系统用超纯铁素体不锈钢的高温疲劳行为和冷凝液腐蚀机理研究,李谋成,上海大学,200,2012-01至2015-12
2011,联合基金项目,A01,243,U1137605,L07,基于聚光作用的中低温太阳能高效集热、贮热及转化机理研究,李明,云南师范大学,190,2012-01至2015-12
2011,联合基金项目,A01,244,61179073,F01,民机复合材料蒙皮表面用纳米添加剂改性涂层的制备及性能研究,李梦,中国民用航空飞行学院,39,2012-01至2014-12
2011,联合基金项目,A01,245,11176014,A06,Gd2Zr2O7烧绿石固化锕系核素研究,李林艳,清华大学,44,2012-01至2014-12
2011,联合基金项目,A01,246,U1178302,L08,近50年来亚洲中部干旱区湖泊的遥感制图及时空变化过程研究,李均力,中国科学院新疆生态与地理研究所,50,2012-01至2014-12
2011,联合基金项目,A01,247,61139001,F0106,利用飞机散射信号定位地面干扰源的方法与装备研究,李景春,国家无线电监测中心,230,2012-01至2015-12
2011,联合基金项目,A01,248,11178024,A03,佘山空间大地测量技术并置站本地连接测量研究,李金岭,中国科学院上海天文台,28,2012-01至2014-12
2011,联合基金项目,A01,249,U1134001,L04,高性能中温固体氧化物燃料电池电极的材料组成优化与微观结构调控,李箭,华中科技大学,248,2012-01至2015-12
2011,联合基金项目,A01,250,U1136603,L06,我国西南竹类植物的分子标记、基因多样性与基因资源的发掘,李德铢,中国科学院昆明植物研究所,200,2012-01至2015-12
2011,联合基金项目,A01,251,11176024,A06,基于第二代小波核函数的结构特征参数辨识及预测方法研究,李兵,西安交通大学,42,2012-01至2014-12
2011,联合基金项目,A01,252,U1138304,L08,中国玉米关联分析群体的抗旱性鉴定评价与遗传解析,黎裕,中国农业科学院作物科学研究所,175,2012-01至2015-12
2011,联合基金项目,A01,253,11179024,A0802,故宫彩画颜料及绘制工艺的同步辐射无损分析研究,雷勇,故宫博物院,44,2012-01至2014-12
2011,联合基金项目,A01,254,U1178301,L08,天山中段玛纳斯河流域融雪机理及其径流过程模拟的研究,雷晓云,新疆农业大学,52,2012-01至2014-12
2011,联合基金项目,A01,255,U1134107,E080704,高速铁路桥梁结构噪声辐射特性及预测方法,雷晓燕,华东交通大学,60,2012-01至2014-12
2011,联合基金项目,A01,256,U1162128,B0811,功能化有序介孔碳材料的制备及其对石化废水中典型POPs的选择性吸附,雷乐成,浙江大学,50,2012-01至2014-12
2011,联合基金项目,A01,257,51174250,E041604,热轧带钢还原除鳞及随后冷轧过程中表面形貌和组织性能演变规律的研究,井玉安,辽宁科技大学,41,2012-01至2014-12
2011,联合基金项目,A01,258,U1134202,E050303,高速列车轮轨接触与粘着行为和磨耗机理研究,金学松,西南交通大学,270,2012-01至2015-12
2011,联合基金项目,A01,259,51174251,E04,热成形QPT钢组织超细化机制与高强塑积形成原理,金学军,上海交通大学,43,2012-01至2014-12
2011,联合基金项目,A01,260,61139003,F01,机场跑道异物监测系统基础理论与关键技术研究,金尔文,中国民用航空总局第二研究所,200,2012-01至2015-12
2011,联合基金项目,A01,261,U1132606,L02,云南省少数民族G6PD缺陷症高发机理研究,蒋玮莹,中山大学,200,2012-01至2015-12
2011,联合基金项目,A01,262,11176027,A06,基于核函数的结构特征参数辨识及其变化预测方法,蒋刚,西南科技大学,42,2012-01至2014-12
2011,联合基金项目,A01,263,51174273,E0422,风电场设备状态监测与预警,蒋东翔,清华大学,45,2012-01至2014-12
2011,联合基金项目,A01,264,61179049,F01,飞机蒙皮检测机器人热力转换与振动的映射机理及实验研究,姜勇,中国科学院沈阳自动化研究所,42,2012-01至2014-12
2011,联合基金项目,A01,265,U1162114,B08,分子筛纳米限域空间内乙烯四聚合成1-辛烯的研究,姜涛,天津科技大学,50,2012-01至2014-12
2011,联合基金项目,A01,266,U1162117,B08,ZSM-5分子筛纳晶的多尺度组装调控及其在轻烃催化裂解反应中的催化作用机制研究,姜桂元,中国石油大学（北京）,50,2012-01至2014-12
2011,联合基金项目,A01,267,U1120301,L10,新疆草原蝗虫对气候变暖的适应机理及气候驱动的灾变趋势,季荣,新疆师范大学,100,2012-01至2015-12
2011,联合基金项目,A01,268,51174278,E0422,浅埋煤层大采高顶板结构及其稳定性研究,黄庆享,西安科技大学,45,2012-01至2014-12
2011,联合基金项目,A01,269,U1135001,L05,网络媒体内容服务安全理论与关键技术,黄继武,深圳大学,260,2012-01至2015-12
2011,联合基金项目,A01,270,U1170305,L10,新疆盆地荒漠小蜂总科资源调查及区系分类研究,胡红英,新疆大学,50,2012-01至2014-12
2011,联合基金项目,A01,271,51134014,E0422,煤直接液化过程中氢自由基的形成及加氢液化反应机理,胡浩权,大连理工大学,230,2012-01至2015-12
2011,联合基金项目,A01,272,U1179302,L09,改性新疆蛭石催化甲烷与二氧化碳重整制合成气的研究,侯震山,中国科学院新疆理化技术研究所,50,2012-01至2014-12
2011,联合基金项目,A01,273,11176023,A06,动压箔片轴承气体-弹性动力学研究,侯予,西安交通大学,40,2012-01至2014-12
2011,联合基金项目,A01,274,U1133001,L03,南海灾害性海洋动力环境形成机制和测报方法研究,侯一筠,中国科学院海洋研究所,285,2012-01至2015-12
2011,联合基金项目,A01,275,11179038,A0803,离子辐照硅基薄膜作为大容量高功率锂离子电池负极材料研究,贺德衍,兰州大学,48,2012-01至2014-12
2011,联合基金项目,A01,276,U1134104,E070403,高速铁路供电系统潜隐故障预警与快速诊断恢复方法研究,何正友,西南交通大学,60,2012-01至2014-12
2011,联合基金项目,A01,277,U1162122,B08,稠密气固两相流各向异性颗粒动力学模型研究与应用,何玉荣,哈尔滨工业大学,45,2012-01至2014-12
2011,联合基金项目,A01,278,11176018,A06,移动对象异常行为自动识别技术研究,何小海,四川大学,44,2012-01至2014-12
2011,联合基金项目,A01,279,U1162206,B080303,重要石油化工过程负载型金属催化剂的多级结构设计与控制,何静,北京化工大学,250,2012-01至2015-12
2011,联合基金项目,A01,280,U1131002,L01,凡纳滨对虾白斑综合症生物防控机理,何建国,中山大学,260,2012-01至2015-12
2011,联合基金项目,A01,281,U1134208,E080506,高速铁路交叉隧道动力特性及结构安全性理论研究,何川,西南交通大学,270,2012-01至2015-12
2011,联合基金项目,A01,282,U1133602,L03,滇东北矿集区富锗铅锌矿床成矿机理研究及靶区优选,韩润生,昆明理工大学,240,2012-01至2015-12
2011,联合基金项目,A01,283,U1162106,B08,离子液体导向合成新型多级孔分子筛及其加氢催化活性的研究,韩丽君,中国科学院过程工程研究所,50,2012-01至2014-12
2011,联合基金项目,A01,284,11179035,A0804,抗坏血酸盐及其衍生物抗氧化剂活性和结构的同步辐射光电离和理论研究,韩聚广,中国科学技术大学,48,2012-01至2014-12
2011,联合基金项目,A01,285,11176016,A06,移动对象异常行为自动识别技术研究,管业鹏,上海大学,44,2012-01至2014-12
2011,联合基金项目,A01,286,U1134106,E070503,高速铁路牵引网雷电风险评估方法研究,谷山强,国网电力科学研究院,60,2012-01至2014-12
2011,联合基金项目,A01,287,U1136602,L06,红河流域苏铁多样性的起源、演化和保护研究,龚洵,中国科学院昆明植物研究所,220,2012-01至2015-12
2011,联合基金项目,A01,288,11178011,A030203,活动星系核喷流运动与变化研究,龚碧平,华中科技大学,30,2012-01至2014-12
2011,联合基金项目,A01,289,51174255,E0422,西部生态脆弱矿区煤层开采水资源破坏的力学机制研究,高召宁,安徽理工大学,45,2012-01至2014-12
2011,联合基金项目,A01,290,U1134205,E0704,高速铁路电力牵引系统的安全性预测与控制,高仕斌,西南交通大学,260,2012-01至2015-12
2011,联合基金项目,A01,291,51174283,E0422,多段分级流化床热解和轻度气化褐煤提质基础,高士秋,中国科学院过程工程研究所,45,2012-01至2014-12
2011,联合基金项目,A01,292,11179008,A0802,关联体系中电荷有序的原位同步辐射表征,高琛,中国科学技术大学,300,2012-01至2015-12
2011,联合基金项目,A01,293,11176005,A06,非合作信号信道编码分析,甘露,电子科技大学,40,2012-01至2014-12
2011,联合基金项目,A01,294,11178006,A03,太阳系主要天体基本历表,傅燕宁,中国科学院紫金山天文台,130,2012-01至2015-12
2011,联合基金项目,A01,295,U1131001,L01,华南退化红壤坡地不同恢复模式构建及其养分持留和调控机理,傅声雷,中国科学院华南植物园,265,2012-01至2015-12
2011,联合基金项目,A01,296,11179009,A0801,纳米-微米复合材料同步辐射纳米层析成像及力学性能建模分析方法,傅健,北京航空航天大学,44,2012-01至2014-12
2011,联合基金项目,A01,297,U1137606,L07,二氧化碳捕集、太阳光驱动释放与利用新途径及能量转换研究,付文甫,云南师范大学,190,2012-01至2015-12
2011,联合基金项目,A01,298,61179072,F01,ADS-B安全理论与技术研究,冯子亮,四川大学,38,2012-01至2014-12
2011,联合基金项目,A01,299,U1162116,B08,用于硫醇和噻吩适度重质化的新型梯级孔ZSM-5沸石可控合成和改性研究,范煜,中国石油大学（北京）,50,2012-01至2014-12
2011,联合基金项目,A01,300,51174253,E0414,基于烟气循环的生物质能烧结的基础研究,范晓慧,中南大学,42,2012-01至2014-12
2011,联合基金项目,A01,301,U1178305,L08,长绒棉优异品质形成的分子机理及功能基因发掘研究,范玲,新疆农业科学院,50,2012-01至2014-12
2011,联合基金项目,A01,302,11176029,A06,硝胺类炸药晶体缺陷生成及演化机制,段晓惠,西南科技大学,43,2012-01至2014-12
2011,联合基金项目,A01,303,11178026,A030802,极端条件下望远镜远程控制关键技术研究,段文英,中国科学院紫金山天文台,28,2012-01至2014-12
2011,联合基金项目,A01,304,U1133003,L03,珠江口环境激素类污染物的生态化学行为与毒理效应研究,段舜山,暨南大学,260,2012-01至2015-12
2011,联合基金项目,A01,305,U1133604,L03,滇中湖群富磷区有效削减磷素流失的植物群落结构研究,段昌群,云南大学,200,2012-01至2015-12
2011,联合基金项目,A01,306,U1130304,L10,干旱感受器基因在新疆极端干旱环境下植物生态适应机制中的作用及抗旱基因资源的开发,杜立群,杭州师范大学,172,2012-01至2015-12
2011,联合基金项目,A01,307,51174285,E0422,采动动载对煤巷锚网支护结构稳定性损伤机理研究,窦林名,中国矿业大学,45,2012-01至2014-12
2011,联合基金项目,A01,308,U1162105,B08,离子液体抽提丁二烯的微观机理及调控机制,董海峰,中国科学院过程工程研究所,50,2012-01至2014-12
