year,grant,sub,num,id,subject,title,author,school,money,dueration
2011,联合基金项目,A01,1,11179033,A0804,碳纳米管诱导生长多核共轭大环配合物的EXAFS研究,左霞,首都师范大学,48,2012-01至2014-12
2011,联合基金项目,A01,2,61179053,F01,飞行员分配性注意机理与工效学应用研究,庄达民,北京航空航天大学,36,2012-01至2014-12
2011,联合基金项目,A01,3,51174277,E0422,煤液化油重组份加氢裂化反应特性与催化剂的构效关系,朱志荣,同济大学,45,2012-01至2014-12
2011,联合基金项目,A01,4,51134009,E04,钢包底喷粉精炼新工艺应用基础研究,朱苗勇,东北大学,240,2012-01至2015-12
2011,联合基金项目,A01,5,U1162127,B081002,石油馏分中含氮化合物分子结构与溶解度的构效关系研究,朱京科,浙江大学,50,2012-01至2014-12
2011,联合基金项目,A01,6,11176019,A06,角度复用多幅激光全息记录技术及介质性能研究,朱建华,四川大学,48,2012-01至2014-12
2011,联合基金项目,A01,7,U1134003,L04,表面织构的微细电解加工基础问题及关键技术研究,朱荻,南京航空航天大学,250,2012-01至2015-12
2011,联合基金项目,A01,8,U1134103,E050501,高速列车盘形制动噪声的机理及预测方法的研究,周仲荣,西南交通大学,60,2012-01至2014-12
2011,联合基金项目,A01,9,11176026,A06,抗γ辐照的钨酸铅乳胶复合材料的制备及性能研究,周元林,西南科技大学,43,2012-01至2014-12
2011,联合基金项目,A01,10,U1162108,B08,太阳光辅助大-介孔钛膜电催化处理丙烯腈废水的应用研究,周幸福,南京工业大学,45,2012-01至2014-12
2011,联合基金项目,A01,11,U1162112,B08,多级孔道分子筛:溶剂挥发自组装合成及其中的传质-反应协同作用,周兴贵,华东理工大学,50,2012-01至2014-12
2011,联合基金项目,A01,12,U1132602,L02,增强认知功能药物干预海洛因复吸的药物发现和作用机制,周文华,宁波大学,200,2012-01至2015-12
2011,联合基金项目,A01,13,U1133006,L03,电子垃圾污染土壤的生态修复机制研究,周启星,南开大学,230,2012-01至2015-12
2011,联合基金项目,A01,14,51174258,E0422,光纤传感煤矿瓦斯的光谱域白光干涉解调机理研究,周孟然,安徽理工大学,45,2012-01至2014-12
2011,联合基金项目,A01,15,U1162113,B08,双亲性磁性碳笼负载金属催化剂控制合成及其催化水油两相反应研究,周克斌,中国科学院大学,45,2012-01至2014-12
2011,联合基金项目,A01,16,U1129302,L09,新疆典型矿床的特征提取技术及预测方法研究,周可法,中国科学院新疆生态与地理研究所,100,2012-01至2015-12
2011,联合基金项目,A01,17,51174257,E0422,基于信息融合的煤矿致灾机理建模及预测,周华平,安徽理工大学,45,2012-01至2014-12
2011,联合基金项目,A01,18,51134023,E0422,一矿一面集约生产安全通风技术基础,周福宝,中国矿业大学,200,2012-01至2015-12
2011,联合基金项目,A01,19,11176022,A06,基于大机动运动平台的特定目标多极化成像与匹配技术研究,周峰,西安电子科技大学,46,2012-01至2014-12
2011,联合基金项目,A01,20,61179044,F01,基于可测试性理论的机载电子设备故障诊断方法研究,周德新,中国民航大学,39,2012-01至2014-12
2011,联合基金项目,A01,21,51174279,E0422,神府粉煤成型催化热解－活化耦合多联产转化研究,周安宁,西安科技大学,45,2012-01至2014-12
2011,联合基金项目,A01,22,U1162119,B08,催化裂化烟气催化氧化/氨吸收脱硫脱硝关键技术研究,钟秦,南京理工大学,45,2012-01至2014-12
2011,联合基金项目,A01,23,11179032,A0802,碳纳米管与纳米颗粒弱键相互作用的软X射线谱学研究,钟俊,苏州大学,52,2012-01至2014-12
2011,联合基金项目,A01,24,51174249,E04,变厚度轧制过程金属流动规律,支颖,东北大学,42,2012-01至2014-12
2011,联合基金项目,A01,25,11178019,A03,Blazars中高能辐射机制研究,郑永刚,云南师范大学,26,2012-01至2014-12
2011,联合基金项目,A01,26,11178001,A03,脉冲星和中子星多波段研究及中子星演化,郑小平,华中师范大学,130,2012-01至2015-12
2011,联合基金项目,A01,27,61179056,F01,复杂激励下飞机载流管道系统振动疲劳分析技术研究,郑敏,南京航空航天大学,35,2012-01至2014-12
2011,联合基金项目,A01,28,61179059,F01,大型客机紧急逃生仿真建模及机舱相关设施布局优化研究,郑彬,电子科技大学,39,2012-01至2014-12
2011,联合基金项目,A01,29,11179007,A0801,BESIII上粲偶素强子衰变的实验研究,赵政国,中国科学技术大学,320,2012-01至2015-12
2011,联合基金项目,A01,30,51134022,E0422,振动流化床干法分选细粒煤的基础研究,赵跃民,中国矿业大学,220,2012-01至2015-12
2011,联合基金项目,A01,31,U1134209,E080507,基于全寿命可靠度的高速铁路工程结构设计理论与方法,赵衍刚,中南大学,260,2012-01至2015-12
2011,联合基金项目,A01,32,U1132002,L02,登革病毒抗体介导保护性免疫应答的分子机制,赵卫,南方医科大学,258,2012-01至2015-12
2011,联合基金项目,A01,33,U1162204,B08,重质油特征分子集及其加工转化规律的研究,赵锁奇,中国石油大学（北京）,270,2012-01至2015-12
2011,联合基金项目,A01,34,U1134105,E0314,新型高阻尼防污复合材料在高速列车上应用研究,赵宁,中国科学院化学研究所,60,2012-01至2014-12
2011,联合基金项目,A01,35,U1132603,L02,生物电信号对肿瘤生长转移的调控及机制研究,赵敏,云南师范大学,200,2012-01至2015-12
2011,联合基金项目,A01,36,U1174001,L04,阵列化硅纳米线/共轭聚合物杂合太阳能电池性能研究,章勇,华南师范大学,60,2012-01至2014-12
2011,联合基金项目,A01,37,U1131006,L01,华南地区外来物种福寿螺的入侵机制及防控策略研究,章家恩,华南农业大学,235,2012-01至2015-12
2011,联合基金项目,A01,38,U1136606,L06,云南粉虱传双生病毒成灾机理及防控基础,张仲凯,云南省农业科学院,180,2012-01至2015-12
2011,联合基金项目,A01,39,U1137604,L07,有色冶金含砷废渣低温陶瓷固化机理研究,张召述,昆明理工大学,210,2012-01至2015-12
2011,联合基金项目,A01,40,U1132601,L02,云南有毒两栖动物肽类活性物质结构与功能及作用机制,张云,中国科学院昆明动物研究所,200,2012-01至2015-12
2011,联合基金项目,A01,41,51174269,E0422,热力开采低渗透煤层煤层气机理的研究,张永利,辽宁工程技术大学,45,2012-01至2014-12
2011,联合基金项目,A01,42,U1162118,B08,乙烯选择性齐聚多孔择形催化剂的设计合成与催化性能研究,张瑛,中国石油大学（北京）,50,2012-01至2014-12
2011,联合基金项目,A01,43,51174259,E0422,一步法高效煤制低碳烯烃铁基催化剂及新反应器的研究,张燚,北京化工大学,45,2012-01至2014-12
2011,联合基金项目,A01,44,11179029,A0804,同步辐射研究可见光响应非金属掺杂二氧化钛的局域结构和电子结构,张艳峰,河北师范大学,48,2012-01至2014-12
2011,联合基金项目,A01,45,11178021,A0310,基于大型巡天数据的挖掘方法研究,张彦霞,中国科学院国家天文台,30,2012-01至2014-12
2011,联合基金项目,A01,46,11179031,A0802,聚左旋乳酸及其共混物纤维成型过程中多级微观结构的形成和演变机理：原位X-ray研究,张秀芹,北京服装学院,48,2012-01至2014-12
2011,联合基金项目,A01,47,51134008,E04,全氧高炉炼铁关键技术基础,张欣欣,北京科技大学,240,2012-01至2015-12
2011,联合基金项目,A01,48,11179020,A0801,64位系统上BESIII离线物理软件的研究,张晓梅,中国科学院高能物理研究所,50,2012-01至2014-12
2011,联合基金项目,A01,49,51174268,E0422,动荷载作用下锚喷支护结构损伤破坏机理与控制研究,张向东,辽宁工程技术大学,45,2012-01至2014-12
2011,联合基金项目,A01,50,U1135005,L05,跨媒体协同处理与服务的理论和应用研究,张文生,中国科学院自动化研究所,250,2012-01至2015-12
2011,联合基金项目,A01,51,11179012,A0802,蛋白质翻译延长过程中核糖体的结构与动力学研究,张文,复旦大学,56,2012-01至2014-12
2011,联合基金项目,A01,52,U1133603,L03,云南极端干旱气候的形成机理研究,张万诚,云南省气象科学研究所,205,2012-01至2015-12
2011,联合基金项目,A01,53,51174248,E04,超高强钢板冷轧和平整过程中表面形貌的转印机理与控制方法,张清东,北京科技大学,40,2012-01至2014-12
2011,联合基金项目,A01,54,61179045,F01,机场环境中行为感知基础理论研究,张良,中国民航大学,39,2012-01至2014-12
2011,联合基金项目,A01,55,11178009,A030303,银心区域CO及同位素分子的多波束观测研究,张江水,广州大学,32,2012-01至2014-12
2011,联合基金项目,A01,56,11178010,A03,用于天体光谱观测的多模光纤滤波器研究,张建中,哈尔滨工程大学,28,2012-01至2014-12
2011,联合基金项目,A01,57,61179068,F01,航空钛合金管材中织构取向密度与力学性能的关系研究,张晖,西安交通大学,39,2012-01至2014-12
2011,联合基金项目,A01,58,U1178303,L08,克里雅河山区水库建成对尾闾达理雅博依绿洲季节性洪水生态效应的影响,张峰,新疆大学,48,2012-01至2014-12
2011,联合基金项目,A01,59,11179026,A0801,基于同步辐射LIGA技术的微纳驱动器件制备及其驱动新方法研究,张冬仙,浙江大学,56,2012-01至2014-12
2011,联合基金项目,A01,60,U1170304,L10,齿肋赤藓复水过程的分子机制-基于基因和蛋白质高通量表达的研究,张道远,中国科学院新疆生态与地理研究所,50,2012-01至2014-12
2011,联合基金项目,A01,61,U1134109,E050702,高速列车受电弓气动噪声仿生控制关键技术,张成春,吉林大学,60,2012-01至2014-12
2011,联合基金项目,A01,62,51174263,E0422,基于Ethernet和WSN的矿井监控与应急通信技术研究,张长森,河南理工大学,45,2012-01至2014-12
2011,联合基金项目,A01,63,51174275,E0422,计算机分子模拟研究腐植酸分子结构特点及其与腐植酸生物活性的相关性,张彩凤,太原师范学院,45,2012-01至2014-12
2011,联合基金项目,A01,64,11176021,A06,Bragg体光栅制备及其带宽特性研究,袁孝,苏州大学,50,2012-01至2014-12
2011,联合基金项目,A01,65,U1134008,L04,复合水泥基材料高效利用的基础研究,余其俊,华南理工大学,250,2012-01至2015-12
2011,联合基金项目,A01,66,61179046,F01,基于多因素识别及影响性分析的航班延误治理研究,于剑,中国民航大学,39,2012-01至2014-12
2011,联合基金项目,A01,67,U1133005,L03,珠江流域水体与沉积物中典型有机污染物的生态毒理效应,应光国,中国科学院广州地球化学研究所,240,2012-01至2015-12
2011,联合基金项目,A01,68,U1162109,B080303,形貌规整的多孔纳米复合氧化物固体超强碱催化材料的制备、表征和应用研究,尹双凤,湖南大学,50,2012-01至2014-12
2011,联合基金项目,A01,69,U1131004,L01,香蕉抗枯萎病种质资源挖掘及其抗性分子机理解析,易干军,广东省农业科学院果树研究所,250,2012-01至2015-12
2011,联合基金项目,A01,70,51174290,E0422,考虑测风塔数据分析的风电场风能资源精细评估方法与实现,叶林,中国农业大学,45,2012-01至2014-12
2011,联合基金项目,A01,71,11176033,A06,MEMS三维THz无源器件设计理论研究,姚军,中国科学院光电技术研究所,39,2012-01至2014-12
2011,联合基金项目,A01,72,11178025,A030404,小行星形状、大小和自转的观测研究,姚进生,中国科学院紫金山天文台,30,2012-01至2014-12
2011,联合基金项目,A01,73,51174256,E0422,灰岩含水体上煤层开采底板采动稳定可靠性随机有限元研究,姚多喜,安徽理工大学,45,2012-01至2014-12
2011,联合基金项目,A01,74,11176025,A06,导热颗粒填充聚砜复合材料的制备与性能研究,杨文彬,西南科技大学,42,2012-01至2014-12
2011,联合基金项目,A01,75,11178018,A03,暗物质和暗能量与引力透镜效应的理论及观测研究,杨树政,西华师范大学,32,2012-01至2014-12
2011,联合基金项目,A01,76,51134025,E0422,大断面巷道快速掘进与支护基础,杨仁树,中国矿业大学（北京）,240,2012-01至2015-12
2011,联合基金项目,A01,77,U1162107,B08,石油化工气液及气液固多相反应器的介尺度结构模型及工程放大基础,杨宁,中国科学院过程工程研究所,45,2012-01至2014-12
2011,联合基金项目,A01,78,61179047,F01,钛合金飞秒激光表面处理新技术及其特性研究,杨丽,中国民航大学,39,2012-01至2014-12
2011,联合基金项目,A01,79,61179063,F01,飞行器突发故障应急决策系统的关键技术研究,杨慧,中国民航大学,36,2012-01至2014-12
2011,联合基金项目,A01,80,11179039,A0802,金属富勒烯结构与性质的同步辐射研究,杨华,中国计量大学,48,2012-01至2014-12
2011,联合基金项目,A01,81,61139002,F01,面向机场感知的噪声监测及其环境影响评估,杨国庆,中国民航大学,230,2012-01至2015-12
2011,联合基金项目,A01,82,11176007,A06,基于复杂载体的共形软件天线设计技术研究,杨峰,电子科技大学,46,2012-01至2014-12
2011,联合基金项目,A01,83,U1134102,E020302,碳陶复合材料用于高速列车制动盘和闸片及其摩擦行为研究,燕青芝,北京科技大学,60,2012-01至2014-12
2011,联合基金项目,A01,84,U1133002,L03,南海北部大陆架主要金属和稀有矿产的分布规律与成藏机制,颜文,中国科学院南海海洋研究所,265,2012-01至2015-12
2011,联合基金项目,A01,85,51134012,E0422,大断面巷道快速掘进与支护基础研究,颜事龙,安徽理工大学,240,2012-01至2015-12
2011,联合基金项目,A01,86,11176011,A06,铁基合金脉冲等离子体渗氮(碳)层中微结构演变多尺度模拟,闫牧夫,哈尔滨工业大学,45,2012-01至2014-12
2011,联合基金项目,A01,87,11176017,A06,基于系统电磁学的复杂电子系统电磁效应评估方法,闫丽萍,四川大学,50,2012-01至2014-12
2011,联合基金项目,A01,88,61179054,F01,基于极值统计理论的地基增强系统误差包络方法研究,薛瑞,北京航空航天大学,39,2012-01至2014-12
2011,联合基金项目,A01,89,U1162111,B08,双中心单组份催化剂合成热塑性弹性体研究,许胜,华东理工大学,45,2012-01至2014-12
2011,联合基金项目,A01,90,51174288,E0422,浅埋煤层重复采动关键层结构失稳致灾机理研究,许家林,中国矿业大学,45,2012-01至2014-12
2011,联合基金项目,A01,91,11176001,A06,高能质子照相的数值模拟研究,许海波,北京应用物理与计算数学研究所,200,2012-01至2015-12
2011,联合基金项目,A01,92,11176008,A06,基于磁流变的主被动减振致稳技术研究,徐赵东,东南大学,46,2012-01至2014-12
2011,联合基金项目,A01,93,11179037,A0804,利用同步辐射研究硅氧氮化物荧光体的结构设计和性能优化,徐鑫,中国科学技术大学,56,2012-01至2014-12
2011,联合基金项目,A01,94,11179018,A0803,弱束缚核12，14Be的基态结构新形态的探索,徐望,中国科学院上海应用物理研究所,48,2012-01至2014-12
2011,联合基金项目,A01,95,61179067,F01,基于视频分析与可视化的候机楼安全异常检测关键技术研究,徐庆,天津大学,42,2012-01至2014-12
2011,联合基金项目,A01,96,11179043,A0804,含硼锂离子电池电极材料的制备、电化学性能及其嵌锂机制研究,徐立强,山东大学,48,2012-01至2014-12
2011,联合基金项目,A01,97,51134016,E0422,超（超）临界机组锅炉受热面安全及寿命管理,徐鸿,华北电力大学,215,2012-01至2015-12
2011,联合基金项目,A01,98,U1162110,B08,基于小分子成核剂的聚烯烃结晶过程调控及高性能化的研究,辛忠,华东理工大学,50,2012-01至2014-12
2011,联合基金项目,A01,99,U1134110,E080704,高速铁路混凝土桥墩抗震设计理论及方法研究,辛克贵,清华大学,60,2012-01至2014-12
2011,联合基金项目,A01,100,51134018,E0422,浅埋深薄基岩采动岩体破断及渗流基础,谢和平,四川大学,240,2012-01至2015-12
2011,联合基金项目,A01,101,U1162120,B081102,蒙脱土改性沥青纳米复合材料表面微观结构性能及相关机理,肖新颜,华南理工大学,50,2012-01至2014-12
2011,联合基金项目,A01,102,11179030,A0801,PbCrO3立方钙钛矿压致等结构相变机制研究,肖万生,中国科学院广州地球化学研究所,54,2012-01至2014-12
2011,联合基金项目,A01,103,51174267,E0422,矿山废水同步除硫、去除重金属离子、降低酸度的膨润土吸附与微生物还原协同作用净化机制研究,肖利萍,辽宁工程技术大学,45,2012-01至2014-12
2011,联合基金项目,A01,104,U1162201,B08,石油化工新型沸石催化材料的设计合成,肖丰收,浙江大学,250,2012-01至2015-12
2011,联合基金项目,A01,105,61179075,F01,宏观尺度下耦合超疏水表面的振动除冰方法对飞机结冰的影响研究,肖春华,中国空气动力研究与发展中心,37,2012-01至2014-12
2011,联合基金项目,A01,106,U1137602,L07,双极聚合物隔膜直接甲醇燃料电池中的界面行为研究,相艳,北京航空航天大学,200,2012-01至2015-12
2011,联合基金项目,A01,107,U1162104,B08,CO2驱油系统热力学性质和传递性质的QSAR研究,夏淑倩,天津大学,50,2012-01至2014-12
2011,联合基金项目,A01,108,11179001,A0801,锰基层状固溶体富锂化合物的结构与功能,夏定国,北京大学,280,2012-01至2015-12
2011,联合基金项目,A01,109,51174289,E0422,动态应力场与渗透性耦合环境下煤层底板隐伏陷落柱滞后突水机理与应用研究,武强,中国矿业大学（北京）,45,2012-01至2014-12
2011,联合基金项目,A01,110,51134015,E0422,低成本、长寿命活性焦脱硫关键技术基础,吴少华,哈尔滨工业大学,230,2012-01至2015-12
2011,联合基金项目,A01,111,51174264,E0422,抽采瓦斯水合分离过程温度场特征及热量传递控制机理,吴强,黑龙江科技大学,45,2012-01至2014-12
2011,联合基金项目,A01,112,U1162102,B08,沸石晶体内嵌入式负载贵金属纳米催化剂的制备及其性能研究,吴鹏,华东师范大学,50,2012-01至2014-12
2011,联合基金项目,A01,113,U1138301,L08,新疆干旱区湖泊演变及对气候变化的响应机理研究,吴敬禄,中国科学院南京地理与湖泊研究所,177,2012-01至2015-12
2011,联合基金项目,A01,114,51134021,E0422,煤直接液化过程中活性氢的形成及其对加氢液化的作用机理,魏贤勇,中国矿业大学,220,2012-01至2015-12
2011,联合基金项目,A01,115,51174291,E0422,基于数值分析的多因素作用下重载铁路桥梁结构性能演化过程的研究,卫军,中南大学,45,2012-01至2014-12
2011,联合基金项目,A01,116,61179062,F01,机场跑道混凝土与土体分层结构动力响应及其长期运营沉降研究,王志亮,同济大学,42,2012-01至2014-12
2011,联合基金项目,A01,117,51174254,E0422,直接煤液化重质产物多尺度缔合/聚集行为及其对液化工艺过程的影响研究,王知彩,安徽工业大学,45,2012-01至2014-12
2011,联合基金项目,A01,118,61179060,F01,机场雾天环境下场景成像退化模型及增强方法研究,王正宁,电子科技大学,30,2012-01至2014-12
2011,联合基金项目,A01,119,U1162129,B08,高稳定性苯选择加氢负载型钌催化剂的设计与制备,王正宝,浙江大学,50,2012-01至2014-12
2011,联合基金项目,A01,120,11179042,A0804,芯壳结构砷化镓一维纳米线的局域结构及其光伏电池应用研究,王玉琦,中国科学院合肥物质科学研究院,56,2012-01至2014-12
2011,联合基金项目,A01,121,U1162124,B08,基于三维介孔氮化碳的多功能催化剂的设计与研制,王勇,浙江大学,50,2012-01至2014-12
2011,联合基金项目,A01,122,61179066,F01,基于飞行数据的民机异常进近形成机制研究,王旭辉,中国民航科学技术研究院,39,2012-01至2014-12
2011,联合基金项目,A01,123,11178003,A03,基于国内观测设备的超新星巡天观测及相关问题研究,王晓锋,清华大学,150,2012-01至2015-12
2011,联合基金项目,A01,124,61179064,F01,基于新一代GNSS的新航行系统中的干扰抑制技术研究,王文益,中国民航大学,42,2012-01至2014-12
2011,联合基金项目,A01,125,51174282,E0422,重载铁路钢轨损伤机理研究,王文健,西南交通大学,45,2012-01至2014-12
2011,联合基金项目,A01,126,U1139302,L09,双环戊二烯高附加值精细化学品合成与应用技术研究,王天富,中国科学院新疆理化技术研究所,170,2012-01至2017-12
2011,联合基金项目,A01,127,U1134101,E010202,高铁车体用网络互穿双金属复合型材棘轮疲劳行为以及结构演化与损伤机制研究,王守仁,济南大学,60,2012-01至2014-12
2011,联合基金项目,A01,128,11179028,A0802,基于同步辐射研究分子筛有序无序转变过程机制及其块体玻璃的发光性能,王连军,东华大学,48,2012-01至2014-12
2011,联合基金项目,A01,129,51174274,E0422,添加纳米Fe/CNx对改进煤直接液化铁系催化剂性能研究,王利军,上海第二工业大学,45,2012-01至2014-12
2011,联合基金项目,A01,130,11179004,A0802,同步辐射X-ray细胞显微成像方法学研究及在细胞信号转导途径研究中的应用,王丽华,中国科学院上海应用物理研究所,240,2012-01至2015-12
2011,联合基金项目,A01,131,61179042,F01,星基导航下，有性能约束的空中高速路流量管理模型和优化算法研究,王莉莉,中国民航大学,36,2012-01至2014-12
2011,联合基金项目,A01,132,U1170302,L10,"新疆荒漠植物多伞阿魏中""彗星""状化合物对神经胶质瘤C6细胞的抗肿瘤作用及其机制研究",王金辉,石河子大学,50,2012-01至2014-12
2011,联合基金项目,A01,133,11179005,A0802,大尺寸反射镜纳弧度测量中的关键技术研究,王劼,中国科学院上海应用物理研究所,300,2012-01至2015-12
2011,联合基金项目,A01,134,61179043,F01,基于多视觉传感器融合的超大三维尺度空间事态感知与定位理论和技术研究,王剑,中国民航大学,38,2012-01至2014-12
2011,联合基金项目,A01,135,11178020,A03,大型望远镜观测系统中智能化处理的研究,王坚,中国科学技术大学,30,2012-01至2014-12
2011,联合基金项目,A01,136,11178022,A03,空间太阳滤光器控制系统新技术研究,王家宁,中国科学院国家天文台南京天文光学技术研究所,36,2012-01至2014-12
2011,联合基金项目,A01,137,51134020,E0422,煤田火灾防治理论与方法,王德明,中国矿业大学,240,2012-01至2015-12
2011,联合基金项目,A01,138,11179006,A0804,金属富勒烯功能纳米材料的结构与性能研究,王春儒,中国科学院化学研究所,300,2012-01至2015-12
2011,联合基金项目,A01,139,U1130303,L10,新疆骆驼蓬药用植物资源功能与物质基础研究,王长虹,上海中医药大学,172,2012-01至2015-12
2011,联合基金项目,A01,140,51174287,E0422,煤炭开发对矿区资源环境的影响模型及应用研究,汪云甲,中国矿业大学,45,2012-01至2014-12
2011,联合基金项目,A01,141,51174247,E04,钢铁冷轧辊磨削料制备软磁复合材料的机理研究,田建军,北京科技大学,42,2012-01至2014-12
2011,联合基金项目,A01,142,U1134203,E050602,高速列车空气动力学行为与外形、结构协同设计基础理论研究,田红旗,中南大学,270,2012-01至2015-12
2011,联合基金项目,A01,143,11179021,A0801,结合微流控芯片和同步辐射谱学发展折叠动态结构研究方法,陶冶,中国科学院高能物理研究所,50,2012-01至2014-12
2011,联合基金项目,A01,144,11178012,A03,大射电望远镜馈源支撑系统抑振策略及跟踪精度保证研究,唐晓强,清华大学,26,2012-01至2014-12
2011,联合基金项目,A01,145,U1162115,B08,"纳米沸石纤维捆负载CoMo硫化物催化剂对4,6-DM-DBT的加氢脱硫性能研究",唐天地,温州大学,50,2012-01至2014-12
2011,联合基金项目,A01,146,U1135004,L05,面向低资源移动终端的高效公钥密码芯片的理论与关键技术,唐韶华,华南理工大学,260,2012-01至2015-12
2011,联合基金项目,A01,147,U1162131,B081102,含低维碳纳米粒子-聚丙烯分子刷的高熔体强度聚丙烯研究,唐建华,四川大学,50,2012-01至2014-12
2011,联合基金项目,A01,148,U1135003,L05,基于数字家庭的高清媒体内容分析理解中的非线性理论及关键技术,檀结庆,合肥工业大学,245,2012-01至2015-12
2011,联合基金项目,A01,149,U1130301,L10,准噶尔荒漠短命植物的生活史特征对气候变化的响应,谭敦炎,新疆农业大学,160,2012-01至2015-12
2011,联合基金项目,A01,150,U1138303,L08,克里雅河流域水盐运移过程及其生态响应,塔西甫拉提·特依拜,新疆大学,170,2012-01至2016-12
2011,联合基金项目,A01,151,11179036,A0804,SrTiO3表面与异质结界面的二维电子气的低能区角分辨光电子能谱研究,孙喆,中国科学技术大学,54,2012-01至2014-12
2011,联合基金项目,A01,152,11176009,A06,高性能光致聚合物全息记录材料研制及角度复用激光全息记录技术研究,孙秀冬,哈尔滨工业大学,42,2012-01至2015-12
2011,联合基金项目,A01,153,U1132005,L02,利用iPS技术治疗β-地中海贫血关键问题的研究,孙筱放,广州医科大学,243,2012-01至2015-12
2011,联合基金项目,A01,154,U1134201,E050402,高速列车转向架结构损伤一致载荷谱建立方法与试验验证,孙守光,北京交通大学,270,2012-01至2015-12
2011,联合基金项目,A01,155,11176012,A06,末段简易修正模式分析方法及控制效能研究,孙瑞胜,南京理工大学,40,2012-01至2014-12
