year,grant,sub,num,id,subject,title,author,school,money,dueration
2011,联合基金项目,A01,309,11176028,A06,微生物对放射性废物减量化与核素回收研究,董发勤,西南科技大学,48,2012-01至2014-12
2011,联合基金项目,A01,310,11178005,A030401,中红外太阳偏振测量技术与方法研究,邓元勇,中国科学院国家天文台,180,2012-01至2015-12
2011,联合基金项目,A01,311,U1136605,L06,云南兰坪乌骨绵羊乌质性状形成的分子遗传机制研究,邓学梅,中国农业大学,180,2012-01至2015-12
2011,联合基金项目,A01,312,U1134006,L04,微波和太赫兹波器件用的纳米冷阴极研究及器件特性探索,邓少芝,中山大学,260,2012-01至2015-12
2011,联合基金项目,A01,313,51134019,E0422,煤田火区形成演化过程及灭控理论与方法研究,邓军,西安科技大学,240,2012-01至2015-12
2011,联合基金项目,A01,314,U1162121,B0806,基于性质集成的质量/能量耦合传递系统集成理论研究,邓春,中国石油大学（北京）,45,2012-01至2014-12
2011,联合基金项目,A01,315,61179055,F01,用于飞机风挡玻璃窗的复合有序纳米球壳结构WO3薄膜及其电致变色研究,崔海宁,吉林大学,39,2012-01至2014-12
2011,联合基金项目,A01,316,11176030,A06,沥青铀矿的物理化学稳定域与固铀能力,崔春龙,西南科技大学,42,2012-01至2014-12
2011,联合基金项目,A01,317,11179023,A0801,新型铁基高温超导材料的同步辐射谱学研究,储旺盛,中国科学技术大学,48,2012-01至2014-12
2011,联合基金项目,A01,318,61179051,F01,基于民用飞机结构零件腐蚀损伤条件下喷丸强化机理的研究,程秀全,广州民航职业技术学院,39,2012-01至2014-12
2011,联合基金项目,A01,319,11176020,A06,含铝亚稳分子间复合物反应机理和规律的理论研究,程新路,四川大学,46,2012-01至2014-12
2011,联合基金项目,A01,320,61179069,F01,民用机场航站楼资源动态分配与智能化调度基础理论研究,程绍武,哈尔滨工业大学,37,2012-01至2014-12
2011,联合基金项目,A01,321,61179052,F01,高密度终端区基于四维轨迹的飞机进场管理理论、方法和仿真研究,程朋,清华大学,39,2012-01至2014-12
2011,联合基金项目,A01,322,U1139301,L09,天山浅成低温热液成矿系统的地质对比研究,陈衍景,北京大学,175,2012-01至2016-12
2011,联合基金项目,A01,323,U1134004,L04,面向微电子制造的高速高精度运动平台的设计及控制科学问题与关键技术研究,陈新,广东工业大学,270,2012-01至2015-12
2011,联合基金项目,A01,324,11179013,A0802,填充方钴矿的结构及其填充原子局域振动行为研究,陈喜红,中国科学院上海硅酸盐研究所,58,2012-01至2014-12
2011,联合基金项目,A01,325,11179014,A0801,D介子半轻衰变的实验研究,陈申见,南京大学,52,2012-01至2014-12
2011,联合基金项目,A01,326,U1136604,L06,水稻雌配子育性基因的功能及其调控研究,陈丽娟,云南农业大学,200,2012-01至2015-12
2011,联合基金项目,A01,327,61179061,F01,基于灰色理论的民航安全监测与预警系统研究,陈可嘉,福州大学,38,2012-01至2014-12
2011,联合基金项目,A01,328,51174252,E0418,微波场中高碳铬铁粉固相脱碳机理及关键技术研究,陈津,太原理工大学,40,2012-01至2014-12
2011,联合基金项目,A01,329,51134017,E0422,燃煤电厂烟气大规模CO2捕集过程关键问题研究,陈健,清华大学,230,2012-01至2015-12
2011,联合基金项目,A01,330,61179057,F01,航空发动机智能诊断中学习样本与学习机器的自适应性问题研究,陈果,南京航空航天大学,39,2012-01至2014-12
2011,联合基金项目,A01,331,U1162205,B080405,多机制耦合分离气体混合物应用基础研究,陈光进,中国石油大学（北京）,240,2012-01至2015-12
2011,联合基金项目,A01,332,U1133601,L03,过去两千年多重环境压力对云南湖泊环境的影响及驱动机制,陈光杰,云南师范大学,235,2012-01至2015-12
2011,联合基金项目,A01,333,11178008,A03,深空飞行器开环测速测相测幅关键技术及在行星地基掩星观测中应用研究,陈从颜,东南大学,34,2012-01至2014-12
2011,联合基金项目,A01,334,51134011,E04,镍基、铁镍基合金油井管第二相的演变及其对耐蚀性的影响,陈长风,中国石油大学（北京）,200,2012-01至2015-12
2011,联合基金项目,A01,335,U1132605,L02,KLF5转录因子介导YAP癌基因在乳腺癌中的功能、机制及其应用研究,陈策实,中国科学院昆明动物研究所,200,2012-01至2015-12
2011,联合基金项目,A01,336,51174280,E0422,巷道锚杆锚索支护结构光纤在线监测研究,柴敬,西安科技大学,45,2012-01至2014-12
2011,联合基金项目,A01,337,U1131005,L01,优质鸡遗传多样性与马立克氏病发病特点相关性的分子生物学基础,曹永长,中山大学,260,2012-01至2015-12
2011,联合基金项目,A01,338,11179017,A0803,全裸重离子与氪原子碰撞中的K壳双电离研究,蔡晓红,中国科学院近代物理研究所,50,2012-01至2014-12
2011,联合基金项目,A01,339,11179034,A0804,高活性K-Co-Mo/C催化剂合成醇活性位结构及催化反应机理研究,鲍骏,中国科学技术大学,52,2012-01至2014-12
2011,联合基金项目,A01,340,11176006,A06,MEMS三维THz无源器件电气特性模型研究,鲍景富,电子科技大学,40,2012-01至2014-12
2011,联合基金项目,A01,341,51174270,E0422,褐煤蒸发脱水机理及数学模型研究,白向飞,煤炭科学技术研究院有限公司,45,2012-01至2014-12
2011,联合基金项目,A01,342,61179058,F01,民航发动机在翼性能和航线维修影响评估及部件寿命预测方法研究,白芳,南京航空航天大学,36,2012-01至2014-12
2011,联合基金项目,A01,343,U1170301,L10,新疆自然放牧区域蜱虫种群分布及其蜱传病地方流行关系的研究,巴音查汗,新疆农业大学,50,2012-01至2014-12
2011,联合基金项目,A01,344,11179040,A0803,高能重离子和模拟微重力对细胞基因组稳定性效应的研究,安莉莉,中国科学院生物物理研究所,44,2012-01至2014-12
