year,grant,sub,num,id,subject,title,author,school,money,dueration
2007,面上项目,A01,1877,30772149,H0213,国人预测心脏手术预后评分系统的建立及其预测效能的研究,许建屏,中国医学科学院,31.0,2008-01至2010-12
2007,面上项目,A01,1878,20772005,B010305,Staudinger反应及其相关反应的立体选择性研究,许家喜,北京化工大学,28.0,2008-01至2010-12
2007,面上项目,A01,1879,60776067,F040501,Zn1-xCoxO室温铁磁半导体的磁圆二色谱研究,许怀哲,北京航空航天大学,32.0,2008-01至2010-12
2007,面上项目,A01,1880,10771187,A010301,黎曼流形的几何与拓扑的若干问题研究,许洪伟,浙江大学,26.0,2008-01至2010-12
2007,面上项目,A01,1881,60772075,F010203,深空通信远距离传输协议及信道编译码性能研究,许洪光,哈尔滨工业大学,29.0,2008-01至2010-12
2007,面上项目,A01,1882,50775229,E050201,齿轮表面非晶化工艺与性能研究,许洪斌,重庆理工大学,38.0,2008-01至2010-12
2007,面上项目,A01,1883,20776144,B081104,煤热解层燃控制SOx和NOx排放的化学基础,许光文,中国科学院过程工程研究所,30.0,2008-01至2010-12
2007,面上项目,A01,1884,30772060,H1805,基于三维心电扩布的心肌电-机械耦联规律的超声研究,许迪,南京医科大学,28.0,2008-01至2010-12
2007,面上项目,A01,1885,40773017,D0303,海南岛昌江-琼海断裂带变基性岩成因及构造意义,许德如,中国科学院广州地球化学研究所,39.0,2008-01至2010-12
2007,面上项目,A01,1886,30770856,H0206,可溶性环氧化合物水解酶抑制剂对内皮祖细胞作用研究,许丹焰,中南大学,30.0,2008-01至2010-12
2007,面上项目,A01,1887,20772110,B010301,离子型手性有机小分子/聚乙二醇复合体系的形成及其催化反应研究,许丹倩,浙江工业大学,28.0,2008-01至2010-12
2007,面上项目,A01,1888,10772098,A020401,智能蒙皮湍流减阻控制数值研究,许春晓,清华大学,34.0,2008-01至2010-12
2007,面上项目,A01,1889,30771381,C1305,转Bt基因水稻蛋白质组学非预期效应的研究,许崇任,北京大学,30.0,2008-01至2010-12
2007,面上项目,A01,1890,40773021,D0303,东秦岭造山带碳酸岩杂岩体地球化学对比研究,许成,中国科学院地球化学研究所,39.0,2008-01至2010-12
2007,面上项目,A01,1891,30770491,C050103,内质网应激凋亡途径在硒诱导白血病细胞凋亡中的作用研究,许彩民,中国医学科学院,30.0,2008-01至2010-12
2007,面上项目,A01,1892,70773121,G0304,中国出口商品构成的演变对中国经济增长的影响,许斌,中欧国际工商学院,20.0,2008-01至2010-12
2007,面上项目,A01,1893,20777072,B060102,纳米尺度物质诱导gpt转基因鼠基因突变及其机理研究,许安,中国科学院合肥物质科学研究院,27.0,2008-01至2010-12
2007,面上项目,A01,1894,10775018,A050105,格子玻尔兹曼方法及其在复杂流体中的应用,许爱国,北京应用物理与计算数学研究所,28.0,2008-01至2010-12
2007,面上项目,A01,1895,50777013,E070602,车用整合起动发电系统的新型IPM电机和矩阵Z-源变换器的研究,徐壮,哈尔滨工业大学,29.0,2008-01至2010-12
2007,面上项目,A01,1896,10771167,A011701,地球外核磁流体流动问题的谱方法研究和数值计算,徐忠锋,西安交通大学,24.0,2008-01至2010-12
2007,面上项目,A01,1897,30772143,H0205,骨髓间充质干细胞转基因上调Notch信号构建心脏传导组织的研究,徐志伟,上海交通大学,28.0,2008-01至2010-12
2007,面上项目,A01,1898,60773070,F0206,基于仿生模式识别理论的网站分类导航技术研究,徐志明,哈尔滨工业大学,26.0,2008-01至2010-12
2007,面上项目,A01,1899,20774080,B050201,糖基化纳米纤维及其与凝集素的分子识别作用研究,徐志康,浙江大学,29.0,2008-01至2010-12
2007,面上项目,A01,1900,40773077,D0709,南水北调中线水源地流域侵蚀与营养元素水文地球化学循环,徐志方,中国科学院地质与地球物理研究所,46.0,2008-01至2010-12
2007,面上项目,A01,1901,10774013,A040410,固态阴极射线发光效率的深层次表征及提高,徐征,北京交通大学,35.0,2008-01至2010-12
2007,面上项目,A01,1902,30771834,H2607,锰对谷氨酸神经递质代谢和转运的影响及其分子机制,徐兆发,中国医科大学,30.0,2008-01至2010-12
2007,面上项目,A01,1903,10774078,A040405,聚合物/无机量子点红外复合材料的非线性和超快光谱研究,徐章程,南开大学,38.0,2008-01至2010-12
2007,面上项目,A01,1904,30771111,C0702,植物蛋白酶抑制剂在腺毛分化发育过程中的功能及其作用机理,徐增富,中山大学,27.0,2008-01至2010-12
2007,面上项目,A01,1905,40772189,D0704,斜坡非饱和带低渗透岩石结构体风化前锋扩展过程研究,徐则民,昆明理工大学,43.0,2008-01至2010-12
2007,面上项目,A01,1906,10772054,A020501,血管搭桥术后静脉血管动脉化的形成与物质输运的相关性研究,徐在品,贵州大学,37.0,2008-01至2010-12
2007,面上项目,A01,1907,30772159,H0503,组织工程技术构建新特征仿真型尿道的实验研究,徐月敏,上海交通大学,30.0,2008-01至2010-12
2007,面上项目,A01,1908,30771406,C140104,DCL在DNAmβ诱导的基因沉默和抗TYLCCNV病毒中的功能分析,徐幼平,浙江大学,32.0,2008-01至2010-12
2007,面上项目,A01,1909,60772070,F010201,无线传感器网络测量关键技术研究,徐勇军,中国科学院计算技术研究所,30.0,2008-01至2010-12
2007,面上项目,A01,1910,40771086,D010501,黄土高原生态退耕脆弱性分析与农民可持续生计评估,徐勇,中国科学院地理科学与资源研究所,32.0,2008-01至2010-12
2007,面上项目,A01,1911,30770577,C1002,PAMAM-D载双靶向自杀基因治疗前列腺癌的实验研究,徐勇,天津医科大学,32.0,2008-01至2010-12
2007,面上项目,A01,1912,50774002,E0409,深井高应力岩体内爆炸能量控制技术研究,徐颖,安徽理工大学,30.0,2008-01至2010-12
2007,面上项目,A01,1913,50773094,E0310,可植入水凝胶在肝脏疾病治疗中的应用基础研究,徐迎新,中国人民解放军总医院,34.0,2008-01至2010-12
2007,面上项目,A01,1914,70771028,G0101,随机服务网络收益管理问题研究,徐以汎,复旦大学,20.0,2008-01至2010-12
2007,面上项目,A01,1915,60771021,F010707,用于微波调谐的铁电-介电固溶体材料研究,徐业彬,华中科技大学,8.0,2008-01至2008-12
2007,面上项目,A01,1916,30771258,C150703,高效解磷细菌在植物根际土壤中的行为特征研究,徐阳春,南京农业大学,32.0,2008-01至2010-12
2007,面上项目,A01,1917,50776086,E060202,尾迹扫掠下的叶片吸力面附面层分离机制及其控制策略,徐燕骥,中国科学院工程热物理研究所,35.0,2008-01至2010-12
2007,面上项目,A01,1918,20776060,B0807,理性构建双酶耦合型新催化剂及其催化立体异构反应过程研究,徐岩,江南大学,30.0,2008-01至2010-12
2007,面上项目,A01,1919,70771083,G0117,行为投资组合模型及基于Agent金融市场仿真研究,徐绪松,武汉大学,20.0,2008-01至2010-12
2007,面上项目,A01,1920,30770049,C010302,利用固氮蓝细菌合成脂肪酰多元醇的研究,徐旭东,中国科学院水生生物研究所,32.0,2008-01至2010-12
2007,面上项目,A01,1921,30771526,C180103,骨骼肌肌球蛋白热凝胶形成机理研究,徐幸莲,南京农业大学,28.0,2008-01至2010-12
2007,面上项目,A01,1922,20777071,B060105,温带老龄林土壤甲烷和乙烯氧化特征及影响机制,徐星凯,中国科学院大气物理研究所,32.0,2008-01至2010-12
2007,面上项目,A01,1923,10771015,A011103,非参数和半参数Fiducial推断,徐兴忠,北京理工大学,18.0,2008-01至2009-12
2007,面上项目,A01,1924,10774044,A0403,光学原子钟的三维光晶格理论与实验研究,徐信业,华东师范大学,38.0,2008-01至2010-12
2007,面上项目,A01,1925,60774076,F030114,基于核的增强学习与近似动态规划方法研究,徐昕,中国人民解放军国防科技大学,25.0,2008-01至2010-12
2007,面上项目,A01,1926,10774126,A040215,弱相互作用体系的密度泛函方法研究,徐昕,复旦大学,36.0,2008-01至2010-12
2007,面上项目,A01,1927,60774097,F030104,基于机器博弈的事件对策论研究,徐心和,东北大学,28.0,2008-01至2010-12
2007,面上项目,A01,1928,70772025,G021101,供应链环境下企业财务困境的形成机制与预测方法研究,徐晓燕,中国科学技术大学,21.0,2008-01至2010-12
2007,面上项目,A01,1929,70773043,G0401,基于业务重组的城市政府信息资源共享规划方法及模型构建研究,徐晓林,华中科技大学,20.0,2008-01至2010-12
2007,面上项目,A01,1930,30771783,H2601,双酚A对发育中脑内NMDA受体的影响,徐晓虹,浙江师范大学,8.0,2008-01至2008-12
2007,面上项目,A01,1931,70772062,G0205,不对称信息、公司结构的流动性约束与投资的关系研究,徐晓东,上海交通大学,18.0,2008-01至2010-12
2007,面上项目,A01,1932,40775074,D0510,华北区域本底大气臭氧生成效率观测研究,徐晓斌,中国气象科学研究院,41.0,2008-01至2010-12
2007,面上项目,A01,1933,30771906,H1904,HIV-1/AIDS感染者体内病毒细胞嗜性的研究,徐小元,北京大学,32.0,2008-01至2010-12
2007,面上项目,A01,1934,30771719,C160703,森林流域氮素动态及其调控机制的研究,徐小牛,安徽农业大学,35.0,2008-01至2010-12
2007,面上项目,A01,1935,50778158,E080406,厌氧微生物与ZVI协同还原脱氯转化含氯含硝基芳烃污染物的机理研究,徐向阳,浙江大学,34.0,2008-01至2010-12
2007,面上项目,A01,1936,30770255,C040201,隙蛛亚科蜘蛛分类地位及筛器分类学价值探讨（蜘蛛目：暗蛛科）,徐湘,湖南师范大学,8.0,2008-01至2008-12
2007,面上项目,A01,1937,30771766,C161303,沙生植物沙套形成机制及生物学意义研究,徐先英,甘肃省治沙研究所,8.0,2008-01至2008-12
2007,面上项目,A01,1938,30772661,H3008,非病毒三维纳米基因传递系统的研究,徐希明,江苏大学,32.0,2008-01至2010-12
2007,面上项目,A01,1939,30771877,H1906,Toll-like receptor及其胞内主要信号分子的下调与疟原虫成份诱导DC耐受的研究,徐文岳,中国人民解放军第三军医大学,35.0,2008-01至2010-12
2007,面上项目,A01,1940,20777053,B060103,气体扩散电极体系电化学消毒的研究,徐文英,同济大学,28.0,2008-01至2010-12
2007,面上项目,A01,1941,50775019,E050902,层状金属复合板件等离子体弧柔性成形技术基础研究,徐文骥,大连理工大学,33.0,2008-01至2010-12
2007,面上项目,A01,1942,20773014,B0301,金属和非金属原子簇芳香性的理论研究,徐文国,北京理工大学,25.0,2008-01至2010-12
2007,面上项目,A01,1943,30772654,H3007,脯甘类肽特异性IV型胶原酶抑制剂的设计、合成与抗癌活性研究,徐文方,山东大学,32.0,2008-01至2010-12
2007,面上项目,A01,1944,40772214,D0705,燃煤电厂烟囱排放的烟气中有害元素、多环芳烃的分布,徐文东,中国科学院地质与地球物理研究所,40.0,2008-01至2010-12
2007,面上项目,A01,1945,30772188,H0605,改变外周信号对神经移位后皮层功能重组的影响及其相关蛋白变化的基础研究,徐文东,复旦大学,27.0,2008-01至2010-12
2007,面上项目,A01,1946,20773045,B0305,可调控表面等离子体结构下的表面增强拉曼效应,徐蔚青,吉林大学,30.0,2008-01至2010-12
2007,面上项目,A01,1947,40773046,D0307,太阳系早期灭绝核素的分布规律和来源,徐伟彪,中国科学院紫金山天文台,42.0,2008-01至2010-12
2007,面上项目,A01,1948,70773105,G030902,基于产业集群导向的跨区域群体投资机制研究,徐维祥,浙江工业大学,21.0,2008-01至2010-12
2007,面上项目,A01,1949,30772020,H1005,肺粘膜局部特异性T细胞应答的诱导及其在抗结核杆菌感染中的作用和机制,徐薇,复旦大学,31.0,2008-01至2010-12
2007,面上项目,A01,1950,30772890,H2720,应用3S技术对维药新疆阿魏道地性成因机制的研究,徐暾海,北京中医药大学,30.0,2008-01至2010-12
2007,面上项目,A01,1951,20774090,B020302,新型聚合物基中空纤维型阴离子交换膜的制备及应用基础研究,徐铜文,中国科学技术大学,30.0,2008-01至2010-12
2007,面上项目,A01,1952,50771036,E010702,镍基高温合金中温低塑性的非平衡偏聚机理研究,徐庭栋,钢铁研究总院,36.0,2008-01至2010-12
2007,面上项目,A01,1953,30772712,H2803,脱病毒组织培养半夏中毒蛋白结构及含量变化分析,徐涛,浙江理工大学,28.0,2008-01至2010-12
2007,面上项目,A01,1954,40774059,D040901,位场曲面延拓和大深度向下延拓的迭代法,徐世浙,浙江大学,30.0,2008-01至2010-12
2007,面上项目,A01,1955,30771632,C1703,基于ea4与sod基因互作的家蚕滞育生物钟分子调控机制研究,徐世清,苏州大学,30.0,2008-01至2010-12
2007,面上项目,A01,1956,30772747,H2812,海蛇对胶原诱导关节炎大鼠滑膜血管生成调控的基础研究,徐世杰,中国中医科学院中医基础理论研究所,28.0,2008-01至2010-12
2007,面上项目,A01,1957,50772102,E020201,用于超宽带光纤放大器的双包层纳米微晶玻璃光纤研制,徐时清,中国计量大学,32.0,2008-01至2010-12
2007,面上项目,A01,1958,20772048,B070102,Ircinia属海绵中抗肿瘤活化合物的发现与优化,徐石海,暨南大学,28.0,2008-01至2010-12
2007,面上项目,A01,1959,50776013,E060702,外循环并流移动床生物质催化气化制富氢气体体系的构建,徐绍平,大连理工大学,32.0,2008-01至2010-12
2007,面上项目,A01,1960,40771095,D070102,重金属污染土壤中多组分反应性运移及数值模拟,徐绍辉,青岛大学,45.0,2008-01至2010-12
2007,面上项目,A01,1961,50778151,E080510,腐蚀环境下既有钢结构性能退化与安全评估研究,徐善华,西安建筑科技大学,33.0,2008-01至2010-12
2007,面上项目,A01,1962,20773114,B0303,原子分子系统量子耗散动力学及对电荷转移体系的研究,徐瑞雪,中国科学技术大学,26.0,2008-01至2010-12
2007,面上项目,A01,1963,60778007,F050602,水中激光焊接与切割机理研究,徐荣青,江苏科技大学,7.0,2008-01至2008-12
2007,面上项目,A01,1964,30770075,C010202,野油菜黄单胞菌新的III型效应物的鉴定及其在致病中的作用研究,徐荣旗,中国农业科学院生物技术研究所,30.0,2008-01至2010-12
2007,面上项目,A01,1965,60776030,F040601,高k栅介质/双金属栅器件研究及制备,徐秋霞,中国科学院微电子研究所,36.0,2008-01至2010-12
2007,面上项目,A01,1966,30771712,C160702,基于氢氧同位素的亚高山暗针叶林对水文过程调控机理的研究,徐庆,中国林业科学研究院,35.0,2008-01至2010-12
2007,面上项目,A01,1967,40775028,D0503,海域气溶胶光学厚度、Junge谱和折射指数遥感反演,徐青山,中国科学院合肥物质科学研究院,30.0,2008-01至2010-12
2007,面上项目,A01,1968,20775079,B040103,新型亲水作用色谱分离材料制备及其应用,徐青,中国科学院大连化学物理研究所,27.0,2008-01至2010-12
2007,面上项目,A01,1969,70772073,G0208,纺织服装供应链广义快速响应机制、模型及运作策略研究,徐琪,东华大学,20.0,2008-01至2010-12
2007,面上项目,A01,1970,20772008,B070501,新型抗肿瘤药物蛋白酶体抑制剂的设计、合成及优化,徐萍,北京大学,28.0,2008-01至2010-12
2007,面上项目,A01,1971,30770661,C0901,NSSR1调控NCAML1和TrK-C前体mRNA可变剪接的功能和机制研究,徐平,复旦大学,32.0,2008-01至2010-12
2007,面上项目,A01,1972,30771760,C1612,siRNA抑制百合无症病毒（LSV）表达的研究,徐品三,大连理工大学,30.0,2008-01至2010-12
2007,面上项目,A01,1973,60771029,F010603,指数相关土壤粗糙面电磁散射和辐射的机理及算法研究,徐鹏,武汉大学,8.0,2008-01至2008-12
2007,面上项目,A01,1974,40776078,D0609,典型赤潮藻对海水溶解有机氮的吸收动力学及其机制研究,徐宁,暨南大学,35.0,2008-01至2010-12
2007,面上项目,A01,1975,30771318,C130401,水稻重要米香物质2－乙酰基－吡咯啉（2AP）的代谢研究,徐明良,中国农业大学,28.0,2008-01至2010-12
2007,面上项目,A01,1976,60773017,F020204,可生存的车载网络环境中数据可用性关键技术研究,徐明,中国人民解放军国防科技大学,28.0,2008-01至2010-12
2007,面上项目,A01,1977,30770411,C030801,气候变化对中国自然生态系统固碳潜力的影响,徐明,中国科学院地理科学与资源研究所,35.0,2008-01至2010-12
2007,面上项目,A01,1978,10772061,A020316,基于磁记忆技术的疲劳损伤试验方法与疲劳寿命建模研究,徐敏强,哈尔滨工业大学,25.0,2008-01至2010-12
2007,面上项目,A01,1979,70771005,G0102,城市交通网络组合出行预测模型及其求解算法设计研究,徐猛,北京交通大学,20.0,2008-01至2010-12
2007,面上项目,A01,1980,30772844,H2716,益气养肺法干预肺癌化疗耐药及其线粒体信号传导研究,徐萌,暨南大学,10.0,2008-01至2008-12
2007,面上项目,A01,1981,20775047,B0402,β-淀粉样蛋白与金属离子及药物作用过程的快速原位分析研究,徐茂田,商丘师范学院,28.0,2008-01至2010-12
2007,面上项目,A01,1982,30772366,H0812,miR-125a在小儿AML发病中的作用及机制研究,徐令,中山大学,29.0,2008-01至2010-12
2007,面上项目,A01,1983,50778141,E080701,城市铁路客运枢纽交通衔接合理性自动判别与仿真,徐良杰,武汉理工大学,32.0,2008-01至2010-12
2007,面上项目,A01,1984,30772820,H2711,调更汤对围绝经期生殖轴调节作用的分子机理研究,徐莲薇,上海中医药大学,28.0,2008-01至2010-12
2007,面上项目,A01,1985,40776096,D0609,对虾白斑综合症病毒调控基因的研究,徐丽美,国家海洋局第三海洋研究所,39.0,2008-01至2010-12
2007,面上项目,A01,1986,60774092,F0302,多源监测信息融合仿生复眼系统,徐立中,河海大学,31.0,2008-01至2010-12
2007,面上项目,A01,1987,20777067,B060305,用源自多细胞通路变化建立的细胞应答网络评价环境污染物的毒性效应,徐立红,浙江大学,26.0,2008-01至2010-12
2007,面上项目,A01,1988,20773129,B0304,羧基氧原子簇聚合物的合成结构与性能研究,徐立,中国科学院福建物质结构研究所,28.0,2008-01至2010-12
2007,面上项目,A01,1989,10774177,A040204,生物分子在金属表面吸附的物性研究,徐力方,中国科学院物理研究所,30.0,2008-01至2010-12
2007,面上项目,A01,1990,30772073,H31,吸入麻醉药对痛觉上行传导通路抑制作用及相关机制的研究,徐礼鲜,中国人民解放军第四军医大学,28.0,2008-01至2010-12
2007,面上项目,A01,1991,50778138,E080801,考虑构造应力的流固耦合理论及其在水库诱发地震中的应用,徐礼华,武汉大学,32.0,2008-01至2010-12
2007,面上项目,A01,1992,30771676,C1603,木纤维-无机纳米复合材料的制备及性能研究,徐莉,南京林业大学,30.0,2008-01至2010-12
2007,面上项目,A01,1993,50771078,E010302,超薄超细晶体材料的尺寸效应及其能量学研究,徐可为,西安交通大学,33.0,2008-01至2010-12
2007,面上项目,A01,1994,60776003,F040108,非极性面氮化镓衬底的HVPE生长制备及膜层中应力演变的实时研究,徐科,中国科学院苏州纳米技术与纳米仿生研究所,29.0,2008-01至2010-12
2007,面上项目,A01,1995,10772106,A020306,量子线和量子点纳米结构中应变和压电性质分析,徐凯宇,上海大学,35.0,2008-01至2010-12
2007,面上项目,A01,1996,30770915,H0813,促CD4+CD25-naive T细胞Treg化的人源化重组分子,徐开林,徐州医科大学,30.0,2008-01至2010-12
2007,面上项目,A01,1997,60778036,F050901,掺镱正硅酸盐Yb:GYSO混晶宽调谐超快激光晶体的研究,徐军,中国科学院上海光学精密机械研究所,35.0,2008-01至2010-12
2007,面上项目,A01,1998,30771482,C1501,柑橘果实中psy等基因的表达特性分析,徐娟,华中农业大学,30.0,2008-01至2010-12
2007,面上项目,A01,1999,50775115,E050901,热氢处理改善钛合金切削加工性的基础研究,徐九华,南京航空航天大学,38.0,2008-01至2010-12
2007,面上项目,A01,2000,60776016,F040601,小尺寸超薄HfTiO/GeON叠层高k栅介质Ge基MOSFET研究,徐静平,华中科技大学,32.0,2008-01至2010-12
2007,面上项目,A01,2001,20771084,B010503,低维配合物型磁性分子的设计、合成及磁构关系研究,徐靖源,天津医科大学,8.0,2008-01至2008-12
2007,面上项目,A01,2002,70773001,G0308,中国南方集体林区林权改革模式和绩效的实证分析,徐晋涛,北京大学,20.0,2008-01至2010-12
2007,面上项目,A01,2003,50776089,E0603,微汽泡执行器强化微混合的基础研究,徐进良,中国科学院广州能源研究所,32.0,2008-01至2010-12
2007,面上项目,A01,2004,30772344,H0404,FSH与TGFβ/Smads在卵巢中的相互作用及机制,徐健,北京大学,30.0,2008-01至2010-12
2007,面上项目,A01,2005,30771681,C1603,农产品剩余物喷蒸热压法制造无胶人造板及其无胶胶合机理的研究,徐剑莹,中南林业科技大学,28.0,2008-01至2010-12
2007,面上项目,A01,2006,30771915,H1904,有效活化粘膜免疫反应的艾滋病疫苗策略研究,徐建青,复旦大学,30.0,2008-01至2010-12
2007,面上项目,A01,2007,60771044,F010705,基于SA纳米气敏薄膜的图像识别系统及其FPGA实现,徐建华,电子科技大学,25.0,2008-01至2010-12
2007,面上项目,A01,2008,60778030,F050805,弱偏振像差的亚波长微结构校正,徐建锋,浙江大学,7.0,2008-01至2008-12
2007,面上项目,A01,2009,20776020,B080405,多分散悬浮液聚集处理后的流变特性,徐继润,大连大学,28.0,2008-01至2010-12
2007,面上项目,A01,2010,30771516,C1503,草坪草耐旱机理的研究及相关基因的鉴定与克隆,徐吉臣,北京林业大学,34.0,2008-01至2010-12
2007,面上项目,A01,2011,30772309,H0501,骨髓间充质干细胞的微环境适应性及分子机制研究,徐惠成,中国人民解放军第三军医大学,28.0,2008-01至2010-12
2007,面上项目,A01,2012,20776023,B081005,超级电容器材料促进质子交换膜燃料电池动态响应机理研究,徐洪峰,大连交通大学,29.0,2008-01至2010-12
2007,面上项目,A01,2013,70772075,G021102,基于大规模定制的服务业顾客保留理论及实证研究,徐宏毅,武汉理工大学,18.0,2008-01至2010-12
2007,面上项目,A01,2014,30771228,C0606,C/EBPβ在异染色质形成中的生物学功能及分子机制,徐红,四川大学,28.0,2008-01至2010-12
2007,面上项目,A01,2015,60775060,F030604,轮式机器人在崎岖地面的低能耗通过性控制的方法研究,徐贺,哈尔滨工程大学,26.0,2008-01至2010-12
2007,面上项目,A01,2016,30770623,H1802,脑发育不同期癫痫神经网络和突触重塑异常的ME－MRI和FMRI研究,徐海波,华中科技大学,35.0,2008-01至2010-12
2007,面上项目,A01,2017,20773164,B020303,两亲性多肽的分子设计、界面吸附与自组装研究,徐海,中国石油大学（华东）,28.0,2008-01至2010-12
2007,面上项目,A01,2018,40775063,D0508,适应中国季风降水云系特征的积云参数化方案研究,徐国强,国家气象中心,39.0,2008-01至2010-12
2007,面上项目,A01,2019,60773165,F020507,几何设计中的几何偏微分方程方法及其应用,徐国良,中国科学院数学与系统科学研究院,28.0,2008-01至2010-12
2007,面上项目,A01,2020,30770803,C110206,高热直接刺激脂肪分解的细胞生物学机制,徐国恒,北京大学,40.0,2008-01至2010-12
2007,面上项目,A01,2021,30770554,C1004,近红外光谱技术在耐力运动中对肌氧监测的实现及应用,徐国栋,武汉体育学院,26.0,2008-01至2010-12
2007,面上项目,A01,2022,70772036,G0205,基于企业社会责任的战略绩效评价模型研究,徐光华,南京理工大学,20.0,2008-01至2010-12
2007,面上项目,A01,2023,50779015,E090901,东中国海至长江口的台风浪高精度高分辨率数值模拟研究,徐福敏,河海大学,34.0,2008-01至2010-12
2007,面上项目,A01,2024,30770140,C020301,木兰科及近缘科国产种类花器官结构与发育,徐凤霞,中国科学院华南植物园,30.0,2008-01至2010-12
2007,面上项目,A01,2025,30771283,C1507,油菜高亲和硼吸收转运基因的克隆、表达及其利用硼的功能研究,徐芳森,华中农业大学,31.0,2008-01至2010-12
2007,面上项目,A01,2026,10775126,A050409,同步辐射共振光电发射方法及其在研究DMOS带隙杂化电子态中的应用,徐法强,中国科学技术大学,34.0,2008-01至2010-12
2007,面上项目,A01,2027,30771898,H1904,转基因表达HBV抗原特异性细胞毒T淋巴细胞受体的研究,徐东平,中国人民解放军第三０二医院,30.0,2008-01至2010-12
2007,面上项目,A01,2028,30772768,H2811,小檗碱对骨髓基质干细胞成脂成骨分化的调控及机制研究,徐道华,广东医科大学,26.0,2008-01至2010-12
2007,面上项目,A01,2029,30772545,H1611,组蛋白修饰介导的染色质重塑在端粒酶逆转录酶(hTERT)基因转录中的作用,徐大为,山东大学,28.0,2008-01至2010-12
2007,面上项目,A01,2030,60773185,F020104,选址问题的算法设计与分析,徐大川,北京工业大学,26.0,2008-01至2010-12
2007,面上项目,A01,2031,30772310,H0406,干细胞在子宫内膜异位病灶形成及发展中的作用,徐丛剑,复旦大学,29.0,2008-01至2010-12
2007,面上项目,A01,2032,30772345,H0426,ART技术对子代生殖细胞印记基因的影响及其导致的遗传效应研究,徐晨明,浙江大学,29.0,2008-01至2010-12
2007,面上项目,A01,2033,30771139,C1111,小鼠青春期前后睾丸组织miRNA表达及其靶标功能的研究,徐晨,上海交通大学,27.0,2008-01至2010-12
