year,grant,sub,num,id,subject,title,author,school,money,dueration
2005,面上项目,A01,3338,30571461,C1603,竹纤维/热塑性塑料复合材料界面特性及增强机理研究,邱仁辉,福建农林大学,23.0,2006-01至2008-12
2005,面上项目,A01,3339,60572008,F010205,一种新型的基于WDM和OCDM的全光分组交换研究,邱昆,电子科技大学,25.0,2006-01至2008-12
2005,面上项目,A01,3340,60572103,F010404,基于能量谱的行扫描康普顿背散射成像的衰减迭代补偿及多目标优化重建,邱钧,北京信息科技大学,25.0,2006-01至2008-12
2005,面上项目,A01,3341,30570219,C040201,中国热带和南亚热带陆栖寡毛类分类学和分子系统学研究,邱江平,上海交通大学,8.0,2006-01至2006-12
2005,面上项目,A01,3342,30572023,H1303,耳蜗核损伤后神经干细胞移植及生物学特性研究,邱建华,中国人民解放军第四军医大学,26.0,2006-01至2008-12
2005,面上项目,A01,3343,30571008,C0603,粘细菌细胞膜蛋白质组亚群及发育相关基因研究,邱定红,东南大学,32.0,2006-01至2008-12
2005,面上项目,A01,3344,60573006,F020101,几类非经典计算模型及相关问题的研究,邱道文,中山大学,23.0,2006-01至2008-12
2005,面上项目,A01,3345,10571144,A010501,复芬斯拉(Finsler)流形上的几何函数论,邱春晖,厦门大学,15.0,2006-01至2007-12
2005,面上项目,A01,3346,40575049,D0508,基于奇异值分解的资料同化方法研究,邱崇践,兰州大学,41.0,2006-01至2008-12
2005,面上项目,A01,3347,30570078,C010701,番茄花叶病毒外壳蛋白与一种寄主TCIP蛋白的相互作用研究,邱并生,中国科学院微生物研究所,27.0,2006-01至2008-12
2005,面上项目,A01,3348,40573061,D0708,典型亚热带海湾持久性有机污染物(POPs)的生物累积动力学,丘耀文,中国科学院南海海洋研究所,34.0,2006-01至2008-12
2005,面上项目,A01,3349,60573042,F0207,高安全等级安全操作系统关键技术研究,卿斯汉,中国科学院软件研究所,24.0,2006-01至2008-12
2005,面上项目,A01,3350,10575122,A050304,超锕元素的化学性质,秦芝,中国科学院近代物理研究所,38.0,2006-01至2008-12
2005,面上项目,A01,3351,10571024,A010804,非线性抛物双曲耦合方程组及其吸引子,秦玉明,东华大学,23.0,2006-01至2008-12
2005,面上项目,A01,3352,40572095,D0208,镜煤逐级抽提的超临界等温吸附响应及其动力学模型,秦勇,中国矿业大学,41.0,2006-01至2008-12
2005,面上项目,A01,3353,20572072,B010305,叔丁基亚磺酰胺烯夫碱氮膦配体的合成及其不对称催化反应研究,秦勇,四川大学,26.0,2006-01至2008-12
2005,面上项目,A01,3354,30570397,C050202,一个新的心脏高表达miRNA的表达谱分析及其功能的研究,秦永文,中国人民解放军第二军医大学,26.0,2006-01至2008-12
2005,面上项目,A01,3355,60573001,F02,移动互联网络理论与关键技术,秦雅娟,北京交通大学,24.0,2006-01至2008-12
2005,面上项目,A01,3356,30570174,C020601,北柴胡药材种质资源遗传分析,秦雪梅,山西大学,26.0,2006-01至2008-12
2005,面上项目,A01,3357,30572192,H3102,Caveolae/Caveolins调节血管平滑肌细胞CGRP受体跨膜信号转导作用及开关机制,秦旭平,南华大学,8.0,2006-01至2006-12
2005,面上项目,A01,3358,70573071,G0308,转基因食品的消费者行为及其政策效应：基于实验经济学的研究,秦向东,上海交通大学,18.0,2006-01至2008-12
2005,面上项目,A01,3359,20575009,B040104,纳米材料用于改善蛋白质毛细管电泳分离的研究,秦卫东,北京师范大学,9.0,2006-01至2006-12
2005,面上项目,A01,3360,30570469,C1003,玻璃化冷冻保存对工程化人工肌腱细胞黏附和功能的影响,秦廷武,四川大学,25.0,2006-01至2008-12
2005,面上项目,A01,3361,70573006,G0414,竞争情报活动中的人际网络研究,秦铁辉,北京大学,18.0,2006-01至2008-12
2005,面上项目,A01,3362,50575233,E051102,机械系统中巨型虚拟测试仪器库的创成——岩石模型的研究,秦树人,重庆大学,32.0,2006-01至2008-12
2005,面上项目,A01,3363,30571437,C190603,应用抑制性消减杂交(SSH)结合cDNA微阵列在基因组水平研究分析石斑鱼宿主细胞与虹彩病毒病原之间的相互作用,秦启伟,中山大学,25.0,2006-01至2008-12
2005,面上项目,A01,3364,20576065,B0803,废纸制浆过程中阴离子杂质的产生机制及其与阳离子助剂的作用,秦梦华,齐鲁工业大学,26.0,2006-01至2008-12
2005,面上项目,A01,3365,30572327,H2804,积雪草种内变异和品质评价研究,秦路平,中国人民解放军第二军医大学,25.0,2006-01至2008-12
2005,面上项目,A01,3366,60577003,F050201,量子阱内光泵浦半导体垂直外腔面发射激光器研究,秦莉,中国科学院长春光学精密机械与物理研究所,25.0,2006-01至2008-12
2005,面上项目,A01,3367,30571969,H0913,内质网应激在反复高热惊厥脑损伤中的作用,秦炯,北京大学,28.0,2006-01至2008-12
2005,面上项目,A01,3368,50571053,E010901,多元Fe基合金快凝过程中主导原子团簇演化研究,秦敬玉,山东大学,32.0,2006-01至2008-12
2005,面上项目,A01,3369,30571394,C1804,鸡堆型艾美耳球虫裂殖子特异性单链抗体的筛选,秦建华,河北农业大学,23.0,2006-01至2008-12
2005,面上项目,A01,3370,10571080,A010102,代数K理论和Iwasawa理论中一些相关问题的研究,秦厚荣,南京大学,22.0,2006-01至2008-12
2005,面上项目,A01,3371,10574008,A040410,含半导体纳米晶杂化材料体系发光中的能量转移,秦国刚,北京大学,36.0,2006-01至2008-12
2005,面上项目,A01,3372,10572010,A020316,移动微系统封装中无铅焊锡接点的跌落／冲击可靠性设计方法研究,秦飞,北京工业大学,40.0,2006-01至2008-12
2005,面上项目,A01,3373,40572148,D0703,0-50年尺度地下水CFC测年技术及应用研究,秦大军,中国科学院地质与地球物理研究所,36.0,2006-01至2008-12
2005,面上项目,A01,3374,30570084,C010803,TAT介导的D2C-SN融合蛋白抗登革病毒感染的研究,秦成峰,中国人民解放军军事科学院军事医学研究院,8.0,2006-01至2006-12
2005,面上项目,A01,3375,30571948,H1621,基因调控靶向治疗卵巢癌的实验研究,乔玉环,郑州大学,8.0,2006-01至2006-12
2005,面上项目,A01,3376,50572017,E020301,MoSi2金属间化合物的强韧化实现机制及宏微观双尺度理论研究,乔英杰,哈尔滨工程大学,25.0,2006-01至2008-12
2005,面上项目,A01,3377,30571303,C200301,大蒜绿变的机理及其控制,乔旭光,山东农业大学,22.0,2006-01至2008-12
2005,面上项目,A01,3378,40574049,D040901,方位声波测井方法研究,乔文孝,中国石油大学（北京）,30.0,2006-01至2008-12
2005,面上项目,A01,3379,30570072,C010802,牛泡沫病毒中国株BFV3026 Borf1蛋白转录后调控机制研究,乔文涛,南开大学,30.0,2006-01至2008-12
2005,面上项目,A01,3380,10573018,A0307,外行星暗弱卫星的高精度天体测量与运动学研究,乔荣川,中国科学院国家授时中心,32.0,2006-01至2008-12
2005,面上项目,A01,3381,20572008,B040602,新的核酸识别和切割分子的合成及活性的研究,乔仁忠,北京化工大学,26.0,2006-01至2008-12
2005,面上项目,A01,3382,30570089,C010603,铜绿假单胞菌致病性和耐药性相关新基因功能的研究,乔明强,南开大学,25.0,2006-01至2008-12
2005,面上项目,A01,3383,50572006,E020402,铁电陶瓷滞后开裂机理研究,乔利杰,北京科技大学,26.0,2006-01至2008-12
2005,面上项目,A01,3384,30570872,H0719,PCOS患者脂代谢异常的相关研究,乔杰,北京大学,26.0,2006-01至2008-12
2005,面上项目,A01,3385,30571398,C1802,ERK细胞信号通路与H5N1-AIV增殖及致病性的关系研究,乔健,中国农业大学,29.0,2006-01至2008-12
2005,面上项目,A01,3386,30570042,C010301,麦拓莱霉素合成基因簇的序列测定及功能分析,乔建军,天津大学,26.0,2006-01至2008-12
2005,面上项目,A01,3387,30571899,H0913,磁源成像频谱分析对颞叶癫痫致痫灶的定位和传导机制研究,乔慧,北京市神经外科研究所,25.0,2006-01至2008-12
2005,面上项目,A01,3388,30571753,H1006,rAAV-HO-1抑制细胞凋亡诱导肝移植免疫耐受的研究,乔海泉,哈尔滨医科大学,26.0,2006-01至2008-12
2005,面上项目,A01,3389,30570214,C040201,扁蚜科蚜虫的分子系统学及形态特征演化,乔格侠,中国科学院动物研究所,27.0,2006-01至2008-12
2005,面上项目,A01,3390,40572109,D0711,鹤庆湖泊岩芯的环境磁学与最近2.8 Ma的古气候变化,强小科,中国科学院地球环境研究所,39.0,2006-01至2008-12
2005,面上项目,A01,3391,50575154,E050602,疏密纬织物及其织造实现,钱志良,苏州大学,25.0,2006-01至2008-12
2005,面上项目,A01,3392,50578038,E080703,钢桥面环氧沥青混凝土铺装层疲劳损伤与寿命预估研究,钱振东,东南大学,27.0,2006-01至2008-12
2005,面上项目,A01,3393,30570080,C010803,新发现的呼吸道病毒-人偏肺病毒的病原学研究,钱渊,首都儿科研究所,27.0,2006-01至2008-12
2005,面上项目,A01,3394,20572095,B010301,新型离子载体高碘试剂的合成及其在有机合成中的应用,钱卫星,浙江大学,25.0,2006-01至2008-12
2005,面上项目,A01,3395,40572168,D0705,核废物处置库顶盖毛细屏障作用机制及数值模拟,钱天伟,太原科技大学,30.0,2006-01至2008-12
2005,面上项目,A01,3396,50575095,E051104,基于温度场模型及特征提取的大型变压器远程监诊方法与技术的研究,钱苏翔,嘉兴学院,21.0,2006-01至2008-12
2005,面上项目,A01,3397,30570017,C010201,嗜吡啶红球菌对多氯联苯脱氯机制及相关基因的研究,钱世钧,中国科学院微生物研究所,26.0,2006-01至2008-12
2005,面上项目,A01,3398,70572087,G0204,企业家人力资本供给与企业持续成长能力需求研究,钱士茹,安徽大学,18.0,2006-01至2008-12
2005,面上项目,A01,3399,10573032,A0303,过相接双星公共包层结构变化的观测研究,钱声帮,中国科学院云南天文台,30.0,2006-01至2008-12
2005,面上项目,A01,3400,10572051,A020314,三维结构撞水的流固耦合数值分析与实验研究,钱勤,华中科技大学,10.0,2006-01至2006-12
2005,面上项目,A01,3401,50578158,E080507,钢筋混凝土结构在低速冲击下局部与整体响应研究,钱七虎,中国人民解放军理工大学,28.0,2006-01至2008-12
2005,面上项目,A01,3402,30570608,C2103,中国大学生自我认知与羞耻感的关系及临床应用研究,钱铭怡,北京大学,21.0,2006-01至2008-12
2005,面上项目,A01,3403,30570753,H0203,线粒体Prohibitin在应激心肌细胞损伤发生中的作用及其分子机制,钱令嘉,中国人民解放军军事科学院军事医学研究院,30.0,2006-01至2008-12
2005,面上项目,A01,3404,50575190,E0512,纳动的运行行为和损伤机理研究,钱林茂,西南交通大学,8.0,2006-01至2006-12
2005,面上项目,A01,3405,50572127,E020501,流化床燃煤固硫灰渣膨胀机理与控制方法研究,钱觉时,重庆大学,29.0,2006-01至2008-12
2005,面上项目,A01,3406,20574059,B020302,聚电解质溶液性质和自组装结构有序化调控及其膜的渗透汽化性能研究,钱锦文,浙江大学,26.0,2006-01至2008-12
2005,面上项目,A01,3407,30571060,C0604,应用常染色体单倍域（Haplotype Block）研究中国人群的遗传结构,钱吉,复旦大学,22.0,2006-01至2008-12
2005,面上项目,A01,3408,20573025,B0203,光活性系统蛋白-氢解酶复合体系的构筑及催化产氢研究,钱东金,复旦大学,26.0,2006-01至2008-12
2005,面上项目,A01,3409,10571131,A010705,Hamilton振子链和相关系统的周期与拟周期呼吸子,钱定边,苏州大学,23.0,2006-01至2008-12
2005,面上项目,A01,3410,50578035,E080511,微生物技术修复建筑文物和重大工程混凝土缺陷的基础研究,钱春香,东南大学,30.0,2006-01至2007-12
2005,面上项目,A01,3411,50574033,E0414,高炉渣干法粒化及其余热回收的研究,齐渊洪,钢铁研究总院,32.0,2006-01至2008-12
2005,面上项目,A01,3412,40572012,D0201,复杂遗迹组构的三维可视化分析及其在储层评价中的应用,齐永安,河南理工大学,38.0,2006-01至2008-12
2005,面上项目,A01,3413,30570985,C06,两种凋亡诱发基因介导的细胞凋亡网络信号通路及其与神经关系的研究,齐义鹏,武汉大学,31.0,2006-01至2008-12
2005,面上项目,A01,3414,40573026,D0304,西藏昂拉陵盐湖硼锂矿集区成矿地质-地球化学背景,齐文,中国地质科学院矿产资源研究所,33.0,2006-01至2008-12
2005,面上项目,A01,3415,50574084,E041202,亚熔盐平台技术处理钛铁矿清洁工艺的基础研究,齐涛,中国科学院过程工程研究所,25.0,2006-01至2008-12
2005,面上项目,A01,3416,30571486,C160703,三峡库区以流域为单元森林植被对洪水影响研究,齐实,北京林业大学,25.0,2006-01至2008-12
2005,面上项目,A01,3417,30572083,H0805,血小板活性的增龄性变化与血栓发病机制的研究,齐若梅,北京医院,25.0,2006-01至2008-12
2005,面上项目,A01,3418,30572449,H2902,通里攻下方剂对Cajal间质细胞胃肠运动起搏干预机制研究,齐清会,大连医科大学,28.0,2006-01至2008-12
2005,面上项目,A01,3419,50575185,E050802,轻质高性能Csf/Mg复合材料固-液高压渗挤近终成形技术基础研究,齐乐华,西北工业大学,28.0,2006-01至2008-12
2005,面上项目,A01,3420,30571203,C140102,棉花黄萎菌毒素相关基因分离及基因消除（quelling）体系建立,齐俊生,中国农业大学,28.0,2006-01至2008-12
2005,面上项目,A01,3421,30572203,H3105,人白血病干细胞与耐药性的关系研究,齐静,中国医学科学院,20.0,2006-01至2008-12
2005,面上项目,A01,3422,30571212,C140103,非寄主互作中水稻抗病信号一氧化氮的产生及其对防卫基因表达的调控,齐放军,中国农业科学院植物保护研究所,24.0,2006-01至2008-12
2005,面上项目,A01,3423,50572013,E021101,"a,b轴外延生长Bi系高温超导薄膜的制备研究",祁阳,东北大学,25.0,2006-01至2008-12
2005,面上项目,A01,3424,30570533,H1802,感音性耳聋后听皮质的形态与功能变化及整合机制的探索,祁吉,天津市第一中心医院,26.0,2006-01至2008-12
2005,面上项目,A01,3425,50575204,E050601,面向复杂机械产品全生命周期的自适应配置设计理论,祁国宁,浙江大学,25.0,2006-01至2008-12
2005,面上项目,A01,3426,30570520,H1806,针孔SPECT成像的精确定量研究,漆玉金,中国科学院上海应用物理研究所,26.0,2006-01至2008-12
2005,面上项目,A01,3427,10571009,A010503,拟共形Teichmuller空间与复动力系统,漆毅,北京航空航天大学,22.0,2006-01至2008-12
2005,面上项目,A01,3428,40573049,D0302,等离子体质谱法测定基性岩中超低含量铂族元素及其在峨眉山玄武岩中的应用,漆亮,中国科学院地球化学研究所,34.0,2006-01至2008-12
2005,面上项目,A01,3429,30570346,C030301,树木抑制户外空气中细菌作用特异性的研究,戚继忠,北华大学,8.0,2006-01至2006-12
2005,面上项目,A01,3430,30571456,C1603,基于分形理论的木材缺陷无损检测研究,戚大伟,东北林业大学,8.0,2006-01至2006-12
2005,面上项目,A01,3431,50576086,E060603,基于激光数码全息和计算机层析技术的两相流三维动态测量方法的研究,浦兴国,浙江大学,25.0,2006-01至2008-12
2005,面上项目,A01,3432,50578097,E080102,高句丽建筑演进研究,朴玉顺,沈阳建筑大学,25.0,2006-01至2008-12
2005,面上项目,A01,3433,30570464,C1004,NO前体/供体介入给药抗缺血性脑损害研究,朴翔宇,大连大学,8.0,2006-01至2006-12
2005,面上项目,A01,3434,30571584,H2607,砷对新生幼鼠神经行为影响的毒性作用机制探讨,朴丰源,大连医科大学,27.0,2006-01至2008-12
2005,面上项目,A01,3435,60577031,F050102,以皮层为主的视觉功能重建,濮鸣亮,北京大学,24.0,2006-01至2008-12
2005,面上项目,A01,3436,10571137,A011201,约束非线性规划的新方法研究,濮定国,同济大学,15.0,2006-01至2007-12
2005,面上项目,A01,3437,20573009,B0304,偶氮苯衍生物水滑石插层材料的光致伸缩作用和顺反异构机理研究,蒲敏,北京化工大学,8.0,2006-01至2006-12
2005,面上项目,A01,3438,60574019,F030114,非线性系统基于支持向量机的智能建模与控制方法研究,皮道映,浙江大学,22.0,2006-01至2008-12
2005,面上项目,A01,3439,60573095,F020204,Web服务环境中工作流视图机制的研究与开发,彭智勇,武汉大学,25.0,2006-01至2008-12
2005,面上项目,A01,3440,20572087,B010305,新型双功能固载有机催化剂的合成和不对称催化反应研究,彭云贵,西南大学,26.0,2006-01至2008-12
2005,面上项目,A01,3441,30570589,C0903,ARF6基因在神经发育中的功能作用及与PI3K的相互关系研究,彭英,中山大学,8.0,2006-01至2006-12
2005,面上项目,A01,3442,50576072,E060202,喷入气体压缩腔内润滑油的分布特征及对密封、润滑的影响研究,彭学院,西安交通大学,24.0,2006-01至2008-12
2005,面上项目,A01,3443,50575152,E050502,规则微槽气体端面密封的微尺度效应与应用基础研究,彭旭东,浙江工业大学,29.0,2006-01至2008-12
2005,面上项目,A01,3444,60574048,F030203,网络中心战建模/仿真关键技术研究,彭晓源,北京航空航天大学,24.0,2006-01至2008-12
2005,面上项目,A01,3445,10574161,A040405,基于超短超强激光等离子体相互作用的新型THz辐射源实验探索,彭晓昱,中国科学院物理研究所,34.0,2006-01至2008-12
2005,面上项目,A01,3446,50571108,E011102,Ni/Cr复合膜发生选择性氧化的Cr颗粒“尺寸效应“,彭晓,中国科学院金属研究所,28.0,2006-01至2008-12
2005,面上项目,A01,3447,30571039,H1603,神经粘附分子NECL1在神经系统肿瘤异常表达中的表观遗传调控研究,彭小忠,中国医学科学院,32.0,2006-01至2008-12
2005,面上项目,A01,3448,30570844,H0306,肠三叶因子受体cDNA的筛选、受体蛋白氨基酸序列分析及结构预测,彭曦,中国人民解放军第三军医大学,26.0,2006-01至2008-12
2005,面上项目,A01,3449,40571092,D070105,北京及周边地区免耕条件下土壤水分动态及利用效率,彭文英,首都经济贸易大学,32.0,2006-01至2008-12
2005,面上项目,A01,3450,20573078,B020106,集成光电极的制备及其可见光分解水效能研究,彭天右,武汉大学,26.0,2006-01至2008-12
2005,面上项目,A01,3451,70572022,G020703,中国品牌的消费者-品牌关系：维度、类型与强化机制,彭泗清,北京大学,17.0,2006-01至2008-12
2005,面上项目,A01,3452,30572281,H3112,金属硫蛋白抗阿霉素心脏毒性的作用机制,彭双清,中国人民解放军军事科学院军事医学研究院,25.0,2006-01至2008-12
2005,面上项目,A01,3453,30572235,H3001,基于容许效应以改善雌激素替补治疗为目标的雌激素-RGD缀合激素设计,彭师奇,首都医科大学,31.0,2006-01至2008-12
2005,面上项目,A01,3454,40572064,D0205,内蒙古朱拉扎嘎～渣尔泰山中元古代裂陷槽裂解事件及成矿响应,彭润民,中国地质大学（北京）,40.0,2006-01至2008-12
2005,面上项目,A01,3455,10573011,A0305,II型超新星爆发机制的研究,彭秋和,南京大学,29.0,2006-01至2008-12
2005,面上项目,A01,3456,10573008,A0306,土星及其暗卫星位置的高精度测量研究,彭青玉,暨南大学,31.0,2006-01至2008-12
2005,面上项目,A01,3457,20574060,B030704,表面官能化纳米材料填充不对称性高分子共混物的反应诱导相分离及结构-性能关系,彭懋,浙江大学,26.0,2006-01至2008-12
2005,面上项目,A01,3458,20572081,B0702,树形分子-RNA相互作用以及树形分子靶向RNA和传送RNA能力的研究,彭玲,武汉大学,26.0,2006-01至2008-12
2005,面上项目,A01,3459,60572050,F010102,高性能低复杂度LDPC码代数结构的算法研究,彭立,华中科技大学,21.0,2006-01至2008-12
2005,面上项目,A01,3460,50573024,E030901,高分子有源发光器件集成探索,彭俊彪,华南理工大学,27.0,2006-01至2008-12
2005,面上项目,A01,3461,30570779,H0805,慢性特发性血小板减少性紫癜T细胞信号转导的磷蛋白组学研究,彭军,山东大学,24.0,2006-01至2008-12
2005,面上项目,A01,3462,30571875,H0605,去细胞异体神经促神经再生及选择性生长实验研究,彭江,中国人民解放军总医院,27.0,2006-01至2008-12
2005,面上项目,A01,3463,30570073,C010802,通用型靶向性可控表达重组AAV2载体系统的研究,彭建强,湖南省人民医院,25.0,2006-01至2008-12
2005,面上项目,A01,3464,70571053,G010903,利用时间延迟效应控制与同步复杂系统的研究,彭建华,深圳大学,16.0,2006-01至2008-12
2005,面上项目,A01,3465,50572126,E020501,硬石膏活性激发及其胶结材配制原理研究,彭家惠,重庆大学,27.0,2006-01至2008-12
2005,面上项目,A01,3466,70571036,G0115,跨国公司技术转移动态演化与跃迁机制研究,彭纪生,南京大学,17.0,2006-01至2008-12
2005,面上项目,A01,3467,60574058,F030206,时变方差金融时序列建模与投资组合优化方法研究,彭辉,中南大学,22.0,2006-01至2008-12
2005,面上项目,A01,3468,30571286,C1501,细胞分裂素对苹果根际硝态氮信号的转导研究,彭福田,山东农业大学,22.0,2006-01至2008-12
2005,面上项目,A01,3469,50575235,E051102,基于变耦合系数变压器原理的时栅传感器研究,彭东林,重庆理工大学,29.0,2006-01至2008-12
2005,面上项目,A01,3470,30570755,H0215,MEF2A基因与动脉粥样硬化关系探讨,彭道泉,中南大学,28.0,2006-01至2008-12
2005,面上项目,A01,3471,60572142,F010202,基于广义正交跳频序列的准同步FH-CDMA系统研究,彭代渊,西南交通大学,25.0,2006-01至2008-12
2005,面上项目,A01,3472,60573105,F020302,可重构嵌入式计算机操作系统研究,彭澄廉,复旦大学,25.0,2006-01至2008-12
2005,面上项目,A01,3473,40572172,D0705,湘西下寒武统黑色页岩风化环境效应的地球化学示踪,彭渤,湖南师范大学,37.0,2006-01至2008-12
2005,面上项目,A01,3474,30572266,H3008,PEG化药物转铁蛋白隐形纳米粒研究,裴元英,复旦大学,28.0,2006-01至2008-12
2005,面上项目,A01,3475,50578056,E0807,驾驶员车道变换行为特性及其对交通运行影响研究,裴玉龙,哈尔滨工业大学,28.0,2006-01至2008-12
2005,面上项目,A01,3476,50576067,E060407,柴油均质充量压燃中微粒形成机理、演化历程及理化特性的研究,裴毅强,天津大学,27.0,2006-01至2008-12
2005,面上项目,A01,3477,30571195,C130410,胞质雄性不育相关基因T1170两个转录本及其所含Ⅱ型内含子的功能研究,裴雁曦,山西大学,22.0,2006-01至2008-12
2005,面上项目,A01,3478,30570061,C010301,球孢白僵菌孢子形成相关基因Bbsag1的功能分析,裴炎,西南大学,26.0,2006-01至2008-12
2005,面上项目,A01,3479,30571191,C130410,野生蕉抗枯萎病防卫反应的分子机理研究,裴新梧,中国农业科学院生物技术研究所,23.0,2006-01至2008-12
2005,面上项目,A01,3480,40572121,D0211,扬子地块西北缘后龙门东段变质核杂岩形成机制和区域构造背景,裴先治,长安大学,36.0,2006-01至2008-12
2005,面上项目,A01,3481,20572100,B010301,离子液体促进的卤代杂环化合物高选择性Heck反应研究,裴文,浙江工业大学,8.0,2006-01至2006-12
2005,面上项目,A01,3482,40572061,D0205,湘南钨锡多金属矿集区超巨量金属工业堆积与异常成矿作用,裴荣富,中国地质科学院矿产资源研究所,37.0,2006-01至2008-12
2005,面上项目,A01,3483,60574004,F030101,小型飞行机器人的多模态切换制导控制策略研究,裴海龙,华南理工大学,24.0,2006-01至2008-12
2005,面上项目,A01,3484,10575115,A050501,国际直线对撞机正电子源的设计研究,裴国玺,中国科学院高能物理研究所,40.0,2006-01至2008-12
2005,面上项目,A01,3485,30571871,H0609,RNA干扰技术中断RANKL信号传导通路抑制破骨细胞前体转化的研究,裴福兴,四川大学,25.0,2006-01至2008-12
2005,面上项目,A01,3486,60572147,F010409,下一代互联网性能测量关键技术研究,裴昌幸,西安电子科技大学,24.0,2006-01至2008-12
2005,面上项目,A01,3487,50579015,E0903,太湖蓝藻水华形成机理及模拟研究,逄勇,河海大学,27.0,2006-01至2008-12
2005,面上项目,A01,3488,30572303,H2704,益气化瘀、清热养阴法干预肥胖型T2DM大血管损伤的作用机制,庞宗然,承德医学院,28.0,2006-01至2008-12
2005,面上项目,A01,3489,10574079,A040303,"自旋极化电子原子散射的(e,eγ)符合实验研究",庞文宁,清华大学,36.0,2006-01至2008-12
2005,面上项目,A01,3490,30570358,C050201,NHE1细胞内调节区域及其辅助因子CHP1-2的结构与功能研究,庞天翔,中国医学科学院,25.0,2006-01至2008-12
2005,面上项目,A01,3491,60574069,F030203,信用评价模型及其随机逼近优化算法研究,庞素琳,暨南大学,24.0,2006-01至2008-12
2005,面上项目,A01,3492,10571045,A011101,正交表的构造方法及其应用,庞善起,河南师范大学,20.0,2006-01至2008-12
2005,面上项目,A01,3493,30571917,H0906,颅内压增高状态脑静脉系统调控机制及药物干预的研究,庞琦,山东大学,25.0,2006-01至2008-12
2005,面上项目,A01,3494,30570490,C100403,基于多功能纳米生物器件的多种细胞同时靶向富集与分选新方法研究,庞代文,武汉大学,30.0,2006-01至2008-12
2005,面上项目,A01,3495,60575038,F030502,矛盾知识和对立知识的逻辑基础及处理的研究,潘正华,江南大学,20.0,2006-01至2008-12
2005,面上项目,A01,3496,30570993,C0601,拟南芥磷脂酶C调节花粉萌发和生长的功能研究,潘延云,河北农业大学,28.0,2006-01至2008-12
