year,grant,sub,num,id,subject,title,author,school,money,dueration
2007,面上项目,A01,3748,10771124,A011701,油水资源数值方法的理论和应用,芮洪兴,山东大学,25.0,2008-01至2010-12
2007,面上项目,A01,3749,10771068,A010203,李理论中的有限维代数的结构与表示,芮和兵,华东师范大学,22.0,2008-01至2010-12
2007,面上项目,A01,3750,30772295,H0215,炎症因子干扰HMGCoA还原酶反馈调节：他汀类药物抵抗及泡沫细胞形成的新机制,阮雄中,重庆医科大学,20.0,2008-01至2010-12
2007,面上项目,A01,3751,60774077,F030116,自平衡机器人基于Skinner操作条件反射理论的小脑感觉运动系统研究,阮晓钢,北京工业大学,28.0,2008-01至2010-12
2007,面上项目,A01,3752,50773095,E030703,纳米粒子/聚合物复合材料中的双界面调控及其增韧效应,阮文红,中山大学,30.0,2008-01至2010-12
2007,面上项目,A01,3753,30771251,C150705,茶树铵、硝偏性吸收特性与调控的生理生化基础,阮建云,中国农业科学院茶叶研究所,30.0,2008-01至2010-12
2007,面上项目,A01,3754,50774096,E0416,纳米介质液体防弹材料及防护机理研究,阮建明,中南大学,33.0,2008-01至2010-12
2007,面上项目,A01,3755,10775139,A050503,强流带状电子束成形与传输的动力学系统及关键技术研究,阮存军,中国科学院电子学研究所,36.0,2008-01至2010-12
2007,面上项目,A01,3756,40774057,D040901,坑道直流电阻率超前聚焦探测新方法研究,阮百尧,桂林理工大学,33.0,2008-01至2010-12
2007,面上项目,A01,3757,30772830,H2718,穴位从正常状态的“沉寂”到病理状态的“活化”过程和机制,荣培晶,中国中医科学院针灸研究所,32.0,2008-01至2010-12
2007,面上项目,A01,3758,70771016,G0109,突发事件连锁反应宏观预警研究,荣莉莉,大连理工大学,20.0,2008-01至2010-12
2007,面上项目,A01,3759,30770797,C110203,硫化氢对颈动脉体化学感受器功能的影响及其分子机制,戎伟芳,上海交通大学,42.0,2008-01至2010-12
2007,面上项目,A01,3760,10772046,A020202,非光滑非线性系统的随机分叉,戎海武,佛山科学技术学院,14.0,2008-01至2010-12
2007,面上项目,A01,3761,10775068,A050301,重核和超重核性质的理论研究,任中洲,南京大学,30.0,2008-01至2010-12
2007,面上项目,A01,3762,40771019,D010105,西北河谷平原土地生态安全动态与可持续发展途径,任志远,陕西师范大学,45.0,2008-01至2010-12
2007,面上项目,A01,3763,40775044,D0507,天气尺度瞬变异常强迫对北太平洋中纬度冬季气候异常的作用研究,任雪娟,南京大学,30.0,2008-01至2010-12
2007,面上项目,A01,3764,50775150,E050303,纸载体绳播种植技术关键装备的应用基础研究,任文涛,沈阳农业大学,32.0,2008-01至2010-12
2007,面上项目,A01,3765,40772186,D0704,双（多）层反翘型滑坡成灾机理及控制方法研究,任伟中,中国科学院武汉岩土力学研究所,36.0,2008-01至2010-12
2007,面上项目,A01,3766,30770701,C0905,动脉压力感受器去极化阻滞的研究,任维,陕西师范大学,26.0,2008-01至2010-12
2007,面上项目,A01,3767,10775111,A0504,基于原子核自旋的共振压力显微探头特性研究,任韧,西安交通大学,30.0,2008-01至2010-12
2007,面上项目,A01,3768,60778037,F050902,用于全光开关的配合物型三阶非线性光学波导材料与性能研究,任诠,山东大学,30.0,2008-01至2010-12
2007,面上项目,A01,3769,50779009,E0910,基于风险的高混凝土坝安全评估理论和方法研究,任青文,河海大学,32.0,2008-01至2010-12
2007,面上项目,A01,3770,60778020,F050502,单偏振单模光子晶体光纤的设计及其在可控光学延迟中的应用研究,任立勇,中国科学院西安光学精密机械研究所,35.0,2008-01至2010-12
2007,面上项目,A01,3771,50779064,E0902,农药通过区域尺度非饱和带的淋失动态及对地下水的污染风险,任理,中国农业大学,35.0,2008-01至2010-12
2007,面上项目,A01,3772,10772104,A020304,力热耦合下橡胶复合材料的本构表征及应用,任九生,上海大学,35.0,2008-01至2010-12
2007,面上项目,A01,3773,30771332,C130402,反义Trxs基因对小麦籽粒淀粉蛋白质形成与品质的调控机制,任江萍,河南农业大学,24.0,2008-01至2010-12
2007,面上项目,A01,3774,40771077,D010503,中观尺度区域环境管理系统（REMS）构建与运行机制研究,任建兰,山东师范大学,30.0,2008-01至2010-12
2007,面上项目,A01,3775,20776137,B0804,用于烯烃/烷烃分离的负载过渡金属复合膜研制及渗透机理研究,任吉中,中国科学院大连化学物理研究所,27.0,2008-01至2010-12
2007,面上项目,A01,3776,10772027,A020602,强冲击载荷下陶瓷材料破坏特性及损伤本构模型研究,任会兰,北京理工大学,42.0,2008-01至2010-12
2007,面上项目,A01,3777,30772238,H1618,解析GBM基于EGFR/PI3K信号通路多模式靶向治疗靶标的研究,任欢,哈尔滨医科大学,28.0,2008-01至2010-12
2007,面上项目,A01,3778,20777003,B060305,双壳类动物金属硫蛋白抗体芯片的研制及其在监测长江水系重金属污染中的应用,任宏伟,北京大学,28.0,2008-01至2010-12
2007,面上项目,A01,3779,30771923,H1904,应用高通量质谱蛋白质复合体分析方法鉴定与乙肝病毒X蛋白相互作用的蛋白质分子,任红,重庆医科大学,24.0,2008-01至2010-12
2007,面上项目,A01,3780,10771201,A010501,Dunkl-Clifford分析,任广斌,中国科学技术大学,27.0,2008-01至2010-12
2007,面上项目,A01,3781,40775046,D0507,全球变暖背景下西北太平洋热带气旋活动的变化,任福民,国家气候中心,38.0,2008-01至2010-12
2007,面上项目,A01,3782,50771042,E010803,基于电子理论金属纳米晶体塑性变形机理及金属薄膜内应力形成机制研究与实验验证,任凤章,河南科技大学,25.0,2008-01至2010-12
2007,面上项目,A01,3783,60773138,F0208,高速网络中传输控制系统的优化设计,任丰原,清华大学,29.0,2008-01至2010-12
2007,面上项目,A01,3784,30770203,C020408,拟南芥中一种新的微丝成束蛋白ABP30.6的功能位点解析及磷酸化对其功能的调控研究,任东涛,中国农业大学,35.0,2008-01至2010-12
2007,面上项目,A01,3785,60776032,F040401,GaAs/AlGaAs亚微米Hall阵列探测仪及其在微磁矩样品测试中的应用,任聪,中国科学院物理研究所,37.0,2008-01至2010-12
2007,面上项目,A01,3786,10775027,A050601,大气压纳秒脉冲均匀体积放电等离子体形成机理及不稳定性控制研究,任春生,大连理工大学,36.0,2008-01至2010-12
2007,面上项目,A01,3787,30770195,C020408,芸苔素影响茉莉素信号传导的分子机理研究,任春梅,湖南农业大学,28.0,2008-01至2010-12
2007,面上项目,A01,3788,30771230,C0602,以秀丽线虫为模式生物研究可变剪接在低氧应答中的作用及可能的调节机制,任长虹,中国人民解放军军事科学院军事医学研究院,25.0,2008-01至2010-12
2007,面上项目,A01,3789,10772121,A020501,人耳听觉系统与新型智能声桥机理研究,饶柱石,上海交通大学,30.0,2008-01至2010-12
2007,面上项目,A01,3790,30770670,C0902,脊髓背角神经元－胶质细胞网络在神经病理痛中的作用,饶志仁,中国人民解放军第四军医大学,28.0,2008-01至2010-12
2007,面上项目,A01,3791,50778112,E0801,南方地区既有建筑的绿色改造研究,饶小军,深圳大学,30.0,2008-01至2010-12
2007,面上项目,A01,3792,30772061,H2002,肽抗生素hPAB-β抗细菌L-型感染的实验研究,饶贤才,中国人民解放军第三军医大学,30.0,2008-01至2010-12
2007,面上项目,A01,3793,30771756,C1611,柿采后软化过程中扩张蛋白基因表达调控功能研究,饶景萍,西北农林科技大学,28.0,2008-01至2010-12
2007,面上项目,A01,3794,30770142,C020301,菊属的系统发育研究,饶广远,北京大学,30.0,2008-01至2010-12
2007,面上项目,A01,3795,10774166,A040103,铈基大块金属玻璃的调制差示扫描量热学研究,饶光辉,中国科学院物理研究所,38.0,2008-01至2010-12
2007,面上项目,A01,3796,30770964,H1617,miRNA在人结肠癌细胞羟基喜树碱多药耐药中的作用初探,冉志华,上海交通大学,30.0,2008-01至2010-12
2007,面上项目,A01,3797,30770642,H2201,他汀和血栓调节素对血管内皮细胞辐射损伤的防护作用和机制研究,冉新泽,中国人民解放军第三军医大学,10.0,2008-01至2008-12
2007,面上项目,A01,3798,30770565,H1805,包裹血卟琳的新型靶向高分子材料超声造影剂对肝癌的治疗作用及其机制,冉海涛,重庆医科大学,30.0,2008-01至2010-12
2007,面上项目,A01,3799,60773081,F020501,平板显示器灰度控制的分形方法研究及IP核实现,冉峰,上海大学,28.0,2008-01至2010-12
2007,面上项目,A01,3800,30770308,C0404,黑白仰鼻猴（Rhinopithecus bieti）西藏种群的保护研究,权锐昌,中国科学院西双版纳热带植物园,33.0,2008-01至2010-12
2007,面上项目,A01,3801,50775156,E050202,新型流量自平衡泵控差动缸电液伺服系统的理论与方法,权龙,太原理工大学,35.0,2008-01至2010-12
2007,面上项目,A01,3802,50778033,E0804,TiO2纳米管光催化/超滤一体化膜的制备及水处理特性,全燮,大连理工大学,33.0,2008-01至2010-12
2007,面上项目,A01,3803,60777011,F0501,基于波前技术的无视标视功能检测和视觉诊断的研究,全薇,吉林大学,33.0,2008-01至2010-12
2007,面上项目,A01,3804,60771011,F010605,天线/RCS测试场的时频空角联合评估方法,全绍辉,北京航空航天大学,28.0,2008-01至2010-12
2007,面上项目,A01,3805,20772065,B0702,无需酶制剂的DNA序列碱基突变的检测方法,渠瑾,南开大学,33.0,2008-01至2010-12
2007,面上项目,A01,3806,20772024,B010301,脱氧核苷的绿色合成研究,渠桂荣,河南师范大学,30.0,2008-01至2010-12
2007,面上项目,A01,3807,60772041,F010304,图像重建的Landweber迭代算法及其应用研究,渠刚荣,北京交通大学,30.0,2008-01至2010-12
2007,面上项目,A01,3808,10774186,A040303,原子广义振子强度的相对论多通道理论研究,屈一至,中国科学院大学,30.0,2008-01至2010-12
2007,面上项目,A01,3809,30770303,C040204,噪鹛属(Garrulax)鸟类的分子系统发育与橙翅噪鹛(G.elliotii)的谱系地理学研究,屈延华,中国科学院动物研究所,31.0,2008-01至2010-12
2007,面上项目,A01,3810,70772095,G0205,基于市场微观结构理论的三大财务问题的拓展研究,屈文洲,厦门大学,22.0,2008-01至2010-12
2007,面上项目,A01,3811,30771770,H2601,饮用水氯化消毒副产物对胎儿生长发育和不良生殖结局的影响研究,屈卫东,复旦大学,34.0,2008-01至2010-12
2007,面上项目,A01,3812,30771151,C06,新疆北鲵保护遗传学及中亚地区系统地理学研究,屈良鹄,中山大学,28.0,2008-01至2010-12
2007,面上项目,A01,3813,40772106,D0711,利用卫星热红外遥感监测长白山火山活动性,屈春燕,中国地震局地质研究所,13.0,2008-01至2008-12
2007,面上项目,A01,3814,30771909,H1904,基因工程重组人腺病毒六邻体蛋白疫苗的基础研究,曲章义,哈尔滨医科大学,24.0,2008-01至2010-12
2007,面上项目,A01,3815,60772005,F010507,交流永磁同步电动机伺服系统自适应逆控制策略研究,曲永印,北华大学,24.0,2008-01至2010-12
2007,面上项目,A01,3816,50774005,E0416,高导热DCC材料近净形成形的相关基础问题,曲选辉,北京科技大学,32.0,2008-01至2010-12
2007,面上项目,A01,3817,40773022,D0303,西藏冈底斯碰撞造山带两套碰撞后埃达克岩的岩浆源区及其相关深部过程研究,曲晓明,中国地质科学院矿产资源研究所,41.0,2008-01至2010-12
2007,面上项目,A01,3818,60773173,F020601,汉语隐喻理解关键技术研究,曲维光,南京师范大学,30.0,2008-01至2010-12
2007,面上项目,A01,3819,70772015,G0202,企业文化内部传播渠道有效性实证研究,曲庆,清华大学,21.0,2008-01至2010-12
2007,面上项目,A01,3820,10771169,A011703,传统数值算法及其现代应用价值研究,曲安京,西北大学,25.0,2008-01至2010-12
2007,面上项目,A01,3821,60773161,F020201,Web服务编排与协作的形式化模型,裘宗燕,北京大学,29.0,2008-01至2010-12
2007,面上项目,A01,3822,10771195,A010503,Ramanujan模方程与拟共形映射的交叉研究及其应用,裘松良,浙江理工大学,18.0,2008-01至2009-12
2007,面上项目,A01,3823,20771041,B0102,类分子筛金属有机骨架化合物的结构与功能研究,裘式纶,吉林大学,28.0,2008-01至2010-12
2007,面上项目,A01,3824,50775110,E050301,能量自给的半主动振动控制系统的研究,裘进浩,南京航空航天大学,38.0,2008-01至2010-12
2007,面上项目,A01,3825,20774013,B030704,生物基高分子材料的多层次结构与性能的基础研究,邱兆斌,北京化工大学,32.0,2008-01至2010-12
2007,面上项目,A01,3826,20776161,B0804,热致相分离法制备新型亲水性中空纤维膜及膜性能研究,邱运仁,中南大学,27.0,2008-01至2010-12
2007,面上项目,A01,3827,40771183,D071303,碳黑吸附三丁基锡的行为、机理及环境调控研究,邱宇平,浙江工业大学,34.0,2008-01至2010-12
2007,面上项目,A01,3828,30770150,C020301,东亚特有濒危植物黄山梅亲缘地理与保护遗传学研究,邱英雄,浙江大学,30.0,2008-01至2010-12
2007,面上项目,A01,3829,30772470,H1614,non B-Ig的特征性结构在肿瘤发生及肿瘤生物治疗中的意义,邱晓彦,北京大学,31.0,2008-01至2010-12
2007,面上项目,A01,3830,30772196,H0606,利用“PGE2缓释-HHK套管”研究细胞去分化在骨缺损修复中的作用,邱小忠,南方医科大学,28.0,2008-01至2010-12
2007,面上项目,A01,3831,30770613,H1808,1H-MRS监测鼻咽癌及其放疗后脑损伤区域的代谢分子影像研究,邱士军,南方医科大学,30.0,2008-01至2010-12
2007,面上项目,A01,3832,30772636,H3002,中药升麻中的抗肿瘤活性评估及构效关系,邱明华,中国科学院昆明植物研究所,32.0,2008-01至2010-12
2007,面上项目,A01,3833,30772789,H2806,基于代谢网络变化的复方丹参滴丸整体疗效评价方法的研究,邱明丰,上海交通大学,24.0,2008-01至2010-12
2007,面上项目,A01,3834,50775066,E050501,多气氛共存下金属摩擦表面的自适应耦合机制研究,邱明,河南科技大学,32.0,2008-01至2010-12
2007,面上项目,A01,3835,50776076,E060105,高频大功率回热制冷机理研究,邱利民,浙江大学,32.0,2008-01至2010-12
2007,面上项目,A01,3836,70773060,G0306,银行业跨国并购与我国金融安全的理论与对策研究,邱立成,南开大学,22.0,2008-01至2010-12
2007,面上项目,A01,3837,30771457,C140602,昆虫病原线虫共生菌的分类与生物学特性研究,邱礼鸿,中山大学,30.0,2008-01至2010-12
2007,面上项目,A01,3838,50772017,E020603,功能性碳包覆纳米磁性金属材料的合成、结构控制及其吸附脱硫性能,邱介山,大连理工大学,37.0,2008-01至2010-12
2007,面上项目,A01,3839,60778039,F050903,Ni离子掺杂微晶玻璃光纤的宽带光放大特性,邱建荣,浙江大学,7.0,2008-01至2008-12
2007,面上项目,A01,3840,50772045,E020201,基于稀土离子价态空间选择性操控的超高密度三维光存储的研究,邱建备,昆明理工大学,32.0,2008-01至2010-12
2007,面上项目,A01,3841,40772036,D0204,大别－苏鲁造山带片麻状A型花岗岩成因及其对Rodinia超大陆裂解的启示,邱检生,南京大学,44.0,2008-01至2010-12
2007,面上项目,A01,3842,40772080,D0207,松辽盆地深层天然气田Ar-Ar成藏年龄研究,邱华宁,中国科学院广州地球化学研究所,42.0,2008-01至2010-12
2007,面上项目,A01,3843,40771037,D0702,半干旱区退耕草地的水分收支研究,邱国玉,北京大学,38.0,2008-01至2010-12
2007,面上项目,A01,3844,30772191,H0609,退行性脊柱侧凸（DS）的比较蛋白质组学研究,邱贵兴,中国医学科学院,25.0,2008-01至2010-12
2007,面上项目,A01,3845,30771320,C130401,北方杂交粳稻遗传基础与杂种优势关联性研究,邱福林,辽宁省农业科学院,25.0,2008-01至2010-12
2007,面上项目,A01,3846,10771174,A010501,复流形上的分析及其应用,邱春晖,厦门大学,28.0,2008-01至2010-12
2007,面上项目,A01,3847,50775106,E0505,超声微塑变热锻调控高能束熔覆层开裂行为与磨损特性,邱长军,南华大学,33.0,2008-01至2010-12
2007,面上项目,A01,3848,40772031,D0203,凹凸棒石/γFe2O3/C纳米复合、吸附和磁分离及再生研究,庆承松,合肥工业大学,13.0,2008-01至2008-12
2007,面上项目,A01,3849,30771972,C080101,免疫效应因子对肿瘤内血管新生的调节机制,秦志海,中国科学院生物物理研究所,40.0,2008-01至2010-12
2007,面上项目,A01,3850,30772560,H3101,自噬参与神经兴奋性毒性的机制及药物干预,秦正红,苏州大学,30.0,2008-01至2010-12
2007,面上项目,A01,3851,20772083,B0103,具有四氢吡咯并吲哚骨架的吲哚生物碱的全合成研究,秦勇,四川大学,30.0,2008-01至2010-12
2007,面上项目,A01,3852,30770436,C050201,蛋白质翻译过程中的重要因子LepA的功能,秦燕,中国科学院生物物理研究所,32.0,2008-01至2010-12
2007,面上项目,A01,3853,30772759,H2808,逍遥散抗应激性抑郁症作用机制的代谢组学研究,秦雪梅,山西大学,32.0,2008-01至2010-12
2007,面上项目,A01,3854,70771018,G0117,提升信贷资产风险管理效率的CDO运作机理研究,秦学志,大连理工大学,18.5,2008-01至2010-12
2007,面上项目,A01,3855,30770762,H0906,RGMa在缺血性脑损伤及其神经再生和康复中的作用机制研究,秦新月,重庆医科大学,32.0,2008-01至2010-12
2007,面上项目,A01,3856,10774145,A040104,掺杂beta-Zn4Sb3热电输运性质及其与beta-alpha相转变关联性研究,秦晓英,中国科学院合肥物质科学研究院,44.0,2008-01至2010-12
2007,面上项目,A01,3857,40772212,D0705,中晚更新世以来东亚陆地碳循环与粉尘气溶胶的全球效应,秦小光,中国科学院地质与地球物理研究所,43.0,2008-01至2010-12
2007,面上项目,A01,3858,50775186,E050702,仿生关节驱动机理与实现研究,秦现生,西北工业大学,32.0,2008-01至2010-12
2007,面上项目,A01,3859,10771155,A010704,耦合非线性振子系的动力学与随机共振,秦文新,苏州大学,18.0,2008-01至2010-12
2007,面上项目,A01,3860,20775008,B040104,纳米材料用于蛋白质在线萃取及毛细管电泳分离研究,秦卫东,北京师范大学,28.0,2008-01至2010-12
2007,面上项目,A01,3861,40776058,D0607,检测海水重金属污染物的低检出限聚合物膜离子选择性电极技术研究,秦伟,中国科学院烟台海岸带研究所,40.0,2008-01至2010-12
2007,面上项目,A01,3862,30772350,H1204,硫酸软骨素在视皮层可塑性被抑制后再激活中的作用机制,秦伟,中国人民解放军第三军医大学,29.0,2008-01至2010-12
2007,面上项目,A01,3863,20772085,B030604,钛配合物催化苯甲醛不对称氰化反应的模拟研究,秦松,四川大学,30.0,2008-01至2010-12
2007,面上项目,A01,3864,30772127,H1617,人胆囊癌SP细胞的分离、鉴定和其免疫原性耐药相关蛋白靶点的探索,秦仁义,华中科技大学,30.0,2008-01至2010-12
2007,面上项目,A01,3865,40771148,D0106,基于多维光谱特征空间的农田干旱信息提取,秦其明,北京大学,40.0,2008-01至2010-12
2007,面上项目,A01,3866,60771027,F010807,脑磁感应断层成像关键技术研究,秦明新,中国人民解放军第四军医大学,28.0,2008-01至2010-12
2007,面上项目,A01,3867,30772783,H2808,蔓荆子活性物质群抗PMS的整合作用机制,秦路平,中国人民解放军第二军医大学,30.0,2008-01至2010-12
2007,面上项目,A01,3868,30771808,H2603,乳清蛋白改善胰岛素抵抗的机制研究,秦立强,苏州大学,27.0,2008-01至2010-12
2007,面上项目,A01,3869,40772066,D0205,冈底斯驱龙斑岩铜钼矿的岩浆侵位序列、流体演化与巨量金属富集机理,秦克章,中国科学院地质与地球物理研究所,45.0,2008-01至2010-12
2007,面上项目,A01,3870,60773144,F0205,第二代小波及其在信息安全和数据压缩中的应用技术研究,秦开怀,清华大学,30.0,2008-01至2010-12
2007,面上项目,A01,3871,20772094,B010307,具有高载流子迁移率的金属有机簇合物的分子设计、合成、结构与性能,秦金贵,武汉大学,28.0,2008-01至2010-12
2007,面上项目,A01,3872,40773081,D0708,西藏雅鲁藏布江流域盆地陆地化学风化研究,秦建华,中国地质调查局成都地质调查中心,14.0,2008-01至2008-12
2007,面上项目,A01,3873,30772633,H3002,亚麻根肝保护活性的药效物质基础和作用机理研究,秦海林,中国医学科学院,8.0,2008-01至2008-12
2007,面上项目,A01,3874,30770107,C010803,登革1型病毒广州分离株基因组3'非编码区差异对病毒复制的影响,秦鄂德,中国人民解放军军事科学院军事医学研究院,30.0,2008-01至2010-12
2007,面上项目,A01,3875,10771049,A010501,Clifford分析理论与高维空间的偏微分方程,乔玉英,河北师范大学,24.0,2008-01至2010-12
2007,面上项目,A01,3876,50775221,E050501,微纳孔FeS/微纳粒子固体润滑复合层研制及摩擦学行为研究,乔玉林,中国人民解放军陆军装甲兵学院,32.0,2008-01至2010-12
2007,面上项目,A01,3877,40774014,D0401,塔里木盆地与南天山褶皱带的现今构造活动的GPS和InSAR研究,乔学军,中国地震局地震研究所,43.0,2008-01至2010-12
2007,面上项目,A01,3878,60774091,F030119,多传感器混合多模型状态估计的误差相关性分析及其融合算法研究,乔向东,中国人民解放军空军工程大学,22.0,2008-01至2010-12
2007,面上项目,A01,3879,30770097,C010803,IFP35蛋白抗泡沫病毒作用机制的研究,乔文涛,南开大学,30.0,2008-01至2010-12
2007,面上项目,A01,3880,50772089,E020302,C/SiCN材料的高温热稳定性和力学性能,乔生儒,西北工业大学,30.0,2008-01至2010-12
2007,面上项目,A01,3881,30771621,C1802,缺氧诱导因子与肉鸡腹水综合征肺动脉重塑的关系研究,乔健,中国农业大学,32.0,2008-01至2010-12
2007,面上项目,A01,3882,30772706,H2707,胃俞、中脘不同治疗特点与迷走神经背核GABA和NMDA受体的关系,乔海法,山东中医药大学,30.0,2008-01至2010-12
2007,面上项目,A01,3883,50772086,E020302,能够后期硬化处理的Si3N4/BN/Al(Ti)复相可加工陶瓷及其原位反应的动力学调控,乔冠军,西安交通大学,32.0,2008-01至2010-12
2007,面上项目,A01,3884,30771050,H0904,纹状体对运动性中枢疲劳的调控作用及其机制研究,乔德才,北京师范大学,30.0,2008-01至2010-12
2007,面上项目,A01,3885,30771312,C130410,播娘蒿CBF和COR抗寒基因结构及表达与其抗寒性,乔代蓉,四川大学,28.0,2008-01至2010-12
2007,面上项目,A01,3886,10775179,A050202,重强子物理研究,乔从丰,中国科学院大学,30.0,2008-01至2010-12
2007,面上项目,A01,3887,30771875,H1907,蚊虫杀虫药剂抗性分子机制的研究,乔传令,中国科学院动物研究所,30.0,2008-01至2010-12
2007,面上项目,A01,3888,10772010,A020501,旁路搭桥转流术治疗DeBakey Ⅲ型主动脉夹层的数值模拟研究,乔爱科,北京工业大学,32.0,2008-01至2010-12
2007,面上项目,A01,3889,30770092,C010701,双生病毒卫星DNA启动子的鉴定及其功能研究,钱亚娟,浙江大学,30.0,2008-01至2010-12
2007,面上项目,A01,3890,30771693,C1604,聚苯胺和聚吡咯在植物纤维上的原位沉积特征及逾渗行为,钱学仁,东北林业大学,28.0,2008-01至2010-12
2007,面上项目,A01,3891,30771401,C140103,野油菜黄单胞菌新双组分信号转导系统VgrS/VgrR的调控机理,钱韦,中国科学院微生物研究所,35.0,2008-01至2010-12
2007,面上项目,A01,3892,70773103,G0306,区域金融结构与产业集聚互动机制研究——以长三角地区为例,钱水土,浙江工商大学,20.0,2008-01至2010-12
2007,面上项目,A01,3893,30770774,H0923,注意缺陷多动障碍相关功能基因交互作用的研究,钱秋谨,北京大学,29.0,2008-01至2010-12
2007,面上项目,A01,3894,10774113,A040503,高分辨率的扫描探针声显微镜,钱梦騄,同济大学,55.0,2008-01至2010-12
2007,面上项目,A01,3895,30770843,H0203,TR3在应激致心肌细胞损伤线粒体机制中的作用及其分子基础,钱令嘉,中国人民解放军军事科学院军事医学研究院,30.0,2008-01至2010-12
2007,面上项目,A01,3896,50773062,E031001,新型蜂窝状仿生神经支架构建及多因子联合引导轴突再生机制,钱军民,西安交通大学,32.0,2008-01至2010-12
2007,面上项目,A01,3897,30772685,H2701,脾虚大鼠中枢细胞因子受体基因表达与JAK/STAT通路调节及中药干预研究,钱会南,北京中医药大学,29.0,2008-01至2010-12
2007,面上项目,A01,3898,40772160,D0703,地下水混合作用的水文地球化学效应研究,钱会,长安大学,38.0,2008-01至2010-12
2007,面上项目,A01,3899,40772171,D0704,不同结构体系抗震性能对比的研究,钱德玲,合肥工业大学,41.0,2008-01至2010-12
2007,面上项目,A01,3900,30771864,H2401,地方性氟中毒病区农民生存质量及其影响因素研究,钱聪,中国医科大学,25.0,2008-01至2010-12
2007,面上项目,A01,3901,40771033,D010102,基于生态适宜度理论的淮河流域农业气候风险评估,千怀遂,广州大学,32.0,2008-01至2010-12
2007,面上项目,A01,3902,70773032,G030902,东北老工业基地高新技术产业与装备制造业协调发展研究,綦良群,哈尔滨理工大学,20.0,2008-01至2010-12
2007,面上项目,A01,3903,50777064,E0713,基于欧拉滑动平均预测模型的分布式发电系统快速储能控制方法研究,齐智平,中国科学院电工研究所,34.0,2008-01至2010-12
