year,grant,sub,num,id,subject,title,author,school,money,dueration
2005,面上项目,A01,1599,50572053,E021102,非匀质化合物磁性半导体的自旋极化和电子输运,颜世申,山东大学,27.0,2006-01至2008-12
2005,面上项目,A01,1600,30570226,C040301,转Bt基因水稻对土壤动物的安全性评价及其机理,颜亨梅,湖南师范大学,24.0,2006-01至2008-12
2005,面上项目,A01,1601,30570485,C1004,胃肠道动力和生理参数无创检测技术及胃肠功能数字化研究,颜国正,上海交通大学,27.0,2006-01至2008-12
2005,面上项目,A01,1602,30572159,H1611,NRP2介导Sema3F信号对大肠癌淋巴管生成及其转移的影响,阎晓初,中国人民解放军第三军医大学,25.0,2006-01至2008-12
2005,面上项目,A01,1603,50575045,E050901,微光学非球面电磁流变液即效亚毫米微磨头研抛加工研究,阎秋生,广东工业大学,28.0,2006-01至2008-12
2005,面上项目,A01,1604,50578161,E080801,带组合连梁混合筒体抗震性能与设计研究,阎奇武,中南大学,26.0,2006-01至2008-12
2005,面上项目,A01,1605,50575221,E0506,新型联合收割机数字化设计新技术研究及其系统设计,阎楚良,中国农业机械化科学研究院,32.0,2006-01至2008-12
2005,面上项目,A01,1606,50574042,E041603,电场作用下金属-陶瓷熔体的燃烧合成及凝固过程的研究,严有为,华中科技大学,24.0,2006-01至2008-12
2005,面上项目,A01,1607,30571384,C180502,动物源大肠杆菌O157中VT2噬菌体的整合位点、vt2基因和侧翼序列、噬菌斑形成等分子遗传特征,严亚贤,上海交通大学,26.0,2006-01至2008-12
2005,面上项目,A01,1608,30571443,C190204,坛紫菜单性生殖机理和单性育种学研究,严兴洪,上海海洋大学,25.0,2006-01至2008-12
2005,面上项目,A01,1609,50575167,E050501,滑动磨损表面与磨粒形态映射关系的研究,严新平,武汉理工大学,26.0,2006-01至2008-12
2005,面上项目,A01,1610,30570499,C1002,纳米陶瓷与纳米活性钛的界面有效性与安全性评价,严伟祺,浙江大学,27.0,2006-01至2008-12
2005,面上项目,A01,1611,70572016,G0201,中国西部矿产资源开发利用路径协调机理研究,严良,中国地质大学（武汉）,16.0,2006-01至2008-12
2005,面上项目,A01,1612,30572423,H2719,手法干预对促进大鼠骨骼肌急性损伤后恢复的作用机理研究,严隽陶,上海中医药大学,23.0,2006-01至2008-12
2005,面上项目,A01,1613,30572080,H0912,CNTF非经典信号转导通路中主要构成单元的探索,严进,中国人民解放军第二军医大学,25.0,2006-01至2008-12
2005,面上项目,A01,1614,30570092,C010603,问号钩端螺旋体诱导不同细胞凋亡的主要分子途径及凋亡相关信号传导通路的调控机制,严杰,浙江大学,27.0,2006-01至2008-12
2005,面上项目,A01,1615,10571167,A011002,金融与保险数学,严加安,中国科学院数学与系统科学研究院,25.0,2006-01至2008-12
2005,面上项目,A01,1616,60576012,F040103,异质外延生长p型镧铜氧硫化物透明半导体薄膜的衬底及其特性研究,严辉,北京工业大学,24.0,2006-01至2008-12
2005,面上项目,A01,1617,60574062,F030210,基于知识网的知识化制造系统自重构优化研究,严洪森,东南大学,22.0,2006-01至2008-12
2005,面上项目,A01,1618,30570532,H1802,肝纤维化的高场强(3.0T)MR功能影像学的实验和临床应用研究,严福华,复旦大学,26.0,2006-01至2008-12
2005,面上项目,A01,1619,50577016,E070101,基于全局变量的新型电磁场数值计算方法－有限公式方法及其应用研究,严登俊,河海大学,9.0,2006-01至2006-12
2005,面上项目,A01,1620,20574085,B040612,高分子耗尽效应的自洽场理论研究,严大东,中国科学院化学研究所,26.0,2006-01至2008-12
2005,面上项目,A01,1621,50571105,E011101,污染因素作用下AZ91镁合金薄液膜腐蚀的电化学机理,严川伟,中国科学院金属研究所,32.0,2006-01至2008-12
2005,面上项目,A01,1622,30571856,H1619,凋亡抑制蛋白XIAP在肾癌细胞抗凋亡机制中作用的研究,闫勇,首都医科大学,25.0,2006-01至2008-12
2005,面上项目,A01,1623,30572463,H2720,苗药蜘蛛香治疗肠易激综合征（IBS）的物质基础及作用机理研究,闫兴丽,北京中医药大学,27.0,2006-01至2008-12
2005,面上项目,A01,1624,30571487,C160703,城市森林对多环芳烃环境行为的干扰机理研究,闫文德,中南林业科技大学,30.0,2006-01至2008-12
2005,面上项目,A01,1625,60574092,F0303,低电压驱动集成微流控生物芯片的研究,闫卫平,大连理工大学,27.0,2006-01至2008-12
2005,面上项目,A01,1626,50573018,E030102,单一主催化剂多米诺催化乙烯共聚合成LLDPE研究,闫卫东,河北工业大学,27.0,2006-01至2008-12
2005,面上项目,A01,1627,20574079,B0307,表面诱导的聚合物链各向异性排列过程的原位研究,闫寿科,中国科学院化学研究所,27.0,2006-01至2008-12
2005,面上项目,A01,1628,30571244,C140601,抑制黄曲霉毒素产生的细菌生物活性物质与作用机理,闫培生,哈尔滨工业大学,28.0,2006-01至2008-12
2005,面上项目,A01,1629,10572027,A020409,风沙运动的散体动力学模型及其动力学过程研究,闫民,北京林业大学,36.0,2006-01至2008-12
2005,面上项目,A01,1630,10571025,A0110,分数布朗运动的随机分析及其金融上的一些应用,闫理坦,东华大学,16.0,2006-01至2008-12
2005,面上项目,A01,1631,50575057,E050803,振动作用下液态合金对SiCp/Al流变冲击、扩散-复合连接机理,闫久春,哈尔滨工业大学,27.0,2006-01至2008-12
2005,面上项目,A01,1632,30570038,C010201,烷基醚的微生物降解及其代谢途径研究,闫建平,中国科学院武汉病毒研究所,30.0,2006-01至2008-12
2005,面上项目,A01,1633,30571723,H1008,自身免疫性肝炎抗原特异性T细胞表位研究,闫惠平,首都医科大学,25.0,2006-01至2008-12
2005,面上项目,A01,1634,40574035,D0405,利用卫星重力、测高和海洋资料研究海平面对大气压变化的响应,闫昊明,中国科学院测量与地球物理研究所,35.0,2006-01至2008-12
2005,面上项目,A01,1635,50575001,E051201,体硅微机械惯性传感器与CMOS电路单芯片集成技术研究,闫桂珍,北京大学,27.0,2006-01至2008-12
2005,面上项目,A01,1636,30571219,C1402,唾液成分在烟粉虱B生物型寄主适应中的作用,闫凤鸣,北京大学,25.0,2006-01至2008-12
2005,面上项目,A01,1637,30571029,H0905,溶酶体酸性水解酶基因表达与神经退行性疾病发病的分子遗传学研究,闫波,济宁医学院,8.0,2006-01至2006-12
2005,面上项目,A01,1638,20577029,B060101,应用组合化学和高通量筛选技术开发新型特效饮用水除砷剂,闫兵,山东大学,10.0,2006-01至2006-12
2005,面上项目,A01,1639,60577034,F050304,基于偏振保持光子晶体光纤的光纤陀螺研制,延凤平,北京交通大学,22.0,2006-01至2008-12
2005,面上项目,A01,1640,50574061,E0407,理想充填理论与保护油气层暂堵新方法研究,鄢捷年,中国石油大学（北京）,26.0,2006-01至2008-12
2005,面上项目,A01,1641,60573184,F020603,非母语写作水平计算机自动评测技术研究,荀恩东,北京语言大学,5.0,2006-01至2006-12
2005,面上项目,A01,1642,30571876,H0609,自然衍发基质运载Spemann期信息MSCs投递偶联因子防治PMOP骨折的研究,雪原,天津医科大学,8.0,2006-01至2006-12
2005,面上项目,A01,1643,30571830,H1623,长效可诱导Herceptin抗体与白介素12共表达空壳载体治疗Her-2阳性腺癌的研究,薛绪潮,中国人民解放军第二军医大学,25.0,2006-01至2008-12
2005,面上项目,A01,1644,10571035,A010603,泛函空间与微分包含及其相关问题,薛小平,哈尔滨工业大学,24.0,2006-01至2008-12
2005,面上项目,A01,1645,20572104,B010301,有机锌试剂的扩环和碳链延长反应研究,薛松,天津理工大学,26.0,2006-01至2008-12
2005,面上项目,A01,1646,30571790,H0906,DNA损伤修复与MAPK通路在脑缺血再灌注损伤中的作用机制,薛荣亮,西安交通大学,27.0,2006-01至2008-12
2005,面上项目,A01,1647,30571146,C130401,水稻假基因数据库的构建及其基因的分子进化研究,薛庆中,浙江大学,26.0,2006-01至2008-12
2005,面上项目,A01,1648,10571008,A011103,一类新的带噪声变量的半参数回归模型研究,薛留根,北京工业大学,24.0,2006-01至2008-12
2005,面上项目,A01,1649,10575020,A050101,Yangian的量子代数扩展、物理实现和在量子物理模型中的应用,薛康,东北师范大学,26.0,2006-01至2008-12
2005,面上项目,A01,1650,30570295,C0305,三峡水库主要支流库湾浮游动物对水库水利调度和库湾水动力过程的生态响应,薛俊增,上海海洋大学,28.0,2006-01至2008-12
2005,面上项目,A01,1651,10571031,A011705,信用风险定量分析中的Markov链计算,薛军工,复旦大学,18.0,2006-01至2008-12
2005,面上项目,A01,1652,60573080,F020201,基于PAR方法和PAR平台的泛型程序设计关键技术研究,薛锦云,江西师范大学,24.0,2006-01至2008-12
2005,面上项目,A01,1653,30570262,C040601,改良可逆性大脑中动脉闭塞脑缺血家兔模型的建立,宣芸,首都医科大学,23.0,2006-01至2008-12
2005,面上项目,A01,1654,20577008,B060104,酸雨地区重金属复合污染控制标准的估计模型研究,许中坚,湖南科技大学,27.0,2006-01至2008-12
2005,面上项目,A01,1655,30570158,C020408,生长素极性运输在水稻生长发育中的作用,许智宏,中国科学院上海生命科学研究院,35.0,2006-01至2008-12
2005,面上项目,A01,1656,30570624,H0905,S0X1和MASH1基因在骨髓间充质干细胞定向神经分化中的作用研究,许予明,郑州大学,8.0,2006-01至2006-12
2005,面上项目,A01,1657,40571025,D0702,东南沿海中小流域城市化水文效应研究,许有鹏,南京大学,40.0,2006-01至2008-12
2005,面上项目,A01,1658,10572130,A020405,应用微观渗流技术提高燃料电池输出功率的研究,许友生,浙江师范大学,32.0,2006-01至2008-12
2005,面上项目,A01,1659,30571276,C150204,西瓜抗枯萎病基因精细定位与FOM-1候选基因的克隆,许勇,北京市农林科学院,27.0,2006-01至2008-12
2005,面上项目,A01,1660,20572132,B070102,草珊瑚中倍半萜类抗肿瘤有效成分的基础研究,许旭东,中国医学科学院,26.0,2006-01至2008-12
2005,面上项目,A01,1661,30570371,C050201,NFBD1在DNA损伤依赖型细胞周期检验点中的作用,许兴智,首都师范大学,30.0,2006-01至2008-12
2005,面上项目,A01,1662,60575036,F0305,基于多信息融合的复杂工业过程广义知识模型与优化控制,许晓鸣,上海交通大学,23.0,2006-01至2008-12
2005,面上项目,A01,1663,10574085,A040208,3d过渡金属掺杂ZnO稀磁半导体薄膜的制备与磁性,许小红,山西师范大学,12.0,2006-01至2006-12
2005,面上项目,A01,1664,40575029,D0506,梅雨锋切变线上强MCS的爆发和持续机理研究,许小峰,中国气象局武汉暴雨研究所,34.0,2006-01至2008-12
2005,面上项目,A01,1665,30571707,C08,重症肌无力的发病机制和治疗策略研究,许贤豪,北京医院,26.0,2006-01至2008-12
2005,面上项目,A01,1666,20576111,B0802,功率超声对声悬浮热质传递过程的影响研究,许文林,扬州大学,26.0,2006-01至2008-12
2005,面上项目,A01,1667,20576088,B080403,旋转带蒸馏基础研究,许松林,天津大学,26.0,2006-01至2008-12
2005,面上项目,A01,1668,40571006,D010105,中国沿海城市自然灾害风险评估体系研究,许世远,华东师范大学,48.0,2006-01至2008-12
2005,面上项目,A01,1669,60572106,F0102,水声通信中的OFDM技术关键问题研究及DSP实现,许茹,厦门大学,25.0,2006-01至2008-12
2005,面上项目,A01,1670,30571854,H1619,雄激素受体敲除对小鼠前列腺癌模型肿瘤发生及发展的影响,许清泉,北京大学,26.0,2006-01至2008-12
2005,面上项目,A01,1671,40571166,D0712,中国北方季风气候区典型内陆湖泊花粉源区面积、花粉沉积动力和花粉沉积通量研究,许清海,河北师范大学,43.0,2006-01至2008-12
2005,面上项目,A01,1672,50574025,E041503,熔盐电脱氧制备稀土合金过程机理和强化反应的研究,许茜,东北大学,25.0,2006-01至2008-12
2005,面上项目,A01,1673,40576074,D0609,紫菜属海藻性别及其决定机制的研究,许璞,常熟理工学院,34.0,2006-01至2008-12
2005,面上项目,A01,1674,30571760,H1006,胚胎胰腺干细胞和成人胰岛联合移植治疗1型糖尿病的实验研究,许评,青岛大学,24.0,2006-01至2008-12
2005,面上项目,A01,1675,20577031,B0602,鞘氨醇菌生物降解二芳基醚类物质机理研究,许平,山东大学,26.0,2006-01至2008-12
2005,面上项目,A01,1676,20572039,B010305,天然产物Nikkomycin Bz的全合成研究,许鹏飞,兰州大学,35.0,2006-01至2008-12
2005,面上项目,A01,1677,30572420,H2718,脑缺血后突触重建与胶质细胞相关性及针刺干预作用研究,许能贵,广州中医药大学,26.0,2006-01至2008-12
2005,面上项目,A01,1678,30571458,C1603,秸秆纤维与废弃塑料熔融复合工艺学原理的研究,许民,东北林业大学,26.0,2006-01至2008-12
2005,面上项目,A01,1679,50574044,E0416,超晶格薄膜晶界组装及力学性能异常机理研究,许俊华,江苏科技大学,23.0,2006-01至2008-12
2005,面上项目,A01,1680,30570477,C1004,晚发抑郁患者情绪与认知共同情景激活下的ERP溯源与脑功能动态分析,许晶,大连医科大学,28.0,2006-01至2008-12
2005,面上项目,A01,1681,50574108,E04,循环载荷作用下周期充水岩石变形的损伤演化规律,许江,重庆大学,26.0,2006-01至2008-12
2005,面上项目,A01,1682,20576037,B080703,新型药物合成用酶的定向筛选及其催化性能研究,许建和,华东理工大学,30.0,2006-01至2008-12
2005,面上项目,A01,1683,70572081,G0201,中国企业国际化进程中风险的识别机制、测度指标与管理控制研究,许晖,南开大学,16.0,2006-01至2008-12
2005,面上项目,A01,1684,40574011,D0401,东北亚地区地壳运动与构造亚板块分区,许厚泽,中国科学院测量与地球物理研究所,56.0,2006-01至2008-12
2005,面上项目,A01,1685,30571570,H2603,糖尿病早期视网膜Muller细胞改变及牛磺酸的防护效应,许红霞,中国人民解放军第三军医大学,22.0,2006-01至2008-12
2005,面上项目,A01,1686,30572025,H1301,树突细胞介导变应性鼻炎的分子免疫机制及CpG干预,许庚,中山大学,25.0,2006-01至2008-12
2005,面上项目,A01,1687,20575079,B0404,基于核酸适体的生物传感界面及其与蛋白质相互作用的研究,许丹科,中国人民解放军军事科学院军事医学研究院,26.0,2006-01至2008-12
2005,面上项目,A01,1688,40574006,D0401,中国大陆西部地区活动地块、断层运动的大地测量反演研究,许才军,武汉大学,35.0,2006-01至2008-12
2005,面上项目,A01,1689,50576047,E060404,分层稀薄燃烧LPG液态喷射发动机混合气形成的理论和实验研究,许伯彦,山东建筑大学,27.0,2006-01至2008-12
2005,面上项目,A01,1690,30570442,C050601,稳态强磁场对哺乳动物细胞周期检点的影响,许安,中国科学院合肥物质科学研究院,26.0,2006-01至2008-12
2005,面上项目,A01,1691,50579003,E0901,渭河流域分布式土壤侵蚀模型与水沙变异规律,徐宗学,北京师范大学,28.0,2006-01至2008-12
2005,面上项目,A01,1692,60575045,F030504,关于支撑向量回归机的模型选择问题,徐宗本,西安交通大学,24.0,2006-01至2008-12
2005,面上项目,A01,1693,30570915,C07,胎儿中枢胆碱能系统对心肾调控的动态发育：尼古丁对胎儿与出生后个体的影响,徐智策,苏州大学,24.0,2006-01至2008-12
2005,面上项目,A01,1694,30571848,H0210,人细胞外基质包被猪去细胞瓣膜支架组织工程心脏瓣膜研究,徐志云,中国人民解放军第二军医大学,26.0,2006-01至2008-12
2005,面上项目,A01,1695,50576009,E0603,材料表面能对污垢诱导期影响机理的研究,徐志明,东北电力大学,27.0,2006-01至2008-12
2005,面上项目,A01,1696,30571847,H0115,生物材料人工胸壁的实验研究,徐志飞,中国人民解放军第二军医大学,25.0,2006-01至2008-12
2005,面上项目,A01,1697,60577047,F05,新型结构RGB彩色象素机理研究,徐之海,浙江大学,20.0,2006-01至2008-12
2005,面上项目,A01,1698,20571040,B0102,新颖空心超结构的构筑、结构和性能,徐正,南京大学,22.0,2006-01至2008-12
2005,面上项目,A01,1699,60576016,F040104,几种激发方式中有机量子阱的性质,徐征,北京交通大学,26.0,2006-01至2008-12
2005,面上项目,A01,1700,30572382,H2708,双黄升白冲剂对荷瘤鼠化疗骨髓抑制期细胞周期的调控,徐振晔,上海市中医药研究院,25.0,2006-01至2008-12
2005,面上项目,A01,1701,40576010,D0601,源致内波研究,徐肇廷,中国海洋大学,40.0,2006-01至2008-12
2005,面上项目,A01,1702,30570943,C0702,参与植物筛管分子细胞分化的蛋白酶的分离纯化及其基因克隆与表达分析,徐增富,中山大学,24.0,2006-01至2008-12
2005,面上项目,A01,1703,70571087,G0103,基于不完全语言信息的交互式群决策理论及应用,徐泽水,中国人民解放军理工大学,17.0,2006-01至2008-12
2005,面上项目,A01,1704,40572159,D0704,滑坡灾害孕育过程中的水－岩化学作用机理,徐则民,昆明理工大学,40.0,2006-01至2008-12
2005,面上项目,A01,1705,10572029,A020501,中药防治动脉搭桥术后血管内膜增生的血液流变学和血流动力学机理研究,徐在品,贵州大学,36.0,2006-01至2008-12
2005,面上项目,A01,1706,10572012,A020305,先进复合材料格栅结构的力学行为分析、验证与设计研究,徐元铭,北京航空航天大学,38.0,2006-01至2008-12
2005,面上项目,A01,1707,30571721,C0807,抗原提呈脂质重组载体的免疫活性研究,徐宇虹,上海交通大学,26.0,2006-01至2008-12
2005,面上项目,A01,1708,50573091,E031001,肝组织工程材料与目标细胞间相互作用的生物学机制研究,徐迎新,中国人民解放军总医院,25.0,2006-01至2008-12
2005,面上项目,A01,1709,40571032,D010104,季节冻土层与人工冻结壁相互作用机制,徐学燕,哈尔滨工业大学,31.0,2006-01至2008-12
2005,面上项目,A01,1710,30570022,C010302,固氮蓝细菌Anabaena异形胞发育过程中的基因调控网络,徐旭东,中国科学院水生生物研究所,26.0,2006-01至2008-12
2005,面上项目,A01,1711,20573089,B020103,全氟烃分解反应催化剂的研究,徐秀峰,烟台大学,25.0,2006-01至2008-12
2005,面上项目,A01,1712,40572131,D0211,滇西斑岩岩浆停歇、再运移与成矿,徐兴旺,中国科学院地质与地球物理研究所,10.0,2006-01至2006-12
2005,面上项目,A01,1713,30572055,H1406,Nmnat1基因修饰Schwann细胞修复面神经损伤的实验研究,徐欣,山东大学,8.0,2006-01至2006-12
2005,面上项目,A01,1714,20572055,B070505,基于化感物质愈创木内酯为先导设计合成新作用机制除草剂,徐效华,南开大学,26.0,2006-01至2008-12
2005,面上项目,A01,1715,50575042,E051103,基于局部基准的大型舰船统一姿态基准系统关键技术研究,徐晓苏,东南大学,26.0,2006-01至2008-12
2005,面上项目,A01,1716,50577030,E0701,永磁体阵列强自场作用下的磁化状态研究,徐小农,南京大学,23.0,2006-01至2008-12
2005,面上项目,A01,1717,20571069,B0702,蛇毒内凝血因子IX/凝血因子X结合蛋白的研究(II),徐小龙,中国科学技术大学,25.0,2006-01至2008-12
2005,面上项目,A01,1718,30571023,H0803,中国汉族人β珠蛋白基因簇单核苷酸多态性与抗疟优势选择的关系,徐湘民,南方医科大学,23.0,2006-01至2008-12
2005,面上项目,A01,1719,50578087,E080101,非标准建筑形体的生成与建造途径研究,徐卫国,清华大学,25.0,2006-01至2008-12
2005,面上项目,A01,1720,20572113,B010307,环状大pi-共轭分子的合成及性质研究,徐伟,中国科学院化学研究所,26.0,2006-01至2008-12
2005,面上项目,A01,1721,20576130,B0804,荷电杂化前体溶胶－凝胶反应机理研究及成膜形态结构调控,徐铜文,中国科学技术大学,30.0,2006-01至2008-12
2005,面上项目,A01,1722,10571007,A011705,有限元模型修正的方法和理论,徐树方,北京大学,15.0,2006-01至2007-12
2005,面上项目,A01,1723,30570271,C030301,低温条件下高山离子芥NO信号传导及其对铁蛋白代谢的影响,徐世健,兰州大学,8.0,2006-01至2006-12
2005,面上项目,A01,1724,50576006,E060105,变质量能量转换及储存技术中能质转换及传递规律研究,徐士鸣,大连理工大学,26.0,2006-01至2008-12
2005,面上项目,A01,1725,10572136,A020601,自由活塞驱动气炮研制及高速弹丸斜入水现象研究,徐胜利,中国科学技术大学,41.0,2006-01至2008-12
2005,面上项目,A01,1726,20574036,B0104,含二茂铁单体的活性聚合研究,徐善生,南开大学,26.0,2006-01至2008-12
2005,面上项目,A01,1727,10573002,A0305,各种脉冲星类天体辐射与本质的研究,徐仁新,北京大学,31.0,2006-01至2008-12
2005,面上项目,A01,1728,40571076,D070103,可变电荷土壤带相反电荷的胶体颗粒表面双电层的相互作用,徐仁扣,中国科学院南京土壤研究所,41.0,2006-01至2008-12
2005,面上项目,A01,1729,60576032,F040602,亚50纳米金属栅体硅多栅CMOS器件及关键技术研究,徐秋霞,中国科学院微电子研究所,26.0,2006-01至2008-12
2005,面上项目,A01,1730,50572079,E020401,离子取代对La2NiO4+δ混合导电特性的影响及其机理研究,徐庆,武汉理工大学,30.0,2006-01至2008-12
2005,面上项目,A01,1731,70573063,G041301,基于产业链与物流网络运作机理的区域物流协同理论研究,徐青青,清华大学,17.0,2006-01至2008-12
2005,面上项目,A01,1732,30570550,H1610,辐射致癌相关基因hHBrk1在肿瘤浸润转移中的功能研究,徐勤枝,中国人民解放军军事科学院军事医学研究院,25.0,2006-01至2008-12
2005,面上项目,A01,1733,20572043,B070102,落新妇苷类似物的合成、选择性免疫抑制活性及其先导物优化,徐强,南京大学,26.0,2006-01至2008-12
2005,面上项目,A01,1734,40572055,D0205,现代和古代海底热液矿床黄铁矿中微量元素组成和变化的对比研究,徐启东,中国地质大学（武汉）,35.0,2006-01至2008-12
2005,面上项目,A01,1735,20572006,B070501,蛋白酶体抑制剂的设计、合成及优化,徐萍,北京大学,8.0,2006-01至2006-12
2005,面上项目,A01,1736,30570645,H0912,Nurr1-c对多巴胺代谢的分子调控机制研究,徐评议,中山大学,26.0,2006-01至2008-12
2005,面上项目,A01,1737,50572100,E0209,SiC异构多型体薄膜的SSMBE制备及其结构的同步辐射表征,徐彭寿,中国科学技术大学,27.0,2006-01至2008-12
2005,面上项目,A01,1738,60572015,F010501,三维集成电路的布图规划/布局算法研究,徐宁,武汉理工大学,24.0,2006-01至2008-12
2005,面上项目,A01,1739,30572331,H2903,一氧化氮对药用植物细胞次生代谢产物合成的调控作用及其信号转导机理研究,徐茂军,浙江工商大学,26.0,2006-01至2008-12
2005,面上项目,A01,1740,30570706,H0907,GABA转运蛋白1对T细胞介导的炎症反应和自身免疫病的影响,徐凌云,上海交通大学,25.0,2006-01至2008-12
2005,面上项目,A01,1741,10574069,A040410,在光场受限下强荧光半导体量子点光激射的研究,徐岭,南京大学,32.0,2006-01至2008-12
2005,面上项目,A01,1742,50578159,E080601,基于模糊控制理论的筋土界面参数测试方法与计算模型合理选择研究,徐林荣,中南大学,28.0,2006-01至2008-12
2005,面上项目,A01,1743,30571740,H1008,SLE合并自身免疫性血小板减少发病机理的研究,徐亮,皖南医学院,25.0,2006-01至2008-12
2005,面上项目,A01,1744,20572114,B0103,基于双活化协同作用的高效手性催化体系应用于不对称催化反应的研究,徐利文,中国科学院兰州化学物理研究所,26.0,2006-01至2008-12
2005,面上项目,A01,1745,20573019,B0204,分立外电场诱导的界面可控电化学生长与纳米间隙电极的制备研究,徐丽娜,东南大学,26.0,2006-01至2008-12
2005,面上项目,A01,1746,30571515,C161002,栓皮栎cpDNA系统地理学研究,徐立安,南京林业大学,28.0,2006-01至2008-12
2005,面上项目,A01,1747,40576072,D0609,近岸海域底栖纤毛虫原生动物的生物多样性与生态学研究,徐奎栋,中国科学院海洋研究所,38.0,2006-01至2008-12
2005,面上项目,A01,1748,30570820,H0317,TGF-β3对实验性肝纤维化的影响,徐可树,华中科技大学,25.0,2006-01至2008-12
2005,面上项目,A01,1749,30571745,H1005,炭疽毒素中和性表位及其在毒素致病与免疫中的意义,徐俊杰,中国人民解放军军事科学院军事医学研究院,27.0,2006-01至2008-12
2005,面上项目,A01,1750,10571027,A010704,Gevrey光滑系统的研究和KAM理论应用,徐君祥,东南大学,22.0,2006-01至2008-12
2005,面上项目,A01,1751,60576022,F040601,ULSI低介电常数CNx薄膜制备及其介电性能的研究,徐军,大连理工大学,25.0,2006-01至2008-12
2005,面上项目,A01,1752,40572066,D0205,阿尔泰山南缘造山型金矿床的CO2流体及其成矿作用,徐九华,北京科技大学,10.0,2006-01至2006-12
2005,面上项目,A01,1753,60576021,F040601,小尺寸超薄叠层高k栅介质Si/Ge MOSFET研究,徐静平,华中科技大学,7.0,2006-01至2006-12
2005,面上项目,A01,1754,20575029,B0402,生物体系中非电活性物质的微流控芯片电化学检测研究,徐静娟,南京大学,30.0,2006-01至2008-12
2005,面上项目,A01,1755,30571243,C140601,灰霉病生防细菌抗菌蛋白及其分子遗传基础研究,徐敬友,扬州大学,22.0,2006-01至2008-12
2005,面上项目,A01,1756,30572316,H2803,中药复方“芍药甘草汤”活性成分的单克隆抗体制备及剔除分析法的建立,徐金森,厦门大学,28.0,2006-01至2008-12
