year,grant,sub,num,id,subject,title,author,school,money,dueration
2005,面上项目,A01,5110,50575208,E050901,非一致曲率接触变形下的磨粒场形态与模具曲面的气囊抛光机理研究,计时鸣,浙江工业大学,26.0,2006-01至2008-12
2005,面上项目,A01,5111,70572104,G021101,集装箱多式联运系统协调调度问题研究,计明军,大连海事大学,17.0,2006-01至2008-12
2005,面上项目,A01,5112,20571089,B0702,"金属核酸酶的功能模拟:设计,合成,作用机制及应用探索",计亮年,中山大学,40.0,2006-01至2008-12
2005,面上项目,A01,5113,20572125,B0306,Gemins类化合物簇集和解簇集行为的研究,计国桢,中国科学院上海有机化学研究所,26.0,2006-01至2008-12
2005,面上项目,A01,5114,30571353,C170108,粘细菌解毒肽对饲料黄曲霉毒素的解毒作用机理研究,计成,中国农业大学,27.0,2006-01至2008-12
2005,面上项目,A01,5115,10571114,A010602,非交换Lp-空间及其在解析算子代数中的应用,吉国兴,陕西师范大学,15.0,2006-01至2007-12
2005,面上项目,A01,5116,30570086,C010803,树突状细胞Toll样受体对丙型肝炎病毒单链RNA分子的感受及信号转导,姬新颖,中国人民解放军第四军医大学,26.0,2006-01至2008-12
2005,面上项目,A01,5117,60576069,F040103,非晶态碲镉汞薄膜制备与光电特性研究,姬荣斌,昆明物理研究所,15.0,2006-01至2008-12
2005,面上项目,A01,5118,60572064,F010402,中国海常见浮游植物种类细胞图像识别,姬光荣,中国海洋大学,26.0,2006-01至2008-12
2005,面上项目,A01,5119,30572358,H2811,桂皮醛和芍药苷对细胞骨架β-actin表达及构型重建的影响,霍海如,中国中医科学院中药研究所,27.0,2006-01至2008-12
2005,面上项目,A01,5120,70573109,G0414,信息化领导力的行为模式、范式与理论体系研究,霍国庆,中国科学院大学,19.0,2006-01至2008-12
2005,面上项目,A01,5121,70573030,G0306,上市公司信息披露与资本成本研究,惠晓峰,哈尔滨工业大学,16.0,2006-01至2008-12
2005,面上项目,A01,5122,50576070,E060405,含氧混合燃料发动机燃烧规律及相关基础性研究,黄佐华,西安交通大学,28.0,2006-01至2008-12
2005,面上项目,A01,5123,20571018,B070205,细胞色素P450催化活性区域的结构改造及新催化反应的探索,黄仲贤,复旦大学,26.0,2006-01至2008-12
2005,面上项目,A01,5124,10574040,A040206,铜氧化物和钴氧化物超导体的数值研究,黄忠兵,湖北大学,10.0,2006-01至2006-12
2005,面上项目,A01,5125,50578019,E080701,非均衡城市交通规划理论与方法的研究,黄中祥,长沙理工大学,30.0,2006-01至2008-12
2005,面上项目,A01,5126,40573036,D0305,川-滇-黔铅锌成矿域成矿年代学研究,黄智龙,中国科学院地球化学研究所,36.0,2006-01至2008-12
2005,面上项目,A01,5127,20572042,B0103,新型手性含硫、硒或碲配体和催化剂的合成及其在不对称催化反应中应用的研究,黄志真,南京大学,26.0,2006-01至2008-12
2005,面上项目,A01,5128,10571065,A011002,白噪声泛函与广义算子的理论及应用,黄志远,华中科技大学,29.0,2006-01至2008-12
2005,面上项目,A01,5129,50576084,E060603,气液两相流流量测量新方法研究,黄志尧,浙江大学,27.0,2006-01至2008-12
2005,面上项目,A01,5130,20572112,B010307,基于杯芳烃的索烃和轮烷组装体研究,黄志镗,中国科学院化学研究所,40.0,2006-01至2008-12
2005,面上项目,A01,5131,30570581,C0904,下丘脑睡眠觉醒调节的分子机制,黄志力,复旦大学,24.0,2006-01至2008-12
2005,面上项目,A01,5132,10571134,A011201,对称锥上最优化问题的牛顿型算法设计与分析,黄正海,天津大学,22.0,2006-01至2008-12
2005,面上项目,A01,5133,60573178,F020507,离散三维实体集合的包含性结构与逆向参数化,黄正东,华中科技大学,21.0,2006-01至2008-12
2005,面上项目,A01,5134,30570281,C030301,鄂尔多斯沙化草地两种沙丘禾草种子和幼苗阶段的适应对策,黄振英,中国科学院植物研究所,24.0,2006-01至2008-12
2005,面上项目,A01,5135,30571573,H2603,ER等位基因代表型农村产妇骨密度自我恢复和补钙效果的观察,黄振武,中国疾病预防控制中心营养与健康所,25.0,2006-01至2008-12
2005,面上项目,A01,5136,50575197,E050101,运动链新拓扑理论和对应有特点的数据库建立机理研究,黄真,燕山大学,25.0,2006-01至2008-12
2005,面上项目,A01,5137,60577042,F050301,混沌光通信技术,黄肇明,上海大学,22.0,2006-01至2008-12
2005,面上项目,A01,5138,30570871,H0505,BMP-7基因修饰骨髓成体干细胞移植治疗IgA肾病的实验研究,黄云剑,中国人民解放军第三军医大学,6.0,2006-01至2006-12
2005,面上项目,A01,5139,20576136,B080704,亚基疫苗颗粒在液-固相界面的解聚和多尺度分布研究,黄永东,中国科学院过程工程研究所,25.0,2006-01至2008-12
2005,面上项目,A01,5140,50575104,E050902,喷射电沉积法快速制备成型泡沫金属新方法的探索,黄因慧,南京航空航天大学,25.0,2006-01至2008-12
2005,面上项目,A01,5141,30571861,H1619,缺氧诱导因子(HIF)亚型在国人家族性与散发性肾透明细胞癌中的生物学功能研究,黄翼然,上海交通大学,28.0,2006-01至2008-12
2005,面上项目,A01,5142,40576037,D0604,基于210Po/210Pb不平衡的POC输出通量的研究,黄奕普,厦门大学,45.0,2006-01至2008-12
2005,面上项目,A01,5143,30570654,H0923,儿童破坏性行为障碍病因学机制的双生子研究,黄颐,四川大学,27.0,2006-01至2008-12
2005,面上项目,A01,5144,50576089,E060303,利用纵向涡发生器强化窄间隙矩形通道内单相和沸腾传热,黄彦平,中国核动力研究设计院,27.0,2006-01至2008-12
2005,面上项目,A01,5145,40576049,D0606,海洋用钢在海洋大气中的环境致脆机制与氢渗透行为,黄彦良,中国科学院海洋研究所,32.0,2006-01至2008-12
2005,面上项目,A01,5146,20576055,B081104,一步法氧气直接氧化苯制苯酚的膜催化剂研究,黄彦,南京工业大学,26.0,2006-01至2008-12
2005,面上项目,A01,5147,30572153,H1609,获得性TRAIL基因耐药的机制及其逆转策略,黄学锋,浙江大学,25.0,2006-01至2008-12
2005,面上项目,A01,5148,30571489,C1608,生态环境功能再生产与生态公益林可持续经营关系研究,黄选瑞,河北农业大学,24.0,2006-01至2008-12
2005,面上项目,A01,5149,30570088,C010603,伤寒沙门菌z66鞭毛抗原表达调节机制研究,黄新祥,江苏大学,25.0,2006-01至2008-12
2005,面上项目,A01,5150,30572103,H1614,新的食管癌相关基因的寻找及其功能分析,黄晓平,中山大学,8.0,2006-01至2006-12
2005,面上项目,A01,5151,70572088,G021101,电子市场环境中供应链合同模型研究,黄小原,东北大学,19.0,2006-01至2008-12
2005,面上项目,A01,5152,40573015,D0303,华北克拉通南缘TTG片麻岩地球化学特征及早前寒武纪地壳演化,黄小龙,中国科学院广州地球化学研究所,37.0,2006-01至2008-12
2005,面上项目,A01,5153,70573079,G030601,资本充足性约束下银行风险偏好和行为调整研究,黄宪,武汉大学,18.0,2006-01至2008-12
2005,面上项目,A01,5154,20577027,B0602,新型固定化微生物燃料电池及其污水净化与产电特性,黄霞,清华大学,28.0,2006-01至2008-12
2005,面上项目,A01,5155,30572339,H2811,丹参与柴胡复方质量控制成分的药理学基础,黄熙,中南大学,30.0,2006-01至2008-12
2005,面上项目,A01,5156,30570014,C010202,介质调控白腐菌胞外过氧化物酶降解酚型木素研究,黄锡荣,山东大学,35.0,2006-01至2008-12
2005,面上项目,A01,5157,40572090,D0208,内蒙古二连-海拉尔盆地群中煤-锗矿床的成矿模式研究,黄文辉,中国地质大学（北京）,42.0,2006-01至2008-12
2005,面上项目,A01,5158,50572069,E020201,含层叠纳米晶的超高速光开关碲酸盐玻璃研究,黄文旵,同济大学,27.0,2006-01至2008-12
2005,面上项目,A01,5159,50575103,E051201,压电型直线电机驱动的二自由度纳米定位平台及定位技术,黄卫清,南京航空航天大学,25.0,2006-01至2008-12
2005,面上项目,A01,5160,20576046,B0807,面包面团体系表面分子胶粘性形成的机理及关键因素,黄卫宁,江南大学,24.0,2006-01至2008-12
2005,面上项目,A01,5161,20574012,B0502,用于制备稀土聚合物电致发光器件的UV引发逐层自组装技术的探索,黄维,南京邮电大学,25.0,2006-01至2008-12
2005,面上项目,A01,5162,30571798,H1622,Wnt信号途径与乳腺干细胞自我更新及乳腺癌发生的关系,黄韬,华中科技大学,8.0,2006-01至2006-12
2005,面上项目,A01,5163,60573126,F0208,自主服务保障的中间件研究：模型及关键技术,黄涛,中国科学院软件研究所,24.0,2006-01至2008-12
2005,面上项目,A01,5164,50576028,E060601,高温高压和超临界条件下流体物性预测的分子模拟,黄素逸,华中科技大学,25.0,2006-01至2008-12
2005,面上项目,A01,5165,30572357,H2809,当归补血汤对ox-LDL激活NF-κB信号转导通路的作用研究,黄水清,广州中医药大学,8.0,2006-01至2006-12
2005,面上项目,A01,5166,30572124,H1605,TCR基因转染记忆性T细胞打破肿瘤免疫耐受的研究,黄树林,广东药科大学,26.0,2006-01至2008-12
2005,面上项目,A01,5167,50575074,E050803,三电弧共熔池GMAW焊熔池动态行为的数值模拟及电弧协同控制的研究,黄石生,华南理工大学,30.0,2006-01至2008-12
2005,面上项目,A01,5168,30571201,C1307,花生种子EST及贮藏蛋白和抗性基因分子克隆,黄上志,中山大学,26.0,2006-01至2008-12
2005,面上项目,A01,5169,10573031,A0303,相接双星中的物理过程研究,黄润乾,中国科学院云南天文台,30.0,2006-01至2008-12
2005,面上项目,A01,5170,40575026,D0506,北半球大气准定常行星波的年际年代际变化及其与东亚季风的关系研究,黄荣辉,中国科学院大气物理研究所,45.0,2006-01至2008-12
2005,面上项目,A01,5171,20571062,B010205,烃的氯气燃烧法制备氯化富勒烯,黄荣彬,厦门大学,28.0,2006-01至2008-12
2005,面上项目,A01,5172,40571028,D0702,洞庭湖泥沙淤积的动力学研究,黄群,中国科学院南京地理与湖泊研究所,40.0,2006-01至2008-12
2005,面上项目,A01,5173,50575155,E050502,多物体接触边界元法研究低速重载轧机油膜轴承润滑机理与延寿技术,黄庆学,太原科技大学,27.0,2006-01至2008-12
2005,面上项目,A01,5174,50574074,E0409,浅埋煤层地表隔水层的采动隔水性研究,黄庆享,西安科技大学,24.0,2006-01至2008-12
2005,面上项目,A01,5175,40571084,D070104,土壤矿物与细菌相互作用的热力学研究,黄巧云,华中农业大学,45.0,2006-01至2008-12
2005,面上项目,A01,5176,30570406,C050203,蛋白质激酶结构的功能相关运动及其对酶活性的调节机制,黄强,复旦大学,22.0,2006-01至2008-12
2005,面上项目,A01,5177,20574003,B0104,兼具自由基活性聚合与配位聚合特征的聚合物的合成方法和性能研究,黄启谷,北京化工大学,26.0,2006-01至2008-12
2005,面上项目,A01,5178,20572088,B010305,特特拉姆酸类天然产物的不对称合成研究,黄培强,厦门大学,40.0,2006-01至2008-12
2005,面上项目,A01,5179,40571018,D010101,地表沙尘释放过程以及沙尘暴发生机制的研究,黄宁,兰州大学,37.0,2006-01至2008-12
2005,面上项目,A01,5180,30572231,H3111,应用TPMT表型及基因型指导硫嘌呤类药物的临床使用,黄民,中山大学,28.0,2006-01至2008-12
2005,面上项目,A01,5181,50579051,E090701,基于材料状态相关临界状态理论的土坡渐进破坏分析,黄茂松,同济大学,8.0,2006-01至2006-12
2005,面上项目,A01,5182,60573171,F020513,保护私有信息的若干计算几何问题及其应用研究,黄刘生,中国科学技术大学,5.0,2006-01至2006-12
2005,面上项目,A01,5183,40576062,D0609,海洋底栖甲藻的垂直移动及其调控机制研究,黄凌风,厦门大学,34.0,2006-01至2008-12
2005,面上项目,A01,5184,40576052,D0608,近岸珊瑚礁海域生态系统碳收支及调控机制,黄良民,中国科学院南海海洋研究所,40.0,2006-01至2008-12
2005,面上项目,A01,5185,70571016,G0114,中国企业信息系统采用与内化的理论模型及实证研究,黄丽华,复旦大学,17.5,2006-01至2008-12
2005,面上项目,A01,5186,60571027,F010807,温室植物电信号与环境因子关系的研究,黄岚,中国农业大学,22.0,2006-01至2008-12
2005,面上项目,A01,5187,30570960,C0709,抑癌因子Merlin及其相互作用蛋白的功能与调控机理研究,黄来强,清华大学,26.0,2006-01至2008-12
2005,面上项目,A01,5188,60574057,F030120,高性能并行分布式仿真支撑环境研究,黄柯棣,中国人民解放军国防科技大学,25.0,2006-01至2008-12
2005,面上项目,A01,5189,20574010,B010401,星型杂臂ABC嵌段共聚物合成中的机理转换新方法研究,黄骏廉,复旦大学,26.0,2006-01至2008-12
2005,面上项目,A01,5190,40572098,D0711,长江中游洞穴石笋古植被记录及其对季风变化的响应,黄俊华,中国地质大学（武汉）,38.0,2006-01至2008-12
2005,面上项目,A01,5191,30570407,C050203,调控端粒酶催化亚基hTERT核仁定位的机制及其在抗肿瘤中的意义,黄君健,中国人民解放军军事科学院军事医学研究院,25.0,2006-01至2008-12
2005,面上项目,A01,5192,30570979,C1110,从血液供应改变角度探讨节细胞易损性差异的机制,黄菊芳,中南大学,28.0,2006-01至2008-12
2005,面上项目,A01,5193,40571115,D0106,基于生长模型的水稻冠层高光谱模拟模型研究,黄敬峰,浙江大学,35.0,2006-01至2008-12
2005,面上项目,A01,5194,60573071,F020508,基于超声的早期乳腺癌计算机辅助诊断关键技术研究,黄剑华,哈尔滨工业大学,5.0,2006-01至2006-12
2005,面上项目,A01,5195,10575086,A050408,2-嘧啶氧基-N-芳基苄胺类衍生物的除草作用机制研究,黄建中,浙江大学,30.0,2006-01至2008-12
2005,面上项目,A01,5196,40575036,D0507,跨季度预报的相似-动力方法研究,黄建平,兰州大学,46.0,2006-01至2008-12
2005,面上项目,A01,5197,60572102,F010408,基于认知信息论的遥感影像识别,黄建军,深圳大学,23.0,2006-01至2008-12
2005,面上项目,A01,5198,20571065,B030601,特殊形貌碳酸钙生长机理的计算机模拟,黄建花,浙江理工大学,8.0,2006-01至2006-12
2005,面上项目,A01,5199,60572098,F0102,正交多载波复合调制高速远程水声通信新方法研究,黄建国,西北工业大学,25.0,2006-01至2008-12
2005,面上项目,A01,5200,20573006,B0203,若干两亲分子及其混合体系中囊泡形成与转化的规律性研究,黄建滨,北京大学,28.0,2006-01至2008-12
2005,面上项目,A01,5201,30572129,H1608,胃癌血清蛋白诊断模型的优化、新相关蛋白的鉴定及生物学特性分析,黄建,浙江大学,25.0,2006-01至2008-12
2005,面上项目,A01,5202,30572128,H1608,人肝癌转移特异性标志物的筛选及验证,黄坚,中国人民解放军军事科学院军事医学研究院,25.0,2006-01至2008-12
2005,面上项目,A01,5203,30570131,C020401,新蛋白GIP1影响叶绿体发育及其功能稳定的机理,黄继荣,中国科学院上海生命科学研究院,30.0,2006-01至2008-12
2005,面上项目,A01,5204,60576018,F040106,面向高性能光电子器件制备的半导体晶片低温键合新途径、新技术的研究,黄辉,北京邮电大学,20.0,2006-01至2008-12
2005,面上项目,A01,5205,50576036,E060303,水平温度梯度作用下双层流体剪切层内局部扰动的规律及其磁场主动控制,黄护林,南京航空航天大学,27.0,2006-01至2008-12
2005,面上项目,A01,5206,50576017,E060202,考虑相变的高效冷却涡轮流动及传热机理研究,黄洪雁,哈尔滨工业大学,27.0,2006-01至2008-12
2005,面上项目,A01,5207,30570941,C0702,一个新的TRF1结合蛋白TRF1BP1的功能及对细胞周期调控机制的研究,黄河,浙江大学,8.0,2006-01至2006-12
2005,面上项目,A01,5208,30571894,H0606,Dmp-1对间充质干细胞向成骨细胞分化的影响及机制研究,黄海洋,中国人民解放军第三军医大学,27.0,2006-01至2008-12
2005,面上项目,A01,5209,10572020,A020307,极端环境下碳基复合材料应力剥蚀的非线性研究,黄海明,北京交通大学,36.0,2006-01至2008-12
2005,面上项目,A01,5210,50578006,E080701,基于活动的停车换乘问题建模理论与优化研究,黄海军,北京航空航天大学,28.0,2006-01至2008-12
2005,面上项目,A01,5211,30570851,H0503,结缔组织生长因子促进肾脏成肌纤维细胞生成的分子机理研究,黄海长,北京大学,28.0,2006-01至2008-12
2005,面上项目,A01,5212,30571563,H2603,叶酸对神经干细胞增殖分化调控机制的研究,黄国伟,天津医科大学,26.0,2006-01至2008-12
2005,面上项目,A01,5213,50576034,E060201,叶尖间隙对微叶栅内流的影响机理与叶尖逆向涡控研究,黄国平,南京航空航天大学,25.0,2006-01至2008-12
2005,面上项目,A01,5214,30571726,H1008,调节性T细胞在强直性脊柱炎中的功能缺陷及其分子机制研究,黄烽,中国人民解放军总医院,30.0,2006-01至2008-12
2005,面上项目,A01,5215,30571905,H0906,脑出血后血红蛋白和铁离子在迟发性脑水肿形成中的机制：多聚（腺苷二磷酸－核糖）聚合酶-1(PARP-1)的作用,黄峰平,复旦大学,27.0,2006-01至2008-12
2005,面上项目,A01,5216,30570064,C010802,乙肝病毒X蛋白增强HBV复制的功能区和分子机理研究,黄飞骏,四川大学,24.0,2006-01至2008-12
2005,面上项目,A01,5217,30570633,H0912,信号接头蛋白CIN85在帕金森病中的作用研究,黄芳,复旦大学,8.0,2006-01至2006-12
2005,面上项目,A01,5218,30570130,C020401,涉入藻类产氢过程的蛋白质分子鉴定及其功能研究,黄芳,中国科学院植物研究所,28.0,2006-01至2008-12
2005,面上项目,A01,5219,30572034,H1404,牙髓细胞类型识别受体对pg分子识别机制及信号传递通路,黄定明,四川大学,27.0,2006-01至2008-12
2005,面上项目,A01,5220,50576049,E060203,涡轮泵内的三维非定常空化机理与能量转化特性的研究,黄典贵,中国科学院工程热物理研究所,28.0,2006-01至2008-12
2005,面上项目,A01,5221,70572089,G0205,激励与风险和管理者行为偏差的关系,黄登仕,西南交通大学,19.0,2006-01至2008-12
2005,面上项目,A01,5222,60577007,F0501,基于有源微环谐振腔的无损光信息缓存,黄德修,华中科技大学,24.0,2006-01至2008-12
2005,面上项目,A01,5223,60574072,F030212,复杂生产过程基于微粒群的优化调度理论与方法研究,黄德先,清华大学,23.0,2006-01至2008-12
2005,面上项目,A01,5224,30570368,C050201,蛋白质远程同源检测中的核方法研究,黄德双,中国科学院合肥物质科学研究院,20.0,2006-01至2008-12
2005,面上项目,A01,5225,30570970,C120105,多胚跳小蜂胚胎发育过程差异表达基因的克隆和表达,黄大卫,中国科学院动物研究所,24.0,2006-01至2008-12
2005,面上项目,A01,5226,50574030,E0419,生态化利用鞍山铁尾矿反应合成SiC/氧化物多孔复合材料的应用基础研究,黄大威,东北大学,25.0,2006-01至2008-12
2005,面上项目,A01,5227,60572007,F010902,LiTaO3薄膜红紫外线智能火焰探测器关键技术研究,黄大贵,电子科技大学,24.0,2006-01至2008-12
2005,面上项目,A01,5228,40571154,D071404,黄河中游古代都市迁移发展与环境变迁互动关系研究,黄春长,陕西师范大学,42.0,2006-01至2008-12
2005,面上项目,A01,5229,30571863,H0512,肾移植慢性排斥的免疫自稳干预及机制研究,黄赤兵,中国人民解放军第三军医大学,27.0,2006-01至2008-12
2005,面上项目,A01,5230,30570465,C1004,生物微粒的光学信息解析及其分析应用研究,黄承志,西南大学,30.0,2006-01至2008-12
2005,面上项目,A01,5231,30571559,H2603,维生素A、E、叶酸与盐亭食管癌关系研究,黄承钰,四川大学,25.0,2006-01至2008-12
2005,面上项目,A01,5232,50578027,E080504,钢管自应力免振混凝土结构设计理论研究,黄承逵,大连理工大学,26.0,2006-01至2008-12
2005,面上项目,A01,5233,50572098,E0203,不连续金属塑性相（Fe/Mo）复合耐高温气固两相流冲蚀磨损Sialon基材料的基础研究,黄朝晖,中国地质大学（北京）,27.0,2006-01至2008-12
2005,面上项目,A01,5234,40574069,D0410,并行计算在空间天气数值预报研究中的应用,黄朝晖,中国科学院国家空间科学中心,36.0,2006-01至2008-12
2005,面上项目,A01,5235,30570904,C07,食管癌相关基因-2（ECRG-2)对肿瘤转移的影响及其机理,黄常志,中国医学科学院,8.0,2006-01至2006-12
2005,面上项目,A01,5236,60573190,F020104,基于DNA计算平台上的遗传算法模型研究与探索,黄布毅,郑州轻工业学院,21.0,2006-01至2008-12
2005,面上项目,A01,5237,30571065,C0606,重组EpoAB肽－NGF模拟肽融合蛋白的体外表达和其作用机制的研究,黄秉仁,中国医学科学院,30.0,2006-01至2008-12
2005,面上项目,A01,5238,40576055,D0608,典型赤潮生物高亲和磷转运系统及其调控机理研究,黄邦钦,厦门大学,43.0,2006-01至2008-12
2005,面上项目,A01,5239,30571698,C080101,染色质重塑和可逆乙酰化修饰在白细胞介素5（IL-5）基因转录调控中的作用机制研究,黄百渠,东北师范大学,28.0,2006-01至2008-12
2005,面上项目,A01,5240,50576099,E0603,微/纳尺度超急速爆发沸腾研究,淮秀兰,中国科学院工程热物理研究所,28.0,2006-01至2008-12
2005,面上项目,A01,5241,30570167,C020601,云南金平苗族瑶族傣族自治县集市贸易中非木材林产品的民族植物学研究,淮虎银,扬州大学,24.0,2006-01至2008-12
2005,面上项目,A01,5242,70571073,G0102,面向柔性的供应链设计与协调方法及其应用研究,华中生,中国科学技术大学,17.0,2006-01至2008-12
2005,面上项目,A01,5243,60576038,F040108,实现有机电致发光固态照明光源的某些关键问题研究,华玉林,天津理工大学,21.0,2006-01至2008-12
2005,面上项目,A01,5244,30571519,C161003,竹子鞭芽发育基因调控的新研究模型建立及其实例分析,华锡奇,浙江省林业科学研究院,18.0,2006-01至2008-12
2005,面上项目,A01,5245,20573061,B0201,抗氧抗水催化剂体系的探索与研究,华瑞茂,清华大学,30.0,2006-01至2008-12
2005,面上项目,A01,5246,40572057,D0205,赣南与陆壳重熔型花岗岩类有关典型矿床成矿过程的壳-幔相互作用,华仁民,南京大学,38.0,2006-01至2008-12
2005,面上项目,A01,5247,70573044,G04,基于信息联结市场上的价格发现：理论与实证研究,华仁海,南京财经大学,17.0,2006-01至2008-12
2005,面上项目,A01,5248,40572015,D0201,新元古代末期动物骨骼化起源及其环境背景研究,华洪,西北大学,38.0,2006-01至2008-12
2005,面上项目,A01,5249,10575055,A050105,具有吸收态的非平衡相变与临界行为的普适性研究,华达银,宁波大学,26.0,2006-01至2008-12
2005,面上项目,A01,5250,30571379,C180501,以犬腺病毒为基础的抗原表位展示技术的建立及相关特征研究,扈荣良,中国人民解放军军事科学院军事医学研究院,29.0,2006-01至2008-12
2005,面上项目,A01,5251,50579056,E090801,溢－渗流条件下土石过水围堰护面与垫层的耦合作用,胡志根,武汉大学,27.0,2006-01至2008-12
2005,面上项目,A01,5252,20577055,B060104,硫素在水稻根际微环境中化学行为对水稻吸收重金属影响机理,胡正义,中国科学院南京土壤研究所,26.0,2006-01至2008-12
2005,面上项目,A01,5253,10572104,A020205,复合材料空间可展结构柔性多体系统动力学研究,胡振东,同济大学,30.0,2006-01至2008-12
2005,面上项目,A01,5254,30570921,C07,促乳素和消炎痛抑制大鼠和小鼠排卵的信号通路和分子机制的研究,胡召元,中国科学院动物研究所,24.0,2006-01至2008-12
2005,面上项目,A01,5255,60578028,F050902,K2Al2B2O7晶体的266nm高转换效率紫外光输出研究,胡章贵,中国科学院理化技术研究所,23.0,2006-01至2008-12
2005,面上项目,A01,5256,30571884,H0604,具有高效、稳定骨诱导活性的新型融合蛋白的研究,胡蕴玉,中国人民解放军第四军医大学,26.0,2006-01至2008-12
2005,面上项目,A01,5257,30570047,C010202,不同能源培养的氧化亚铁硫杆菌比较蛋白质组学研究,胡岳华,中南大学,8.0,2006-01至2006-12
2005,面上项目,A01,5258,60573115,F0208,无线传感器网络传输控制协议研究,胡月明,华南农业大学,24.0,2006-01至2008-12
2005,面上项目,A01,5259,30570068,C010802,菜青虫野田村病毒的分子特征及基因组结构研究,胡远扬,武汉大学,28.0,2006-01至2008-12
2005,面上项目,A01,5260,30571360,C1806,分子修饰提高中药多糖的生物活性和作用机理研究,胡元亮,南京农业大学,28.0,2006-01至2008-12
2005,面上项目,A01,5261,30570774,H0811,凝血因子Ⅶ－L蛋白纳米粒靶向介导decoy基因干预血栓前状态的实验研究,胡豫,华中科技大学,27.0,2006-01至2008-12
2005,面上项目,A01,5262,50577032,E0713,应用于风力发电的定子双绕组异步电机发电关键技术研究,胡育文,南京航空航天大学,28.0,2006-01至2008-12
2005,面上项目,A01,5263,20576073,B0801,柴油耦合深度脱硫新技术及相关基础研究,胡玉峰,中国石油大学（北京）,23.0,2006-01至2008-12
2005,面上项目,A01,5264,30572277,H3004,能结合beta-内酰胺酶的多肽串联表达和抑制活性的研究,胡又佳,上海医药工业研究院,20.0,2006-01至2008-12
2005,面上项目,A01,5265,50575087,E0510,面向制造系统的高可靠性柔性可重构自组织E－诊断关键技术研究,胡友民,华中科技大学,26.0,2006-01至2008-12
2005,面上项目,A01,5266,30572239,H3001,茚酮类AChE抑制剂的设计、合成与构效关系研究,胡永洲,浙江大学,23.0,2006-01至2008-12
