year,grant,sub,num,id,subject,title,author,school,money,dueration
2007,面上项目,A01,5794,30772709,H2803,多蕊蛇菰降血糖活性成分的研究,吉腾飞,中国医学科学院,30.0,2008-01至2010-12
2007,面上项目,A01,5795,30770451,C050201,C-反应蛋白跨血管内皮细胞的净单向转运机制研究,吉尚戎,兰州大学,35.0,2008-01至2010-12
2007,面上项目,A01,5796,60772027,F010206,时域相位OCDMA系统的编码理论与方法研究,吉建华,深圳大学,22.0,2008-01至2010-12
2007,面上项目,A01,5797,30771667,C190401,多不饱和脂肪酸对草鱼脂肪细胞发育的影响及其分子机理的研究,吉红,西北农林科技大学,30.0,2008-01至2010-12
2007,面上项目,A01,5798,60774033,F030203,植物多聚腺苷化位点的特征提取与建模识别研究,吉国力,厦门大学,28.0,2008-01至2010-12
2007,面上项目,A01,5799,40771163,D010701,面向GML的空间聚类分析与异常检测方法研究,吉根林,南京师范大学,12.0,2008-01至2008-12
2007,面上项目,A01,5800,30770520,C050404,钙释放受体调节蛋白敲除对β-细胞胰岛素分泌的影响及机制研究,姬广聚,中国科学院生物物理研究所,32.0,2008-01至2010-12
2007,面上项目,A01,5801,60773011,F020601,信息检索中的文本重排技术研究,姬东鸿,武汉大学,29.0,2008-01至2010-12
2007,面上项目,A01,5802,30770652,H2201,PTEN对抗氧化防御蛋白的调控及其在DNA损伤修复中的作用,霍艳英,中国人民解放军军事科学院军事医学研究院,33.0,2008-01至2010-12
2007,面上项目,A01,5803,50778036,E080402,酞酸酯废水生物处理的菌种筛选及降解机理研究,霍明昕,东北师范大学,36.0,2008-01至2010-12
2007,面上项目,A01,5804,50778069,E080503,钢管混凝土柱在高温（火灾）下及火灾后的抗冲击性能,霍静思,湖南大学,30.0,2008-01至2010-12
2007,面上项目,A01,5805,70772077,G021101,制造业入厂物流利益分配机制研究,霍佳震,同济大学,22.0,2008-01至2010-12
2007,面上项目,A01,5806,70773028,G0306,基于非线性相互预测的金融危机传染机制研究,惠晓峰,哈尔滨工业大学,20.0,2008-01至2010-12
2007,面上项目,A01,5807,70773096,G0308,农业企业汇率风险反应行为与应对策略研究,黄祖辉,浙江大学,21.0,2008-01至2010-12
2007,面上项目,A01,5808,20774017,B0502,具有光电特性的共轭聚合物与n型纳米粒子复合纳米纤维的研制,黄宗浩,东北师范大学,28.0,2008-01至2010-12
2007,面上项目,A01,5809,20772020,B010702,淀粉样多肽与神经生长抑制因子、血红素等的相互作以用以及其神经毒性的机理研究,黄仲贤,复旦大学,28.0,2008-01至2010-12
2007,面上项目,A01,5810,40771185,D071301,应用稳定同位素标记方法研究菜园土壤重金属形态的活性及动态变化,黄志勇,集美大学,25.0,2008-01至2010-12
2007,面上项目,A01,5811,30772126,H1617,DNA损伤感应分子PARP-1和Ku80在人原发性肝癌中的表达和相互关系及其临床意义的研究,黄志勇,华中科技大学,30.0,2008-01至2010-12
2007,面上项目,A01,5812,50772083,E020404,导电相/压电相/聚合物复合材料阻尼耗能机制研究,黄志雄,武汉理工大学,35.0,2008-01至2010-12
2007,面上项目,A01,5813,20772125,B010307,多维多空腔主体分子的合成与分子识别性能研究,黄志镗,中国科学院化学研究所,30.0,2008-01至2010-12
2007,面上项目,A01,5814,20772159,B01,"对癌基因c-myc,G-四链体具有选择性相互作用的吲哚喹啉衍生物",黄志纾,中山大学,28.0,2008-01至2010-12
2007,面上项目,A01,5815,30771774,H2601,环境内毒素分析的酶标免疫传感器研究,黄正,华中科技大学,32.0,2008-01至2010-12
2007,面上项目,A01,5816,50773054,E030703,纳米纤维增强有机玻璃的设计与制备,黄争鸣,同济大学,32.0,2008-01至2010-12
2007,面上项目,A01,5817,10771095,A010204,相对同调与代数的Gorenstein性质,黄兆泳,南京大学,21.0,2008-01至2010-12
2007,面上项目,A01,5818,60773186,F020506,环绕智能环境下感知系统行为描述及协议性能分析研究,黄樟钦,北京工业大学,23.0,2008-01至2010-12
2007,面上项目,A01,5819,50772011,E020401,一维ZnO纳米材料的结构尺寸效应与力电耦合性能研究,黄运华,北京科技大学,30.0,2008-01至2010-12
2007,面上项目,A01,5820,10774139,A040408,基于周期性极化晶体和量子路由器的量子网络信息传送实验研究,黄运锋,中国科学技术大学,35.0,2008-01至2010-12
2007,面上项目,A01,5821,50779029,E0909,基于GIS的滑坡稳定治理研究,黄悦华,三峡大学,33.0,2008-01至2010-12
2007,面上项目,A01,5822,50773051,E031304,三维编织碳纤维增强环氧树脂基复合材料湿热残余应力的研究,黄远,天津大学,30.0,2008-01至2010-12
2007,面上项目,A01,5823,30772667,H3008,口服十二指肠溃疡复合靶向给药系统的研究,黄园,四川大学,25.0,2008-01至2010-12
2007,面上项目,A01,5824,10771062,A011602,关于图的交叉数问题研究,黄元秋,湖南师范大学,23.0,2008-01至2010-12
2007,面上项目,A01,5825,10771222,A010705,动力系统复杂性研究的新方法,黄煜,中山大学,23.0,2008-01至2010-12
2007,面上项目,A01,5826,20774094,B050301,肿瘤细胞特异性靶向高分子纳米胶束的合成与穿膜效应,黄宇彬,中国科学院长春应用化学研究所,32.0,2008-01至2010-12
2007,面上项目,A01,5827,20772061,B010101,离子液体中的有机磷小分子催化反应研究,黄有,南开大学,8.0,2008-01至2008-12
2007,面上项目,A01,5828,30771445,C140602,斜纹夜蛾鞣化激素的表达调控研究,黄勇平,中国科学院上海生命科学研究院,30.0,2008-01至2010-12
2007,面上项目,A01,5829,50776069,E060405,生物质热解燃油在压燃式发动机中燃烧特性的基础研究,黄勇成,西安交通大学,30.0,2008-01至2010-12
2007,面上项目,A01,5830,30770250,C040201,黄海自由生活海洋线虫系统分类学研究,黄勇,聊城大学,22.0,2008-01至2010-12
2007,面上项目,A01,5831,20774105,B050305,以纤维素为基的双亲性接枝共聚物的合成与组装,黄勇,中国科学院化学研究所,30.0,2008-01至2010-12
2007,面上项目,A01,5832,60777028,F040108,回音壁光学微腔模式特性及微腔激光器的研究,黄永箴,中国科学院半导体研究所,34.0,2008-01至2010-12
2007,面上项目,A01,5833,60773140,F020703,基于流媒体的自适应信息隐藏理论和方法,黄永峰,清华大学,25.0,2008-01至2010-12
2007,面上项目,A01,5834,30771178,C0603,与前列腺癌相关蛋白HsaTRZ2/ELAC2同源的粟酒裂殖酵母线粒体蛋白Trz2的研究,黄鹰,南京师范大学,28.0,2008-01至2010-12
2007,面上项目,A01,5835,30770002,C010102,嗜酸丝状放线菌的多样性与活性研究,黄英,中国科学院微生物研究所,30.0,2008-01至2010-12
2007,面上项目,A01,5836,30771539,C170102,鸭生长性状相关基因的精细定位与克隆,黄银花,中国农业大学,25.0,2008-01至2010-12
2007,面上项目,A01,5837,60778015,F050604,高运转效率人眼安全1.55微米一体化微片激光器研究,黄艺东,中国科学院福建物质结构研究所,7.0,2008-01至2008-12
2007,面上项目,A01,5838,20777004,B060305,外生菌根对过量重金属的胞外抗性机理研究,黄艺,北京大学,28.0,2008-01至2010-12
2007,面上项目,A01,5839,10774064,A040103,玻璃系统中淬火无序对自触发无序的影响及玻璃化转变机制研究,黄以能,南京大学,35.0,2008-01至2010-12
2007,面上项目,A01,5840,50779002,E090803,船舶与海洋结构物全寿命长效防腐蚀关键技术研究,黄一,大连理工大学,30.0,2008-01至2010-12
2007,面上项目,A01,5841,30771533,C170102,鸡Lpin1基因的单倍型构建及其对脂肪沉积效应的研究,黄艳群,河南农业大学,30.0,2008-01至2010-12
2007,面上项目,A01,5842,30771060,C07,精子发生个体化过程的分子细胞机制,黄勋,中国科学院遗传与发育生物学研究所,32.0,2008-01至2010-12
2007,面上项目,A01,5843,30771515,C200301,活性氧在采后香蕉果实诱导抗病性中的信号转导作用,黄雪梅,华南农业大学,32.0,2008-01至2010-12
2007,面上项目,A01,5844,70772086,G020801,面向APS的能力需求计划和能力平衡并行算法研究,黄学文,大连理工大学,19.5,2008-01至2010-12
2007,面上项目,A01,5845,10774161,A040308,用于原子精密谱测量的窄线宽半导体激光器的研制,黄学人,中国科学院武汉物理与数学研究所,45.0,2008-01至2010-12
2007,面上项目,A01,5846,20773048,B0301,重要新型分子(离子)结构和反应机理的理论研究,黄旭日,吉林大学,26.0,2008-01至2010-12
2007,面上项目,A01,5847,40775029,D0503,气象多普勒雷达测量近地面层大气折射率场的研究,黄兴友,南京信息工程大学,45.0,2008-01至2010-12
2007,面上项目,A01,5848,20771026,B030601,多核钨氧化物的电子结构与化学键,黄昕,福州大学,25.0,2008-01至2010-12
2007,面上项目,A01,5849,30772176,H0514,糖尿病膀胱自主神经损伤的发生机制及抗氧化干预,黄啸,浙江大学,28.0,2008-01至2010-12
2007,面上项目,A01,5850,30772255,H1505,人真皮内成纤维细胞热损伤3D模型的建立，FGF2的表达及HSP90的保护作用,黄晓元,中南大学,8.0,2008-01至2008-12
2007,面上项目,A01,5851,30770070,C010202,食线虫芽胞杆菌侵染性胞外蛋白酶功能及协同作用研究,黄晓玮,云南大学,30.0,2008-01至2010-12
2007,面上项目,A01,5852,40772026,D0203,纳米细菌对肾草酸钙结石成核及晶相分布的影响,黄晓波,北京大学,43.0,2008-01至2010-12
2007,面上项目,A01,5853,20771102,B0304,一类新颖的基于化合物半导体的有机-无机杂化纳米结构,黄小荥,中国科学院福建物质结构研究所,28.0,2008-01至2010-12
2007,面上项目,A01,5854,40776086,D0609,海草根和叶的营养吸收过程及其与附生藻类的竞争机制,黄小平,中国科学院南海海洋研究所,36.0,2008-01至2010-12
2007,面上项目,A01,5855,40773015,D0303,东南沿海新生代玄武岩时空演化的深部动力学机制,黄小龙,中国科学院广州地球化学研究所,41.0,2008-01至2010-12
2007,面上项目,A01,5856,60773194,F020104,等圆及长方体Packing与一般NP难度问题的高效能求解----拟物拟人算法,黄文奇,华中科技大学,27.0,2008-01至2010-12
2007,面上项目,A01,5857,30772647,H3007,穿心莲内酯衍生物的合成及其抑制COX-2 TNF-α及IL-6表达的生物活性研究,黄文龙,中国药科大学,30.0,2008-01至2010-12
2007,面上项目,A01,5858,40772095,D0208,西北侏罗纪煤的煤岩学和煤化学特殊性及其地质成因研究,黄文辉,中国地质大学（北京）,45.0,2008-01至2010-12
2007,面上项目,A01,5859,30770218,C020601,雷公藤高效低毒药材质量评价体系的建立和优良种质遴选,黄文华,中国医学科学院,30.0,2008-01至2010-12
2007,面上项目,A01,5860,20773113,B0201,烷基在模型催化剂表面的催化转化,黄伟新,中国科学技术大学,31.0,2008-01至2010-12
2007,面上项目,A01,5861,20774043,B0502,基于配位/离子型有机半导体材料的光伏太阳能电池和电存储器件,黄维,南京邮电大学,32.0,2008-01至2010-12
2007,面上项目,A01,5862,30771029,H0714,特发性矮小症相关基因多态性与矮小易感性研究,黄薇,上海人类基因组研究中心,30.0,2008-01至2010-12
2007,面上项目,A01,5863,10771030,A011705,电磁计算中大规模线性代数方程组的预条件技术与高效算法,黄廷祝,电子科技大学,18.0,2008-01至2009-12
2007,面上项目,A01,5864,50778147,E080401,分层型水源水库内源污染机制与水质调控,黄廷林,西安建筑科技大学,32.0,2008-01至2010-12
2007,面上项目,A01,5865,50775158,E050103,少自由度并联机构设计中若干基础理论问题研究,黄田,天津大学,36.0,2008-01至2010-12
2007,面上项目,A01,5866,10774046,A040414,微纳粒子的近场光学局域特性研究,黄素梅,华东师范大学,30.0,2008-01至2010-12
2007,面上项目,A01,5867,30771520,C1503,马蔺(Iris lactea var.chinensis)Pb吸收及超富集耐性机理研究,黄苏珍,江苏省中国科学院植物研究所,30.0,2008-01至2010-12
2007,面上项目,A01,5868,30771005,H0510,甘露聚糖结合凝集素途径的补体激活在糖尿病肾病炎症损伤中的研究,黄颂敏,四川大学,30.0,2008-01至2010-12
2007,面上项目,A01,5869,30772365,H0501,PEA3在胚胎肾脏发育中作用的研究,黄松明,南京医科大学,26.0,2008-01至2010-12
2007,面上项目,A01,5870,70771055,G0110,订单生产模式下的订单报价与生产排序协调研究,黄四民,清华大学,20.0,2008-01至2010-12
2007,面上项目,A01,5871,40775023,D0503,利用变分同化结合正则化方法对雷达回波资料反演大气波导的理论分析与数值研究,黄思训,中国人民解放军理工大学,38.0,2008-01至2010-12
2007,面上项目,A01,5872,30770135,C020302,群落水平上植物与传粉者相互作用的研究——以高山草甸为例,黄双全,武汉大学,30.0,2008-01至2010-12
2007,面上项目,A01,5873,50775083,E050301,旋转机械振动故障信息火用诊断方法研究,黄树红,华中科技大学,28.0,2008-01至2010-12
2007,面上项目,A01,5874,10772174,A020403,煤油超燃雾化全过程数值研究,黄生洪,中国科学技术大学,36.0,2008-01至2010-12
2007,面上项目,A01,5875,50772076,E0206,超高密度超长定向单壁碳纳米管阵列在表面的可控生长及其生长机理研究,黄少铭,温州大学,32.0,2008-01至2010-12
2007,面上项目,A01,5876,30771635,C1704,寄主胁迫诱导两种蜜蜂微孢子虫变异的进化蛋白质组学研究,黄少康,福建农林大学,30.0,2008-01至2010-12
2007,面上项目,A01,5877,20777019,B0602,烟气中NOx在生物过滤系统中的转化机理研究,黄少斌,华南理工大学,26.0,2008-01至2010-12
2007,面上项目,A01,5878,30771088,C0701,寻找和功能分析拟南芥微丝加帽蛋白的结合蛋白,黄善金,中国科学院植物研究所,34.0,2008-01至2010-12
2007,面上项目,A01,5879,70771088,G0115,基于自主创新的知识创造过程中的知识产权风险及其管理策略,黄瑞华,西安交通大学,22.5,2008-01至2010-12
2007,面上项目,A01,5880,20771013,B0102,光电磁功能配合物的默认与非默认网络结构拓扑学和设计合成,黄如丹,北京理工大学,30.0,2008-01至2010-12
2007,面上项目,A01,5881,10775135,A050504,聚变堆防氚渗透耐蚀绝缘复合涂层研究,黄群英,中国科学院合肥物质科学研究院,40.0,2008-01至2010-12
2007,面上项目,A01,5882,30771043,H0203,缺氧运动心肌AMPK调控HIF-1活性及机制的研究,黄庆愿,中国人民解放军第三军医大学,30.0,2008-01至2010-12
2007,面上项目,A01,5883,60773136,F020508,基于自适应特征的复杂背景下目标检测与跟踪方法研究,黄庆明,中国科学院大学,24.0,2008-01至2010-12
2007,面上项目,A01,5884,30770771,H0921,抑郁症研究：白细胞介素-1与海马神经元损伤和再生,黄庆军,汕头大学,30.0,2008-01至2011-12
2007,面上项目,A01,5885,40774028,D0404,评估电性结构对地表电场影响的物理模拟实验和数值模拟计算,黄清华,北京大学,45.0,2008-01至2010-12
2007,面上项目,A01,5886,30771749,C161002,杨树生长性状杂种优势的分子机理研究,黄秦军,中国林业科学研究院,30.0,2008-01至2010-12
2007,面上项目,A01,5887,30771028,H0713,ERM蛋白在晚期糖基化终产物致内皮细胞损伤中的作用,黄巧冰,南方医科大学,30.0,2008-01至2010-12
2007,面上项目,A01,5888,50779053,E090105,基于电力市场的梯级水电站优化调度研究,黄强,西安理工大学,32.0,2008-01至2010-12
2007,面上项目,A01,5889,70772065,G021101,合约市场与现货市场并存下的供应链运作与风险管理,黄培清,上海交通大学,14.0,2008-01至2010-12
2007,面上项目,A01,5890,10772073,A020409,野外风沙跃移运动随机系统的研究,黄宁,兰州大学,45.0,2008-01至2010-12
2007,面上项目,A01,5891,20773161,B0301,含硫、氧和氮原子的某些三原子分子离子的电子激发态及光解离动力学的多组态二级微扰理论方法研究,黄明宝,中国科学院大学,26.0,2008-01至2010-12
2007,面上项目,A01,5892,30770262,C040201,中国小叶蝉亚科分类及系统发育研究,黄敏,西北农林科技大学,28.0,2008-01至2010-12
2007,面上项目,A01,5893,30770018,C010301,香菇C91-3菌株蛋白A(LFP91-3-A)的基因克隆、表达及抗肿瘤机理研究,黄敏,大连医科大学,8.0,2008-01至2008-12
2007,面上项目,A01,5894,40771196,D071404,水体石油类污染遥感探测机理与识别模型研究,黄妙芬,大连海洋大学,45.0,2008-01至2010-12
2007,面上项目,A01,5895,20774065,B0104,化学氧化直接合成多功能聚氨基蒽醌纳米粒子,黄美荣,同济大学,30.0,2008-01至2010-12
2007,面上项目,A01,5896,50778132,E080601,近距离地铁和高磁耦合动载下两相饱和软粘土的长期运营沉降,黄茂松,同济大学,32.0,2008-01至2010-12
2007,面上项目,A01,5897,60774072,F030118,柴油发电机组并联运行混沌振荡的鲁棒控制研究,黄曼磊,哈尔滨工程大学,28.0,2008-01至2010-12
2007,面上项目,A01,5898,60773032,F020301,安全多方量子计算基础协议的研究与应用,黄刘生,中国科学技术大学,29.0,2008-01至2010-12
2007,面上项目,A01,5899,20773102,B020404,新型三维多孔锡基合金微晶电极的电沉积制备及界面性质研究,黄令,厦门大学,28.0,2008-01至2010-12
2007,面上项目,A01,5900,30771396,C140102,中国苹果树腐烂病菌种类及其致病性差异的研究,黄丽丽,西北农林科技大学,30.0,2008-01至2010-12
2007,面上项目,A01,5901,10771055,A010702,右端不连续微分方程的定性理论及其应用研究,黄立宏,湖南大学,26.0,2008-01至2010-12
2007,面上项目,A01,5902,20775094,B040103,以鹿茸为生物放大器获得高表达血管调节因子用于心脑血管疾病的预警研究,黄力,中日友好医院,28.0,2008-01至2010-12
2007,面上项目,A01,5903,60777019,F050201,基于选择共振腔的单片集成白光LED芯片新方案研究,黄黎蓉,华中科技大学,30.0,2008-01至2010-12
2007,面上项目,A01,5904,30770852,H0220,负相调控Notch/Id在血管壁EPCs增殖分化及血管损伤修复中作用,黄岚,中国人民解放军第三军医大学,30.0,2008-01至2010-12
2007,面上项目,A01,5905,10772089,A020301,碳纳米管复合材料中界面的粘聚力模型,黄克智,清华大学,40.0,2008-01至2010-12
2007,面上项目,A01,5906,20776011,B080603,一种系统强化型反应蒸馏塔的综合与设计方法,黄克谨,北京化工大学,27.0,2008-01至2010-12
2007,面上项目,A01,5907,50772133,E020603,生物活性碳纳米管载体材料的光裂解机理及其调控机制研究,黄可龙,中南大学,32.0,2008-01至2010-12
2007,面上项目,A01,5908,60771063,F010509,面向测试性设计的信息模型及其应用技术研究,黄考利,中国人民解放军军械工程学院,8.0,2008-01至2008-12
2007,面上项目,A01,5909,30770881,H0212,1型多聚ADP核糖合成酶与细胞内信号转导系统的相互作用在心室重塑中的调节机制研究,黄恺,华中科技大学,30.0,2008-01至2010-12
2007,面上项目,A01,5910,20776082,B0807,乙酰基团在淀粉颗粒结构层次上分布的研究,黄峻榕,陕西科技大学,8.0,2008-01至2008-12
2007,面上项目,A01,5911,30771851,H2611,国人脑卒中预测模型的建立及简易风险评估工具的开发研究,黄久仪,上海市脑血管病防治研究所,23.0,2008-01至2010-12
2007,面上项目,A01,5912,70772045,G020703,断裂的消费者－品牌关系再续研究,黄静,武汉大学,21.0,2008-01至2010-12
2007,面上项目,A01,5913,50772097,E0207,生物模板上纳米功能材料精确复制及其机理研究,黄靖云,浙江大学,30.0,2008-01至2010-12
2007,面上项目,A01,5914,70772022,G0210,企业电子商务价值驱动力与评价研究,黄京华,清华大学,24.0,2008-01至2010-12
2007,面上项目,A01,5915,70772012,G020703,参考点依赖和损失厌恶对消费者新产品决策的影响,黄劲松,北京航空航天大学,20.0,2008-01至2010-12
2007,面上项目,A01,5916,40774045,D0408,地球物理与地球化学观测的地球动力学协调：地幔热-化学对流模型的研究,黄金水,中国科学技术大学,45.0,2008-01至2010-12
2007,面上项目,A01,5917,40774040,D0407,海南地幔柱的深部结构及动力学研究,黄金莉,中国地震局地震预测研究所,45.0,2008-01至2010-12
2007,面上项目,A01,5918,30771613,C180501,山羊关节炎脑炎病毒感染羊免疫应答的分子机理研究,黄金海,天津大学,8.0,2008-01至2008-12
2007,面上项目,A01,5919,30772857,H2902,应用比较蛋白质组学研究中药复方对人肺腺癌细胞放射增敏的靶分子,黄金昶,中日友好医院,28.0,2008-01至2010-12
2007,面上项目,A01,5920,20776068,B0804,两亲性分子在聚合物膜材料表面的包埋与亲水改性技术,黄健,南京工业大学,28.0,2008-01至2010-12
2007,面上项目,A01,5921,50772063,E020601,水热电泳沉积碳/碳复合材料高温抗氧化硅酸钇涂层的工艺、性能及机理研究,黄剑锋,陕西科技大学,37.0,2008-01至2010-12
2007,面上项目,A01,5922,40771141,D010702,基于高分辨率遥感的树冠信息提取技术研究,黄建文,中国林业科学研究院,33.0,2008-01至2010-12
2007,面上项目,A01,5923,20771092,B030601,双亲水嵌段共聚物存在下纳米超结构形成机理的模拟研究,黄建花,浙江理工大学,28.0,2008-01至2010-12
2007,面上项目,A01,5924,40771112,D070104,钾调控外生菌根真菌分泌草酸的机理研究,黄建国,西南大学,44.0,2008-01至2010-12
2007,面上项目,A01,5925,10771138,A011708,组合弹性结构问题的自适应有限元方法研究,黄建国,上海交通大学,24.0,2008-01至2010-12
2007,面上项目,A01,5926,30770947,H1615,PD-L1分子在肺癌免疫逃逸中的作用及其机制,黄建安,苏州大学,30.0,2008-01至2010-12
2007,面上项目,A01,5927,20777027,B060103,低温及冰封环境下景观水体中污染物迁移转化规律研究,黄继国,吉林大学,10.0,2008-01至2008-12
2007,面上项目,A01,5928,40776085,D0609,海洋酸化对三亚造礁石珊瑚光合效率及钙化生长的影响与作用机制研究,黄晖,中国科学院南海海洋研究所,37.0,2008-01至2010-12
2007,面上项目,A01,5929,50775026,E050402,基于可能性和证据理论的机械系统可靠性分析和设计优化,黄洪钟,电子科技大学,32.0,2008-01至2010-12
2007,面上项目,A01,5930,30771479,C1501,中华猕猴桃和美味猕猴桃的自然杂交渐渗及其倍性变异的机理研究,黄宏文,中国科学院华南植物园,30.0,2008-01至2010-12
2007,面上项目,A01,5931,30770674,C0902,单胺能中缝背核神经元的刺激-分泌耦联研究,黄宏平,皖南医学院,31.0,2008-01至2011-12
2007,面上项目,A01,5932,30770945,H0104,气道中性粒细胞炎症中IL-4诱导肺血管内皮细胞CXCL-8产生的信号途径的研究,黄宏,华中科技大学,29.0,2008-01至2010-12
2007,面上项目,A01,5933,20774024,B0307,聚合物结晶、熔融及分子间相互作用的广义二维红外相关光谱研究,黄鹤,武汉理工大学,30.0,2008-01至2010-12
2007,面上项目,A01,5934,40776060,D0607,鱼脑蛋白质组（学）技术筛选与鉴定连续监测流动海水中有机磷农药污染程度及危害性的指示蛋白质,黄河清,厦门大学,41.0,2008-01至2010-12
2007,面上项目,A01,5935,30770919,H0818,一个新的中心体蛋白TACP1在细胞有丝分裂中的功能及分子机制研究,黄河,浙江大学,30.0,2008-01至2010-12
2007,面上项目,A01,5936,30772337,H0419,胎鼠心脏近端流出道隔心肌化的关键基因研究,黄国英,复旦大学,31.0,2008-01至2010-12
2007,面上项目,A01,5937,30771797,H2603,叶酸对神经干细胞增殖分化作用蛋白质组学的研究,黄国伟,天津医科大学,30.0,2008-01至2010-12
2007,面上项目,A01,5938,10772184,A020313,结构冰激共振锁频的实验与理论研究,黄国君,中国科学院力学研究所,38.0,2008-01至2010-12
2007,面上项目,A01,5939,40771218,D0712,全新世珠江口淡水入流量与季风变化,黄光庆,广州地理研究所,50.0,2008-01至2010-12
2007,面上项目,A01,5940,10773032,A0304,日冕磁场能量释放中的非线性等离子体过程的研究,黄光力,中国科学院紫金山天文台,39.0,2008-01至2010-12
2007,面上项目,A01,5941,50779067,E090203,强非均质介质中溶质不规则迁移机理研究,黄冠华,中国农业大学,34.0,2008-01至2010-12
2007,面上项目,A01,5942,40771132,D070105,黄土高原丘陵沟壑区保护性耕作对水土流失的影响及其机制研究,黄高宝,甘肃农业大学,31.0,2008-01至2010-12
2007,面上项目,A01,5943,50775089,E051005,基于有限排序能力缓冲区的多车间混流装配关联优化,黄刚,华中科技大学,28.0,2008-01至2010-12
2007,面上项目,A01,5944,40775051,D0507,印度洋海温的长期变化对亚非季风系统年代际演变的作用,黄刚,中国科学院大气物理研究所,40.0,2008-01至2010-12
2007,面上项目,A01,5945,40775024,D0503,卫星紫外臭氧垂直廓线反演算法精度的定量评估,黄富祥,国家卫星气象中心,39.0,2008-01至2010-12
2007,面上项目,A01,5946,50772123,E0207,光催化剂中的结构和性能关系模型以及新型光催化材料,黄富强,中国科学院上海硅酸盐研究所,32.0,2008-01至2010-12
2007,面上项目,A01,5947,30771870,H1907,微小按蚊唾液腺抗疟原虫子孢子入侵机理的研究,黄复生,中国人民解放军第三军医大学,33.0,2008-01至2010-12
2007,面上项目,A01,5948,30771983,C080101,TNF-a拮抗剂影响T细胞功能的机制研究,黄烽,中国人民解放军总医院,30.0,2008-01至2010-12
2007,面上项目,A01,5949,60771022,F010703,深亚微米（纳米）CMOS在片无源器件的模型研究及性能优化,黄风义,东南大学,32.0,2008-01至2010-12
