year,grant,sub,num,id,subject,title,author,school,money,duration
2016,重大研究计划,A01,439,91647210,E0904,径流变化条件下雅鲁藏布江水沙变化及河床演变研究,方红卫,清华大学,325.0,2017-01至2020-12
2016,重大研究计划,A01,440,91647119,G0105,澜沧江水资源利用机制研究,方德斌,武汉大学,75.0,2017-01至2019-12
2016,重大研究计划,A01,441,91640203,C060604,长链非编码RNA LncHPADR调控肝癌干细胞自我更新作用及其分子机制研究,范祖森,中国科学院生物物理研究所,310.0,2017-01至2020-12
2016,重大研究计划,A01,442,91632000,H09,指导专家组调研和组织学术交流会费用,段树民,浙江大学,200.0,2017-01至2017-12
2016,重大研究计划,A01,443,91644214,D0510,二次有机气溶胶的界面反应及其在灰霾形成中的作用机制,杜林,山东大学,220.0,2017-01至2020-12
2016,重大研究计划,A01,444,91634111,E041202,纳微气泡界面介尺度结构定向调控生成活性氧的基础研究,杜浩,中国科学院过程工程研究所,67.0,2017-01至2019-12
2016,重大研究计划,A01,445,91644225,D0512,我国华北地区大气复合污染与气候变化的相互作用研究,董文杰,中山大学,300.0,2017-01至2020-12
2016,重大研究计划,A01,446,91642201,H1005,滤泡辅助性T细胞在肠道区域免疫系统的作用及机制,董晨,清华大学,200.0,2017-01至2020-12
2016,重大研究计划,A01,447,91648104,E050102,气驱动连续机器人动力学与时滞主动控制,丁烨,上海交通大学,70.0,2017-01至2019-12
2016,重大研究计划,A01,448,91643206,B06,大气细颗粒物毒性组分在呼吸道的定位分布及其引发呼吸道损伤及保护/适应性反应的分子作用机制,丁文军,中国科学院大学,295.0,2017-01至2020-12
2016,重大研究计划,A01,449,91648109,E050702,碳纳米管导电超弹性体软体机器人大变形致动及变刚度机制,丁建宁,常州大学,68.0,2017-01至2019-12
2016,重大研究计划,A01,450,91648000,E0501,共融机器人战略规划研究和学术交流,丁汉,华中科技大学,300.0,2017-01至2018-12
2016,重大研究计划,A01,451,91649122,H2501,热卡限制类似方法——11β-HSD1抑制剂防治心肌纤维化机制研究,丁国宪,南京医科大学,60.0,2017-01至2019-12
2016,重大研究计划,A01,452,91639117,H0220,"利用""血管微环境重构""的节点通路促进肺再生并抑制纤维化",丁楅森,四川大学,120.0,2017-01至2019-12
2016,重大研究计划,A01,453,91648101,A0202,基于保辛方法的刚-柔-软体机器人耦合系统的交互动力学特性研究,邓子辰,西北工业大学,68.0,2017-01至2019-12
2016,重大研究计划,A01,454,91622103,B01,面向生物信息分子运输的介孔晶体及原位SAXS监测,邓鹤翔,武汉大学,80.0,2017-01至2018-12
2016,重大研究计划,A01,455,91640108,C060604,一种新的P16基因增强子反义链lncRNA P16AS的功能与肿瘤发生发展,邓大君,北京市肿瘤防治研究所,85.0,2017-01至2019-12
2016,重大研究计划,A01,456,91649109,H0203,环形非编码RNA circRNA_000203促进衰老性心肌重构的机制研究,单志新,广东省心血管病研究所,60.0,2017-01至2019-12
2016,重大研究计划,A01,457,91646125,G021101,大数据驱动的O2O即时物流管理与决策研究,代宏砚,中央财经大学,42.0,2017-01至2019-12
2016,重大研究计划,A01,458,91623104,E050902,柔性功能器件大面积印刷制备研究,崔铮,中国科学院苏州纳米技术与纳米仿生研究所,30.0,2017-01至2017-12
2016,重大研究计划,A01,459,91629101,C0801,可逆泛素化介导的细胞自噬对非可控炎症的调控作用机制研究,崔隽,中山大学,94.0,2017-01至2018-12
2016,重大研究计划,A01,460,91641106,E060405,柴油微引燃天然气（HPDI）发动机缸内直喷射流诱导湍流场和燃烧相互作用机制研究,仇滔,北京工业大学,60.0,2017-01至2019-12
2016,重大研究计划,A01,461,91648105,E050102,多并联共融机器人大型光学镜面加工装备动态耦合特性及协同控制策略研究,程刚,中国矿业大学,60.0,2017-01至2019-12
2016,重大研究计划,A01,462,91634116,B0801,气固反应中金属合金纳米催化剂介尺度结构的形成机制及调控,程道建,北京化工大学,67.0,2017-01至2019-12
2016,重大研究计划,A01,463,91622126,E021102,稀土正铁氧体单晶及其异质结构的可控制备与超快磁光效应,成昭华,中国科学院物理研究所,80.0,2017-01至2018-12
2016,重大研究计划,A01,464,91631302,C020303,多倍体植物遗传变异的分子进化机理研究,陈增建,南京农业大学,240.0,2017-01至2019-12
2016,重大研究计划,A01,465,91640202,C060604,植物生殖发育相关的长链非编码RNA功能与调控机制,陈月琴,中山大学,290.0,2017-01至2020-12
2016,重大研究计划,A01,466,91646109,G021101,供需双边大数据驱动的血液共享管理随机模型研究,陈旭,电子科技大学,43.0,2017-01至2019-12
2016,重大研究计划,A01,467,91622124,E0201,具有高激光损伤阈值的卤化物中红外非线性光学晶体材料的设计合成与性能研究,陈兴国,武汉大学,80.0,2017-01至2018-12
2016,重大研究计划,A01,468,91645102,B0202,原位近常压光电子能谱技术于能源小分子活化基础问题的研究,陈伟,苏州工业园区新国大研究院,75.0,2017-01至2019-12
2016,重大研究计划,A01,469,91641118,E060605,旋流火焰高时空分辨激光光谱诊断及定量表征方法研究,陈爽,中国空气动力研究与发展中心,60.0,2017-01至2019-12
2016,重大研究计划,A01,470,91639303,H0222,肺动脉去神经术抑制肺动脉高压患者肺动脉与右心室重构的机制及转化研究,陈绍良,南京医科大学,260.0,2017-01至2019-12
2016,重大研究计划,A01,471,91640000,C050208,基因信息传递过程中非编码RNA的调控作用机制学术交流机动经费,陈润生,中国科学院生物物理研究所,100.0,2016-10至2017-12
2016,重大研究计划,A01,472,91643109,H2607,长三角地区细颗粒物毒性组分致肺癌表遗传机制研究,陈瑞,东南大学,75.0,2017-01至2019-12
2016,重大研究计划,A01,473,91638203,F010606,基于少量地面控制源的多层高动态空间信息网的时空基准研究,陈锐志,武汉大学,339.0,2017-01至2020-12
2016,重大研究计划,A01,474,91636110,A040411,适于空间应用的超稳定高精细度光学腔研究,陈群峰,中国科学院武汉物理与数学研究所,90.0,2017-01至2019-12
2016,重大研究计划,A01,475,91641119,E060407,构建基于CFD-PDF-PBE耦合的航空发动机湍流燃烧碳烟详细生成模型,陈龙飞,北京航空航天大学,39.0,2017-01至2019-12
2016,重大研究计划,A01,476,91636109,A040408,基于多光子高阶OAM纠缠实现相位及转动的超灵敏测量,陈理想,厦门大学,90.0,2017-01至2019-12
2016,重大研究计划,A01,477,91645119,B020103,CO2加氢制甲醇模型催化剂的构建及其表界面结构调控与反应特性的研究,陈礼敏,华南理工大学,75.0,2017-01至2019-12
2016,重大研究计划,A01,478,91640101,C010802,与流感病毒致病相关的宿主长链非编码RNA的筛选鉴定及功能研究,陈吉龙,福建农林大学,84.0,2017-01至2019-12
2016,重大研究计划,A01,479,91631106,C060402,微进化机制中群体基因组数据分析的新方法研究,陈华,中国科学院北京基因组研究所,84.0,2017-01至2018-12
2016,重大研究计划,A01,480,91648110,E050702,基于电活性材料的驱动与传感一体化智能软体机器人集成制造工艺研究,陈花玲,西安交通大学,59.0,2017-01至2019-12
2016,重大研究计划,A01,481,91649125,H3102,PARP-1调控衰老相关分泌表型（SASP）在动脉粥样硬化中的作用研究,陈宏山,南京医科大学,60.0,2017-01至2019-12
2016,重大研究计划,A01,482,91646000,G02,大数据驱动的管理与决策研究指导专家组战略研究与组织学术交流会费用,陈国青,清华大学,200.0,2017-01至2017-12
2016,重大研究计划,A01,483,91634204,B080205,超声微反应器内介尺度行为及调控机制,陈光文,中国科学院大连化学物理研究所,300.0,2017-01至2020-12
2016,重大研究计划,A01,484,91639301,H0203,血管局部炎症免疫调控网络及干预靶点,陈丰原,中南大学,280.0,2017-01至2019-12
2016,重大研究计划,A01,485,91641129,E060405,超声速射流火焰湍流输运和热扩散不稳定性研究,陈方,上海交通大学,60.0,2017-01至2019-12
2016,重大研究计划,A01,486,91640204,C060604,小分子RNA介导的基因沉默协同调控泛素化蛋白降解的机制研究,陈大华,中国科学院动物研究所,270.0,2017-01至2020-12
2016,重大研究计划,A01,487,91637102,D0507,青藏高原水汽“源汇”结构的多尺度变化及其对区域降水影响研究,陈斌,中国气象科学研究院,68.0,2017-01至2019-12
2016,重大研究计划,A01,488,91648208,F030706,人机共融的灵巧柔顺下肢康复机器人交互方法与应用,陈霸东,西安交通大学,300.0,2017-01至2020-12
2016,重大研究计划,A01,489,91647112,E090104,考虑多重风险的澜沧江流域径流多目标适应性调控研究,畅建霞,西安理工大学,75.0,2017-01至2019-12
2016,重大研究计划,A01,490,91626000,A0504,指导专家组调研和组织学术交流会费用,柴之芳,中国科学院高能物理研究所,300.0,2017-01至2018-12
2016,重大研究计划,A01,491,91642000,H10,组织器官区域免疫特性与疾病,曹雪涛,中国医学科学院基础医学研究所,100.0,2017-01至2017-12
2016,重大研究计划,A01,492,91646204,G011203,面向Online-to-Offline智能商务的大数据融合与应用,曹杰,南京财经大学,201.0,2017-01至2020-12
2016,重大研究计划,A01,493,91636220,A040405,突破机械振子微弱力测量经典极限的声子压缩,曹更玉,中国科学院武汉物理与数学研究所,330.0,2017-01至2020-12
2016,重大研究计划,A01,494,91632110,C0916,开发新型稀疏标记系统解析参与条件性恐惧记忆5-羟色胺神经元的全脑精细投射及功能,曹罡,华中农业大学,60.0,2017-01至2019-12
2016,重大研究计划,A01,495,91632106,C0913,眶前额叶皮层－杏仁核神经环路对奖赏和厌恶工作记忆的编码,蔡昕颖,上海纽约大学,60.0,2017-01至2019-12
2016,重大研究计划,A01,496,91649203,H0203,心脏Telocyte在心脏衰老和再生能力下降中的作用及其机制研究,蔡冬青,暨南大学,270.0,2017-01至2020-12
2016,重大研究计划,A01,497,91622111,B010503,基于功能基元的晶态超分子材料的构筑与性能研究,卜显和,南开大学,80.0,2017-01至2018-12
2016,重大研究计划,A01,498,91646115,G010303,基于大数据的个性化动态定价策略研究,毕文杰,中南大学,43.0,2017-01至2019-12
2016,重大研究计划,A01,499,91645000,B03,碳基能源转化利用的催化科学战略研究,包信和,复旦大学,150.0,2017-01至2017-12
2016,重大研究计划,A01,500,91630309,A0117,波传播反问题的数学分析、计算方法及应用,包刚,浙江大学,250.0,2017-01至2019-12
2016,重大研究计划,A01,501,91649108,C1112,下丘脑饥饿信号通路在热量限制抗肝脏衰老中的作用研究,John Speakman,中国科学院遗传与发育生物学研究所,60.0,2017-01至2019-12
2016,重大研究计划,A01,502,91632117,H0918,加强酒精成瘾患者情绪控制的新方法探索：基于功能连接的实时神经反馈技术,Benjamin Becker,电子科技大学,60.0,2017-01至2019-12
