year,grant,sub,num,id,subject,title,author,school,money,dueration
2007,重点项目,A01,323,60736019,F020507,复杂产品虚拟样机多领域集成建模和协同模拟分析研究,高曙明,浙江大学,200,2008-01至2011-12
2007,重点项目,A01,324,40730424,D040901,用于地层-岩性油气藏地震信号特征识别的相空间理论与方法,高静怀,西安交通大学,170,2008-01至2011-12
2007,重点项目,A01,325,40730950,D0505,热带测雨卫星探测结果的融合及在暴雨降水结构和云参数分析中的应用研究,傅云飞,中国科学技术大学,165,2008-01至2011-12
2007,重点项目,A01,326,30730090,H1509,骨髓间充质干细胞转分化再生汗腺效能与功能评价研究,付小兵,中国人民解放军总医院,170,2008-01至2011-12
2007,重点项目,A01,327,20732003,B010305,新型催化剂的设计和合成及催化有机化学反应研究,冯小明,四川大学,170,2008-01至2011-12
2007,重点项目,A01,328,10732050,A020503,天然生物材料的多尺度力学与仿生研究,冯西桥,清华大学,200,2008-01至2011-12
2007,重点项目,A01,329,30730076,C1603,木材细胞壁力学性能表征体系构建及应用,费本华,中国林业科学研究院,140,2008-01至2011-12
2007,重点项目,A01,330,60736025,F0302,小型无人飞行器自主控制与导航,房建成,北京航空航天大学,200,2008-01至2011-12
2007,重点项目,A01,331,30730019,C030202,扬子鳄种群衰退的分子机理研究,方盛国,浙江大学,170,2008-01至2011-12
2007,重点项目,A01,332,40730528,D071301,物理和生物扰动对湖泊沉积物－水界面微环境与磷再生及迁移的影响,范成新,中国科学院南京地理与湖泊研究所,160,2008-01至2011-12
2007,重点项目,A01,333,50736006,E0604,气固两相湍流与燃烧相互作用的直接数值模拟和实验研究,樊建人,浙江大学,190,2008-01至2011-12
2007,重点项目,A01,334,30730037,C0902,胶质细胞分泌及功能的研究,段树民,浙江大学,200,2008-01至2011-12
2007,重点项目,A01,335,50735007,E0512,阵列波导器件封装制造的基本原理与关键技术,段吉安,中南大学,180,2008-01至2011-12
2007,重点项目,A01,336,40730105,D0708,温带草地植被－土壤系统碳氮耦合特征及其对氮素水平的响应,董云社,中国科学院地理科学与资源研究所,170,2008-01至2011-12
2007,重点项目,A01,337,40730208,D02,PETM气候－环境事件及生态效应的陆相高分辨率记录,丁仲礼,中国科学院地质与地球物理研究所,200,2008-01至2011-12
2007,重点项目,A01,338,30730103,H1611,土槿皮乙酸对新生血管生成和微管抑制作用分子机制的深入研究,丁健,中国科学院上海药物研究所,150,2008-01至2011-12
2007,重点项目,A01,339,30730028,C050201,参与组蛋白修饰的重要蛋白质和蛋白质复合物的结构与功能研究,丁建平,中国科学院上海生命科学研究院,160,2008-01至2011-12
2007,重点项目,A01,340,40730210,D0201,中国新近纪哺乳动物演化对重大气候环境变化的响应,邓涛,中国科学院古脊椎动物与古人类研究所,165,2008-01至2011-12
2007,重点项目,A01,341,40730741,D0709,金属硫化物矿山尾矿钝化机理及环境地球化学效应研究,党志,华南理工大学,165,2008-01至2011-12
2007,重点项目,A01,342,60736030,F040205,纳米工艺下可制造性和成品率驱动的集成电路设计方法学研究,程玉华,北京大学,180,2008-01至2011-12
2007,重点项目,A01,343,60736022,F03,飞行器制导控制中的混杂控制理论与方法,程代展,中国科学院数学与系统科学研究院,220,2008-01至2011-12
2007,重点项目,A01,344,50738002,E080802,柔性桥梁风致振动与控制的现代理论体系研究,陈政清,湖南大学,200,2008-01至2011-12
2007,重点项目,A01,345,30730055,C0708,细胞极性影响细胞增殖、迁移和肿瘤发生发展的机理,陈正军,中国科学院上海生命科学研究院,155,2008-01至2011-12
2007,重点项目,A01,346,60736003,F010206,毫米波光纤无线系统理论与技术,陈章渊,北京大学,190,2008-01至2011-12
2007,重点项目,A01,347,10731040,A0116,组合数学中的构造性方法,陈永川,南开大学,130,2008-01至2011-12
2007,重点项目,A01,348,40730318,D0402,地震波雷达-用人工震源探测大陆地壳结构及其演化,陈颙,中国地震局地震预测研究所,150,2008-01至2011-12
2007,重点项目,A01,349,40730421,D0205,东秦岭造山型成矿系统的比较研究,陈衍景,中国科学院广州地球化学研究所,165,2008-01至2011-12
2007,重点项目,A01,350,50733003,E0310,智能性可生物降解高分子材料的制备与医学应用探索,陈学思,中国科学院长春应用化学研究所,180,2008-01至2011-12
2007,重点项目,A01,351,10734090,A040410,第三代焦平面中HgCdTe材料的量子特征态研究,陈效双,中国科学院上海技术物理研究所,230,2008-01至2011-12
2007,重点项目,A01,352,10731020,A010602,算子代数、Banach空间几何及其在拓扑、分析中的应用,陈晓漫,复旦大学,120,2008-01至2011-12
2007,重点项目,A01,353,10734040,A040303,分子超激发态的结构与动力学,陈向军,中国科学技术大学,220,2008-01至2011-12
2007,重点项目,A01,354,40730633,D0702,中亚干旱区近50年LUCC对区域水循环蒸散发过程与格局的影响研究,陈曦,中国科学院新疆生态与地理研究所,180,2008-01至2011-12
2007,重点项目,A01,355,30730036,H1809,基于医学图像模糊内容检索的关键技术研究,陈武凡,南方医科大学,155,2008-01至2011-12
2007,重点项目,A01,356,50737003,E0705,特高压输电系统操作过电压柔性限制技术和雷电屏蔽技术基础研究,陈维江,中国电力科学研究院有限公司,175,2008-01至2011-12
2007,重点项目,A01,357,30730044,H1016,GRP78调控A类清道夫受体功能及其信号通路的研究,陈琪,南京医科大学,165,2008-01至2011-12
2007,重点项目,A01,358,30730041,C2101,汉语声调的听觉认知加工,陈林,中国科学技术大学,160,2008-01至2011-12
2007,重点项目,A01,359,40730948,D05,登陆台风强度变化机理研究,陈联寿,中国气象科学研究院,185,2008-01至2011-12
2007,重点项目,A01,360,50730004,E0210,碳基低温固体氧化物燃料电池关键材料基础科学问题研究,陈立泉,中国科学院物理研究所,220,2008-01至2011-12
2007,重点项目,A01,361,20731003,B0102,无机复合体系及其功能开拓,陈接胜,上海交通大学,160,2008-01至2011-12
2007,重点项目,A01,362,30730073,C16,华山松挥发性物质扩散与华山松大小蠹行为选择及种群密度调控机制的研究,陈辉,西北农林科技大学,170,2008-01至2011-12
2007,重点项目,A01,363,20735002,B040104,食品安全复杂样品体系分离与检测新技术、新方法研究,陈国南,福州大学,160,2008-01至2011-12
2007,重点项目,A01,364,40730530,D0610,测高卫星海面气象参数定量反演与气候模态精细提取,陈戈,中国海洋大学,170,2008-01至2011-12
2007,重点项目,A01,365,40730843,D0601,基于多源卫星观测的热带海洋模拟和短期气候预测研究,陈大可,国家海洋局第二海洋研究所,175,2008-01至2011-12
2007,重点项目,A01,366,30730034,C1002,硅酸盐基骨组织工程材料及与再生环境相互作用关系的研究,常江,中国科学院上海硅酸盐研究所,150,2008-01至2011-12
2007,重点项目,A01,367,50739002,E0905,山洪形成机理、预报技术与致灾风险评估方法研究,曹叔尤,四川大学,190,2008-01至2011-12
2007,重点项目,A01,368,20731005,B01,多孔配位聚合物的合成、结构及吸附分离性能研究,曹荣,中国科学院福建物质结构研究所,200,2008-01至2011-12
2007,重点项目,A01,369,30730027,C050201,非受体酪氨酸激酶c-Abl/Arg与凋亡相关蛋白AIF及Galectin-3的相互作用及生物学意义,曹诚,中国人民解放军军事科学院军事医学研究院,150,2008-01至2011-12
2007,重点项目,A01,370,70732005,G0203,基于资源观的新企业创建与早期成长机理研究,蔡莉,吉林大学,97,2008-01至2011-12
2007,重点项目,A01,371,20733005,B030302,基于化学反应高维、耦合势能面的态-态动力学,边文生,中国科学院化学研究所,180,2008-01至2011-12
2007,重点项目,A01,372,20734003,B0307,聚合物物理凝胶化及凝胶结构的多尺度研究,安立佳,中国科学院长春应用化学研究所,170,2008-01至2011-12
2007,重点项目,A01,373,30730057,C06,全基因组范围挖掘疾病相关基因的交互模式,Jurg Ott,中国科学院心理研究所,120,2008-01至2011-12
