year,grant,sub,num,id,subject,title,author,school,money,duration
2016,重大研究计划,A01,1,91643107,B0604,大气细颗粒物与内皮细胞一氧化氮合成酶交互作用的分子机制研究,庄树林,浙江大学,79.0,2017-01至2019-12
2016,重大研究计划,A01,2,91649107,C1112,影响核膜与内质网膜结构的ANKLE2分子在衰老调控中的关键作用,朱正茂,南开大学,60.0,2017-01至2019-12
2016,重大研究计划,A01,3,91639000,H0203,血管稳态与重构的调控机制,朱毅,天津医科大学,160.0,2017-01至2017-12
2016,重大研究计划,A01,4,91645122,B030101,金属/氧化物协同催化丙烷脱氢反应的机理研究及理性催化剂筛选,朱贻安,华东理工大学,68.0,2017-01至2019-12
2016,重大研究计划,A01,5,91632112,H0902,果蝇类负面情绪及其对学习记忆的影响,朱岩,中国科学院生物物理研究所,60.0,2017-01至2019-12
2016,重大研究计划,A01,6,91648102,E0501,在未知人机共融环境下基于行人行为学习的户外移动机器人自主感知、语义制图和运动规划,朱晓蕊,哈尔滨工业大学,65.0,2017-01至2019-12
2016,重大研究计划,A01,7,91641116,E060405,基于从头算分子动力学模拟的大分子碳氢燃料的反应机理研究,朱通,华东师范大学,60.0,2017-01至2019-12
2016,重大研究计划,A01,8,91636218,A040307,基于冷里德堡原子的微波电场精密测量研究,朱诗亮,南京大学,360.0,2017-01至2020-12
2016,重大研究计划,A01,9,91614000,D04,华北克拉通破坏学术交流活动（第五阶段）,朱日祥,中国科学院地质与地球物理研究所,24.9,2016-05至2017-12
2016,重大研究计划,A01,10,91641121,B030301,国产航油RP-3结焦积碳机理构建和实验验证,朱权,四川大学,60.0,2017-01至2019-12
2016,重大研究计划,A01,11,91632114,H0912,长链非编码mSYT-AS异常在阿尔茨海默病ECIIPN-CA1PV环路功能障碍中作用研究,朱铃强,华中科技大学,60.0,2017-01至2019-12
2016,重大研究计划,A01,12,91648202,E050103,蒙皮镜像加工机器人系统的主动顺应与协调控制研究,朱利民,上海交通大学,300.0,2017-01至2020-12
2016,重大研究计划,A01,13,91644216,D0510,大气复合污染海量多源观测同化与集合预报方法研究,朱江,中国科学院大气物理研究所,314.0,2017-01至2020-12
2016,重大研究计划,A01,14,91639105,H0203,血管成纤维细胞外泌体调控血管平滑肌细胞表型转化与高血压血管重构的分子机制,朱国庆,南京医科大学,65.0,2017-01至2019-12
2016,重大研究计划,A01,15,91622106,B0102,具有氙气吸附性能的晶态多孔有机框架材料的定向合成,朱广山,东北师范大学,80.0,2017-01至2018-12
2016,重大研究计划,A01,16,91647107,E0901,澜沧江高海拔地区水能开发对局地气候影响研究,朱德军,清华大学,75.0,2017-01至2019-12
2016,重大研究计划,A01,17,91647109,E090102,尼洋河流域水循环模拟及径流演变规律,周祖昊,中国水利水电科学研究院,75.0,2017-01至2019-12
2016,重大研究计划,A01,18,91645121,B020404,模型催化剂上甲烷电催化活化转化的反应机理与构效关系,周志有,厦门大学,75.0,2017-01至2019-12
2016,重大研究计划,A01,19,91646102,G03,支持技术预见的多源异构大数据融合与时序文本预测方法研究,周源,清华大学,43.0,2017-01至2019-12
2016,重大研究计划,A01,20,91640115,C060604,NF110与DDX5对长非编码RNA结构与功能的调控,周宇,武汉大学,80.0,2017-01至2019-12
2016,重大研究计划,A01,21,91644110,E080405,华北典型区域生物质燃烧排放清单建立与校验,周颖,北京工业大学,100.0,2017-01至2019-12
2016,重大研究计划,A01,22,91647117,E0904,澜沧江源区历史径流泥沙序列重构研究,周银军,长江水利委员会长江科学院,80.0,2017-01至2019-12
2016,重大研究计划,A01,23,91645107,B020103,纳米结构铜催化剂在CO转化反应过程中的原位动态研究,周燕,中国科学院大连化学物理研究所,75.0,2017-01至2019-12
2016,重大研究计划,A01,24,91632108,C0914,噪声影响听觉及记忆的中枢机制研究,周晓明,华东师范大学,60.0,2017-01至2019-12
2016,重大研究计划,A01,25,91634114,E060504,气固两相流中基于局域介尺度结构的各向异性曳力模型研究,周强,西安交通大学,67.0,2017-01至2019-12
2016,重大研究计划,A01,26,91636219,A040308,原子干涉法检验洛伦兹对称性的实验研究,周敏康,华中科技大学,360.0,2017-01至2020-12
2016,重大研究计划,A01,27,91634115,B0802,气液固三相接触线介尺度结构和传递的模型与机制研究,周乐平,华北电力大学,67.0,2017-01至2019-12
2016,重大研究计划,A01,28,91647104,D0106,基于多源遥感协同与时空融合的西南河流源区地表蒸散发估算研究,周纪,电子科技大学,75.0,2017-01至2019-12
2016,重大研究计划,A01,29,91649118,H0912,以果蝇为模型研究泛酸激酶在帕金森疾病中的作用,周兵,清华大学,70.0,2017-01至2019-12
2016,重大研究计划,A01,30,91639302,H0215,血管稳态失衡中的细胞命运转变及调控机制研究,周斌,中国科学院上海生命科学研究院,300.0,2017-01至2019-12
2016,重大研究计划,A01,31,91622120,B010307,基于共轭多吡啶配体及配合物的低维晶态材料的合成与光电性能,钟羽武,中国科学院化学研究所,80.0,2017-01至2018-12
2016,重大研究计划,A01,32,91632301,C0913,主动遗忘的神经环路及分子机制,钟毅,清华大学,230.0,2017-01至2019-12
2016,重大研究计划,A01,33,91622105,B0102,晶态稀土氧化物发光陶瓷材料的超高压高温合成及其性能研究,钟声亮,江西师范大学,80.0,2017-01至2018-12
2016,重大研究计划,A01,34,91649101,C060706,9.4T下活体脑组织内衰老早期的磁共振成像研究,钟凯,中国科学院合肥物质科学研究院,70.0,2017-01至2019-12
2016,重大研究计划,A01,35,91632109,C0915,基于人脑标本的阿尔茨海默病和精神分裂症的神经环路多模态跨尺度融合研究,钟健晖,浙江大学,100.0,2017-01至2019-12
2016,重大研究计划,A01,36,91643203,H2601,交通尾气颗粒物致健康损害效应的关键组分及人群生物标志物研究,郑玉新,青岛大学,296.0,2017-01至2020-12
2016,重大研究计划,A01,37,91636213,A0403,突破标准量子极限的双数态的制备与研究,郑盟锟,清华大学,360.0,2017-01至2020-12
2016,重大研究计划,A01,38,91639108,H0215,膜联蛋白A1影响动脉粥样硬化斑块的形成和稳定性,郑乐民,北京大学,65.0,2017-01至2019-12
2016,重大研究计划,A01,39,91639110,H0216,ADAMTS1调控中性粒细胞参与主动脉夹层发病的机制研究,郑金刚,中日友好医院,65.0,2017-01至2019-12
2016,重大研究计划,A01,40,91645112,B0305,碳基小分子在分子筛限域孔道中扩散机制的核磁共振和理论计算研究,郑安民,中国科学院武汉物理与数学研究所,75.0,2017-01至2019-12
2016,重大研究计划,A01,41,91649123,H2501,遗传编码的NAD+探针在器官衰老研究中的应用,赵玉政,华东理工大学,70.0,2017-01至2019-12
2016,重大研究计划,A01,42,91644220,D0512,长三角排放清单的优化集成与综合校验,赵瑜,南京大学,290.0,2017-01至2020-12
2016,重大研究计划,A01,43,91629105,H1609,肿瘤细胞非凋亡的细胞程序死亡调控与治疗敏感性研究,赵晓航,中国医学科学院肿瘤医院,80.0,2017-01至2018-12
2016,重大研究计划,A01,44,91638101,F010601,深度融合的空间信息网络光/射频/分组混合交换机制与方法研究,赵尚弘,中国人民解放军空军工程大学,82.0,2017-01至2019-12
2016,重大研究计划,A01,45,91639113,H1822,通过仿生天然细胞外基质构建功能型人工血管促进组织再生重构,赵强,南开大学,65.0,2017-01至2019-12
2016,重大研究计划,A01,46,91636102,A0403,用于精密测量的抗弛豫镀膜原子气室的研究,赵凯锋,复旦大学,85.0,2017-01至2019-12
2016,重大研究计划,A01,47,91648201,E0501,人机协作型移动双臂机器人的基础研究,赵杰,哈尔滨工业大学,300.0,2017-01至2020-12
2016,重大研究计划,A01,48,91648106,E050103,基于多元智能材料的超轻质软体机械臂大变形致动及变刚度机理研究,赵建文,哈尔滨工业大学,68.0,2017-01至2019-12
2016,重大研究计划,A01,49,91640117,C0607,环形非编码RNA组学中的关键计算方法研究,赵方庆,中国科学院动物研究所,80.0,2017-01至2019-12
2016,重大研究计划,A01,50,91644103,D0709,二次有机气溶胶液相生成机制和化学过程的碳氮稳定同位素研究,章炎麟,南京信息工程大学,100.0,2017-01至2019-12
2016,重大研究计划,A01,51,91635303,C130403,玉米穗粒数和粒重的调控网络解析,张祖新,华中农业大学,680.0,2017-01至2018-12
2016,重大研究计划,A01,52,91639202,H0214,上皮细胞钠通道在血管稳态和重构中的作用及其分子调控机制,张志仁,哈尔滨医科大学,220.0,2017-01至2020-12
2016,重大研究计划,A01,53,91639114,H3102,Zn2+跨膜转运异常在腹主动脉瘤发病中的作用和机制研究,张政,中南大学,65.0,2017-01至2019-12
2016,重大研究计划,A01,54,91642117,H1012,PGE2对ILC2功能的抑制作用及其在肺部过敏性炎症中的病理意义,张毓,锦州医科大学,60.0,2017-01至2019-12
2016,重大研究计划,A01,55,91639112,H0220,Foxp1介导IL-b/Lox-1调节内皮细胞/单核巨噬细胞交互作用在动脉粥样硬化发生发展中的作用,张玉珍,同济大学,65.0,2017-01至2019-12
2016,重大研究计划,A01,56,91636106,A040408,基于光纤干涉仪的量子精密测量,张勇,南京大学,90.0,2017-01至2019-12
2016,重大研究计划,A01,57,91648113,E051002,基于仿生学的多机器人加工作业任务规划研究,张小明,华中科技大学,60.0,2017-01至2019-12
2016,重大研究计划,A01,58,91627000,B020304,可控自组装重大研究计划指导专家组调研和学术交流费用,张希,清华大学,30.7,2017-01至2018-12
2016,重大研究计划,A01,59,91630206,F020305,商用客机气动噪声大规模并行计算的建模、算法与软件,张武,上海大学,200.0,2017-01至2019-12
2016,重大研究计划,A01,60,91631108,C060502,RNA表观遗传调控的进化,张锐,中山大学,100.0,2017-01至2019-12
2016,重大研究计划,A01,61,91643108,H2607,氧化应激因子FOXO在大气细颗粒物致肺遗传损伤中的作用及机制,张荣,河北医科大学,90.0,2017-01至2019-12
2016,重大研究计划,A01,62,91630201,A0117,偏微分方程特征值问题的数值方法与理论,张然,吉林大学,160.0,2017-01至2019-12
2016,重大研究计划,A01,63,91642108,H0105,内质网应激介导IL-17致支气管扩张慢性炎症反应的作用研究,张鹏,同济大学,60.0,2017-01至2019-12
2016,重大研究计划,A01,64,91641105,E0604,大分子直链烷烃高精度从头算燃烧反应动力学的研究,张鹏,香港理工大学深圳研究院,60.0,2017-01至2019-12
2016,重大研究计划,A01,65,91646205,G011202,大数据驱动的全景式个性化心血管健康管理研究,张朋柱,上海交通大学,240.0,2017-01至2020-12
2016,重大研究计划,A01,66,91646103,G0306,基于网络政府数据分析的政策扩散路径与回应关切能力研究,张楠,清华大学,43.0,2017-01至2019-12
2016,重大研究计划,A01,67,91622109,B0105,晶态荧光多孔配位聚合物的气体传感研究,张杰鹏,中山大学,80.0,2017-01至2018-12
2016,重大研究计划,A01,68,91646201,G0310,大数据驱动的大型活动全景式安全管理与决策方法,张辉,清华大学,240.0,2017-01至2020-12
2016,重大研究计划,A01,69,91644211,D05,中国大气污染物对云和辐射的影响及其气候效应研究,张华,国家气候中心,300.0,2017-01至2020-12
2016,重大研究计划,A01,70,91642120,H05,免疫介导肾小球疾病共性及特性遗传学及其致病机制研究,张宏,北京大学,85.0,2017-01至2019-12
2016,重大研究计划,A01,71,91634104,B081104,超细气泡反应体系的传质特性与介尺度构效调控,张锋,南京大学,67.0,2017-01至2019-12
2016,重大研究计划,A01,72,91639102,H0203,线粒体长链非编码EnermtRNA-1在血管平滑肌细胞功能及血管内膜形成中的作用及其分子机制,张春祥,滨州医学院,65.0,2017-01至2019-12
2016,重大研究计划,A01,73,91647201,E0901,西南河流源区供水-发电-环境互馈关系及系统弹性研究,张弛,大连理工大学,350.0,2017-01至2020-12
2016,重大研究计划,A01,74,91641109,E060404,燃烧室液雾湍流边界层回火机制及模型研究,张弛,北京航空航天大学,60.0,2017-01至2019-12
2016,重大研究计划,A01,75,91648112,E051002,双伺服驱动机器人柔顺关节的变刚度设计理论及刚柔控制,张波,上海交通大学,70.0,2017-01至2019-12
2016,重大研究计划,A01,76,91638201,F011304,空间信息网络下的高光谱遥感协同观测理论与方法研究,张兵,中国科学院遥感与数字地球研究所,350.0,2017-01至2020-12
2016,重大研究计划,A01,77,91649116,H0902,网格细胞空间导航神经环路的衰老和退变特征及其预测AD转化的机制,张冰,南京大学,60.0,2017-01至2019-12
2016,重大研究计划,A01,78,91647115,E0903,澜沧江小湾水库硫元素的生物地球化学过程及其生态环境效应,张宝刚,中国地质大学（北京）,80.0,2017-01至2019-12
2016,重大研究计划,A01,79,91646107,H2611,基于临床大数据的多模式多视图不合理处方识别模型的构建与优化研究,詹思延,北京大学,43.0,2017-01至2019-12
2016,重大研究计划,A01,80,91631103,C040504,人工选择下家蚕飞行能力退化的分子机制,詹帅,中国科学院上海生命科学研究院,99.0,2017-01至2019-12
2016,重大研究计划,A01,81,91622117,B050101,p-ReSe2/n-ReS2二维异质结的气相控制合成及其各向异性光电性能研究,翟天佑,华中科技大学,80.0,2017-01至2018-12
2016,重大研究计划,A01,82,91640103,C050208,细菌来源的miRNA样小RNA的产生机制及在细菌-宿主相互作用中的功能,曾科,南京大学,85.0,2017-01至2019-12
2016,重大研究计划,A01,83,91646121,G020703,隐私大数据发掘与个性化营销研究,曾伏娥,武汉大学,43.0,2017-01至2019-12
2016,重大研究计划,A01,84,91637106,D0502,青藏高原复杂地形湍流结构及湍流强度参数化研究,岳平,中国气象局兰州干旱气象研究所,84.0,2017-01至2019-12
2016,重大研究计划,A01,85,91644221,D0512,气候变化背景下光化学活跃区大气氧化性演变对近地面臭氧污染的影响研究,袁自冰,华南理工大学,250.0,2017-01至2020-12
2016,重大研究计划,A01,86,91648121,F030705,共融机器人的视觉注意模型及其深度强化学习方法,袁泽剑,西安交通大学,70.0,2017-01至2019-12
2016,重大研究计划,A01,87,91641107,A011702,湍流燃烧的LES-PDF模拟方法及高精度格式研究,袁礼,中国科学院数学与系统科学研究院,50.0,2017-01至2019-12
2016,重大研究计划,A01,88,91634102,B081005,高温电气转化池中介尺度结构和过程耦合机理的研究,袁金良,宁波大学,67.0,2017-01至2019-12
2016,重大研究计划,A01,89,91640105,C050208,生殖细胞中小非编码RNA（piRNA）沉默转录的分子机制,俞洋,中国科学院生物物理研究所,85.0,2017-01至2019-12
2016,重大研究计划,A01,90,91622102,B01,超金属-金属成键导向手性超分子晶体材料的绝对不对称自组装,于澍燕,北京工业大学,80.0,2017-01至2018-12
2016,重大研究计划,A01,91,91638000,F01,指导专家组调研和组织学术会议费用,于全,中国人民解放军总参谋部第六十一研究所,100.0,2017-01至2017-12
2016,重大研究计划,A01,92,91645126,B020404,SOEC阴极表界面原位脱溶过渡金属对CO2协同电催化机制研究,于波,清华大学,75.0,2017-01至2019-12
2016,重大研究计划,A01,93,91622113,B0304,多极轴分子铁电薄膜,游雨蒙,东南大学,80.0,2017-01至2018-12
2016,重大研究计划,A01,94,91644224,D0512,对流输送和闪电对大气成分垂直分布的影响及其机理研究,银燕,南京信息工程大学,300.0,2017-01至2020-12
2016,重大研究计划,A01,95,91648204,F020205,群体智能机器人操作系统的机理、架构与技术研究,易晓东,中国人民解放军国防科技大学,290.0,2017-01至2020-12
2016,重大研究计划,A01,96,91642204,H0510,模式识别受体介导的足细胞免疫调控在肾小球疾病中的作用,易凡,山东大学,200.0,2017-01至2020-12
2016,重大研究计划,A01,97,91641112,E060605,OH示踪同时测量流场温度与速度方法研究,叶景峰,西北核技术研究所,60.0,2017-01至2019-12
2016,重大研究计划,A01,98,91637105,D0505,夏季青藏高原大气热源三维结构与切变线系统相互作用研究,姚秀萍,中国气象局气象干部培训学院,70.0,2017-01至2019-12
2016,重大研究计划,A01,99,91641110,E060405,液体火箭内煤油燃烧机理简化及湍流燃烧建模研究,姚卫,中国科学院力学研究所,60.0,2017-01至2019-12
2016,重大研究计划,A01,100,91622122,E0201,"层状三角晶格RExRhO2（RE=K,Na）晶体生长、RE精确调控及其与晶体拓扑量子特性关系的研究",姚淑华,南京大学,80.0,2017-01至2018-12
2016,重大研究计划,A01,101,91622123,E0201,具有π共轭平面结构单元的新型红外非线性光学材料的设计、合成、晶体生长和性能研究,姚吉勇,中国科学院理化技术研究所,80.0,2017-01至2018-12
2016,重大研究计划,A01,102,91648108,E050303,面向电子装配机器人高速精密运动实现关键技术,杨志军,广东工业大学,65.0,2017-01至2019-12
2016,重大研究计划,A01,103,91630313,A0117,复杂结构及其相变的多尺度模型与算法,杨志坚,武汉大学,250.0,2017-01至2019-12
2016,重大研究计划,A01,104,91642208,H1004,应用人源化小鼠研究皮肤区域免疫耐受机制,杨永广,吉林大学,200.0,2017-01至2020-12
2016,重大研究计划,A01,105,91632111,H0902,星型胶质细胞介导的BLP-vCA1神经环路损伤在阿尔茨海默病抑郁和空间记忆障碍中的作用及干预机制研究,杨莹,华中科技大学,60.0,2017-01至2019-12
2016,重大研究计划,A01,106,91643115,H0108,PM2.5对慢性气道性疾病患者呼吸道微生物生态影响的定群研究,杨汀,中日友好医院,90.0,2017-01至2019-12
2016,重大研究计划,A01,107,91637208,D0507,青藏高原与西亚、北非和南欧气候变异的相互影响,杨崧,中山大学,310.0,2017-01至2020-12
2016,重大研究计划,A01,108,91631104,C060101,基因组异质性对减数分裂重组影响的ChIP-seq实验验证,杨四海,南京大学,100.0,2017-01至2019-12
2016,重大研究计划,A01,109,91629102,H0310,肠道微生态对肠炎癌相关免疫细胞表观遗传修饰的调节,杨荣存,南开大学,93.0,2017-01至2018-12
2016,重大研究计划,A01,110,91645113,B03,合成气精准转化制二甲醚用胶囊催化剂的结构调控、改性及其限域空间反应机制的构建研究,杨国辉,中国科学院山西煤炭化学研究所,68.0,2017-01至2019-12
2016,重大研究计划,A01,111,91640112,C060604,lncRNA编码多肽高通量分析技术的建立及其应用,杨福全,中国科学院生物物理研究所,86.0,2017-01至2019-12
2016,重大研究计划,A01,112,91642118,H1904,TLR2信号途径在肝窦内皮细胞和库否细胞调控HBV特异性CTL活化中的作用及其机制研究,杨东亮,华中科技大学,60.0,2017-01至2019-12
2016,重大研究计划,A01,113,91636104,A040305,极性分子的精密光谱测量和激光冷却,颜波,浙江大学,75.0,2017-01至2019-12
2016,重大研究计划,A01,114,91632116,H0912,人脑分拣蛋白神经病变：病理发生机制与AD诊断应用探讨,严小新,中南大学,100.0,2017-01至2019-12
2016,重大研究计划,A01,115,91649115,H09,非人灵长类动物脑衰老分子机制的研究,闫森,暨南大学,70.0,2017-01至2019-12
2016,重大研究计划,A01,116,91636103,A040302,用并存磁力计探测自旋相关的新相互作用,闫海洋,中国工程物理研究院核物理与化学研究所,85.0,2017-01至2019-12
2016,重大研究计划,A01,117,91630203,A010504,不完全观测下信号恢复的理论与算法,许志强,中国科学院数学与系统科学研究院,170.0,2017-01至2019-12
2016,重大研究计划,A01,118,91646122,G011203,基于深度学习的多源异构质检大数据融合与分析技术研究,许应成,中国标准化研究院,43.0,2017-01至2019-12
2016,重大研究计划,A01,119,91641127,B030101,航空燃料芳烃组分宽范围燃烧反应动力学的理论计算研究,许雪飞,清华大学,60.0,2017-01至2019-12
2016,重大研究计划,A01,120,91637211,D0505,夏季青藏高原东移云团引发长江流域暴雨的研究,许小峰,中国气象局武汉暴雨研究所,317.0,2017-01至2020-12
2016,重大研究计划,A01,121,91647202,E0901,变化环境下的雅鲁藏布江流域径流响应与水文过程演变机理研究,徐宗学,北京师范大学,325.0,2017-01至2020-12
2016,重大研究计划,A01,122,91645116,B020103,CO高选择性酯化制精细化学品的催化剂设计与合成,徐忠宁,中国科学院福建物质结构研究所,75.0,2017-01至2019-12
2016,重大研究计划,A01,123,91637103,D0508,青藏高原陆-气耦合过程及其对中小尺度对流系统影响的高分辨率数值模拟研究,徐忠峰,中国科学院大气物理研究所,70.0,2017-01至2019-12
2016,重大研究计划,A01,124,91644223,D0512,青藏高原大气动力、热力过程对中国东部大气污染时空变异影响的机理,徐祥德,中国气象科学研究院,330.0,2017-01至2020-12
2016,重大研究计划,A01,125,91622101,A050701,同步辐射方法原位研究光功能钪/钇基金属有机骨架材料的构效关系及荧光传感机理,徐伟宏,中国科学院合肥物质科学研究院,70.0,2017-01至2018-12
2016,重大研究计划,A01,126,91632304,H0902,消退学习的神经环路可塑性及其分子机制,徐天乐,上海交通大学,220.0,2017-01至2019-12
2016,重大研究计划,A01,127,91643207,B0603,大气细颗粒物引起线粒体损伤介导的炎症反应及与儿童喘息、哮喘发病关系的研究,徐顺清,华中科技大学,285.0,2017-01至2020-12
2016,重大研究计划,A01,128,91630205,A0117,磁流体波传播问题的建模与计算,徐立伟,重庆大学,180.0,2017-01至2019-12
2016,重大研究计划,A01,129,91648103,E0501,柔性连续体分拣机器人的拓扑综合、动力学分析和运动控制,徐凯,上海交通大学,70.0,2017-01至2019-12
2016,重大研究计划,A01,130,91634106,E0414,介尺度范围下铁氧化物界面气固相反应-扩散竞争机制,徐健,重庆大学,67.0,2017-01至2019-12
2016,重大研究计划,A01,131,91632101,C0903,谱系依赖神经微环路形成的分子机制,徐华泰,中国科学院上海生命科学研究院,60.0,2017-01至2019-12
2016,重大研究计划,A01,132,91632303,H09,“窝/安全空间”记忆形成及其调控恐惧反应的环路机制,徐富强,中国科学院武汉物理与数学研究所,400.0,2017-01至2019-12
2016,重大研究计划,A01,133,91646123,G0109,大数据驱动的太湖流域水环境综合治理全景式情景重构与预测研究,徐峰,南京大学,43.0,2017-01至2019-12
2016,重大研究计划,A01,134,91649121,H2501,基于单细胞质谱及质谱成像技术的脑衰老向退行性变化演变相关化学小分子的研究,熊伟,中国科学技术大学,70.0,2017-01至2019-12
2016,重大研究计划,A01,135,91648203,E050702,修复与增强人体运动能力的穿戴式机器人基础研究,熊蔡华,华中科技大学,300.0,2017-01至2020-12
2016,重大研究计划,A01,136,91637313,D0512,青藏高原地-气系统多源信息综合数据共享平台研发,熊安元,国家气象信息中心,450.0,2017-01至2019-12
2016,重大研究计划,A01,137,91646202,F020512,面向全流程智慧健康管理决策的多源异构大数据融合方法研究,邢春晓,清华大学,240.0,2017-01至2020-12
2016,重大研究计划,A01,138,91639106,H0203,TRIM65介导的血管内皮细胞VCAM-1转录后修饰对血管炎症及动脉粥样硬化的影响及其机制,辛洪波,南昌大学,65.0,2017-01至2019-12
2016,重大研究计划,A01,139,91632201,H09,社交行为关键脑区海马CA2环路的解析及调控机制研究,谢维,东南大学,220.0,2017-01至2019-12
2016,重大研究计划,A01,140,91648120,F030606,基于演化博弈的智能群体控制理论及在共融机器人协作中的应用,谢广明,北京大学,65.0,2017-01至2019-12
2016,重大研究计划,A01,141,91631111,H1603,肠癌肿瘤细胞从原发到转移的单细胞微进化研究,谢丹,四川大学,83.0,2017-01至2019-12
2016,重大研究计划,A01,142,91636107,A040408,“光-原子”体系精密测量中的量子噪声机制及噪声抑制新方法,肖艳红,复旦大学,90.0,2017-01至2019-12
2016,重大研究计划,A01,143,91631102,C040204,鲤科鱼类低氧适应性进化的分子遗传机制,肖武汉,中国科学院水生生物研究所,100.0,2017-01至2019-12
2016,重大研究计划,A01,144,91639101,H0109,微小RNA-222在运动防治肺动脉高压所致肺血管重构中的作用及机制研究,肖俊杰,上海大学,65.0,2017-01至2019-12
2016,重大研究计划,A01,145,91640107,C0606,长非编码RNA-lncSUN调控番茄果实发育的作用机理,肖晗,中国科学院上海生命科学研究院,80.0,2017-01至2019-12
2016,重大研究计划,A01,146,91634201,B080303,高性能、低成本的多尺度孔道与结构催化材料,肖丰收,浙江大学,300.0,2017-01至2020-12
2016,重大研究计划,A01,147,91649120,H2501,肠道菌群孔道形成毒素和三叶因子复合物在血管内皮衰老中的作用机制,向阳,南昌大学,60.0,2017-01至2019-12
2016,重大研究计划,A01,148,91646207,G011203,城市道路交通大数据融合方法研究,向世明,中国科学院自动化研究所,240.0,2017-01至2020-12
