year,grant,sub,num,id,subject,title,author,school,money,duration
2001,重大研究计划,A01,1,90101013,E0309,新型有机TFT器件的原理性研究,邹德春,北京大学,22.0,2002-01至2004-12
2001,重大研究计划,A01,2,90101003,A040204,低维半导体结构中杂质及少体作用对光电量子特性的影响,朱嘉麟,清华大学,25.0,2002-01至2004-12
2001,重大研究计划,A01,3,90103027,A040203,受限小量子系统物理和介观输运理论,朱邦芬,清华大学,120.0,2002-01至2004-12
2001,重大研究计划,A01,4,90104014,F010202,OFDM宽带无线传输系统的理论研究与关键技术实现,赵玉萍,北京大学,30.0,2002-01至2004-12
2001,重大研究计划,A01,5,90101005,F050903,全彩色电子墨水微胶囊的制备及其动态响应研究,赵晓鹏,西北工业大学,24.0,2002-01至2004-12
2001,重大研究计划,A01,6,90103019,A050306,相对论重离子碰撞及真空的性质,赵维勤,中国科学院高能物理研究所,45.0,2002-01至2004-12
2001,重大研究计划,A01,7,90104010,F010201,形式化的协议理论,赵保华,中国科学技术大学,30.0,2002-01至2004-12
2001,重大研究计划,A01,8,90103020,A0503,重子结构及双重子结构的夸克模型研究,张宗烨,中国科学院高能物理研究所,37.5,2002-01至2004-12
2001,重大研究计划,A01,9,90103016,A050202,量子色动力学（QCD）一些前沿问题研究,张肇西,中国科学院理论物理研究所,15.0,2002-01至2004-12
2001,重大研究计划,A01,10,90104013,F010204,面向头肩序列图像的鲁棒视频传输技术研究,张延华,北京工业大学,31.0,2002-01至2004-12
2001,重大研究计划,A01,11,90102010,D0503,西部生态环境20年要素演变的卫星遥感研究,张文建,国家卫星气象中心,80.0,2002-01至2005-12
2001,重大研究计划,A01,12,90104019,F010204,宽带COFDM调制中的关键技术,张海林,西安电子科技大学,28.0,2002-01至2004-12
2001,重大研究计划,A01,13,90101022,E0204,抗光损伤近化学计量比铌酸锂晶体与全光微结构研究,张光寅,南开大学,130.0,2002-01至2004-12
2001,重大研究计划,A01,14,90103001,A050201,非对易空间量子场论与相关的可积系统研究,岳瑞宏,西北大学,45.0,2002-01至2004-12
2001,重大研究计划,A01,15,90103004,A050201,超弦理论研究,喻明,中国科学院理论物理研究所,97.5,2002-01至2004-12
2001,重大研究计划,A01,16,90101028,B0105,分子光电功能材料,游效曾,南京大学,140.0,2002-01至2004-12
2001,重大研究计划,A01,17,90104018,F010102,基于正交频分复用的高速蜂窝因特网理论及关键技术研究,尹长川,北京邮电大学,30.0,2002-01至2004-12
2001,重大研究计划,A01,18,90102005,D010104,2000年来高分辨率气候环境记录研究,姚檀栋,中国科学院寒区旱区环境与工程研究所,100.0,2002-01至2004-12
2001,重大研究计划,A01,19,90104024,F010104,网络应用的自动生成理论研究,杨放春,北京邮电大学,30.0,2002-01至2004-12
2001,重大研究计划,A01,20,90103002,A050201,非微扰量子场论中的若干前沿问题,闫沐霖,中国科学技术大学,15.0,2002-01至2004-12
2001,重大研究计划,A01,21,90103036,B0307,溶剂分子体积对高分子溶液相行为的影响及临界现象,薛奇,南京大学,30.0,2002-01至2004-12
2001,重大研究计划,A01,22,90104004,A010206,信息安全技术及其在网络环境下的工程实现,徐茂智,北京大学,80.0,2002-01至2005-12
2001,重大研究计划,A01,23,90104003,F010205,Tb/s级WDM光网络及其智能节点功能的研究,谢世钟,清华大学,350.0,2002-01至2005-12
2001,重大研究计划,A01,24,90102004,C0307,河西走廊内流区生态安全评价与景观规划预案研究,肖笃宁,中国科学院寒区旱区环境与工程研究所,100.0,2002-01至2004-12
2001,重大研究计划,A01,25,90102003,D0702,西北干旱区地表—地下水系统变化及其植被生态效应,仵彦卿,中国科学院寒区旱区环境与工程研究所,90.0,2002-01至2004-12
2001,重大研究计划,A01,26,90103014,A050203,中微子物理和味动力学以及CP不守恒,吴岳良,中国科学院理论物理研究所,37.5,2002-01至2004-12
2001,重大研究计划,A01,27,90103026,A050102,波色--爱因斯坦凝聚体链的隧道效应和孤子型激发的研究,吴颖,华中科技大学,15.0,2002-01至2004-12
2001,重大研究计划,A01,28,90104033,A0114,电子商务安全支付协议的研究,吴世忠,中国信息安全产品测评认证中心,20.0,2002-01至2004-12
2001,重大研究计划,A01,29,90104002,F0208,下一代互联网络体系结构及其协议理论研究,吴建平,清华大学,200.0,2002-01至2005-12
2001,重大研究计划,A01,30,90103012,A0502,J/ψ物理和胶球与混杂态的理论研究,吴济民,中国科学院高能物理研究所,15.0,2002-01至2004-12
2001,重大研究计划,A01,31,90103034,A040204,有机固体物性的理论研究,吴长勤,复旦大学,60.0,2002-01至2004-12
2001,重大研究计划,A01,32,90103021,A040202,强关联电子系统中的若干前沿问题,翁征宇,清华大学,37.5,2002-01至2004-12
2001,重大研究计划,A01,33,90104025,F010201,网络中关键系统的灾难恢复技术,王志英,中国人民解放军国防科技大学,20.0,2002-01至2004-12
2001,重大研究计划,A01,34,90103024,A040202,低维强关联体系电子态性质研究,王玉鹏,中国科学院物理研究所,60.0,2002-01至2004-12
2001,重大研究计划,A01,35,90103031,A040215,蛋白质序列分析、结构预测和折叠动力学及其相关问题,王炜,南京大学,67.5,2002-01至2004-12
2001,重大研究计划,A01,36,90101023,F040302,光网络用放大器电吸收调制器和模斑转换串接集成材料与器件的研,王圩,中国科学院半导体研究所,140.0,2002-01至2004-12
2001,重大研究计划,A01,37,90101017,F040108,三基色及白色有机微腔发光二极管的研制,王立军,中国科学院长春光学精密机械与物理研究所,24.0,2002-01至2004-12
2001,重大研究计划,A01,38,90104027,F0208,网络安全攻击行为的分类体系及判定模型,王继龙,清华大学,20.0,2002-01至2004-12
2001,重大研究计划,A01,39,90104007,F010201,实时容错协议的形式化技术,王戟,中国人民解放军国防科技大学,20.0,2002-01至2004-12
2001,重大研究计划,A01,40,90102015,C0305,绿洲戈壁过渡带土植气界面物质能量交换与群落稳定性,王根轩,兰州大学,70.0,2002-01至2004-12
2001,重大研究计划,A01,41,90103018,A050306,基于QCD的低能强子物理,王凡,南京大学,30.0,2002-01至2004-12
2001,重大研究计划,A01,42,90101004,F040501,量子点应力场分布及电子结构与器件应用研究,王崇愚,清华大学,25.0,2002-01至2004-12
2001,重大研究计划,A01,43,90102011,C170203,草地农业生态系统健康评价,万长贵,兰州大学,80.0,2002-01至2005-12
2001,重大研究计划,A01,44,90102001,D0711,历史时期典型岩溶环境的自然变化与人类影响：石笋记录,谭明,中国科学院地质与地球物理研究所,40.0,2002-01至2005-12
2001,重大研究计划,A01,45,90104016,F010202,宽带高速无线通信传输理论及关键技术,谈振辉,北京交通大学,31.0,2002-01至2004-12
2001,重大研究计划,A01,46,90101006,E0309,芳杂环高分子稀土螯合物软磁性材料制备,孙维林,浙江大学,25.0,2002-01至2004-12
2001,重大研究计划,A01,47,90101008,E0309,酞菁基光伏极性反转半导体纳米复合材料,孙景志,浙江大学,25.0,2002-01至2004-12
2001,重大研究计划,A01,48,90103000,A05,理论物理学及其交叉科学若干前沿问题总体研究,苏肇冰,中国科学院理论物理研究所,200.0,2002-01至2006-12
2001,重大研究计划,A01,49,90104001,F010201,下一代网络体系结构模型及超高速网络交换与路由研究,苏金树,中国人民解放军国防科技大学,100.0,2002-01至2005-12
2001,重大研究计划,A01,50,90103023,A04,低维多电子系统物理性质的理论研究,苏刚,中国科学院大学,15.0,2002-01至2004-12
2001,重大研究计划,A01,51,90104015,F010104,高速宽带无线IP网络性能与服务,舒炎泰,天津大学,30.0,2002-01至2004-12
2001,重大研究计划,A01,52,90104021,F02,网络信息的智能获取理论研究,史忠植,中国科学院计算技术研究所,30.0,2002-01至2004-12
2001,重大研究计划,A01,53,90101021,F010705,基于纳米量子结构的声子泵浦型硅基激光器探索,施毅,南京大学,22.0,2002-01至2004-12
2001,重大研究计划,A01,54,90101000,E02,光电信息功能材料重大研究计划,沈家骢,吉林大学,200.0,2002-01至2006-12
2001,重大研究计划,A01,55,90102012,D070102,坡面土壤-植被-大气界面物质交换过程与模拟,邵明安,中国科学院水利部水土保持研究所,100.0,2002-01至2005-12
2001,重大研究计划,A01,56,90103010,A050202,胶子球中几个理论问题的研究,阮图南,中国科学技术大学,15.0,2002-01至2004-12
2001,重大研究计划,A01,57,90101029,E030901,高性能有机电致发光软屏的研制,邱勇,清华大学,120.0,2002-01至2004-12
2001,重大研究计划,A01,58,90101007,E0204,光通信波段高效无机－有机复合有源平面,钱国栋,浙江大学,24.0,2002-01至2004-12
2001,重大研究计划,A01,59,90104022,F0208,动态构造的网管系统模型的实现方法研究,钱德沛,北京航空航天大学,30.0,2002-01至2004-12
2001,重大研究计划,A01,60,90104023,F010201,网络管理质量的评估模型,亓峰,北京邮电大学,30.0,2002-01至2004-12
2001,重大研究计划,A01,61,90102009,C030602,新疆天山中段植被演变研究,倪健,中国科学院植物研究所,80.0,2002-01至2005-12
2001,重大研究计划,A01,62,90103003,A0501,多电子系统物理性质的理论研究,马中骐,中国科学院高能物理研究所,7.5,2002-01至2004-12
2001,重大研究计划,A01,63,90103035,A0401,聚合物和复杂流体,马余强,南京大学,30.0,2002-01至2004-12
2001,重大研究计划,A01,64,90102006,D010104,冻土环境对青藏铁路工程建设的影响及工程的环境效应,马巍,中国科学院寒区旱区环境与工程研究所,100.0,2002-01至2004-12
2001,重大研究计划,A01,65,90103007,A050202,超子的自旋与味道结构,马伯强,北京大学,15.0,2002-01至2004-12
2001,重大研究计划,A01,66,90102014,D010105,内蒙古河套灌区浅层地下水动态变化的生态环境效应,罗毅,中国科学院地理科学与资源研究所,70.0,2002-01至2004-12
2001,重大研究计划,A01,67,90103009,A050203,标准模型和标准模型外新物理的系统理论分析,罗民兴,浙江大学,15.0,2002-01至2004-12
2001,重大研究计划,A01,68,90103030,C050101,从mRNA序列经肽链的α和β折叠到蛋白质框架结构规律探索,罗辽复,内蒙古大学,30.0,2002-01至2004-12
2001,重大研究计划,A01,69,90101018,B010307,多个D--π--A单元非共轭组合的有机非线性材料的合成组装,陆国元,南京大学,23.0,2002-01至2004-12
2001,重大研究计划,A01,70,90101011,A040204,用飞秒脉冲激光研究锗硅量子点的泡利阻塞现象,陆昉,复旦大学,25.0,2002-01至2004-12
2001,重大研究计划,A01,71,90102008,H1907,西部开发中自然环境变化对重要虫媒病传播影响的研究,陆宝麟,中国人民解放军军事科学院军事医学研究院,70.0,2002-01至2004-12
2001,重大研究计划,A01,72,90104012,F010206,因特网拥塞控制机制的研究,刘增基,西安电子科技大学,30.0,2002-01至2004-12
2001,重大研究计划,A01,73,90103032,C050101,蛋白质空间结构理论模拟新方法,刘海燕,中国科学技术大学,30.0,2002-01至2004-12
2001,重大研究计划,A01,74,90101002,F0401,量子点、量子线结构纳米衍射光学元件探索,刘峰奇,中国科学院半导体研究所,22.0,2002-01至2004-12
2001,重大研究计划,A01,75,90103006,A050202,强子及其相互作用的格点量子色动力学的研究,刘川,北京大学,15.0,2002-01至2004-12
2001,重大研究计划,A01,76,90101012,F040104,LiTaO3/Si结构的智能剥离(Smart-cut)研究,林成鲁,中国科学院上海微系统与信息技术研究所,23.0,2002-01至2004-12
2001,重大研究计划,A01,77,90104032,A0114,高效率盲数字签名技术和电子支付系统的研究与实现,李子臣,清华大学,16.0,2002-01至2004-12
2001,重大研究计划,A01,78,90104006,F0208,大规模互联网网络行为测量和分析方法,李忠诚,中国科学院计算技术研究所,30.0,2002-01至2004-12
2001,重大研究计划,A01,79,90102016,D0712,典型山地-绿洲-荒漠系统的演变及其预测模型,李有利,北京大学,80.0,2002-01至2005-12
2001,重大研究计划,A01,80,90101015,E020601,在表面上定位生长单壁碳纳米管,李彦,北京大学,21.0,2002-01至2004-12
2001,重大研究计划,A01,81,90102000,D01,中国西部环境和生态科学总体研究,李秀彬,中国科学院地理科学与资源研究所,200.0,2002-01至2009-12
2001,重大研究计划,A01,82,90103017,A050203,费米子代疑难问题的深入研究,李小源,中国科学院理论物理研究所,15.0,2002-01至2004-12
2001,重大研究计划,A01,83,90104008,F0208,互联网网络行为的物理学测量和分析研究,李未,北京航空航天大学,30.0,2002-01至2004-12
2001,重大研究计划,A01,84,90103005,A0502,顶夸克和希格斯物理以及超对称唯象学的研究,李重生,北京大学,15.0,2002-01至2004-12
2001,重大研究计划,A01,85,90103029,A040215,蛋白质新折叠模式预测,来鲁华,北京大学,22.5,2002-01至2004-12
2001,重大研究计划,A01,86,90103008,A050204,高能对撞机物理,邝宇平,清华大学,30.0,2002-01至2004-12
2001,重大研究计划,A01,87,90104030,F01,面向大规模网络的分布式入侵检测和预警模型,荆继武,中国科学院大学,50.0,2002-01至2004-12
2001,重大研究计划,A01,88,90101016,E030901,纳米催化的三维周期性微结构制备新技术的探索研究,蒋民华,山东大学,25.0,2002-01至2004-12
2001,重大研究计划,A01,89,90104020,F02,新一代网络中间件的体系结构、协议及实现机制,贾焰,中国人民解放军国防科技大学,50.0,2002-01至2004-12
2001,重大研究计划,A01,90,90104017,F010205,智能光网的组网及网络管理研究,纪越峰,北京邮电大学,30.0,2002-01至2004-12
2001,重大研究计划,A01,91,90101001,E03,有机高分子/无机纳米半导体杂化功能材料,姬相玲,中国科学院长春应用化学研究所,25.0,2002-01至2004-12
2001,重大研究计划,A01,92,90101020,F040104,自组装有序、微区定域纳米Si量子点阵列的新技术,黄信凡,南京大学,21.0,2002-01至2004-12
2001,重大研究计划,A01,93,90102002,D0704,中国西部特殊地质环境条件形成机理及工程环境效应研究,黄润秋,成都理工大学,100.0,2002-01至2005-12
2001,重大研究计划,A01,94,90103015,A050201,重味、超对称和新物理探索,黄朝商,中国科学院理论物理研究所,22.5,2002-01至2004-12
2001,重大研究计划,A01,95,90104034,A010206,信息安全关键密码理论与技术研究及信息安全通道设计,胡磊,广州大学,22.0,2002-01至2004-12
2001,重大研究计划,A01,96,90104029,F020704,网络数据传输中的主动防御技术研究,胡汉平,华中科技大学,20.0,2002-01至2004-12
2001,重大研究计划,A01,97,90104011,F010201,下一代网络的体系结构、协议模型与机制,洪佩琳,中国科学技术大学,50.0,2002-01至2004-12
2001,重大研究计划,A01,98,90103037,B0307,外场诱导聚合物的软有序化,何天白,中国科学院长春应用化学研究所,60.0,2002-01至2004-12
2001,重大研究计划,A01,99,90101024,F010205,光子带隙材料及其应用,何赛灵,浙江大学,140.0,2002-01至2004-12
2001,重大研究计划,A01,100,90101009,F040104,硅基铌酸锂光电信息功能薄膜的研究,何军辉,浙江大学,24.0,2002-01至2004-12
2001,重大研究计划,A01,101,90104035,A010206,网络密码分析与应用技术研究,韩文报,中国人民解放军战略支援部队信息工程大学,22.0,2002-01至2004-12
2001,重大研究计划,A01,102,90104009,F0208,下一代网络服务体系结构及其关键技术的研究,顾冠群,东南大学,30.0,2002-01至2004-12
2001,重大研究计划,A01,103,90103038,A0402,材料设计中的一些基础物理问题的理论研究,龚新高,复旦大学,70.0,2002-01至2004-12
2001,重大研究计划,A01,104,90101027,A040409,若干新型光子器件的飞秒多光子微制备及机理研究,龚旗煌,北京大学,130.0,2002-01至2004-12
2001,重大研究计划,A01,105,90104031,F0208,面向大规模网络的分布式入侵检测和预警模型,龚俭,东南大学,50.0,2002-01至2004-12
2001,重大研究计划,A01,106,90101014,B010307,新型π共扼分子体系的合成及其光电性能,甘良兵,北京大学,25.0,2002-01至2004-12
2001,重大研究计划,A01,107,90102018,D010105,黄土丘陵沟壑区景观格局演变与水土流失机理,傅伯杰,中国科学院生态环境研究中心,100.0,2002-01至2004-12
2001,重大研究计划,A01,108,90103033,A0112,生物信息学中信息理论方法的研究与应用,方伟武,中国科学院数学与系统科学研究院,22.5,2002-01至2004-12
2001,重大研究计划,A01,109,90103011,A050203,B介子弱衰变及稀有衰变研究,杜东生,中国科学院高能物理研究所,15.0,2002-01至2004-12
2001,重大研究计划,A01,110,90102013,D010203,中国西北近50年城市化与环境互动作用机理,董锁成,中国科学院地理科学与资源研究所,80.0,2002-01至2004-12
2001,重大研究计划,A01,111,90103013,A0502,LHC和Tevatron上的高能物理的研究,陈裕启,中国科学院理论物理研究所,50.0,2002-01至2004-12
2001,重大研究计划,A01,112,90102007,C030604,塔里木河下游浅层地下水变化的生态效应及生态系统健康评价研究,陈亚宁,中国科学院新疆生态与地理研究所,80.0,2002-01至2004-12
2001,重大研究计划,A01,113,90104005,A010206,网上信息收集和分析的基础问题和模型研究,陈克非,上海交通大学,80.0,2002-01至2005-12
2001,重大研究计划,A01,114,90104000,F02,网络与信息安全,陈俊亮,北京邮电大学,200.0,2002-01至2006-12
2001,重大研究计划,A01,115,90104028,F0208,基于伪装网技术的网络防护理论与应用,陈建二,中南大学,20.0,2002-01至2004-12
2001,重大研究计划,A01,116,90104026,F020201,安全协议的形式化描述和分析,陈火旺,中国人民解放军国防科技大学,30.0,2002-01至2004-12
2001,重大研究计划,A01,117,90103022,A0402,强关联多电子系统若干理论问题的研究,陈鸿,同济大学,82.5,2002-01至2004-12
2001,重大研究计划,A01,118,90103025,A040405,亚皮秒强激光在充气毛细管中传输的理论研究,陈宝振,北京师范大学,15.0,2002-01至2004-12
2001,重大研究计划,A01,119,90101019,B050202,新型高效、高选择性共轭荧光聚合物生物传感器,曹镛,华南理工大学,25.0,2002-01至2004-12
2001,重大研究计划,A01,120,90103028,A040204,受限小量子系统的理论研究,鲍诚光,中山大学,45.0,2002-01至2004-12
2001,重大研究计划,A01,121,90102017,D0711,我国西部干旱环境的演变规律与发展趋势,安芷生,中国科学院地球环境研究所,80.0,2002-01至2004-12
2001,重大研究计划,A01,122,90101010,B0305,染料敏化纳米光电转换材料的超快动力学机理,艾希成,中国科学院化学研究所,25.0,2002-01至2004-12
