year,grant,sub,num,id,subject,title,author,school,money,duration
2016,重大研究计划,A01,295,91649105,C0901,变异亨廷顿蛋白下游基因通过抑制自吞噬参与神经衰老与退行的分子机制,鲁伯埙,复旦大学,70.0,2017-01至2019-12
2016,重大研究计划,A01,296,91636215,A040302,用冷原子方法寻找逆磁性原子的固有电偶极矩,卢征天,中国科学技术大学,360.0,2017-01至2020-12
2016,重大研究计划,A01,297,91646104,G0112,社会网络行为传播扩散的统计方法研究与应用,卢乃吉,哈尔滨工业大学,43.0,2017-01至2019-12
2016,重大研究计划,A01,298,91623000,E0512,纳米制造战略研究和学术交流,卢秉恒,西安交通大学,187.88,2017-01至2017-12
2016,重大研究计划,A01,299,91634203,B080304,带变量约束的非合作博弈及其在化工介尺度结构研究中的应用,刘志新,中国科学院数学与系统科学研究院,260.0,2017-01至2020-12
2016,重大研究计划,A01,300,91647116,E090303,电站调峰作用下的澜沧江下游水动力及底栖动物变化规律,刘昭伟,清华大学,75.0,2017-01至2019-12
2016,重大研究计划,A01,301,91631110,C010803,细胞感染模型中RNA病毒的准种微进化理论和方法学研究,刘翟,中国科学院微生物研究所,83.0,2017-01至2018-12
2016,重大研究计划,A01,302,91645117,B0201,多孔碳化硅担载钴基费托催化剂的研制及钴纳米颗粒晶相和原子排布的调控,刘岳峰,中国科学院大连化学物理研究所,75.0,2017-01至2019-12
2016,重大研究计划,A01,303,91641128,B030104,航空发动机碳氢燃料低污染燃烧反应机理的分子模拟研究,刘轶,上海大学,59.0,2017-01至2019-12
2016,重大研究计划,A01,304,91646101,G0310,大数据驱动的“微观-宏观”跨尺度建模与决策范式研究,刘奕,清华大学,43.0,2017-01至2019-12
2016,重大研究计划,A01,305,91637312,D0507,青藏高原地-气耦合过程和海洋对区域能量和水分循环及全球气候的协同影响,刘屹岷,中国科学院大气物理研究所,335.0,2017-01至2019-12
2016,重大研究计划,A01,306,91636101,A030604,高精度远距离光纤光学频率传递研究,刘涛,中国科学院国家授时中心,90.0,2017-01至2019-12
2016,重大研究计划,A01,307,91644222,D0512,气候变化对大气复合污染的影响过程与机制,刘绍臣,暨南大学,263.0,2017-01至2020-12
2016,重大研究计划,A01,308,91646113,G011201,大数据驱动的医疗健康个性化服务价值测度与个性化能力构建研究,刘汕,西安交通大学,43.0,2017-01至2019-12
2016,重大研究计划,A01,309,91640201,C050208,PIWI/piRNA在哺乳动物精子形成及男性不育中的功能机制,刘默芳,中国科学院上海生命科学研究院,310.0,2017-01至2020-12
2016,重大研究计划,A01,310,91634113,B080304,流化床化学气相沉积过程纳米粒子凝聚/合并/分散的介尺度机制及调控,刘马林,清华大学,67.0,2017-01至2019-12
2016,重大研究计划,A01,311,91646105,G0306,大数据驱动的面向城市基层社会治理的管理与决策模式研究,刘鲁宁,哈尔滨工业大学,43.0,2017-01至2019-12
2016,重大研究计划,A01,312,91632107,C0913,果蝇视觉学习记忆的功能神经回路解析,刘力,中国科学院生物物理研究所,60.0,2017-01至2019-12
2016,重大研究计划,A01,313,91649201,C0902,Vimar/RAP1GDS1介导神经元衰老中线粒体功能降低的作用及机制,刘磊,首都医科大学,270.0,2017-01至2020-12
2016,重大研究计划,A01,314,91649205,H2501,溶酶体ATP酶ATP13A2在帕金森氏病运动及行为障碍中的作用机制,刘俊平,杭州师范大学,230.0,2017-01至2020-12
2016,重大研究计划,A01,315,91647203,E0901,雅鲁藏布江流域水文过程多尺度监测研究,刘九夫,水利部交通运输部国家能源局南京水利科学研究院,400.0,2017-01至2020-12
2016,重大研究计划,A01,316,91647108,E090102,拉萨河典型流域表层结构与径流响应关系的解析及模拟研究,刘金涛,河海大学,75.0,2017-01至2019-12
2016,重大研究计划,A01,317,91649106,C110308,心肌衰老中mtDNA甲基化的作用及分子机制,刘健康,西安交通大学,60.0,2017-01至2019-12
2016,重大研究计划,A01,318,91647111,E090102,尼洋河流域径流组成地球化学指示性因子示踪实验研究,刘宏伟,水利部交通运输部国家能源局南京水利科学研究院,65.0,2017-01至2019-12
2016,重大研究计划,A01,319,91643112,B060301,北京市大气PM 2.5诱导产生羟基自由基的定量及相关毒性组分分析,刘国全,北京大学,90.0,2017-01至2019-12
2016,重大研究计划,A01,320,91642107,H0104,肺C类纤维在RSV感染早期区域抗病毒免疫反应与后期介导肺部II类免疫反应的作用机制研究,刘恩梅,重庆医科大学,60.0,2017-01至2019-12
2016,重大研究计划,A01,321,91639304,H0203,血管损伤新模型的建立和研发,刘德培,中国医学科学院基础医学研究所,280.0,2017-01至2019-12
2016,重大研究计划,A01,322,91647207,E090303,澜沧江流域水电梯级开发对生源物质的影响研究,刘德富,湖北工业大学,325.0,2017-01至2020-12
2016,重大研究计划,A01,323,91647106,E0901,河库系统内供水-发电-环境互馈关系机理与演进规律,刘德地,武汉大学,75.0,2017-01至2019-12
2016,重大研究计划,A01,324,91643103,H0214,Exosome/TLR4通路在细颗粒物诱发血压升高中的作用机制,刘翠清,浙江中医药大学,82.0,2017-01至2019-12
2016,重大研究计划,A01,325,91649114,H09,衰老及帕金森病的发病过程中生物节律异常的作用研究,刘春风,苏州大学,60.0,2017-01至2019-12
2016,重大研究计划,A01,326,91622118,B050101,硼磷酸盐无铍深紫外非线性光学材料的设计与制备,林哲帅,中国科学院理化技术研究所,80.0,2017-01至2018-12
2016,重大研究计划,A01,327,91628301,D0603,南海海盆的深部结构和扩张过程的集成研究,林间,中国科学院南海海洋研究所,253.0,2017-01至2019-12
2016,重大研究计划,A01,328,91641111,E060405,湍流火焰与壁面油膜相互作用机理研究,梁兴雨,天津大学,60.0,2017-01至2019-12
2016,重大研究计划,A01,329,91641201,E060405,航空航天发动机中高速湍流燃烧过程的LES-PDF方法,梁剑寒,中国人民解放军国防科技大学,240.0,2017-01至2020-12
2016,重大研究计划,A01,330,91645124,B081001,兼具分离与催化功能的双相透氧膜及甲烷芳构化研究,梁方义,中国科学院青岛生物能源与过程研究所,75.0,2017-01至2019-12
2016,重大研究计划,A01,331,91643105,B040101,用于大气颗粒物对信号通路影响研究的无损采样及细胞暴露新方法,练鸿振,南京大学,90.0,2017-01至2019-12
2016,重大研究计划,A01,332,91633301,E0309,柔性有机/聚合物太阳电池材料和器件的研究,李永舫,中国科学院化学研究所,1250.0,2017-01至2019-12
2016,重大研究计划,A01,333,91640111,C060604,哺乳动物中病毒特异性siRNA的功能机制,李杨,复旦大学,86.0,2017-01至2019-12
2016,重大研究计划,A01,334,91642111,H0812,骨髓微环境对抗白血病中心记忆T细胞的影响和机制,李扬秋,暨南大学,60.0,2017-01至2019-12
2016,重大研究计划,A01,335,91625000,D0702,黑河流域水资源综合管理战略研究,李秀彬,中国科学院地理科学与资源研究所,250.0,2017-01至2018-12
2016,重大研究计划,A01,336,91644108,D0510,基于大气氧化中间态物种的大气HOx自由基来源和活性研究,李歆,北京大学,100.0,2017-01至2019-12
2016,重大研究计划,A01,337,91625103,D0702,流域水资源管理中长期决策方法研究,李新,中国科学院寒区旱区环境与工程研究所,100.0,2017-01至2017-12
2016,重大研究计划,A01,338,91641102,E060404,利用大规模反应分子动力学模拟揭示航空发动机燃料燃烧的全景式产物演化及反应机理,李晓霞,中国科学院过程工程研究所,60.0,2017-01至2019-12
2016,重大研究计划,A01,339,91629103,H1602,REGgamma蛋白酶体系统介导肠道炎症与恶性结肠肿瘤的机制研究,李晓涛,华东师范大学,84.0,2017-01至2018-12
2016,重大研究计划,A01,340,91625101,D0101,黑河流域典型生态系统水分收支与区域生态需水研究,李小雁,北京师范大学,100.0,2017-01至2017-12
2016,重大研究计划,A01,341,91647102,D010104,长江源区有机碳的迁移转化及冰冻圈过程的影响机制研究,李向应,河海大学,75.0,2017-01至2019-12
2016,重大研究计划,A01,342,91642202,H01,嗜酸性粒细胞调控肺局部免疫反应的作用和分子机制研究,李雯,浙江大学,200.0,2017-01至2020-12
2016,重大研究计划,A01,343,91643113,B060301,黑碳和黑碳-污染物复合体诱发肺部炎症反应的作用机理研究,李文雍,阜阳师范学院,75.0,2017-01至2019-12
2016,重大研究计划,A01,344,91648111,E051002,双机器人协同测量手-眼标定与运动规划,李文龙,华中科技大学,70.0,2017-01至2019-12
2016,重大研究计划,A01,345,91632103,C0911,负面情绪记忆遗忘机制的神经环路研究,李卫东,上海交通大学,60.0,2017-01至2019-12
2016,重大研究计划,A01,346,91649202,C120208,自噬在迟发性性腺机能减退发生过程中功能和作用机制的研究,李卫,中国科学院动物研究所,260.0,2017-01至2020-12
2016,重大研究计划,A01,347,91642116,H1103,Langerhans细胞不同亚群在特应性皮炎中的作用及机制研究,李巍,复旦大学,60.0,2017-01至2019-12
2016,重大研究计划,A01,348,91645202,B020103,碳基载能分子高效转化的理论计算研究,李微雪,中国科学技术大学,270.0,2017-01至2020-12
2016,重大研究计划,A01,349,91646116,G011203,基于大数据的灾难信息挖掘与决策支持的关键技术研究,李涛,南京邮电大学,42.0,2017-01至2019-12
2016,重大研究计划,A01,350,91641204,E060405,极端条件下发动机燃烧不稳定性的电场及等离子体控制基础研究,李水清,清华大学,300.0,2017-01至2020-12
2016,重大研究计划,A01,351,91641115,E060406,煤油高氧燃比跨临界湍流燃烧雾化/蒸发及火焰特性研究,李森,中国科学院力学研究所,60.0,2017-01至2019-12
2016,重大研究计划,A01,352,91630310,A011701,辐射输运问题的新型模型约简和高效数值方法研究,李若,北京大学,200.0,2017-01至2019-12
2016,重大研究计划,A01,353,91637104,D0504,亚洲夏季风系统控制下地面排放大气污染物的分布特征及其向UTLS区域输送过程的研究,李倩,中国科学院大气物理研究所,91.0,2017-01至2019-12
2016,重大研究计划,A01,354,91641122,E060405,燃气轮机MILD燃烧湍流反应机制、稳定性极限及大涡模拟模型,李鹏飞,华中科技大学,60.0,2017-01至2019-12
2016,重大研究计划,A01,355,91645203,B03,甲烷无氧直接转化催化剂的设计及动态机理研究,李隽,清华大学,320.0,2017-01至2020-12
2016,重大研究计划,A01,356,91638202,F010606,基于任务驱动的动态重构空间信息网络体系设计与关键技术研究,李建东,西安电子科技大学,289.0,2017-01至2020-12
2016,重大研究计划,A01,357,91637210,D0507,大气环流模式对青藏高原陡峭地形区降水模拟的改进研究,李建,中国气象科学研究院,300.0,2017-01至2020-12
2016,重大研究计划,A01,358,91649119,H0929,猕猴模型探讨脑老化过程中DNA甲基化和去甲基化的表观遗传调控作用,李家立,中国科学院昆明动物研究所,70.0,2017-01至2019-12
2016,重大研究计划,A01,359,91649111,H0413,睾酮调控肝脏miR-361-5p/miR-125a-5p在LOH中的作用及机制研究,李红钢,华中科技大学,60.0,2017-01至2019-12
2016,重大研究计划,A01,360,91645104,B020404,基于金属氧化物/金属复合纳米管二氧化碳的高效转化及其机理研究,李高仁,中山大学,75.0,2017-01至2019-12
2016,重大研究计划,A01,361,91631107,C060502,利用正常人类乳腺上皮细胞MCF10A模型分析单个细胞进化成肿瘤细胞的基因组特征,李枫,武汉大学,83.0,2017-01至2019-12
2016,重大研究计划,A01,362,91640106,C0508,发展蛋白质-RNA相互作用高效新方法研究长非编码RNA调控组蛋白甲基化机制,李发慧,中国科学院生物物理研究所,85.0,2017-01至2019-12
2016,重大研究计划,A01,363,91643106,B0603,大气细颗粒物毒性组分对呼吸道病原菌耐药性的影响机制研究,李丹,复旦大学,90.0,2017-01至2019-12
2016,重大研究计划,A01,364,91646117,G021101,基于大数据技术的互联网产品众筹参与行为研究,李大辉,天津理工大学,43.0,2017-01至2019-12
2016,重大研究计划,A01,365,91641123,A020415,超声速流动中近壁区湍流与燃烧相互作用的大涡模拟研究,李椿萱,北京航空航天大学,60.0,2017-01至2019-12
2016,重大研究计划,A01,366,91632115,H0912,阿尔兹海默氏症tau蛋白对皮层环路功能的调控及治疗策略的筛选,雷鹏,四川大学,60.0,2017-01至2019-12
2016,重大研究计划,A01,367,91641000,E06,面向发动机的湍流燃烧基础研究指导专家组战略研究和学术交流,乐嘉陵,中国空气动力研究与发展中心,250.0,2017-01至2018-12
2016,重大研究计划,A01,368,91642102,H1604,B细胞在不同消化系统肿瘤中亚群和功能差异的机制,邝栋明,中山大学,85.0,2017-01至2019-12
2016,重大研究计划,A01,369,91634103,B080304,生物质流化床气化炉内介尺度结构和气化性能的研究,库晓珂,浙江大学,67.0,2017-01至2019-12
2016,重大研究计划,A01,370,91647101,D0702,澜沧江典型冰川河流域径流分割及其对气候变化敏感性的同位素示踪研究,孔彦龙,中国科学院地质与地球物理研究所,80.0,2017-01至2019-12
2016,重大研究计划,A01,371,91631308,C060503,新性状起源的分子机制和叠加效应研究——以黑种草属植物花瓣的表型复杂化为例,孔宏智,中国科学院植物研究所,275.0,2017-01至2019-12
2016,重大研究计划,A01,372,91630311,A0114,医学影像配准与融合的建模和算法,孔德兴,浙江大学,250.0,2017-01至2019-12
2016,重大研究计划,A01,373,91625102,D0702,变化环境下黑河流域绿洲农业水效率演变研究,康绍忠,中国农业大学,100.0,2017-01至2017-12
2016,重大研究计划,A01,374,91643205,B0603,大气细颗粒物及其组分的心肺健康危害机制研究,阚海东,复旦大学,300.0,2017-01至2020-12
2016,重大研究计划,A01,375,91640113,C060604,长链非编码RNA和染色质互作的系统性研究,瞿昆,中国科学技术大学,85.0,2017-01至2019-12
2016,重大研究计划,A01,376,91622119,B050101,光电特性导向的含铋晶态半导体氧化物的可控制备及结构调控,井立强,黑龙江大学,80.0,2017-01至2018-12
2016,重大研究计划,A01,377,91634101,B080304,加压大型鼓泡塔中气泡群介尺度流动结构与传质特性的构效关系,靳海波,北京石油化工学院,67.0,2017-01至2019-12
2016,重大研究计划,A01,378,91637209,D0507,青藏高原湖泊过程及其与大气相互作用的高分辨率模式发展和模拟研究,金继明,西北农林科技大学,318.0,2017-01至2020-12
2016,重大研究计划,A01,379,91636108,A040408,基于多粒子自旋压缩与量子纠缠的量子度量,金光日,北京交通大学,80.0,2017-01至2019-12
2016,重大研究计划,A01,380,91643204,H2607,非编码RNA在大气细颗粒物致气道炎症反应中的作用机制研究,蒋义国,广州医科大学,300.0,2017-01至2020-12
2016,重大研究计划,A01,381,91629104,H1602,法尼酯X受体FXR介导炎性微环境-肿瘤交互作用促进肺癌发生发展研究,蒋捍东,上海交通大学,94.0,2017-01至2018-12
2016,重大研究计划,A01,382,91647118,E090403,径流变化下长江源复杂辫状河道形态动力过程的模拟方法研究,蒋昌波,长沙理工大学,75.0,2017-01至2019-12
2016,重大研究计划,A01,383,91645108,B020103,高稳定性金属纳米粒子/ZSM-5分子筛双功能催化剂构筑及其催化转化轻质正构烷烃作用机制研究,姜桂元,中国石油大学（北京）,75.0,2017-01至2019-12
2016,重大研究计划,A01,384,91636105,A040305,强激光场中冷原子的高分辨动量成像,江玉海,中国科学院上海高等研究院,90.0,2017-01至2019-12
2016,重大研究计划,A01,385,91638301,F010607,面向突发事件快速响应的空间信息网络关键技术综合集成与演示验证,江碧涛,北京市遥感信息研究所,1760.0,2017-01至2021-12
2016,重大研究计划,A01,386,91641117,E060405,反应活性控制压燃（RCCI）发动机混合气形成和燃烧过程的机理研究,贾明,大连理工大学,60.0,2017-01至2019-12
2016,重大研究计划,A01,387,91639204,H0220,蛋白质巯基亚硝基化修饰在血管内皮功能障碍中的作用研究,季勇,南京医科大学,220.0,2017-01至2020-12
2016,重大研究计划,A01,388,91647212,E090504,西南河流源区数据服务平台开发,黄跃飞,清华大学,330.0,2017-01至2020-12
2016,重大研究计划,A01,389,91640102,C050102,piRNA生成加工通路中重要蛋白质及复合体的结构功能研究,黄旲,中国科学院上海生命科学研究院,86.0,2017-01至2019-12
2016,重大研究计划,A01,390,91641103,E060405,旋转爆轰流场的三间断结构重构机理研究,黄思源,中国空气动力研究与发展中心,60.0,2017-01至2019-12
2016,重大研究计划,A01,391,91644219,D0510,大气有机颗粒物的在线源解析与动态定量方法体系建立,黄汝锦,中国科学院地球环境研究所,290.0,2017-01至2020-12
2016,重大研究计划,A01,392,91644105,D05,长三角生物质燃烧的三维特征解析及对区域霾形成的过程研究,黄侃,复旦大学,83.0,2017-01至2019-12
2016,重大研究计划,A01,393,91643208,B060306,大气细颗粒物对心血管疾病的长期影响和预测研究,黄建凤,中国医学科学院阜外医院,300.0,2017-01至2020-12
2016,重大研究计划,A01,394,91642104,C0808,树突状细胞p38α信号通路在维持肠道免疫稳态及肠炎和肠炎相关结肠癌发生发展中的机制研究,黄功华,上海交通大学,60.0,2017-01至2019-12
2016,重大研究计划,A01,395,91642115,H1012,肠道上皮Hes1介导抗菌信号调节拟杆菌定植在炎症性肠病中的作用机制,胡小玉,清华大学,60.0,2017-01至2019-12
2016,重大研究计划,A01,396,91629301,H1602,补体激活在结肠炎恶性转化过程中发挥关键作用的网络调控研究,胡维国,复旦大学,195.0,2017-01至2018-12
2016,重大研究计划,A01,397,91647204,E0901,“供水-发电-环境”相互作用关系的自适应建模与非平衡相变条件,胡铁松,武汉大学,325.0,2017-01至2020-12
2016,重大研究计划,A01,398,91646108,F030211,管理与决策导向的航天大数据分析方法与支撑技术,胡绍林,西安理工大学,43.0,2017-01至2019-12
2016,重大研究计划,A01,399,91644107,D0510,城市大气NO3自由基和N2O5的夜间化学过程研究,胡仁志,中国科学院合肥物质科学研究院,98.0,2017-01至2019-12
2016,重大研究计划,A01,400,91641104,B030302,碳氢燃料燃烧过程中氧原子与HO2及C2H2反应的量子动力学研究,胡茜茜,南京大学,60.0,2017-01至2019-12
2016,重大研究计划,A01,401,91649104,C0705,衰老导致的肌肉再生障碍的机制,胡苹,中国科学院上海生命科学研究院,60.0,2017-01至2019-12
2016,重大研究计划,A01,402,91634118,B080901,异质结构材料制备过程中介尺度结构调控及反应-扩散作用机制研究,胡鹏,北京工业大学,67.0,2017-01至2019-12
2016,重大研究计划,A01,403,91645123,B020404,基于限域效应构筑高性能CO2电化学还原纳米催化剂的研究,胡劲松,中国科学院化学研究所,75.0,2017-01至2019-12
2016,重大研究计划,A01,404,91644104,D0709,城市大气颗粒物不同粒径多环芳烃的分布特征及其单体稳定碳同位素溯源的研究,胡健,中国科学院地球化学研究所,83.0,2017-01至2019-12
2016,重大研究计划,A01,405,91641124,E060401,中国汽油的基础燃烧特性和化学反应动力学机理研究,胡二江,西安交通大学,60.0,2017-01至2019-12
2016,重大研究计划,A01,406,91630208,A011702,血流与脉搏波的多模型耦合建模与计算,胡丹,上海交通大学,150.0,2017-01至2019-12
2016,重大研究计划,A01,407,91647000,E0901,西南河流源区径流变化和适应性利用2016年战略研究项目,胡春宏,中国水利水电科学研究院,350.0,2017-01至2018-12
2016,重大研究计划,A01,408,91649112,H0711,CDKN2A基因在胰岛β细胞衰老致2型糖尿病的机制及其致病变异定位,胡承,上海交通大学,60.0,2017-01至2019-12
2016,重大研究计划,A01,409,91641114,E060405,热裂解态煤油在强湍流下火焰特性及燃烧建模研究,侯凌云,清华大学,60.0,2017-01至2019-12
2016,重大研究计划,A01,410,91645109,B081001,下行床中煤/甲烷催化共炼高选择性生成小分子芳烃和烷烃的研究,侯宝林,中国科学院大连化学物理研究所,75.0,2017-01至2019-12
2016,重大研究计划,A01,411,91646127,G031402,面向政府决策的大数据资源共享与治理机制研究,洪学海,中国科学院计算技术研究所,43.0,2017-01至2020-12
2016,重大研究计划,A01,412,91630312,A011701,随机哈密尔顿偏微分方程高效数值方法,洪佳林,中国科学院数学与系统科学研究院,250.0,2017-01至2019-12
2016,重大研究计划,A01,413,91637101,D0503,青藏高原夏季UT-LS气溶胶、卷云形成发展综合观测研究,贺千山,上海市气象局,100.0,2017-01至2019-12
2016,重大研究计划,A01,414,91645201,B020103,合成气催化转化直接制芳烃研究,贺鹤勇,复旦大学,320.0,2017-01至2020-12
2016,重大研究计划,A01,415,91640114,C060604,水稻OsSGS3与OsHEN1调控small RNAs合成及其对抗病性的调节,何祖华,中国科学院上海生命科学研究院,85.0,2017-01至2019-12
2016,重大研究计划,A01,416,91631109,C060502,银叶真藓适应极端环境的基因组特征及关键基因的作用机制,何奕騉,首都师范大学,100.0,2017-01至2019-12
2016,重大研究计划,A01,417,91642112,H10,肠上皮STAT6活化导致肠道免疫紊乱和肠炎/癌发生发展的机制研究,何睿,复旦大学,60.0,2017-01至2019-12
2016,重大研究计划,A01,418,91646118,G021101,物联网环境下大数据驱动的供应链运营协调与优化研究,何龙飞,天津大学,43.0,2017-01至2019-12
2016,重大研究计划,A01,419,91645118,B03,C1资源利用导向的Au基金属簇催化羰基合成新体系构建,何林,中国科学院兰州化学物理研究所,68.0,2017-01至2019-12
2016,重大研究计划,A01,420,91634120,B080303,多组元协同催化材料的结构控制及介尺度机制,何静,北京化工大学,67.0,2017-01至2019-12
2016,重大研究计划,A01,421,91644102,D03,生物质燃烧二次有机气溶胶的生成模拟及特征研究,何建辉,香港中文大学深圳研究院,75.0,2017-01至2019-12
2016,重大研究计划,A01,422,91643201,B060301,大气细颗粒物暴露导致慢阻肺的暴露组学与系统生物学研究,郝柯,同济大学,300.0,2017-01至2020-12
2016,重大研究计划,A01,423,91644217,D0510,华北地区大气化学/气溶胶-辐射-气象相互作用机制及其对大气复合污染的影响,韩志伟,中国科学院大气物理研究所,275.0,2017-01至2020-12
2016,重大研究计划,A01,424,91642106,C0808,3型天然淋巴样细胞在不同肠道相关淋巴组织中的区域特性调控研究,郭晓欢,清华大学,60.0,2017-01至2019-12
2016,重大研究计划,A01,425,91640110,C060604,PRC2复合物介导的细胞核RNA干扰的功能与机制研究,光寿红,中国科学技术大学,85.0,2017-01至2019-12
2016,重大研究计划,A01,426,91639201,H02,前列腺素E2受体EP4在血管稳态维持及重塑中的作用,管又飞,大连医科大学,220.0,2017-01至2020-12
2016,重大研究计划,A01,427,91643111,H2607,线粒体损伤在大气细颗粒物致鼻腔黏膜上皮细胞纤毛运动功能损伤中的作用及机制研究,龚树生,首都医科大学,90.0,2017-01至2019-12
2016,重大研究计划,A01,428,91634117,B080702,蛋氨酸气-液-固三相连续反应结晶过程中介尺度机制及调控,龚俊波,天津大学,67.0,2017-01至2019-12
2016,重大研究计划,A01,429,91638205,F010603,业务驱动的空间通信传输与接入方法,葛宁,清华大学,340.0,2017-01至2020-12
2016,重大研究计划,A01,430,91643104,B06,高分辨质谱技术鉴定大气细颗粒有机组分及其呼吸系统损伤,高媛,中国科学院大连化学物理研究所,90.0,2017-01至2019-12
2016,重大研究计划,A01,431,91631301,C010603,结核分枝杆菌优势亚型的高致病性进化机制研究,高谦,复旦大学,240.0,2017-01至2019-12
2016,重大研究计划,A01,432,91646124,G0116,基于多源大数据的城市交通微观-宏观行为规律研究,高亮,北京交通大学,43.0,2017-01至2019-12
2016,重大研究计划,A01,433,91631101,C020303,血红杜鹃复合体种系分化及适应性进化机制研究,高连明,中国科学院昆明植物研究所,88.0,2017-01至2019-12
2016,重大研究计划,A01,434,91634108,B080901,新型多孔稀土上转换纳米材料介尺度结构及其调控,高国,上海交通大学,67.0,2017-01至2019-12
2016,重大研究计划,A01,435,91635302,C130401,控制水稻粒重关键基因及其遗传调控网络解析,傅向东,中国科学院遗传与发育生物学研究所,900.0,2017-01至2018-12
2016,重大研究计划,A01,436,91634105,B080202,高黏/非牛顿流体气液微反应器并行微通道内气泡群非均匀结构介尺度动力学,付涛涛,天津大学,67.0,2017-01至2019-12
2016,重大研究计划,A01,437,91631304,C06,大规模多态信息的细胞溯祖理论和统计分析方法,符云新,云南大学,275.0,2017-01至2019-12
2016,重大研究计划,A01,438,91630314,A011403,重大脑精神疾病的遗传影像学分析理论与计算方法,冯建峰,复旦大学,250.0,2017-01至2019-12
