2018,重点项目,A01,469,61834007,F040709,基于智能化能量获取的自供能自主报警无线传感节点技术,李昕欣,中国科学院上海微系统与信息技术研究所,286,2019-01至2023-12
2018,重点项目,A01,470,81830032,H09,胶质细胞对神经退行性疾病大动物模型脑病理的作用,李晓江,暨南大学,293,2019-01至2023-12
2018,重点项目,A01,471,31830041,C1111,跨代遗传在机体代谢重编程中的作用及机制研究,李小英,复旦大学,272,2019-01至2023-12
2018,重点项目,A01,472,31830054,C0711,线粒体调控溶酶体相关细胞器钙稳态的分子机器,李巍,首都医科大学,296,2019-01至2023-12
2018,重点项目,A01,473,41830539,D0603,晚中新世以来印度洋-太平洋暖池水体交换过程及其气候效应,李铁刚,自然资源部第一海洋研究所,302,2019-01至2023-12
2018,重点项目,A01,474,51839005,E091002,面向振动控制的船舶大型推进轴系智能安装理论与技术,李天匀,华中科技大学,300,2019-01至2023-12
2018,重点项目,A01,475,31830111,C0704,大脑中的内源性干细胞在形成神经血管单元中的作用和机制研究,李思光,同济大学,276,2019-01至2023-12
2018,重点项目,A01,476,41830646,D070106,亚热带人工针叶林植物-土壤反馈对外源养分添加的响应机制,李胜功,中国科学院地理科学与资源研究所,301,2019-01至2023-12
2018,重点项目,A01,477,61833012,F030410,网络化系统分布式实时优化决策理论及应用,李少远,上海交通大学,265,2019-01至2023-12
2018,重点项目,A01,478,41830104,D0515,基于星载双频测雨雷达反演中国雨季降水潜热垂直结构,李锐,中国科学技术大学,299,2019-01至2023-12
2018,重点项目,A01,479,51839007,E0908,低热水泥混凝土拱坝建造理论与技术,李庆斌,清华大学,300,2019-01至2023-12
2018,重点项目,A01,480,31830048,C060603,探究核小体组装维持DNA复制体稳定性的机制,李晴,北京大学,293,2019-01至2023-12
2018,重点项目,A01,481,81830120,H2708,大肠癌湿热证肠道微生态的生物学基础及效应机制,李琦,上海中医药大学,294,2019-01至2023-12
2018,重点项目,A01,482,11834018,A040214,DNA损伤修复中的若干关键物理问题及单分子解决方案,李明,中国科学院物理研究所,310,2019-01至2023-12
2018,重点项目,A01,483,61832019,F020506,高通量蛋白质组学计算的基础理论与算法,李敏,中南大学,281,2019-01至2023-12
2018,重点项目,A01,484,81830073,H2005,基于多组学的乙肝慢加急性肝衰竭预警预测多重分子标志物精准检验方法的研究,李君,浙江大学,294,2019-01至2023-12
2018,重点项目,A01,485,81830082,H16,单泛素化NEMO网络失控促DNA损伤炎症诱发恶性转化的分子机制,李隽,中山大学,293,2019-01至2023-12
2018,重点项目,A01,486,61832003,F020104,大数据分析的计算理论与高效算法,李建中,哈尔滨工业大学,305,2019-01至2023-12
2018,重点项目,A01,487,51838010,E080701,震后功能可恢复桥梁结构新体系与设计理论,李建中,同济大学,280,2019-01至2023-12
2018,重点项目,A01,488,81830116,H27,以COPD临床试验为示范的辨证论治疗效结局测量与评价关键技术研究,李建生,河南中医药大学,294,2019-01至2023-12
2018,重点项目,A01,489,41831281,D0705,地震作用下工程岩体失稳诱灾机制与安全评价研究,李建春,东南大学,301,2019-01至2023-12
2018,重点项目,A01,490,71831007,G0112,O2O模式下即时配送服务运作管理的理论与方法,李建斌,华中科技大学,230,2019-01至2023-12
2018,重点项目,A01,491,31830067,C130505,黄籽羽衣甘蓝和油菜C基因组粒色基因的挖掘利用,李加纳,西南大学,225,2019-01至2023-12
2018,重点项目,A01,492,81830029,H13,小分子化合物协同调控多信号通路激活成年鼠前庭毛细胞再生及机制研究,李华伟,复旦大学,293,2019-01至2023-12
2018,重点项目,A01,493,61836011,F060109,复杂环境下的机器博弈算法与应用,李厚强,中国科学技术大学,286,2019-01至2023-12
2018,重点项目,A01,494,61831005,F011602,图像大数据记忆迁移分析方法与应用,李宏亮,电子科技大学,277,2019-01至2023-12
2018,重点项目,A01,495,41830217,D021101,龙门山断裂带中地震破裂传播机制,李海兵,中国地质科学院地质研究所,306,2019-01至2023-12
2018,重点项目,A01,496,71831005,G0102,在线广告模式与定价策略优化研究,李国鑫,哈尔滨工业大学,230,2019-01至2023-12
2018,重点项目,A01,497,51831010,E0105,弛豫铁电体/铁电玻璃的电极化机制与应用特性研究,李国荣,中国科学院上海硅酸盐研究所,300,2019-01至2023-12
2018,重点项目,A01,498,71832011,G0211,分享经济环境下企业运营与资源配置理论研究,李刚,西安交通大学,235,2019-01至2023-12
2018,重点项目,A01,499,31830100,C190202,凡纳滨对虾抗副溶血弧菌性状的遗传基础及调控机制研究,李富花,中国科学院海洋研究所,290,2019-01至2023-12
2018,重点项目,A01,500,11835016,A0506,强磁场下等离子体输运与约束机理的研究,李定,中国科学院物理研究所,300,2019-01至2023-12
2018,重点项目,A01,501,51835010,E050702,软组织-PEEK-骨共生的植入物设计制造及其功能研究,李涤尘,西安交通大学,300,2019-01至2023-12
2018,重点项目,A01,502,31830106,C010803,大麦条纹花叶病毒γb蛋白促进病毒运动和病毒粒子装配的分子机制研究,李大伟,中国农业大学,291,2019-01至2023-12
2018,重点项目,A01,503,21838003,B080901,微区限域构建二维杂化电催化材料与调控机制,李春忠,华东理工大学,315,2019-01至2023-12
2018,重点项目,A01,504,81830051,H1008,Th17/,Treg免疫平衡调控自身免疫疾病的新策略研究,李斌,上海交通大学,294,2019-01至2023-12
2018,重点项目,A01,505,21833002,B0301,多参考电子相关新方法和线性标度量子化学方法的发展和应用,黎书华,南京大学,315,2019-01至2023-12
2018,重点项目,A01,506,41831070,D041002,中低纬电离层中尺度结构研究,雷久侯,中国科学技术大学,297,2019-01至2023-12
2018,重点项目,A01,507,41830320,D020101,中国南方晚三叠世牙形石演化及生物-环境事件研究,赖旭龙,中国地质大学（武汉）,300,2019-01至2023-12
2018,重点项目,A01,508,21835003,B050406,可拉伸光电功能高分子的设计合成及其性能研究,赖文勇,南京邮电大学,310,2019-01至2023-12
2018,重点项目,A01,509,31830025,C0804,B细胞对肝癌组织免疫微环境的影响及调控机制,邝栋明,中山大学,289,2019-01至2023-12
2018,重点项目,A01,510,31830079,C1501,莴笋膨大肉质茎形成的遗传和分子机理,匡汉晖,华中农业大学,291,2019-01至2023-12
2018,重点项目,A01,511,71831002,G0102,绿色港口与航运网络运营管理优化研究,匡海波,大连海事大学,240,2019-01至2023-12
2018,重点项目,A01,512,61831014,F011701,宽视场层析计算成像理论与关键技术研究,孔令杰,清华大学,291,2019-01至2023-12
2018,重点项目,A01,513,51837008,E0709,等离子体活性物种在气相/液相/细胞内浓度关系及其抗癌效应的研究,孔刚玉,西安交通大学,300,2019-01至2023-12
2018,重点项目,A01,514,81830060,H1821,生物活性载体材料调控干细胞和组织微环境治疗急性肾损伤,孔德领,南开大学,294,2019-01至2023-12
2018,重点项目,A01,515,41830105,D010105,青藏高原东南部冰川储量变化的多源遥感综合观测研究,柯长青,南京大学,305,2019-01至2023-12
2018,重点项目,A01,516,31830059,C120105,心肌细胞成熟调控中的表观遗传机制研究,康九红,同济大学,297,2019-01至2023-12
2018,重点项目,A01,517,31830004,C020103,拟南芥有性生殖过程中RALF小肽及其受体的功能研究,瞿礼嘉,北京大学,295,2019-01至2023-12
2018,重点项目,A01,518,81830027,H1206,遗传和环境因素交互作用于“脉络膜血供减少—巩膜缺氧—成纤维细胞分化—细胞外基质重塑”的核心功能模块导致近视形成,瞿佳,温州医科大学,301,2019-01至2023-12
2018,重点项目,A01,519,41830751,D070104,中国北方旱作农田土壤氧化亚氮产生过程及主要控制因素,巨晓棠,中国农业大学,307,2019-01至2023-12
2018,重点项目,A01,520,51837004,E0704,含主动负荷的综合负荷在线建模基础研究,鞠平,河海大学,270,2019-01至2023-12
2018,重点项目,A01,521,81830053,H18,肝癌智能影像诊断的新技术与新方法,居胜红,东南大学,294,2019-01至2023-12
2018,重点项目,A01,522,11833010,A030801,太阳光球磁场高分辨测量关键技术研究,金振宇,中国科学院云南天文台,320,2019-01至2023-12
2018,重点项目,A01,523,61832006,F020302,面向大数据高效处理的体系结构与关键技术,金海,华中科技大学,288,2019-01至2023-12
2018,重点项目,A01,524,51832005,E020702,基于高通量计算和单颗粒诊断法的新型氮化物发光材料的筛选、发现和应用,解荣军,厦门大学,300,2019-01至2023-12
2018,重点项目,A01,525,31830047,C060603,哺乳动物配子发生和早期胚胎发育中染色质三维结构重编程研究,颉伟,清华大学,293,2019-01至2023-12
2018,重点项目,A01,526,61836009,F060708,类脑认知机器学习与遥感解译应用,焦李成,西安电子科技大学,296,2019-01至2023-12
2018,重点项目,A01,527,31830022,C0802,锰元素调节天然免疫与获得性免疫的发现与机制研究,蒋争凡,北京大学,293,2019-01至2023-12
2018,重点项目,A01,528,31830037,C090201,生物运动信息的视觉加工研究,蒋毅,中国科学院心理研究所,288,2019-01至2023-12
2018,重点项目,A01,529,51835008,E050301,涡扇发动机宽带风扇噪声的声源反演与辐射声场重建理论与方法,蒋伟康,上海交通大学,300,2019-01至2023-12
2018,重点项目,A01,530,61834005,F0402,可编程动态自重构三维阵列芯片体系结构关键技术,蒋林,西安科技大学,290,2019-01至2023-12
2018,重点项目,A01,531,51834007,E0410,易燃易爆危险化学品储运过程重大事故风险防控关键基础问题研究,蒋军成,南京工业大学,300,2019-01至2023-12
2018,重点项目,A01,532,11831006,A010602,算子代数中的几何与分类理论,蒋春澜,河北师范大学,250,2019-01至2023-12
2018,重点项目,A01,533,51839002,E0909,基于数据挖掘的南海岛礁演变机制及多尺度模拟预测技术研究,蒋昌波,长沙理工大学,300,2019-01至2023-12
2018,重点项目,A01,534,21838008,B08,面向烯烃与烷烃分离的有机分子筛膜研究,姜忠义,天津大学,315,2019-01至2023-12
2018,重点项目,A01,535,51834003,E0401,盐矿废弃溶腔综合利用的基础研究,姜德义,重庆大学,303,2019-01至2023-12
2018,重点项目,A01,536,61835003,F050302,基于时—空映射和透镜傅里叶变换的宽带信号时—频分析与处理关键技术研究,江阳,贵州大学,284,2019-01至2023-12
2018,重点项目,A01,537,51839011,E0903,水位大幅波动下鄱阳湖洲滩湿地碳氮耦合生消机制与环境生态效应,江和龙,中国科学院南京地理与湖泊研究所,300,2019-01至2023-12
2018,重点项目,A01,538,41831280,D0705,内孤立波对南海水合物试采区海底面稳定性影响研究,贾永刚,中国海洋大学,304,2019-01至2023-12
2018,重点项目,A01,539,51832002,E0203,碳化硅基复合陶瓷在乙烯裂解制备环境下的组织性能演化规律与机理,贾德昌,哈尔滨工业大学,300,2019-01至2023-12
2018,重点项目,A01,540,11832014,A020305,桥联模型发展的若干基本问题研究,黄争鸣,同济大学,310,2019-01至2023-12
2018,重点项目,A01,541,41831291,D0705,高速非稳态流动土体的冲击致灾机制与韧性防灾研究,黄雨,同济大学,304,2019-01至2023-12
2018,重点项目,A01,542,31830093,C170902,利用基因组编辑技术构建复合型抗病毒的家蚕品系研究,黄勇平,中国科学院上海生命科学研究院,290,2019-01至2023-12
2018,重点项目,A01,543,41830756,D070103,土壤组分互作界面有机碳的固定机制与过程模拟,黄巧云,华中农业大学,308,2019-01至2023-12
2018,重点项目,A01,544,81830014,H0203,转录因子等关键核蛋白的ADP核糖化修饰调节血管平滑肌细胞表型转化的作用和机制研究,黄恺,华中科技大学,293,2019-01至2023-12
2018,重点项目,A01,545,11835002,A050306,高能核核碰撞实验探索手征磁效应和手征涡旋效应,黄焕中,复旦大学,330,2019-01至2023-12
2018,重点项目,A01,546,81830052,H18,代谢影像组学智能预测肺癌靶向耐药的关键技术与应用,黄钢,上海健康医学院,294,2019-01至2023-12
2018,重点项目,A01,547,41831175,D0507,全球变暖背景下海洋的快慢响应过程及对东亚区域气候的影响,黄刚,中国科学院大气物理研究所,302,2019-01至2023-12
2018,重点项目,A01,548,31830084,C0409,榕小蜂群落成员对封闭隐头花序的基因组适应,黄大卫,南开大学,285,2019-01至2023-12
2018,重点项目,A01,549,51836009,E0603,热化学储能系统中多尺度能质转换与传递的耦合与协同,淮秀兰,中国科学院工程热物理研究所,290,2019-01至2023-12
2018,重点项目,A01,550,71831001,G0111,大数据环境下的智慧物流优化理论与方法,华国伟,北京交通大学,235,2019-01至2023-12
2018,重点项目,A01,551,81830100,H2611,基于出生队列的先天性心脏病多因素病因研究,胡志斌,南京医科大学,294,2019-01至2023-12
2018,重点项目,A01,552,21832003,B0204,催化与限域协同促进的高功率长寿命锂硫电池电极材料的构筑、性能及机制,胡征,南京大学,315,2019-01至2023-12
2018,重点项目,A01,553,31830055,C120407,植物细胞全能性的分子调控,胡玉欣,中国科学院植物研究所,285,2019-01至2023-12
2018,重点项目,A01,554,11835007,A050506,面向粒子辐射探测领域应用的具有高通用性、超多通路的全数字输出前端读出芯片关键技术研究,胡永才,西北工业大学,310,2019-01至2023-12
2018,重点项目,A01,555,81830119,H2703,非酒精性脂肪性肝病湿热证与肠道微生态的相关性及机制研究,胡义扬,上海中医药大学,294,2019-01至2023-12
2018,重点项目,A01,556,41830425,D0207,含油气盆地溶蚀流体类型判识标志、水-岩作用机理及溶蚀型储层成因模式,胡文瑄,南京大学,302,2019-01至2023-12
2018,重点项目,A01,557,61831006,F010404,面向高速率移动互联的硅基毫米波反向阵芯片关键技术,胡三明,东南大学,278,2019-01至2023-12
2018,重点项目,A01,558,41830432,D0304,扬子克拉通前寒武纪基底对中生代大面积低温成矿的制约,胡瑞忠,中国科学院地球化学研究所,303,2019-01至2023-12
2018,重点项目,A01,559,41830431,D0207,陆相页岩油在基质-裂缝体系中的多尺度运移机理研究,胡钦红,中国石油大学（华东）,299,2019-01至2023-12
2018,重点项目,A01,560,11831017,A010901,Gromov-Witten不变量理论,胡建勋,中山大学,250,2019-01至2023-12
2018,重点项目,A01,561,11832005,A0202,空间结构在轨自主组装的动态控制与地面实验,胡海岩,北京理工大学,330,2019-01至2023-12
2018,重点项目,A01,562,31830032,C090102,外侧缰核胶质细胞在抑郁症中的作用及机制研究,胡海岚,浙江大学,296,2019-01至2023-12
2018,重点项目,A01,563,11832017,A0204,基于微纳流控肺器官芯片的纳米颗粒输运研究,胡国庆,中国科学院力学研究所,320,2019-01至2023-12
2018,重点项目,A01,564,51838005,E080401,,饮用水多级屏障处理过程调控与微污染物/病原微生物协同去除研究,胡春,广州大学,300,2019-01至2023-12
2018,重点项目,A01,565,61833016,F031006,大型液体运载火箭智能健康监测自愈控制与预测维护,胡昌华,中国人民解放军火箭军工程大学,287,2019-01至2023-12
2018,重点项目,A01,566,61833001,F030110,数据驱动的地铁无人智能驾驶基础理论与技术,侯忠生,北京交通大学,283,2019-01至2023-12
2018,重点项目,A01,567,21833007,B0301,化学活性系统非平衡统计动力学的理论研究,侯中怀,中国科学技术大学,315,2019-01至2023-12
2018,重点项目,A01,568,41830644,D010105,青藏高原冰芯底部年龄的确定及全新世冰川退缩量估算,侯书贵,南京大学,307,2019-01至2023-12
2018,重点项目,A01,569,21835006,B050804,面向未来应用的聚合物太阳能电池关键材料和器件制备技术的研究,侯剑辉,中国科学院化学研究所,340,2019-01至2023-12
2018,重点项目,A01,570,81830022,H07,胰岛α与β细胞功能和表型的动态变化在血糖稳态调控中的作用及其机制,洪天配,北京大学,294,2019-01至2023-12
2018,重点项目,A01,571,31830034,C090116,面向儿童早期发育的人脑功能连接组学关键计算方法研究,贺永,北京师范大学,283,2019-01至2023-12
2018,重点项目,A01,572,11835006,A0504,系统级封装的瞬时γ剂量率效应的关键问题研究,贺朝会,西安交通大学,330,2019-01至2023-12
2018,重点项目,A01,573,31830049,C060608,植物胚胎发育早期重置“春化记忆”的分子表观遗传机制研究,何跃辉,中国科学院上海生命科学研究院,282,2019-01至2023-12
2018,重点项目,A01,574,41830110,D0401,基于微型雷达干涉测量的隧道形变稳定性监测理论与方法,何秀凤,河海大学,302,2019-01至2023-12
2018,重点项目,A01,575,31830051,C0708,肿瘤微环境中细胞程序性坏死的调控机制及功能研究,何苏丹,苏州系统医学研究所,248,2019-01至2023-12
2018,重点项目,A01,576,21833011,B030302,氮气分子在多核金属团簇上的吸附、活化与转化,何圣贵,中国科学院化学研究所,327,2019-01至2023-12
2018,重点项目,A01,577,81830107,H3105,泛素化修饰介导的转录因子异常调控在肝癌耐药中的分子机制及治疗策略研究,何俏军,浙江大学,294,2019-01至2023-12
2018,重点项目,A01,578,11835005,A050204,TeV新物理理论与实验检验,何红建,上海交通大学,330,2019-01至2023-12
2018,重点项目,A01,579,81830010,H02,氧化还原敏感蛋白SENP3介导线粒体融合/分裂失衡参与易损斑块形成的机制研究,何奔,上海交通大学,298,2019-01至2023-12
2018,重点项目,A01,580,41831174,D010102,中世纪暖期与小冰期中国东部年代际干湿格局差异及其机制研究,郝志新,中国科学院地理科学与资源研究所,302,2019-01至2023-12
2018,重点项目,A01,581,81830077,H0605,基于SCI动态病理变化的多靶向治疗促脊髓再生修复及相关机制研究,郝定均,西安交通大学,297,2019-01至2023-12
2018,重点项目,A01,582,51835006,E050701,基于生物体表感受器的机械传感仿生原理与关键技术,韩志武,吉林大学,300,2019-01至2023-12
2018,重点项目,A01,583,61834006,F0402,集成电路近似计算基础理论与设计方法,韩银和,中国科学院计算技术研究所,286,2019-01至2023-12
2018,重点项目,A01,584,11832011,A020317,基于光滑有限元法的生物组织宏观力学性能分析与软件开发,韩旭,河北工业大学,320,2019-01至2023-12
2018,重点项目,A01,585,51831012,E010501,新型磁子阀效应及其关键材料和器件原理研究,韩秀峰,中国科学院物理研究所,300,2019-01至2023-12
2018,重点项目,A01,586,81830024,H07,转录因子Ets-1介导2型糖尿病胰岛β细胞去分化与转分化的作用与机制研究,韩晓,南京医科大学,294,2019-01至2023-12
2018,重点项目,A01,587,81830002,H08,双靶点自体/通用型CART治疗B系恶性血液病的临床与抵抗相关机制研究,韩为东,中国人民解放军总医院,294,2019-01至2023-12
2018,重点项目,A01,588,51838008,E080503,基于多灾害耦合作用的高强钢管再生混凝土结构抗震性能及设计方法研究,韩林海,清华大学,305,2019-01至2023-12
2018,重点项目,A01,589,21833009,B030303,非铅钙钛矿材料光电动力学,韩克利,中国科学院大连化学物理研究所,315,2019-01至2023-12
2018,重点项目,A01,590,11833009,A030303,星际和星系际磁场研究,韩金林,中国科学院国家天文台,310,2019-01至2023-12
2018,重点项目,A01,591,51836003,E0605,孔隙介质中多相多组分反应流体输运的多尺度建模与机理研究,郭照立,华中科技大学,290,2019-01至2023-12
2018,重点项目,A01,592,61832018,F020308,嵌入式安全微处理器体系结构,郭阳,中国人民解放军国防科技大学,279,2019-01至2023-12
2018,重点项目,A01,593,81830105,H31,AKR1C3介导肿瘤耐药的新机制并发展先导化合物,郭青龙,中国药科大学,294,2019-01至2023-12
2018,重点项目,A01,594,51839010,E0906,水力装备瞬态过程非稳态流动及其诱发振动问题研究,郭鹏程,西安理工大学,300,2019-01至2023-12
2018,重点项目,A01,595,81830113,H2902,调肝启枢化浊法调控宿主-肠道菌群对话干预糖脂代谢紊乱的作用及机制研究,郭姣,广东药科大学,294,2019-01至2023-12
2018,重点项目,A01,596,11835015,A050306,奇特强子态与低能强相互作用,郭奉坤,中国科学院理论物理研究所,300,2019-01至2023-12
2018,重点项目,A01,597,31830044,C111101,氨基酸调控机体能量和糖脂代谢的作用与机制,郭非凡,中国科学院上海生命科学研究院,297,2019-01至2023-12
2018,重点项目,A01,598,61836010,F060708,基于神经网络自学习的嵌入式视觉感知技术及其芯片设计研究,郭东辉,厦门大学,276,2019-01至2023-12
2018,重点项目,A01,599,31830066,C130504,大豆耐盐基因发掘及其调控机制解析,关荣霞,中国农业科学院作物科学研究所,271,2019-01至2023-12
2018,重点项目,A01,600,51832001,E02,高性能医用铁基纳米材料的制备新技术及其机理研究,顾宁,东南大学,305,2019-01至2023-12
2018,重点项目,A01,601,81830030,H1304,线粒体去乙酰化蛋白SIRT3在噪声诱导的隐匿性听力损失中作用机制及干预研究,龚树生,首都医科大学,285,2019-01至2023-12
2018,重点项目,A01,602,21831007,B010305,有机小分子和金属联合不对称催化,龚流柱,中国科学技术大学,327,2019-01至2023-12
2018,重点项目,A01,603,81830062,H2101,线粒体DAMP分子在高原肺血管重塑中的作用与机制,高钰琪,中国人民解放军第三军医大学,294,2019-01至2023-12
2018,重点项目,A01,604,51836006,E060408,燃烧烟气多污染物高效协同催化脱除的关键基础问题,高翔,浙江大学,300,2019-01至2023-12
2018,重点项目,A01,605,31830033,C090102,小鼠全脑星形胶质细胞亚型鉴定及特定亚型的功能研究,高天明,南方医科大学,305,2019-01至2023-12
2018,重点项目,A01,606,21838011,B081002,FCC汽油关键组分精准分离与定向转化过程基础研究,高金森,中国石油大学（北京）,315,2019-01至2023-12
2018,重点项目,A01,607,61831013,F010501,硬件性能受限下室外毫米波大规模MIMO宽带通信理论与关键技术,,,,,,,,高飞飞,清华大学,289,2019-01至2023-12
2018,重点项目,A01,608,11834001,A040401,矢量涡旋光束的生成、传输及畸变校正技术研究,高春清,北京理工大学,310,2019-01至2023-12
2018,重点项目,A01,609,11831001,A010704,非双曲动力系统,甘少波,北京大学,250,2019-01至2023-12
2018,重点项目,A01,610,51832003,E02,材料的过程仿生制备新技术及其基础问题研究,傅正义,武汉理工大学,300,2019-01至2023-12
2018,重点项目,A01,611,31830082,C1507,G蛋白信号转导途径及其提高水稻氮肥利用效率的分子机制解析,傅向东,中国科学院遗传与发育生物学研究所,293,2019-01至2023-12
2018,重点项目,A01,612,51835011,E050802,跨尺度构件形性协同塑性成形理论及技术基础研究,傅铭旺,香港理工大学深圳研究院,300,2019-01至2023-12
2018,重点项目,A01,613,81830064,H15,创伤导致汗腺微环境改变与重建汗腺微环境诱导汗腺再生的基础与应用研究,付小兵,中国人民解放军总医院,293,2019-01至2023-12
2018,重点项目,A01,614,11833002,A030302,开普勒天区大样本脉动变星的星震学研究,付建宁,北京师范大学,300,2019-01至2023-12
2018,重点项目,A01,615,51838001,E080602,湿-热-力耦合作用下泥岩人工边坡灾变机理、评价方法与防控措施研究,付宏渊,长沙理工大学,305,2019-01至2023-12
2018,重点项目,A01,616,21833005,B0305,分子内激子裂分材料的设计、合成和激子动力学研究,付红兵,首都师范大学,325,2019-01至2023-12
2018,重点项目,A01,617,51837011,E0712,临床颅脑损伤电阻抗动态成像监测的关键问题研究,付峰,中国人民解放军第四军医大学,315,2019-01至2023-12
2018,重点项目,A01,618,71833005,G0305,国家治理视角下公共服务供给的财政制度研究,伏润民,云南财经大学,230,2019-01至2023-12
2018,重点项目,A01,619,61832014,F020210,价值驱动的软件服务持续迭代演化机理与关键技术,冯志勇,天津大学,272,2019-01至2023-12
2018,重点项目,A01,620,31830001,C0106,MCR基因家族：多粘菌素耐药的新机制,冯友军,浙江大学,275,2019-01至2023-12
2018,重点项目,A01,621,51839003,E0907,深埋隧道断裂型岩爆机理、模拟、监测与预警,冯夏庭,东北大学,300,2019-01至2023-12
2018,重点项目,A01,622,21831003,B0102,功能复合固体合成化学基础研究,冯守华,吉林大学,327,2019-01至2023-12
2018,重点项目,A01,623,61832007,F0203,基于忆阻器的存储计算融合机理与体系结构,冯丹,华中科技大学,286,2019-01至2023-12
2018,重点项目,A01,624,51833006,E0312,手性水凝胶的仿生构筑及性能研究,冯传良,上海交通大学,298,2019-01至2023-12
2018,重点项目,A01,625,81830081,H16,具核梭杆菌致结直肠黏膜DNA损伤诱导炎症和促癌发生,房静远,上海交通大学,293,2019-01至2023-12
