2018,重点项目,A01,312,31830024,C0802,ZCCHC3在抗病毒天然免疫识别及信号转导中的功能及作用机制,舒红兵,武汉大学,292,2019-01至2023-12
2018,重点项目,A01,313,31830096,C180202,猪新型冠状病毒病原生物学研究,石正丽,中国科学院武汉病毒研究所,290,2019-01至2023-12
2018,重点项目,A01,314,31830005,C020303,红树多物种趋同适应性进化的基因组机制研究,施苏华,中山大学,290,2019-01至2023-12
2018,重点项目,A01,315,61836004,F060708,通用类脑计算架构模型与方法研究,施路平,清华大学,287,2019-01至2023-12
2018,重点项目,A01,316,21835007,B050404,基于介孔纳米颗粒催化反应的肿瘤非毒化学治疗,施剑林,中国科学院上海硅酸盐研究所,300,2019-01至2023-12
2018,重点项目,A01,317,81830038,H0906,脑出血后小胶质细胞与脑水肿发生的机制和临床意义,施福东,首都医科大学,300,2019-01至2023-12
2018,重点项目,A01,318,11834011,A0402,新型钙钛矿/硅异质结两端叠层太阳电池物理与器件研究,沈文忠,上海交通大学,310,2019-01至2023-12
2018,重点项目,A01,319,51837010,E070701,高效大功率高速永磁电机的设计与控制理论及应用研究,沈建新,浙江大学,300,2019-01至2023-12
2018,重点项目,A01,320,51833008,E031002,酶响应电荷反转聚合物的设计与高疗效抗肿瘤纳米药物的构建,申有青,浙江大学,300,2019-01至2023-12
2018,重点项目,A01,321,11831008,A0111,多源异构数据的融合、特征提取与分析方法,邵军,华东师范大学,255,2019-01至2023-12
2018,重点项目,A01,322,51839006,E090201,干旱区灌区水-农业-自然生态复合系统稳定性与空间格局优化,尚松浩,清华大学,300,2019-01至2023-12
2018,重点项目,A01,323,61832002,F020505,面向社会热点事件感知的异构多源社会媒体大数据分析,桑基韬,北京交通大学,277,2019-01至2023-12
2018,重点项目,A01,324,61831001,F012201,微纳强流真空电子光学系统的集成方法与关键技术,阮存军,北京航空航天大学,280,2019-01至2023-12
2018,重点项目,A01,325,31830046,C060506,端粒保护对基因组稳定性维护的表观遗传机制,容益康,中山大学,282,2019-01至2023-12
2018,重点项目,A01,326,51831006,E0105,应变玻璃及其奇异性能,任晓兵,西安交通大学,304,2019-01至2023-12
2018,重点项目,A01,327,41830537,D0603,南海北部陆缘临界破裂过程、深水盆地发育及其构造地层记录,任建业,中国地质大学（武汉）,302,2019-01至2023-12
2018,重点项目,A01,328,21834005,B040403,活细胞内多种生物分子时空信息同时获取的新方法及其应用,任吉存,上海交通大学,315,2019-01至2023-12
2018,重点项目,A01,329,31830080,C1501,黄瓜果刺的系统发育调控,任华中,中国农业大学,280,2019-01至2023-12
2018,重点项目,A01,330,61835009,F0512,基于非线性光学成像的神经元和胶质细胞光生物调节机制研究,屈军乐,深圳大学,294,2019-01至2023-12
2018,重点项目,A01,331,81830013,H0203,趋炎高密度脂蛋白通过调控蛋白质和microRNA损伤血管内皮功能的机制,区景松,中山大学,293,2019-01至2023-12
2018,重点项目,A01,332,41830424,D0207,四川盆地构造-热演化及其对震旦-寒武系天然气成藏的约束,邱楠生,中国石油大学（北京）,304,2019-01至2023-12
2018,重点项目,A01,333,61835015,F0512,调控血管靶向光动力治疗实时在体光学相干成像造影关键技术研究,邱海霞,中国人民解放军总医院,278,2019-01至2023-12
2018,重点项目,A01,334,81830084,H16,干预关键代谢靶点协同癌蛋白MYC选择性致死肿瘤细胞的分子机制研究,卿国良,武汉大学,297,2019-01至2023-12
2018,重点项目,A01,335,61833002,F0304,高速列车运行风险评估及调控基础理论与方法,秦勇,北京交通大学,284,2019-01至2023-12
2018,重点项目,A01,336,31830043,C1111,线粒体翻译异常导致的疾病中的代谢重塑与功能的分子机制研究,秦燕,中国科学院生物物理研究所,295,2019-01至2023-12
2018,重点项目,A01,337,41830430,D0205,塔里木地幔柱的影响范围及其成矿多样性,秦克章,中国科学院地质与地球物理研究所,299,2019-01至2023-12
2018,重点项目,A01,338,81830018,H0310,干扰素-Apol9通路在结肠炎病理中发挥作用的细胞与分子机制,钱友存,中国科学院上海生命科学研究院,294,2019-01至2023-12
2018,重点项目,A01,339,21831006,B0102,高压化学反应制备介稳相材料,钱逸泰,中国科学技术大学,298,2019-01至2023-12
2018,重点项目,A01,340,81830006,H0818,新型溶瘤病毒为基础多靶点治疗DLBCL的免疫疗法策略研究,钱文斌,浙江大学,294,2019-01至2023-12
2018,重点项目,A01,341,41831289,D070202,基岩裂隙水非达西流与溶质非费克运移机制及其升尺度模型,钱家忠,合肥工业大学,303,2019-01至2023-12
2018,重点项目,A01,342,31830023,C0802,记忆B细胞发育与功能研究,祁海,清华大学,299,2019-01至2023-12
2018,重点项目,A01,343,81830099,H2401,慢性饮水型砷暴露对2型糖尿病的促发机制以及评价和防治方法研究,皮静波,中国医科大学,294,2019-01至2023-12
2018,重点项目,A01,344,11831009,A010601,非光滑变分理论及其在椭圆型偏微分方程中的应用,彭双阶,华中师范大学,250,2019-01至2023-12
2018,重点项目,A01,345,61831002,F0104,面向智能服务的雾无线接入网络动态协同理论与关键技术,彭木根,北京邮电大学,287,2019-01至2023-12
2018,重点项目,A01,346,31830113,C0713,唾液蛋白mLeg1调控高脂食物诱导的肥胖症的机制研究,彭金荣,浙江大学,279,2019-01至2023-12
2018,重点项目,A01,347,61833011,F030104,工业炉窑燃烧场重构及能效优化控制,彭晨,上海大学,285,2019-01至2023-12
2018,重点项目,A01,348,31830060,C120404,c-Jun/AP-1家族因子介导细胞命运转变的机制研究,裴端卿,中国科学院广州生物医药与健康研究院,277,2019-01至2023-12
2018,重点项目,A01,349,61835014,F0509,新型紫外非线性光学晶体的制备及激光性能研究,潘世烈,中国科学院新疆理化技术研究所,301,2019-01至2023-12
2018,重点项目,A01,350,51831009,E010504,金属氢化物在全固态锂离子电池中的应用基础,潘洪革,浙江大学,300,2019-01至2023-12
2018,重点项目,A01,351,31830029,C1003,运动系统复杂连接结构的高清解析与精准再生,欧阳宏伟,浙江大学,287,2019-01至2023-12
2018,重点项目,A01,352,81830041,H04,以胎盘G蛋白偶联受体为靶点的子痫前期病理生理机制研究及再分型：母子两代心血管代谢风险防控新策略,牛建民,南方医科大学,294,2019-01至2023-12
2018,重点项目,A01,353,41830426,D0304,石英脉型黑钨矿床成矿流体与成矿机制的精细解剖,倪培,南京大学,302,2019-01至2023-12
2018,重点项目,A01,354,21833003,B0303,极紫外激光研究典型小分子超激化态光谱及超快动力学,莫宇翔,清华大学,300,2019-01至2023-12
2018,重点项目,A01,355,61836005,F060104,类人任务规划、推理及其验证系统的研究和应用,明仲,深圳大学,287,2019-01至2023-12
2018,重点项目,A01,356,11831004,A0105,限制性猜想的相关研究及其应用,苗长兴,北京应用物理与计算数学研究所,250,2019-01至2023-12
2018,重点项目,A01,357,61833009,F030711,网络化微航天器系统架构建模及自主协同控制研究,孟子阳,清华大学,286,2019-01至2023-12
2018,重点项目,A01,358,81830049,H1005,NLRP3炎症小体和共生菌群在控制流感病毒感染中的协同作用与机制研究,孟广勋,中国科学院上海巴斯德研究所,294,2019-01至2023-12
2018,重点项目,A01,359,21837006,B070202,基于溶液结构的四链体核酸功能的铂配合物调控,毛宗万,中山大学,300,2019-01至2023-12
2018,重点项目,A01,360,61831009,F0112,超大孔径超稀疏多站地基短波辐射源精确定位理论及方法,毛兴鹏,哈尔滨工业大学,283,2019-01至2023-12
2018,重点项目,A01,361,61831016,F0120,毫米波异质集成电路设计理论与实现方法研究,毛军发,上海交通大学,297,2019-01至2023-12
2018,重点项目,A01,362,51832004,E021002,分级介孔纳米线钾离子电池正极材料的表界面调控及原位作用机制,麦立强,武汉理工大学,300,2019-01至2023-12
2018,重点项目,A01,363,11835010,A050608,Tokamak中的高能量粒子驱动的模以及与磁流体不稳定性相互作用,马志为,浙江大学,300,2019-01至2023-12
2018,重点项目,A01,364,31830089,C0409,候鸟迁徙活动的稳定性及其对环境变化的响应：以两种鹬类为例,马志军,复旦大学,285,2019-01至2023-12
2018,重点项目,A01,365,21833004,B030101,多体格林函数理论方法的发展及其在激发态能量转换机制研究中的应用,马玉臣,山东大学,305,2019-01至2023-12
2018,重点项目,A01,366,51836002,E060304,超薄液膜的快速铺展和涟漪波动及其强化热质传递机理的研究,马学虎,大连理工大学,310,2019-01至2023-12
2018,重点项目,A01,367,81830016,H03,肠道微生态调控黏膜相关恒定T细胞免疫功能介导非酒精性脂肪性肝病发生发展的机制研究,马雄,上海交通大学,294,2019-01至2023-12
2018,重点项目,A01,368,41830650,D010105,青藏高原典型内陆湖水面蒸发观测研究,马伟强,中国科学院青藏高原研究所,303,2019-01至2023-12
2018,重点项目,A01,369,41830648,D010702,西南地区复杂地表陆表过程观测与模拟研究,马明国,西南大学,292,2019-01至2023-12
2018,重点项目,A01,370,61831017,F0122,基于新型磁介多功能电子材料的微波器件及电路研究,马凯学,天津大学,285,2019-01至2023-12
2018,重点项目,A01,371,21838007,B081104,超分子结构设计与制革过程强化,马建中,陕西科技大学,315,2019-01至2023-12
2018,重点项目,A01,372,41831293,D0705,海底采矿对地质环境的胁迫影响与致灾机理,马凤山,中国科学院地质与地球物理研究所,304,2019-01至2023-12
2018,重点项目,A01,373,21831009,B010306,三类复杂天然产物的汇聚式全合成研究,马大为,中国科学院上海有机化学研究所,327,2019-01至2023-12
2018,重点项目,A01,374,81830017,H03,肠道菌群调控肝脏免疫微环境阻断HBV慢性感染进程的作用与机制研究,马春红,山东大学,293,2019-01至2023-12
2018,重点项目,A01,375,31830007,C020406,糖酵解途径介导植物盐胁迫应答机制研究,吕应堂,武汉大学,282,2019-01至2023-12
2018,重点项目,A01,376,71833002,G0305,国家治理视角下公共服务供给的财政制度研究,吕炜,东北财经大学,230.3,2019-01至2023-12
2018,重点项目,A01,377,81830071,H20,氧化磷酸化复合体功能缺陷型线粒体病的精准诊断防治分子标志物研究,吕建新,杭州医学院,293,2019-01至2023-12
2018,重点项目,A01,378,61836006,F060709,基于脑成像的视听深度神经网络构建与应用,吕建成,四川大学,291,2019-01至2023-12
2018,重点项目,A01,379,41830322,D0709,长江流域稻作农业起源与环境变化关系的微体化石研究,吕厚远,中国科学院地质与地球物理研究所,309,2019-01至2023-12
2018,重点项目,A01,380,61834009,F040807,神经形态器件与芯片集成基础研究,吕杭炳,中国科学院微电子研究所,290,2019-01至2023-12
2018,重点项目,A01,381,41830752,D070201,淮河流域遥感土壤水分数据产品验证及暴雨洪水数据同化系统构建,吕海深,河海大学,298,2019-01至2023-12
2018,重点项目,A01,382,71831006,G0112,物联网环境下的服务开发与设计优化研究,雒兴刚,杭州电子科技大学,230,2019-01至2023-12
2018,重点项目,A01,383,41831287,D0707,水环境典型耐药基因污染特征、传播扩散以及健康效应研究,罗义,南开大学,305,2019-01至2023-12
2018,重点项目,A01,384,41830649,D010104,青藏高原典型高山草线的形成和变化机制,罗天祥,中国科学院青藏高原研究所,306,2019-01至2023-12
2018,重点项目,A01,385,21833010,B030403,深紫外非线性光学晶体材料结构设计和性能研究,罗军华,中国科学院福建物质结构研究所,300,2019-01至2023-12
2018,重点项目,A01,386,11834005,A0402,混合量子系统:,量子多体问题的构筑单元,罗洪刚,兰州大学,310,2019-01至2023-12
2018,重点项目,A01,387,51831002,E010102,复相组织超高强高韧钢中多类型析出强化及相变强化耦合机制研究,罗海文,北京科技大学,296,2019-01至2023-12
2018,重点项目,A01,388,51837005,E070602,大功率电声高效换能机理与控制方法研究,罗安,湖南大学,300,2019-01至2023-12
2018,重点项目,A01,389,21838004,B0801,纳微界面传递的分子热力学机制,陆小华,南京工业大学,315,2019-01至2023-12
2018,重点项目,A01,390,31830071,C200602,冷害影响采后香蕉果实成熟和品质形成过程中MYB转录因子的调控网络解析,陆旺金,华南农业大学,284,2019-01至2023-12
2018,重点项目,A01,391,61832008,F0207,自主协同的多模态感知及融合机制研究,陆桑璐,南京大学,283,2019-01至2023-12
2018,重点项目,A01,392,81830097,H1103,微生态介导的CD4+TRM细胞异常分化活化及免疫微环境改变在系统性红斑狼疮发生发展中的作用及机制研究,陆前进,中南大学,294,2019-01至2023-12
2018,重点项目,A01,393,41830428,D0304,江南造山带西段多时代含钨锡花岗岩演化及成矿机制,陆建军,南京大学,304,2019-01至2023-12
2018,重点项目,A01,394,51836008,E060202,超高负荷低压涡轮内部流动机理及设计方法研究,卢新根,中国科学院工程热物理研究所,300,2019-01至2023-12
2018,重点项目,A01,395,31830085,C040302,青藏高原地山雀交配系统的地理变异及进化机制,卢欣,武汉大学,282,2019-01至2023-12
2018,重点项目,A01,396,61833004,F0308,知识和数据驱动的氧化铝生产过程协调优化控制及应用验证,卢绍文,东北大学,284,2019-01至2023-12
2018,重点项目,A01,397,61831011,F0123,面向燃料电池汽车的高性能车载气体传感器的构建,卢革宇,吉林大学,286,2019-01至2023-12
2018,重点项目,A01,398,51838012,E080802,输电塔线体系风致耦合场作用效应及抗风防灾研究,楼文娟,浙江大学,305,2019-01至2023-12
2018,重点项目,A01,399,21834001,B040204,单分子界面精准测量生物分子动态相互作用,龙亿涛,华东理工大学,315,2019-01至2023-12
2018,重点项目,A01,400,11834015,A040306,基于激光诱导电子再碰撞的分子超快成像研究,柳晓军,中国科学院武汉物理与数学研究所,320,2019-01至2023-12
2018,重点项目,A01,401,11835003,A050105,基于大数据的网络动力学与统计物理及其在脑功能微观机制方面的应用,刘宗华,华东师范大学,300,2019-01至2023-12
2018,重点项目,A01,402,71832004,G020202,基于跨界共享的组织竞合与突破性创新机制研究,刘智强,华中科技大学,240,2019-01至2023-12
2018,重点项目,A01,403,21834003,B040102,特征结构印迹纳米材料的制备及其在重大疾病诊断与治疗中的应用,刘震,南京大学,315,2019-01至2023-12
2018,重点项目,A01,404,31830075,C1405,稻飞虱对新烟碱类杀虫剂代谢抗性的遗传调控机制,刘泽文,南京农业大学,287,2019-01至2023-12
2018,重点项目,A01,405,41830645,D0107,大数据支持下的空间交互网络理论及分析方法研究,刘瑜,北京大学,296,2019-01至2023-12
2018,重点项目,A01,406,11832003,A020501,冠脉狭窄与心肌缺血定量关系的生物力学研究,刘有军,北京工业大学,320,2019-01至2023-12
2018,重点项目,A01,407,71832008,G020703,移动互联网时代的全渠道营销研究,刘益,上海交通大学,240,2019-01至2023-12
2018,重点项目,A01,408,61835006,F0502,公里级低损耗空芯光子带隙光纤制备及传输理论与关键技术研究,刘艳格,南开大学,283,2019-01至2023-12
2018,重点项目,A01,409,51831011,E010503,新型牙种植体用钛合金及其表面构建机制,刘宣勇,中国科学院上海硅酸盐研究所,300,2019-01至2023-12
2018,重点项目,A01,410,81830056,H1803,脑卒中相关血管床粥样硬化斑块的快速磁共振成像及智能诊断研究,刘新,中国科学院深圳先进技术研究院,294,2019-01至2023-12
2018,重点项目,A01,411,11833006,A0302,银河系的形成和演化：基于LAMOST和Gaia的精细结构及其化学动力学性质研究,刘晓为,云南大学,320,2019-01至2023-12
2018,重点项目,A01,412,11834008,A040503,生物组织光声断层成像中的几个关键科学问题研究,刘晓峻,南京大学,320,2019-01至2023-12
2018,重点项目,A01,413,41830966,D0509,中国东部气溶胶与天气-气候相互作用机制及其对大气重污染影响的模拟研究,刘小红,中国科学院大气物理研究所,305,2019-01至2023-12
2018,重点项目,A01,414,71832012,G0214,中国企业国际化与制度演进,刘夏明,西南财经大学,235,2019-01至2023-12
2018,重点项目,A01,415,61835013,F0505,基于超冷里德堡原子的量子精密测量,刘伍明,中国科学院物理研究所,302,2019-01至2023-12
2018,重点项目,A01,416,21833001,B030101,强关联电子体系的新方法,刘文剑,北京大学,305,2019-01至2023-12
2018,重点项目,A01,417,51835012,E050501,空间固体-油脂复合润滑体系的构筑及其摩擦表面/界面行为与调控,刘维民,中国科学院兰州化学物理研究所,300,2019-01至2023-12
2018,重点项目,A01,418,71832003,G0204,共享理念下的多元雇佣：合作型人才管理理论建构与作用机理研究,刘善仕,华南理工大学,240,2019-01至2023-12
2018,重点项目,A01,419,51835002,E050101,空间大型薄膜无铰链轻质可展机构设计理论与方法,刘荣强,哈尔滨工业大学,300,2019-01至2023-12
2018,重点项目,A01,420,31830109,C0513,PIWI-ins元件在PIWI/piRNA调控和男性不育中的功能机制研究,刘默芳,中国科学院上海生命科学研究院,296,2019-01至2023-12
2018,重点项目,A01,421,81830025,H0704,胰岛素生物合成异常所致β细胞去特征化、去分化和转分化的分子机制,刘铭,天津医科大学,294,2019-01至2023-12
2018,重点项目,A01,422,81830083,H16,KRAS与肿瘤微环境关键调控GPCR的协同致死效应与分子机制研究,刘明耀,华东师范大学,293,2019-01至2023-12
2018,重点项目,A01,423,81830065,H1504,周细胞对严重创伤休克血管反应性和血管通透性的协同调控及保护机制,刘良明,中国人民解放军第三军医大学,293,2019-01至2023-12
2018,重点项目,A01,424,61834002,F0402,动态可重构芯片关键技术,刘雷波,清华大学,283,2019-01至2023-12
2018,重点项目,A01,425,51838013,E0804,资源化为核心的可持续乡村污水及污泥处理系统与关键技术原理研究,刘俊新,中国科学院生态环境研究中心,300,2019-01至2023-12
2018,重点项目,A01,426,61835011,F0504,甚长波红外量子级联探测器关键技术研究,刘俊岐,中国科学院半导体研究所,289,2019-01至2023-12
2018,重点项目,A01,427,31830050,C0708,代谢调控血小板衰老死亡的分子机制,刘俊岭,上海交通大学,288,2019-01至2023-12
2018,重点项目,A01,428,31830095,C180202,禽C型偏肺病毒感染的分子致病机制,刘爵,北京市农林科学院,292,2019-01至2023-12
2018,重点项目,A01,429,51834001,E0411,金属矿全尾砂膏体绿色处置流变特性及固结行为,刘娟红,北京科技大学,300,2019-01至2023-12
2018,重点项目,A01,430,81830080,H16,基于人工智能与表位肽预测融合排序的肿瘤个体化抗原肽组合及其疫苗研究,刘杰,复旦大学,293,2019-01至2023-12
2018,重点项目,A01,431,31830099,C180701,黏菌素耐药质粒与其宿主菌的适应性进化机制,刘健华,华南农业大学,287,2019-01至2023-12
2018,重点项目,A01,432,81830115,H27,基于整体观和辨证论治复杂干预的中医疗效评价关键技术和结局指标研究,刘建平,北京中医药大学,293,2019-01至2023-12
2018,重点项目,A01,433,61834008,F0403,大功率氮化镓绿光激光器的材料生长与物理机制,刘建平,中国科学院苏州纳米技术与纳米仿生研究所,294,2019-01至2023-12
2018,重点项目,A01,434,41830862,D0706,河水-地下水交互带铁的生物地球化学转化及其截污机制,刘慧,中国地质大学（武汉）,300,2019-01至2023-12
2018,重点项目,A01,435,71832006,G0202,变革环境下的组织变革及其管理研究,刘洪,南京大学,225.86,2019-01至2023-12
2018,重点项目,A01,436,41831282,D0706,地震环境下陆域吹填珊瑚礁砂液化机理与微生物加固研究,刘汉龙,重庆大学,306,2019-01至2023-12
2018,重点项目,A01,437,31830091,C170401,生殖系统局部合成褪黑素促进猪早期妊娠的机理研究,刘国世,中国农业大学,282,2019-01至2023-12
2018,重点项目,A01,438,71833001,G0302,精准健康扶贫的经济学实验：基于四川凉山的干预研究,刘国恩,北京大学,235,2019-01至2023-12
2018,重点项目,A01,439,31830061,C120104,造血干细胞发育的动态表观遗传调控,刘峰,中国科学院动物研究所,287,2019-01至2023-12
2018,重点项目,A01,440,61833007,F0308,微生物制造过程生长代谢估计及在线监测调控,刘飞,江南大学,283,2019-01至2023-12
2018,重点项目,A01,441,41830427,D0208,煤层气储层流体微观动力学机理研究,刘大锰,中国地质大学（北京）,301,2019-01至2023-12
2018,重点项目,A01,442,31830003,C010603,结核分枝杆菌调控宿主细胞自噬的分子机制,刘翠华,中国科学院微生物研究所,289,2019-01至2023-12
2018,重点项目,A01,443,41830861,D070202,过渡带和界面水文生物地球化学的动力学过程及其对地球关键带物质组分迁移转化的影响机制,刘崇炫,南方科技大学,290,2019-01至2023-12
2018,重点项目,A01,444,61835005,F0503,基于编码调制的超高速超长距离光传输系统关键问题研究,刘博,南京信息工程大学,288,2019-01至2023-12
2018,重点项目,A01,445,31830006,C020303,新形成异源多倍体小麦减数分裂染色体稳定性快速适应性进化的遗传基础和分子机制,刘宝,东北师范大学,298,2019-01至2023-12
2018,重点项目,A01,446,21836002,B060106,纳米材料表界面调控及其在有毒重金属分离回收中的应用基础研究,林璋,华南理工大学,330,2019-01至2023-12
2018,重点项目,A01,447,51831001,E010101,电子束选区熔化高温TiAl合金相变及强韧化机理研究,林均品,北京科技大学,300,2019-01至2023-12
2018,重点项目,A01,448,51833003,E0314,有机/无机杂化大分子的自组装结构与相关性能研究,林嘉平,华东理工大学,300,2019-01至2023-12
2018,重点项目,A01,449,11835011,A050101,量子体系的动力学与非线性机制的研究,林机,浙江师范大学,300,2019-01至2023-12
2018,重点项目,A01,450,51836001,E060702,自然生物系统高效转化生物质过程仿生原理及方法,廖强,重庆大学,310,2019-01至2023-12
2018,重点项目,A01,451,31830097,C180202,H9N2亚型禽流感病毒激活鸡T细胞免疫应答的分子机制,廖明,华南农业大学,285,2019-01至2023-12
2018,重点项目,A01,452,41831288,D0203,多金属矿山尾矿渗滤液复杂污染物的原位修复及机理研究,廖立兵,中国地质大学（北京）,297,2019-01至2023-12
2018,重点项目,A01,453,31830083,C150701,大豆氮磷协同高效与高产优质关联的生理遗传机制,廖红,福建农林大学,281,2019-01至2023-12
2018,重点项目,A01,454,21833006,B030101,复杂分子体系激发态电子结构和量子动力学理论计算方法的发展及应用,梁万珍,厦门大学,305,2019-01至2023-12
2018,重点项目,A01,455,81830089,H1617,多功能纳米载体介导肝癌免疫微环境的靶向协同作用和机制研究,梁廷波,浙江大学,293,2019-01至2023-12
2018,重点项目,A01,456,51834009,E0417,高强韧高导大尺寸铜基复合材料的制备基础研究,梁淑华,西安理工大学,300,2019-01至2023-12
2018,重点项目,A01,457,81830004,H0816,TLR4通路介导的内皮细胞激活促进CART细胞治疗相关sCRS的发生,梁爱斌,同济大学,293,2019-01至2023-12
2018,重点项目,A01,458,51834004,E0412,镁合金在线、原位、传感测氢及关键问题研究,厉英,东北大学,300,2019-01至2023-12
2018,重点项目,A01,459,41830102,D0607,基于类群分辨的海洋浮游植物固碳遥感机理与方法研究,李忠平,厦门大学,306,2019-01至2023-12
2018,重点项目,A01,460,51837003,E070201,非线性绝缘电介质暂态介电特性表征、测试技术及暂态介电机理研究,李忠华,哈尔滨理工大学,300,2019-01至2023-12
2018,重点项目,A01,461,11835008,A050509,X射线成像和能谱分析的多通道硅漂移探测器阵列研究,李正,湘潭大学,330,2019-01至2023-12
2018,重点项目,A01,462,81830012,H02,外泌体miRNAs介导细胞间应答网络调控心房代谢重构在心房颤动中的作用与机制,李悦,哈尔滨医科大学,298,2019-01至2023-12
2018,重点项目,A01,463,11832015,A020602,非均质材料高速雨滴冲击破坏机理研究,李玉龙,西北工业大学,330,2019-01至2023-12
2018,重点项目,A01,464,31830031,C090101,SUMO/deSUMO修饰在痛痒觉调控中的作用和机制,李勇,上海交通大学,284,2019-01至2023-12
2018,重点项目,A01,465,81830061,H21,钙调氯离子通道对失重性骨丢失的调控作用及机制研究,李英贤,中国航天员科研训练中心,294,2019-01至2023-12
2018,重点项目,A01,466,11831011,A010801,一些双曲系统的动力学性态与机制,李亚纯,上海交通大学,260,2019-01至2023-12
2018,重点项目,A01,467,31830069,C200304,多组学解析浓香型白酒酿造过程中关键酯类物质合成的作用机制,李秀婷,北京工商大学,284,2019-01至2023-12
2018,重点项目,A01,468,41830101,D040901,多辐射源、多分辨地空瞬变电磁深部探测偏移成像理论与方法研究,李貅,长安大学,296,2019-01至2023-12
